[I 2025-06-12 01:32:29,893] Trial 29 finished with value: 0.8794084543049808 and parameters: {'boosting_type': 'goss', 'learning_rate': 0.00967847173319715, 'num_leaves': 96, 'max_depth': 13, 'min_data_in_leaf': 29, 'feature_fraction': 0.9105509980288957, 'lambda_l1': 3.5972573018726397, 'lambda_l2': 3.981165986199527, 'min_gain_to_split': 0.24295367949205843, 'max_bin': 110}. Best is trial 11 with value: 0.888762461860649.
Training until validation scores don't improve for 30 rounds
[50]	valid_0's multi_error: 0.142983	valid_0's multi_logloss: 0.368993
[100]	valid_0's multi_error: 0.131986	valid_0's multi_logloss: 0.318179
[150]	valid_0's multi_error: 0.126423	valid_0's multi_logloss: 0.302273
[200]	valid_0's multi_error: 0.123629	valid_0's multi_logloss: 0.295228
[250]	valid_0's multi_error: 0.122904	valid_0's multi_logloss: 0.291307
[300]	valid_0's multi_error: 0.12249	valid_0's multi_logloss: 0.288804
[350]	valid_0's multi_error: 0.121429	valid_0's multi_logloss: 0.286994
[400]	valid_0's multi_error: 0.120834	valid_0's multi_logloss: 0.285836
[450]	valid_0's multi_error: 0.120679	valid_0's multi_logloss: 0.284804
Early stopping, best iteration is:
[421]	valid_0's multi_error: 0.120058	valid_0's multi_logloss: 0.285268
Training until validation scores don't improve for 30 rounds
[50]	valid_0's multi_error: 0.1435	valid_0's multi_logloss: 0.368998
[100]	valid_0's multi_error: 0.133978	valid_0's multi_logloss: 0.320115
[150]	valid_0's multi_error: 0.129321	valid_0's multi_logloss: 0.305075
[200]	valid_0's multi_error: 0.127303	valid_0's multi_logloss: 0.298175
[250]	valid_0's multi_error: 0.126216	valid_0's multi_logloss: 0.294121
[300]	valid_0's multi_error: 0.124819	valid_0's multi_logloss: 0.291717
[350]	valid_0's multi_error: 0.123784	valid_0's multi_logloss: 0.290319
Early stopping, best iteration is:
[354]	valid_0's multi_error: 0.123292	valid_0's multi_logloss: 0.290193
Training until validation scores don't improve for 30 rounds
[50]	valid_0's multi_error: 0.147356	valid_0's multi_logloss: 0.374954
[100]	valid_0's multi_error: 0.136255	valid_0's multi_logloss: 0.324294
[150]	valid_0's multi_error: 0.131391	valid_0's multi_logloss: 0.309444
[200]	valid_0's multi_error: 0.129683	valid_0's multi_logloss: 0.302658
[250]	valid_0's multi_error: 0.128027	valid_0's multi_logloss: 0.298996
[300]	valid_0's multi_error: 0.127251	valid_0's multi_logloss: 0.296367
[350]	valid_0's multi_error: 0.12632	valid_0's multi_logloss: 0.294678
Early stopping, best iteration is:
[350]	valid_0's multi_error: 0.12632	valid_0's multi_logloss: 0.294678
[I 2025-06-12 01:34:33,605] Trial 30 finished with value: 0.87426565636567 and parameters: {'boosting_type': 'goss', 'learning_rate': 0.06942403524601262, 'num_leaves': 94, 'max_depth': 8, 'min_data_in_leaf': 39, 'feature_fraction': 0.6387590066624081, 'lambda_l1': 1.7693232972780193, 'lambda_l2': 3.4017544691610437, 'min_gain_to_split': 2.9544523316670706, 'max_bin': 78}. Best is trial 11 with value: 0.888762461860649.
Training until validation scores don't improve for 30 rounds
[50]	valid_0's multi_error: 0.132633	valid_0's multi_logloss: 0.314092
[100]	valid_0's multi_error: 0.124431	valid_0's multi_logloss: 0.288607
[150]	valid_0's multi_error: 0.118712	valid_0's multi_logloss: 0.275727
[200]	valid_0's multi_error: 0.116875	valid_0's multi_logloss: 0.270086
[250]	valid_0's multi_error: 0.115219	valid_0's multi_logloss: 0.265991
[300]	valid_0's multi_error: 0.113356	valid_0's multi_logloss: 0.262678
[350]	valid_0's multi_error: 0.112865	valid_0's multi_logloss: 0.261279
[400]	valid_0's multi_error: 0.112373	valid_0's multi_logloss: 0.260153
Early stopping, best iteration is:
[379]	valid_0's multi_error: 0.111804	valid_0's multi_logloss: 0.260482
Training until validation scores don't improve for 30 rounds
[50]	valid_0's multi_error: 0.134574	valid_0's multi_logloss: 0.314467
[100]	valid_0's multi_error: 0.124043	valid_0's multi_logloss: 0.289734
[150]	valid_0's multi_error: 0.12086	valid_0's multi_logloss: 0.279251
[200]	valid_0's multi_error: 0.116461	valid_0's multi_logloss: 0.272564
Early stopping, best iteration is:
[214]	valid_0's multi_error: 0.116047	valid_0's multi_logloss: 0.271482
Training until validation scores don't improve for 30 rounds
[50]	valid_0's multi_error: 0.136204	valid_0's multi_logloss: 0.319666
[100]	valid_0's multi_error: 0.126915	valid_0's multi_logloss: 0.293693
[150]	valid_0's multi_error: 0.121662	valid_0's multi_logloss: 0.281328
[200]	valid_0's multi_error: 0.11879	valid_0's multi_logloss: 0.27571
[250]	valid_0's multi_error: 0.118091	valid_0's multi_logloss: 0.272138
[300]	valid_0's multi_error: 0.116073	valid_0's multi_logloss: 0.269462
Early stopping, best iteration is:
[316]	valid_0's multi_error: 0.114754	valid_0's multi_logloss: 0.269412
[I 2025-06-12 01:36:18,187] Trial 31 finished with value: 0.8838704808595003 and parameters: {'boosting_type': 'goss', 'learning_rate': 0.19252739345417408, 'num_leaves': 36, 'max_depth': 8, 'min_data_in_leaf': 18, 'feature_fraction': 0.7071888147230334, 'lambda_l1': 0.08003527118978893, 'lambda_l2': 4.876386433162773, 'min_gain_to_split': 0.042868236655151035, 'max_bin': 100}. Best is trial 11 with value: 0.888762461860649.
Training until validation scores don't improve for 30 rounds
[50]	valid_0's multi_error: 0.134729	valid_0's multi_logloss: 0.320016
[100]	valid_0's multi_error: 0.124276	valid_0's multi_logloss: 0.29098
[150]	valid_0's multi_error: 0.119618	valid_0's multi_logloss: 0.278683
[200]	valid_0's multi_error: 0.116617	valid_0's multi_logloss: 0.2697
[250]	valid_0's multi_error: 0.114055	valid_0's multi_logloss: 0.264585
[300]	valid_0's multi_error: 0.11258	valid_0's multi_logloss: 0.261158
Early stopping, best iteration is:
[295]	valid_0's multi_error: 0.112347	valid_0's multi_logloss: 0.261262
Training until validation scores don't improve for 30 rounds
[50]	valid_0's multi_error: 0.135764	valid_0's multi_logloss: 0.322403
[100]	valid_0's multi_error: 0.125466	valid_0's multi_logloss: 0.293983
[150]	valid_0's multi_error: 0.121171	valid_0's multi_logloss: 0.281663
[200]	valid_0's multi_error: 0.119126	valid_0's multi_logloss: 0.273981
[250]	valid_0's multi_error: 0.116358	valid_0's multi_logloss: 0.269493
[300]	valid_0's multi_error: 0.114573	valid_0's multi_logloss: 0.266258
[350]	valid_0's multi_error: 0.113874	valid_0's multi_logloss: 0.264334
Early stopping, best iteration is:
[333]	valid_0's multi_error: 0.112735	valid_0's multi_logloss: 0.264815
Training until validation scores don't improve for 30 rounds
[50]	valid_0's multi_error: 0.137989	valid_0's multi_logloss: 0.325193
[100]	valid_0's multi_error: 0.128752	valid_0's multi_logloss: 0.296364
[150]	valid_0's multi_error: 0.12262	valid_0's multi_logloss: 0.282675
[200]	valid_0's multi_error: 0.119722	valid_0's multi_logloss: 0.274589
[250]	valid_0's multi_error: 0.117807	valid_0's multi_logloss: 0.269216
Early stopping, best iteration is:
[267]	valid_0's multi_error: 0.115866	valid_0's multi_logloss: 0.267981
[I 2025-06-12 01:38:13,801] Trial 32 finished with value: 0.8843956142365066 and parameters: {'boosting_type': 'goss', 'learning_rate': 0.14420345893446748, 'num_leaves': 41, 'max_depth': 9, 'min_data_in_leaf': 18, 'feature_fraction': 0.6780855513543839, 'lambda_l1': 0.39882909835111946, 'lambda_l2': 4.7550206401939965, 'min_gain_to_split': 0.008218999112412778, 'max_bin': 101}. Best is trial 11 with value: 0.888762461860649.
Training until validation scores don't improve for 30 rounds
[50]	valid_0's multi_error: 0.13209	valid_0's multi_logloss: 0.313111
[100]	valid_0's multi_error: 0.122283	valid_0's multi_logloss: 0.285412
[150]	valid_0's multi_error: 0.118298	valid_0's multi_logloss: 0.273329
[200]	valid_0's multi_error: 0.114081	valid_0's multi_logloss: 0.265952
[250]	valid_0's multi_error: 0.113615	valid_0's multi_logloss: 0.262927
[300]	valid_0's multi_error: 0.112011	valid_0's multi_logloss: 0.260668
Early stopping, best iteration is:
[308]	valid_0's multi_error: 0.111312	valid_0's multi_logloss: 0.260308
Training until validation scores don't improve for 30 rounds
[50]	valid_0's multi_error: 0.13209	valid_0's multi_logloss: 0.314319
[100]	valid_0's multi_error: 0.122723	valid_0's multi_logloss: 0.286105
[150]	valid_0's multi_error: 0.117988	valid_0's multi_logloss: 0.274421
[200]	valid_0's multi_error: 0.115789	valid_0's multi_logloss: 0.268967
[250]	valid_0's multi_error: 0.113977	valid_0's multi_logloss: 0.265645
Early stopping, best iteration is:
[258]	valid_0's multi_error: 0.113408	valid_0's multi_logloss: 0.265468
Training until validation scores don't improve for 30 rounds
[50]	valid_0's multi_error: 0.136359	valid_0's multi_logloss: 0.317892
[100]	valid_0's multi_error: 0.125129	valid_0's multi_logloss: 0.288222
[150]	valid_0's multi_error: 0.120964	valid_0's multi_logloss: 0.2768
[200]	valid_0's multi_error: 0.117471	valid_0's multi_logloss: 0.270873
[250]	valid_0's multi_error: 0.117264	valid_0's multi_logloss: 0.268409
[300]	valid_0's multi_error: 0.115323	valid_0's multi_logloss: 0.267473
Early stopping, best iteration is:
[311]	valid_0's multi_error: 0.114521	valid_0's multi_logloss: 0.267171
[I 2025-06-12 01:40:17,806] Trial 33 finished with value: 0.8849943817423148 and parameters: {'boosting_type': 'goss', 'learning_rate': 0.16091445836697627, 'num_leaves': 63, 'max_depth': 7, 'min_data_in_leaf': 17, 'feature_fraction': 0.983732516279956, 'lambda_l1': 1.2263342484032698, 'lambda_l2': 4.99118658348907, 'min_gain_to_split': 0.3360762812798668, 'max_bin': 130}. Best is trial 11 with value: 0.888762461860649.
Training until validation scores don't improve for 30 rounds
[50]	valid_0's multi_error: 0.151107	valid_0's multi_logloss: 0.366663
[100]	valid_0's multi_error: 0.137523	valid_0's multi_logloss: 0.326254
[150]	valid_0's multi_error: 0.130356	valid_0's multi_logloss: 0.308317
[200]	valid_0's multi_error: 0.125543	valid_0's multi_logloss: 0.297214
[250]	valid_0's multi_error: 0.122878	valid_0's multi_logloss: 0.2892
[300]	valid_0's multi_error: 0.121455	valid_0's multi_logloss: 0.28443
[350]	valid_0's multi_error: 0.120575	valid_0's multi_logloss: 0.28168
Early stopping, best iteration is:
[349]	valid_0's multi_error: 0.120575	valid_0's multi_logloss: 0.28168
Training until validation scores don't improve for 30 rounds
[50]	valid_0's multi_error: 0.150668	valid_0's multi_logloss: 0.366799
[100]	valid_0's multi_error: 0.137497	valid_0's multi_logloss: 0.326856
[150]	valid_0's multi_error: 0.131676	valid_0's multi_logloss: 0.309626
[200]	valid_0's multi_error: 0.127717	valid_0's multi_logloss: 0.299783
[250]	valid_0's multi_error: 0.125543	valid_0's multi_logloss: 0.29342
[300]	valid_0's multi_error: 0.123241	valid_0's multi_logloss: 0.288644
[350]	valid_0's multi_error: 0.12205	valid_0's multi_logloss: 0.285646
Early stopping, best iteration is:
[364]	valid_0's multi_error: 0.121559	valid_0's multi_logloss: 0.285371
Training until validation scores don't improve for 30 rounds
[50]	valid_0's multi_error: 0.152479	valid_0's multi_logloss: 0.370296
[100]	valid_0's multi_error: 0.139464	valid_0's multi_logloss: 0.330182
[150]	valid_0's multi_error: 0.13359	valid_0's multi_logloss: 0.313139
[200]	valid_0's multi_error: 0.12914	valid_0's multi_logloss: 0.30216
[250]	valid_0's multi_error: 0.12707	valid_0's multi_logloss: 0.294311
[300]	valid_0's multi_error: 0.125336	valid_0's multi_logloss: 0.289573
[350]	valid_0's multi_error: 0.12368	valid_0's multi_logloss: 0.286442
Early stopping, best iteration is:
[350]	valid_0's multi_error: 0.12368	valid_0's multi_logloss: 0.286442
[I 2025-06-12 01:41:34,818] Trial 34 finished with value: 0.875648341608445 and parameters: {'boosting_type': 'gbdt', 'learning_rate': 0.0943345753175671, 'num_leaves': 23, 'max_depth': 10, 'min_data_in_leaf': 24, 'feature_fraction': 0.806353993284289, 'lambda_l1': 0.04318580855498538, 'lambda_l2': 4.285166623955569, 'min_gain_to_split': 0.723760546245701, 'max_bin': 124, 'bagging_fraction': 0.8388056956933023, 'bagging_freq': 5}. Best is trial 11 with value: 0.888762461860649.
Training until validation scores don't improve for 30 rounds
[50]	valid_0's multi_error: 0.127794	valid_0's multi_logloss: 0.296218
[100]	valid_0's multi_error: 0.123706	valid_0's multi_logloss: 0.283798
[150]	valid_0's multi_error: 0.120808	valid_0's multi_logloss: 0.281072
[200]	valid_0's multi_error: 0.119954	valid_0's multi_logloss: 0.281149
Early stopping, best iteration is:
[171]	valid_0's multi_error: 0.11954	valid_0's multi_logloss: 0.280797
Training until validation scores don't improve for 30 rounds
[50]	valid_0's multi_error: 0.12839	valid_0's multi_logloss: 0.297771
[100]	valid_0's multi_error: 0.123137	valid_0's multi_logloss: 0.286749
[150]	valid_0's multi_error: 0.120575	valid_0's multi_logloss: 0.283139
[200]	valid_0's multi_error: 0.119359	valid_0's multi_logloss: 0.28396
Early stopping, best iteration is:
[171]	valid_0's multi_error: 0.119308	valid_0's multi_logloss: 0.282786
Training until validation scores don't improve for 30 rounds
[50]	valid_0's multi_error: 0.131831	valid_0's multi_logloss: 0.302976
[100]	valid_0's multi_error: 0.124974	valid_0's multi_logloss: 0.288491
[150]	valid_0's multi_error: 0.123577	valid_0's multi_logloss: 0.286665
[200]	valid_0's multi_error: 0.122801	valid_0's multi_logloss: 0.287457
Early stopping, best iteration is:
[173]	valid_0's multi_error: 0.122102	valid_0's multi_logloss: 0.286351
[I 2025-06-12 01:42:43,365] Trial 35 finished with value: 0.8775947525083504 and parameters: {'boosting_type': 'goss', 'learning_rate': 0.2958361747418561, 'num_leaves': 55, 'max_depth': 8, 'min_data_in_leaf': 31, 'feature_fraction': 0.6281279717535131, 'lambda_l1': 0.5220490912207801, 'lambda_l2': 4.7492835777293205, 'min_gain_to_split': 1.2674126899375828, 'max_bin': 99}. Best is trial 11 with value: 0.888762461860649.
Training until validation scores don't improve for 30 rounds
[50]	valid_0's multi_error: 0.17856	valid_0's multi_logloss: 0.732152
[100]	valid_0's multi_error: 0.172376	valid_0's multi_logloss: 0.568825
[150]	valid_0's multi_error: 0.1679	valid_0's multi_logloss: 0.488615
[200]	valid_0's multi_error: 0.16301	valid_0's multi_logloss: 0.44257
[250]	valid_0's multi_error: 0.159853	valid_0's multi_logloss: 0.413164
[300]	valid_0's multi_error: 0.156308	valid_0's multi_logloss: 0.392738
[350]	valid_0's multi_error: 0.151858	valid_0's multi_logloss: 0.37755
[400]	valid_0's multi_error: 0.147718	valid_0's multi_logloss: 0.365836
[450]	valid_0's multi_error: 0.14526	valid_0's multi_logloss: 0.356815
[500]	valid_0's multi_error: 0.142776	valid_0's multi_logloss: 0.349505
[550]	valid_0's multi_error: 0.141404	valid_0's multi_logloss: 0.343191
[600]	valid_0's multi_error: 0.139438	valid_0's multi_logloss: 0.337858
[650]	valid_0's multi_error: 0.13786	valid_0's multi_logloss: 0.333325
[700]	valid_0's multi_error: 0.136747	valid_0's multi_logloss: 0.328787
[750]	valid_0's multi_error: 0.135609	valid_0's multi_logloss: 0.324869
[800]	valid_0's multi_error: 0.134185	valid_0's multi_logloss: 0.321412
[850]	valid_0's multi_error: 0.133125	valid_0's multi_logloss: 0.318284
[900]	valid_0's multi_error: 0.131909	valid_0's multi_logloss: 0.315399
[950]	valid_0's multi_error: 0.130874	valid_0's multi_logloss: 0.312698
[1000]	valid_0's multi_error: 0.130046	valid_0's multi_logloss: 0.310076
Did not meet early stopping. Best iteration is:
[1000]	valid_0's multi_error: 0.130046	valid_0's multi_logloss: 0.310076
Training until validation scores don't improve for 30 rounds
[50]	valid_0's multi_error: 0.176982	valid_0's multi_logloss: 0.732474
[100]	valid_0's multi_error: 0.171341	valid_0's multi_logloss: 0.568759
[150]	valid_0's multi_error: 0.166477	valid_0's multi_logloss: 0.488162
[200]	valid_0's multi_error: 0.16301	valid_0's multi_logloss: 0.442309
[250]	valid_0's multi_error: 0.158094	valid_0's multi_logloss: 0.412803
[300]	valid_0's multi_error: 0.154756	valid_0's multi_logloss: 0.392588
[350]	valid_0's multi_error: 0.151444	valid_0's multi_logloss: 0.37793
[400]	valid_0's multi_error: 0.147977	valid_0's multi_logloss: 0.366309
[450]	valid_0's multi_error: 0.145053	valid_0's multi_logloss: 0.357651
[500]	valid_0's multi_error: 0.143474	valid_0's multi_logloss: 0.350336
[550]	valid_0's multi_error: 0.141818	valid_0's multi_logloss: 0.344151
[600]	valid_0's multi_error: 0.140525	valid_0's multi_logloss: 0.339044
[650]	valid_0's multi_error: 0.139257	valid_0's multi_logloss: 0.334525
[700]	valid_0's multi_error: 0.138118	valid_0's multi_logloss: 0.330486
[750]	valid_0's multi_error: 0.136204	valid_0's multi_logloss: 0.326759
[800]	valid_0's multi_error: 0.135013	valid_0's multi_logloss: 0.323547
[850]	valid_0's multi_error: 0.134185	valid_0's multi_logloss: 0.32053
[900]	valid_0's multi_error: 0.132995	valid_0's multi_logloss: 0.31771
[950]	valid_0's multi_error: 0.131986	valid_0's multi_logloss: 0.314938
[1000]	valid_0's multi_error: 0.130874	valid_0's multi_logloss: 0.312601
Did not meet early stopping. Best iteration is:
[991]	valid_0's multi_error: 0.130848	valid_0's multi_logloss: 0.313001
Training until validation scores don't improve for 30 rounds
[50]	valid_0's multi_error: 0.181096	valid_0's multi_logloss: 0.732778
[100]	valid_0's multi_error: 0.17543	valid_0's multi_logloss: 0.571398
[150]	valid_0's multi_error: 0.170229	valid_0's multi_logloss: 0.491291
[200]	valid_0's multi_error: 0.166089	valid_0's multi_logloss: 0.44615
[250]	valid_0's multi_error: 0.161613	valid_0's multi_logloss: 0.417063
[300]	valid_0's multi_error: 0.159232	valid_0's multi_logloss: 0.397174
[350]	valid_0's multi_error: 0.155791	valid_0's multi_logloss: 0.382634
[400]	valid_0's multi_error: 0.152427	valid_0's multi_logloss: 0.371357
[450]	valid_0's multi_error: 0.149555	valid_0's multi_logloss: 0.362148
[500]	valid_0's multi_error: 0.147174	valid_0's multi_logloss: 0.354916
[550]	valid_0's multi_error: 0.144794	valid_0's multi_logloss: 0.34883
[600]	valid_0's multi_error: 0.142879	valid_0's multi_logloss: 0.343598
[650]	valid_0's multi_error: 0.141767	valid_0's multi_logloss: 0.338798
[700]	valid_0's multi_error: 0.140188	valid_0's multi_logloss: 0.334456
[750]	valid_0's multi_error: 0.138869	valid_0's multi_logloss: 0.330932
[800]	valid_0's multi_error: 0.137627	valid_0's multi_logloss: 0.327496
[850]	valid_0's multi_error: 0.136876	valid_0's multi_logloss: 0.32439
[900]	valid_0's multi_error: 0.135531	valid_0's multi_logloss: 0.321433
[950]	valid_0's multi_error: 0.134341	valid_0's multi_logloss: 0.318697
[1000]	valid_0's multi_error: 0.13372	valid_0's multi_logloss: 0.316074
Did not meet early stopping. Best iteration is:
[985]	valid_0's multi_error: 0.133564	valid_0's multi_logloss: 0.316874
[I 2025-06-12 01:47:15,276] Trial 36 finished with value: 0.8654956224317893 and parameters: {'boosting_type': 'goss', 'learning_rate': 0.01119471521465074, 'num_leaves': 40, 'max_depth': 6, 'min_data_in_leaf': 10, 'feature_fraction': 0.8412328914726764, 'lambda_l1': 0.78805507492076, 'lambda_l2': 3.7434669593393535, 'min_gain_to_split': 0.33022511783708614, 'max_bin': 80}. Best is trial 11 with value: 0.888762461860649.
Training until validation scores don't improve for 30 rounds
[50]	valid_0's multi_error: 0.144044	valid_0's multi_logloss: 0.379427
[100]	valid_0's multi_error: 0.131262	valid_0's multi_logloss: 0.317101
[150]	valid_0's multi_error: 0.125285	valid_0's multi_logloss: 0.297638
[200]	valid_0's multi_error: 0.123629	valid_0's multi_logloss: 0.294328
[250]	valid_0's multi_error: 0.123525	valid_0's multi_logloss: 0.293971
Early stopping, best iteration is:
[230]	valid_0's multi_error: 0.123473	valid_0's multi_logloss: 0.294066
Training until validation scores don't improve for 30 rounds
[50]	valid_0's multi_error: 0.145027	valid_0's multi_logloss: 0.378965
[100]	valid_0's multi_error: 0.132529	valid_0's multi_logloss: 0.317867
[150]	valid_0's multi_error: 0.125906	valid_0's multi_logloss: 0.299543
[200]	valid_0's multi_error: 0.125854	valid_0's multi_logloss: 0.297047
Early stopping, best iteration is:
[183]	valid_0's multi_error: 0.125673	valid_0's multi_logloss: 0.297291
Training until validation scores don't improve for 30 rounds
[50]	valid_0's multi_error: 0.146838	valid_0's multi_logloss: 0.382675
[100]	valid_0's multi_error: 0.135583	valid_0's multi_logloss: 0.322347
[150]	valid_0's multi_error: 0.128933	valid_0's multi_logloss: 0.303857
[200]	valid_0's multi_error: 0.127484	valid_0's multi_logloss: 0.300568
Early stopping, best iteration is:
[194]	valid_0's multi_error: 0.12738	valid_0's multi_logloss: 0.300607
