[I 2025-06-12 05:32:12,720] Trial 103 finished with value: 0.8876942978654214 and parameters: {'boosting_type': 'goss', 'learning_rate': 0.09612135679817553, 'num_leaves': 61, 'max_depth': 13, 'min_data_in_leaf': 31, 'feature_fraction': 0.6193132116668929, 'lambda_l1': 0.2029994684163988, 'lambda_l2': 4.557599571011207, 'min_gain_to_split': 0.09806058244793707, 'max_bin': 85}. Best is trial 94 with value: 0.8896529108188087.
Training until validation scores don't improve for 30 rounds
[50]	valid_0's multi_error: 0.132504	valid_0's multi_logloss: 0.320374
[100]	valid_0's multi_error: 0.121067	valid_0's multi_logloss: 0.286453
[150]	valid_0's multi_error: 0.116772	valid_0's multi_logloss: 0.272908
[200]	valid_0's multi_error: 0.114184	valid_0's multi_logloss: 0.266275
[250]	valid_0's multi_error: 0.112684	valid_0's multi_logloss: 0.262163
[300]	valid_0's multi_error: 0.111959	valid_0's multi_logloss: 0.259898
Early stopping, best iteration is:
[305]	valid_0's multi_error: 0.111364	valid_0's multi_logloss: 0.259739
Training until validation scores don't improve for 30 rounds
[50]	valid_0's multi_error: 0.133564	valid_0's multi_logloss: 0.32091
[100]	valid_0's multi_error: 0.122413	valid_0's multi_logloss: 0.288692
[150]	valid_0's multi_error: 0.118247	valid_0's multi_logloss: 0.275819
[200]	valid_0's multi_error: 0.115064	valid_0's multi_logloss: 0.268975
[250]	valid_0's multi_error: 0.114003	valid_0's multi_logloss: 0.265537
Early stopping, best iteration is:
[246]	valid_0's multi_error: 0.113512	valid_0's multi_logloss: 0.265735
Training until validation scores don't improve for 30 rounds
[50]	valid_0's multi_error: 0.137911	valid_0's multi_logloss: 0.325262
[100]	valid_0's multi_error: 0.12632	valid_0's multi_logloss: 0.291088
[150]	valid_0's multi_error: 0.120006	valid_0's multi_logloss: 0.277571
[200]	valid_0's multi_error: 0.117703	valid_0's multi_logloss: 0.270955
[250]	valid_0's multi_error: 0.116513	valid_0's multi_logloss: 0.267544
[300]	valid_0's multi_error: 0.116513	valid_0's multi_logloss: 0.266305
Early stopping, best iteration is:
[283]	valid_0's multi_error: 0.115116	valid_0's multi_logloss: 0.266619
[I 2025-06-12 05:34:09,946] Trial 104 finished with value: 0.8846744786403686 and parameters: {'boosting_type': 'goss', 'learning_rate': 0.10042601610033895, 'num_leaves': 61, 'max_depth': 14, 'min_data_in_leaf': 31, 'feature_fraction': 0.8624449481081436, 'lambda_l1': 0.19415319783136925, 'lambda_l2': 4.307848565534197, 'min_gain_to_split': 0.7455899381367845, 'max_bin': 85}. Best is trial 94 with value: 0.8896529108188087.
Training until validation scores don't improve for 30 rounds
[50]	valid_0's multi_error: 0.144044	valid_0's multi_logloss: 0.391952
[100]	valid_0's multi_error: 0.13209	valid_0's multi_logloss: 0.322643
[150]	valid_0's multi_error: 0.125647	valid_0's multi_logloss: 0.298451
[200]	valid_0's multi_error: 0.120989	valid_0's multi_logloss: 0.285499
[250]	valid_0's multi_error: 0.1176	valid_0's multi_logloss: 0.277504
[300]	valid_0's multi_error: 0.116022	valid_0's multi_logloss: 0.272204
[350]	valid_0's multi_error: 0.114003	valid_0's multi_logloss: 0.268038
[400]	valid_0's multi_error: 0.113253	valid_0's multi_logloss: 0.264775
[450]	valid_0's multi_error: 0.111778	valid_0's multi_logloss: 0.262244
[500]	valid_0's multi_error: 0.111054	valid_0's multi_logloss: 0.260517
Early stopping, best iteration is:
[475]	valid_0's multi_error: 0.110769	valid_0's multi_logloss: 0.261317
Training until validation scores don't improve for 30 rounds
[50]	valid_0's multi_error: 0.144173	valid_0's multi_logloss: 0.392754
[100]	valid_0's multi_error: 0.131469	valid_0's multi_logloss: 0.323784
[150]	valid_0's multi_error: 0.124897	valid_0's multi_logloss: 0.299827
[200]	valid_0's multi_error: 0.122283	valid_0's multi_logloss: 0.287696
[250]	valid_0's multi_error: 0.119204	valid_0's multi_logloss: 0.279836
[300]	valid_0's multi_error: 0.117212	valid_0's multi_logloss: 0.274424
[350]	valid_0's multi_error: 0.115271	valid_0's multi_logloss: 0.270136
[400]	valid_0's multi_error: 0.114573	valid_0's multi_logloss: 0.267246
Early stopping, best iteration is:
[384]	valid_0's multi_error: 0.114288	valid_0's multi_logloss: 0.26817
Training until validation scores don't improve for 30 rounds
[50]	valid_0's multi_error: 0.147278	valid_0's multi_logloss: 0.396869
[100]	valid_0's multi_error: 0.135816	valid_0's multi_logloss: 0.327366
[150]	valid_0's multi_error: 0.129994	valid_0's multi_logloss: 0.303789
[200]	valid_0's multi_error: 0.12544	valid_0's multi_logloss: 0.291315
[250]	valid_0's multi_error: 0.122024	valid_0's multi_logloss: 0.283668
[300]	valid_0's multi_error: 0.120239	valid_0's multi_logloss: 0.278277
[350]	valid_0's multi_error: 0.117652	valid_0's multi_logloss: 0.274202
[400]	valid_0's multi_error: 0.115815	valid_0's multi_logloss: 0.270905
Early stopping, best iteration is:
[405]	valid_0's multi_error: 0.11553	valid_0's multi_logloss: 0.270636
[I 2025-06-12 05:37:34,589] Trial 105 finished with value: 0.8843919495024086 and parameters: {'boosting_type': 'goss', 'learning_rate': 0.052997627854551366, 'num_leaves': 72, 'max_depth': 13, 'min_data_in_leaf': 39, 'feature_fraction': 0.6201047065958545, 'lambda_l1': 4.279828552573807, 'lambda_l2': 4.547495536555245, 'min_gain_to_split': 0.0978088309230321, 'max_bin': 88}. Best is trial 94 with value: 0.8896529108188087.
Training until validation scores don't improve for 30 rounds
[50]	valid_0's multi_error: 0.134108	valid_0's multi_logloss: 0.330152
[100]	valid_0's multi_error: 0.12337	valid_0's multi_logloss: 0.291199
[150]	valid_0's multi_error: 0.118428	valid_0's multi_logloss: 0.276954
[200]	valid_0's multi_error: 0.115478	valid_0's multi_logloss: 0.268149
[250]	valid_0's multi_error: 0.113072	valid_0's multi_logloss: 0.26348
[300]	valid_0's multi_error: 0.1117	valid_0's multi_logloss: 0.260287
[350]	valid_0's multi_error: 0.110096	valid_0's multi_logloss: 0.258547
Early stopping, best iteration is:
[339]	valid_0's multi_error: 0.109708	valid_0's multi_logloss: 0.258865
Training until validation scores don't improve for 30 rounds
[50]	valid_0's multi_error: 0.136695	valid_0's multi_logloss: 0.332663
[100]	valid_0's multi_error: 0.124664	valid_0's multi_logloss: 0.293437
[150]	valid_0's multi_error: 0.119437	valid_0's multi_logloss: 0.279209
[200]	valid_0's multi_error: 0.115737	valid_0's multi_logloss: 0.270518
[250]	valid_0's multi_error: 0.115038	valid_0's multi_logloss: 0.265769
[300]	valid_0's multi_error: 0.113227	valid_0's multi_logloss: 0.263221
Early stopping, best iteration is:
[312]	valid_0's multi_error: 0.11271	valid_0's multi_logloss: 0.262737
Training until validation scores don't improve for 30 rounds
[50]	valid_0's multi_error: 0.139309	valid_0's multi_logloss: 0.336028
[100]	valid_0's multi_error: 0.12663	valid_0's multi_logloss: 0.296421
[150]	valid_0's multi_error: 0.121792	valid_0's multi_logloss: 0.281678
[200]	valid_0's multi_error: 0.117807	valid_0's multi_logloss: 0.273196
[250]	valid_0's multi_error: 0.116203	valid_0's multi_logloss: 0.26816
Early stopping, best iteration is:
[264]	valid_0's multi_error: 0.114754	valid_0's multi_logloss: 0.267075
[I 2025-06-12 05:39:47,650] Trial 106 finished with value: 0.8856256275838549 and parameters: {'boosting_type': 'goss', 'learning_rate': 0.09150441162320462, 'num_leaves': 62, 'max_depth': 13, 'min_data_in_leaf': 32, 'feature_fraction': 0.6895802939686452, 'lambda_l1': 0.6197575493355373, 'lambda_l2': 4.561960589133597, 'min_gain_to_split': 0.4646330055021327, 'max_bin': 99}. Best is trial 94 with value: 0.8896529108188087.
Training until validation scores don't improve for 30 rounds
[50]	valid_0's multi_error: 0.122775	valid_0's multi_logloss: 0.29121
[100]	valid_0's multi_error: 0.115944	valid_0's multi_logloss: 0.269783
[150]	valid_0's multi_error: 0.111623	valid_0's multi_logloss: 0.262543
[200]	valid_0's multi_error: 0.110924	valid_0's multi_logloss: 0.260619
[250]	valid_0's multi_error: 0.110019	valid_0's multi_logloss: 0.260608
Early stopping, best iteration is:
[222]	valid_0's multi_error: 0.110717	valid_0's multi_logloss: 0.259967
Training until validation scores don't improve for 30 rounds
[50]	valid_0's multi_error: 0.123215	valid_0's multi_logloss: 0.292503
[100]	valid_0's multi_error: 0.116073	valid_0's multi_logloss: 0.271106
[150]	valid_0's multi_error: 0.113589	valid_0's multi_logloss: 0.265308
[200]	valid_0's multi_error: 0.111571	valid_0's multi_logloss: 0.264115
Early stopping, best iteration is:
[188]	valid_0's multi_error: 0.111907	valid_0's multi_logloss: 0.263847
Training until validation scores don't improve for 30 rounds
[50]	valid_0's multi_error: 0.126294	valid_0's multi_logloss: 0.295252
[100]	valid_0's multi_error: 0.118609	valid_0's multi_logloss: 0.273487
[150]	valid_0's multi_error: 0.114805	valid_0's multi_logloss: 0.267537
[200]	valid_0's multi_error: 0.113926	valid_0's multi_logloss: 0.266413
Early stopping, best iteration is:
[187]	valid_0's multi_error: 0.114598	valid_0's multi_logloss: 0.266232
[I 2025-06-12 05:41:45,281] Trial 107 finished with value: 0.885702983115425 and parameters: {'boosting_type': 'goss', 'learning_rate': 0.15253420975538032, 'num_leaves': 93, 'max_depth': 12, 'min_data_in_leaf': 28, 'feature_fraction': 0.6085746280978603, 'lambda_l1': 0.011044273319517184, 'lambda_l2': 0.11696180414097665, 'min_gain_to_split': 0.35330309482150846, 'max_bin': 87}. Best is trial 94 with value: 0.8896529108188087.
Training until validation scores don't improve for 30 rounds
[50]	valid_0's multi_error: 0.124819	valid_0's multi_logloss: 0.30546
[100]	valid_0's multi_error: 0.115323	valid_0's multi_logloss: 0.270504
[150]	valid_0's multi_error: 0.111002	valid_0's multi_logloss: 0.258152
[200]	valid_0's multi_error: 0.108492	valid_0's multi_logloss: 0.252706
[250]	valid_0's multi_error: 0.107664	valid_0's multi_logloss: 0.250179
Early stopping, best iteration is:
[260]	valid_0's multi_error: 0.106577	valid_0's multi_logloss: 0.250086
Training until validation scores don't improve for 30 rounds
[50]	valid_0's multi_error: 0.126371	valid_0's multi_logloss: 0.306194
[100]	valid_0's multi_error: 0.116824	valid_0's multi_logloss: 0.271484
[150]	valid_0's multi_error: 0.11346	valid_0's multi_logloss: 0.260919
[200]	valid_0's multi_error: 0.1102	valid_0's multi_logloss: 0.256078
[250]	valid_0's multi_error: 0.109191	valid_0's multi_logloss: 0.254465
[300]	valid_0's multi_error: 0.10844	valid_0's multi_logloss: 0.25423
Early stopping, best iteration is:
[272]	valid_0's multi_error: 0.108026	valid_0's multi_logloss: 0.254167
Training until validation scores don't improve for 30 rounds
[50]	valid_0's multi_error: 0.129166	valid_0's multi_logloss: 0.310177
[100]	valid_0's multi_error: 0.118247	valid_0's multi_logloss: 0.274459
[150]	valid_0's multi_error: 0.115271	valid_0's multi_logloss: 0.264025
[200]	valid_0's multi_error: 0.11227	valid_0's multi_logloss: 0.259198
[250]	valid_0's multi_error: 0.110614	valid_0's multi_logloss: 0.257818
Early stopping, best iteration is:
[229]	valid_0's multi_error: 0.110562	valid_0's multi_logloss: 0.25811
[I 2025-06-12 05:45:19,292] Trial 108 finished with value: 0.8897424994899721 and parameters: {'boosting_type': 'goss', 'learning_rate': 0.08339807301114942, 'num_leaves': 146, 'max_depth': 13, 'min_data_in_leaf': 23, 'feature_fraction': 0.9540989409787208, 'lambda_l1': 0.3010709937457269, 'lambda_l2': 3.9811175951576474, 'min_gain_to_split': 0.22016476471457777, 'max_bin': 75}. Best is trial 108 with value: 0.8897424994899721.
Training until validation scores don't improve for 30 rounds
[50]	valid_0's multi_error: 0.125647	valid_0's multi_logloss: 0.311331
[100]	valid_0's multi_error: 0.116694	valid_0's multi_logloss: 0.276121
[150]	valid_0's multi_error: 0.113253	valid_0's multi_logloss: 0.265291
[200]	valid_0's multi_error: 0.112373	valid_0's multi_logloss: 0.261063
[250]	valid_0's multi_error: 0.110872	valid_0's multi_logloss: 0.259168
[300]	valid_0's multi_error: 0.110458	valid_0's multi_logloss: 0.258142
Early stopping, best iteration is:
[277]	valid_0's multi_error: 0.109915	valid_0's multi_logloss: 0.258519
Training until validation scores don't improve for 30 rounds
[50]	valid_0's multi_error: 0.128674	valid_0's multi_logloss: 0.313051
[100]	valid_0's multi_error: 0.11967	valid_0's multi_logloss: 0.278875
[150]	valid_0's multi_error: 0.115659	valid_0's multi_logloss: 0.268354
[200]	valid_0's multi_error: 0.114443	valid_0's multi_logloss: 0.264299
Early stopping, best iteration is:
[186]	valid_0's multi_error: 0.1139	valid_0's multi_logloss: 0.265094
Training until validation scores don't improve for 30 rounds
[50]	valid_0's multi_error: 0.132633	valid_0's multi_logloss: 0.317242
[100]	valid_0's multi_error: 0.121248	valid_0's multi_logloss: 0.282243
[150]	valid_0's multi_error: 0.116875	valid_0's multi_logloss: 0.271145
[200]	valid_0's multi_error: 0.11584	valid_0's multi_logloss: 0.267619
Early stopping, best iteration is:
[204]	valid_0's multi_error: 0.115452	valid_0's multi_logloss: 0.26744
[I 2025-06-12 05:47:51,392] Trial 109 finished with value: 0.8848611044621414 and parameters: {'boosting_type': 'goss', 'learning_rate': 0.08152097844404739, 'num_leaves': 144, 'max_depth': 13, 'min_data_in_leaf': 42, 'feature_fraction': 0.9708613051194629, 'lambda_l1': 0.3063062300018464, 'lambda_l2': 3.5795454478697426, 'min_gain_to_split': 0.9800286053412017, 'max_bin': 72}. Best is trial 108 with value: 0.8897424994899721.
Training until validation scores don't improve for 30 rounds
[50]	valid_0's multi_error: 0.130046	valid_0's multi_logloss: 0.324782
[100]	valid_0's multi_error: 0.120757	valid_0's multi_logloss: 0.285345
[150]	valid_0's multi_error: 0.116617	valid_0's multi_logloss: 0.275132
[200]	valid_0's multi_error: 0.116099	valid_0's multi_logloss: 0.271759
Early stopping, best iteration is:
[181]	valid_0's multi_error: 0.115219	valid_0's multi_logloss: 0.2725
Training until validation scores don't improve for 30 rounds
[50]	valid_0's multi_error: 0.13033	valid_0's multi_logloss: 0.324975
[100]	valid_0's multi_error: 0.122128	valid_0's multi_logloss: 0.287722
[150]	valid_0's multi_error: 0.117652	valid_0's multi_logloss: 0.278201
Early stopping, best iteration is:
[169]	valid_0's multi_error: 0.11716	valid_0's multi_logloss: 0.276754
Training until validation scores don't improve for 30 rounds
[50]	valid_0's multi_error: 0.134599	valid_0's multi_logloss: 0.329444
[100]	valid_0's multi_error: 0.124198	valid_0's multi_logloss: 0.29106
[150]	valid_0's multi_error: 0.121041	valid_0's multi_logloss: 0.281228
[200]	valid_0's multi_error: 0.119101	valid_0's multi_logloss: 0.276836
[250]	valid_0's multi_error: 0.117833	valid_0's multi_logloss: 0.275186
[300]	valid_0's multi_error: 0.117626	valid_0's multi_logloss: 0.274247
Early stopping, best iteration is:
[295]	valid_0's multi_error: 0.117496	valid_0's multi_logloss: 0.274309
[I 2025-06-12 05:49:57,639] Trial 110 finished with value: 0.8811320146314259 and parameters: {'boosting_type': 'goss', 'learning_rate': 0.07187207118041662, 'num_leaves': 140, 'max_depth': 13, 'min_data_in_leaf': 37, 'feature_fraction': 0.8721741852847249, 'lambda_l1': 0.2299771961126686, 'lambda_l2': 3.9685351271678466, 'min_gain_to_split': 1.985073124247284, 'max_bin': 64}. Best is trial 108 with value: 0.8897424994899721.
Training until validation scores don't improve for 30 rounds
[50]	valid_0's multi_error: 0.135816	valid_0's multi_logloss: 0.348765
[100]	valid_0's multi_error: 0.122257	valid_0's multi_logloss: 0.294804
[150]	valid_0's multi_error: 0.116591	valid_0's multi_logloss: 0.276998
[200]	valid_0's multi_error: 0.113279	valid_0's multi_logloss: 0.267148
[250]	valid_0's multi_error: 0.111545	valid_0's multi_logloss: 0.26072
[300]	valid_0's multi_error: 0.109372	valid_0's multi_logloss: 0.256298
[350]	valid_0's multi_error: 0.108518	valid_0's multi_logloss: 0.253513
Early stopping, best iteration is:
[326]	valid_0's multi_error: 0.108233	valid_0's multi_logloss: 0.25456
Training until validation scores don't improve for 30 rounds
[50]	valid_0's multi_error: 0.136462	valid_0's multi_logloss: 0.349294
[100]	valid_0's multi_error: 0.124819	valid_0's multi_logloss: 0.296887
[150]	valid_0's multi_error: 0.119256	valid_0's multi_logloss: 0.279876
[200]	valid_0's multi_error: 0.115996	valid_0's multi_logloss: 0.270477
[250]	valid_0's multi_error: 0.114469	valid_0's multi_logloss: 0.264138
[300]	valid_0's multi_error: 0.113305	valid_0's multi_logloss: 0.260241
[350]	valid_0's multi_error: 0.111493	valid_0's multi_logloss: 0.257306
[400]	valid_0's multi_error: 0.111105	valid_0's multi_logloss: 0.255129
[450]	valid_0's multi_error: 0.110536	valid_0's multi_logloss: 0.254433
[500]	valid_0's multi_error: 0.110407	valid_0's multi_logloss: 0.253451
Early stopping, best iteration is:
[488]	valid_0's multi_error: 0.109915	valid_0's multi_logloss: 0.253666
Training until validation scores don't improve for 30 rounds
[50]	valid_0's multi_error: 0.139593	valid_0's multi_logloss: 0.354195
[100]	valid_0's multi_error: 0.129192	valid_0's multi_logloss: 0.301562
[150]	valid_0's multi_error: 0.121585	valid_0's multi_logloss: 0.282898
[200]	valid_0's multi_error: 0.11835	valid_0's multi_logloss: 0.272789
[250]	valid_0's multi_error: 0.115582	valid_0's multi_logloss: 0.266308
[300]	valid_0's multi_error: 0.113201	valid_0's multi_logloss: 0.262101
[350]	valid_0's multi_error: 0.112503	valid_0's multi_logloss: 0.259392
Early stopping, best iteration is:
[364]	valid_0's multi_error: 0.111856	valid_0's multi_logloss: 0.258813
[I 2025-06-12 05:53:36,192] Trial 111 finished with value: 0.8880493258032977 and parameters: {'boosting_type': 'goss', 'learning_rate': 0.06116771997516123, 'num_leaves': 87, 'max_depth': 12, 'min_data_in_leaf': 23, 'feature_fraction': 0.8996303153636714, 'lambda_l1': 0.39855040435642747, 'lambda_l2': 4.2755528019992175, 'min_gain_to_split': 0.18565533591723116, 'max_bin': 77}. Best is trial 108 with value: 0.8897424994899721.
Training until validation scores don't improve for 30 rounds
[50]	valid_0's multi_error: 0.12011	valid_0's multi_logloss: 0.285295
[100]	valid_0's multi_error: 0.112994	valid_0's multi_logloss: 0.26258
[150]	valid_0's multi_error: 0.108932	valid_0's multi_logloss: 0.255614
[200]	valid_0's multi_error: 0.107431	valid_0's multi_logloss: 0.252561
[250]	valid_0's multi_error: 0.106784	valid_0's multi_logloss: 0.252374
Early stopping, best iteration is:
[231]	valid_0's multi_error: 0.106008	valid_0's multi_logloss: 0.252218
Training until validation scores don't improve for 30 rounds
[50]	valid_0's multi_error: 0.122387	valid_0's multi_logloss: 0.288122
[100]	valid_0's multi_error: 0.1139	valid_0's multi_logloss: 0.264761
[150]	valid_0's multi_error: 0.111752	valid_0's multi_logloss: 0.258186
[200]	valid_0's multi_error: 0.109708	valid_0's multi_logloss: 0.256726
[250]	valid_0's multi_error: 0.108932	valid_0's multi_logloss: 0.257734
Early stopping, best iteration is:
[226]	valid_0's multi_error: 0.108699	valid_0's multi_logloss: 0.256598
Training until validation scores don't improve for 30 rounds
[50]	valid_0's multi_error: 0.126061	valid_0's multi_logloss: 0.292467
[100]	valid_0's multi_error: 0.117005	valid_0's multi_logloss: 0.268468
[150]	valid_0's multi_error: 0.113124	valid_0's multi_logloss: 0.262176
[200]	valid_0's multi_error: 0.112166	valid_0's multi_logloss: 0.261554
Early stopping, best iteration is:
[205]	valid_0's multi_error: 0.111545	valid_0's multi_logloss: 0.261328
[I 2025-06-12 05:56:33,195] Trial 112 finished with value: 0.8893786620292073 and parameters: {'boosting_type': 'goss', 'learning_rate': 0.12176128259488647, 'num_leaves': 145, 'max_depth': 12, 'min_data_in_leaf': 23, 'feature_fraction': 0.954369798740336, 'lambda_l1': 0.1415545411033574, 'lambda_l2': 4.159200501202044, 'min_gain_to_split': 0.23420297678493612, 'max_bin': 80}. Best is trial 108 with value: 0.8897424994899721.
Training until validation scores don't improve for 30 rounds
[50]	valid_0's multi_error: 0.121274	valid_0's multi_logloss: 0.287007
[100]	valid_0's multi_error: 0.113589	valid_0's multi_logloss: 0.262764
[150]	valid_0's multi_error: 0.109656	valid_0's multi_logloss: 0.255771
[200]	valid_0's multi_error: 0.108337	valid_0's multi_logloss: 0.254037
Early stopping, best iteration is:
[213]	valid_0's multi_error: 0.108052	valid_0's multi_logloss: 0.253863
Training until validation scores don't improve for 30 rounds
[50]	valid_0's multi_error: 0.123008	valid_0's multi_logloss: 0.288835
[100]	valid_0's multi_error: 0.115401	valid_0's multi_logloss: 0.266323
[150]	valid_0's multi_error: 0.111545	valid_0's multi_logloss: 0.259714
[200]	valid_0's multi_error: 0.110484	valid_0's multi_logloss: 0.258092
Early stopping, best iteration is:
[206]	valid_0's multi_error: 0.109863	valid_0's multi_logloss: 0.257936
Training until validation scores don't improve for 30 rounds
[50]	valid_0's multi_error: 0.124922	valid_0's multi_logloss: 0.291553
[100]	valid_0's multi_error: 0.117884	valid_0's multi_logloss: 0.268276
[150]	valid_0's multi_error: 0.112891	valid_0's multi_logloss: 0.260915
[200]	valid_0's multi_error: 0.111907	valid_0's multi_logloss: 0.259574
Early stopping, best iteration is:
[196]	valid_0's multi_error: 0.11183	valid_0's multi_logloss: 0.259432
