[I 2025-06-12 00:00:41,141] Trial 6 finished with value: 0.8754128136360747 and parameters: {'boosting_type': 'gbdt', 'learning_rate': 0.12003693689266566, 'num_leaves': 120, 'max_depth': 11, 'min_data_in_leaf': 14, 'feature_fraction': 0.7794363500594912, 'lambda_l1': 1.4974498607724467, 'lambda_l2': 1.879313720614479, 'min_gain_to_split': 0.8736100678107972, 'max_bin': 91, 'bagging_fraction': 0.7168521727602821, 'bagging_freq': 7}. Best is trial 5 with value: 0.8858973092547489.
Training until validation scores don't improve for 30 rounds
[50]	valid_0's multi_error: 0.173877	valid_0's multi_logloss: 0.851055
[100]	valid_0's multi_error: 0.170125	valid_0's multi_logloss: 0.699033
[150]	valid_0's multi_error: 0.165882	valid_0's multi_logloss: 0.602512
[200]	valid_0's multi_error: 0.162415	valid_0's multi_logloss: 0.536935
[250]	valid_0's multi_error: 0.160215	valid_0's multi_logloss: 0.490993
[300]	valid_0's multi_error: 0.157861	valid_0's multi_logloss: 0.458815
[350]	valid_0's multi_error: 0.155713	valid_0's multi_logloss: 0.434677
[400]	valid_0's multi_error: 0.153902	valid_0's multi_logloss: 0.415752
[450]	valid_0's multi_error: 0.151858	valid_0's multi_logloss: 0.401042
[500]	valid_0's multi_error: 0.150254	valid_0's multi_logloss: 0.388647
[550]	valid_0's multi_error: 0.148572	valid_0's multi_logloss: 0.378425
[600]	valid_0's multi_error: 0.147123	valid_0's multi_logloss: 0.370057
[650]	valid_0's multi_error: 0.145415	valid_0's multi_logloss: 0.362934
[700]	valid_0's multi_error: 0.144147	valid_0's multi_logloss: 0.356894
[750]	valid_0's multi_error: 0.143474	valid_0's multi_logloss: 0.351497
[800]	valid_0's multi_error: 0.141844	valid_0's multi_logloss: 0.346723
[850]	valid_0's multi_error: 0.14068	valid_0's multi_logloss: 0.342558
[900]	valid_0's multi_error: 0.139412	valid_0's multi_logloss: 0.338782
[950]	valid_0's multi_error: 0.138274	valid_0's multi_logloss: 0.335428
[1000]	valid_0's multi_error: 0.137704	valid_0's multi_logloss: 0.332551
Did not meet early stopping. Best iteration is:
[994]	valid_0's multi_error: 0.137653	valid_0's multi_logloss: 0.332909
Training until validation scores don't improve for 30 rounds
[50]	valid_0's multi_error: 0.173101	valid_0's multi_logloss: 0.851383
[100]	valid_0's multi_error: 0.170306	valid_0's multi_logloss: 0.699218
[150]	valid_0's multi_error: 0.166606	valid_0's multi_logloss: 0.602373
[200]	valid_0's multi_error: 0.162673	valid_0's multi_logloss: 0.53681
[250]	valid_0's multi_error: 0.160164	valid_0's multi_logloss: 0.490817
[300]	valid_0's multi_error: 0.158171	valid_0's multi_logloss: 0.458537
[350]	valid_0's multi_error: 0.156101	valid_0's multi_logloss: 0.43451
[400]	valid_0's multi_error: 0.154549	valid_0's multi_logloss: 0.415546
[450]	valid_0's multi_error: 0.152686	valid_0's multi_logloss: 0.401135
[500]	valid_0's multi_error: 0.150228	valid_0's multi_logloss: 0.388563
[550]	valid_0's multi_error: 0.14883	valid_0's multi_logloss: 0.37884
[600]	valid_0's multi_error: 0.147252	valid_0's multi_logloss: 0.370494
[650]	valid_0's multi_error: 0.145415	valid_0's multi_logloss: 0.36342
[700]	valid_0's multi_error: 0.14394	valid_0's multi_logloss: 0.357175
[750]	valid_0's multi_error: 0.142129	valid_0's multi_logloss: 0.351737
[800]	valid_0's multi_error: 0.141094	valid_0's multi_logloss: 0.347176
[850]	valid_0's multi_error: 0.139878	valid_0's multi_logloss: 0.343208
[900]	valid_0's multi_error: 0.139231	valid_0's multi_logloss: 0.339581
[950]	valid_0's multi_error: 0.138532	valid_0's multi_logloss: 0.33646
[1000]	valid_0's multi_error: 0.137342	valid_0's multi_logloss: 0.333603
Did not meet early stopping. Best iteration is:
[993]	valid_0's multi_error: 0.137342	valid_0's multi_logloss: 0.333995
Training until validation scores don't improve for 30 rounds
[50]	valid_0's multi_error: 0.175895	valid_0's multi_logloss: 0.851255
[100]	valid_0's multi_error: 0.172247	valid_0's multi_logloss: 0.699363
[150]	valid_0's multi_error: 0.168159	valid_0's multi_logloss: 0.60369
[200]	valid_0's multi_error: 0.165416	valid_0's multi_logloss: 0.538834
[250]	valid_0's multi_error: 0.16257	valid_0's multi_logloss: 0.493628
[300]	valid_0's multi_error: 0.160345	valid_0's multi_logloss: 0.461755
[350]	valid_0's multi_error: 0.158326	valid_0's multi_logloss: 0.438148
[400]	valid_0's multi_error: 0.15667	valid_0's multi_logloss: 0.419274
[450]	valid_0's multi_error: 0.154678	valid_0's multi_logloss: 0.404748
[500]	valid_0's multi_error: 0.153048	valid_0's multi_logloss: 0.392781
[550]	valid_0's multi_error: 0.151677	valid_0's multi_logloss: 0.38318
[600]	valid_0's multi_error: 0.149891	valid_0's multi_logloss: 0.374933
[650]	valid_0's multi_error: 0.148468	valid_0's multi_logloss: 0.36782
[700]	valid_0's multi_error: 0.146735	valid_0's multi_logloss: 0.361536
[750]	valid_0's multi_error: 0.145777	valid_0's multi_logloss: 0.356466
[800]	valid_0's multi_error: 0.144277	valid_0's multi_logloss: 0.351809
[850]	valid_0's multi_error: 0.143009	valid_0's multi_logloss: 0.347856
[900]	valid_0's multi_error: 0.142491	valid_0's multi_logloss: 0.344303
[950]	valid_0's multi_error: 0.14156	valid_0's multi_logloss: 0.341021
[1000]	valid_0's multi_error: 0.140835	valid_0's multi_logloss: 0.338174
Did not meet early stopping. Best iteration is:
[983]	valid_0's multi_error: 0.140732	valid_0's multi_logloss: 0.339053
[I 2025-06-12 00:06:08,193] Trial 7 finished with value: 0.8580284079563122 and parameters: {'boosting_type': 'goss', 'learning_rate': 0.005890250618359491, 'num_leaves': 107, 'max_depth': 7, 'min_data_in_leaf': 41, 'feature_fraction': 0.8813694557407998, 'lambda_l1': 1.2071973148145738, 'lambda_l2': 4.47718841724695, 'min_gain_to_split': 3.808057489851235, 'max_bin': 232}. Best is trial 5 with value: 0.8858973092547489.
Training until validation scores don't improve for 30 rounds
[50]	valid_0's multi_error: 0.162622	valid_0's multi_logloss: 1.02286
[100]	valid_0's multi_error: 0.158999	valid_0's multi_logloss: 0.956471
[150]	valid_0's multi_error: 0.156696	valid_0's multi_logloss: 0.899649
[200]	valid_0's multi_error: 0.154963	valid_0's multi_logloss: 0.848973
[250]	valid_0's multi_error: 0.154419	valid_0's multi_logloss: 0.802443
[300]	valid_0's multi_error: 0.153566	valid_0's multi_logloss: 0.762813
[350]	valid_0's multi_error: 0.152763	valid_0's multi_logloss: 0.727033
[400]	valid_0's multi_error: 0.152194	valid_0's multi_logloss: 0.695062
[450]	valid_0's multi_error: 0.151289	valid_0's multi_logloss: 0.665979
[500]	valid_0's multi_error: 0.150435	valid_0's multi_logloss: 0.639688
[550]	valid_0's multi_error: 0.149995	valid_0's multi_logloss: 0.61632
[600]	valid_0's multi_error: 0.149529	valid_0's multi_logloss: 0.594604
[650]	valid_0's multi_error: 0.148908	valid_0's multi_logloss: 0.575016
[700]	valid_0's multi_error: 0.148572	valid_0's multi_logloss: 0.557062
[750]	valid_0's multi_error: 0.148106	valid_0's multi_logloss: 0.540581
[800]	valid_0's multi_error: 0.147459	valid_0's multi_logloss: 0.525305
[850]	valid_0's multi_error: 0.146864	valid_0's multi_logloss: 0.511581
[900]	valid_0's multi_error: 0.146502	valid_0's multi_logloss: 0.498798
[950]	valid_0's multi_error: 0.146062	valid_0's multi_logloss: 0.487239
[1000]	valid_0's multi_error: 0.145234	valid_0's multi_logloss: 0.47662
Did not meet early stopping. Best iteration is:
[998]	valid_0's multi_error: 0.145234	valid_0's multi_logloss: 0.476994
Training until validation scores don't improve for 30 rounds
[50]	valid_0's multi_error: 0.16257	valid_0's multi_logloss: 1.02288
[100]	valid_0's multi_error: 0.159232	valid_0's multi_logloss: 0.956427
[150]	valid_0's multi_error: 0.156334	valid_0's multi_logloss: 0.899454
[200]	valid_0's multi_error: 0.155118	valid_0's multi_logloss: 0.848643
Early stopping, best iteration is:
[206]	valid_0's multi_error: 0.15504	valid_0's multi_logloss: 0.842844
Training until validation scores don't improve for 30 rounds
[50]	valid_0's multi_error: 0.162699	valid_0's multi_logloss: 1.02285
[100]	valid_0's multi_error: 0.161121	valid_0's multi_logloss: 0.956408
[150]	valid_0's multi_error: 0.159905	valid_0's multi_logloss: 0.899657
[200]	valid_0's multi_error: 0.159206	valid_0's multi_logloss: 0.849009
[250]	valid_0's multi_error: 0.158326	valid_0's multi_logloss: 0.802561
[300]	valid_0's multi_error: 0.157654	valid_0's multi_logloss: 0.763053
[350]	valid_0's multi_error: 0.15711	valid_0's multi_logloss: 0.727439
[400]	valid_0's multi_error: 0.156438	valid_0's multi_logloss: 0.69558
[450]	valid_0's multi_error: 0.155299	valid_0's multi_logloss: 0.666655
[500]	valid_0's multi_error: 0.154419	valid_0's multi_logloss: 0.640509
[550]	valid_0's multi_error: 0.153669	valid_0's multi_logloss: 0.617384
[600]	valid_0's multi_error: 0.153022	valid_0's multi_logloss: 0.59585
[650]	valid_0's multi_error: 0.152091	valid_0's multi_logloss: 0.576454
[700]	valid_0's multi_error: 0.151728	valid_0's multi_logloss: 0.558689
[750]	valid_0's multi_error: 0.151211	valid_0's multi_logloss: 0.542414
[800]	valid_0's multi_error: 0.150797	valid_0's multi_logloss: 0.527326
[850]	valid_0's multi_error: 0.150254	valid_0's multi_logloss: 0.513803
[900]	valid_0's multi_error: 0.149814	valid_0's multi_logloss: 0.501195
[950]	valid_0's multi_error: 0.1494	valid_0's multi_logloss: 0.489778
[1000]	valid_0's multi_error: 0.148649	valid_0's multi_logloss: 0.479327
Did not meet early stopping. Best iteration is:
[999]	valid_0's multi_error: 0.148623	valid_0's multi_logloss: 0.479478
[I 2025-06-12 00:15:36,396] Trial 8 finished with value: 0.8462920961370322 and parameters: {'boosting_type': 'gbdt', 'learning_rate': 0.00149474637322382, 'num_leaves': 133, 'max_depth': 10, 'min_data_in_leaf': 34, 'feature_fraction': 0.6976268830307204, 'lambda_l1': 4.7185623255323, 'lambda_l2': 2.8620265659627195, 'min_gain_to_split': 1.6812924529717783, 'max_bin': 145, 'bagging_fraction': 0.9342194089128861, 'bagging_freq': 2}. Best is trial 5 with value: 0.8858973092547489.
Training until validation scores don't improve for 30 rounds
[50]	valid_0's multi_error: 0.127406	valid_0's multi_logloss: 0.309961
[100]	valid_0's multi_error: 0.126345	valid_0's multi_logloss: 0.302279
Early stopping, best iteration is:
[82]	valid_0's multi_error: 0.125983	valid_0's multi_logloss: 0.303027
Training until validation scores don't improve for 30 rounds
[50]	valid_0's multi_error: 0.128907	valid_0's multi_logloss: 0.309837
[100]	valid_0's multi_error: 0.12795	valid_0's multi_logloss: 0.303822
Early stopping, best iteration is:
[102]	valid_0's multi_error: 0.127794	valid_0's multi_logloss: 0.30354
Training until validation scores don't improve for 30 rounds
[50]	valid_0's multi_error: 0.132995	valid_0's multi_logloss: 0.314564
[100]	valid_0's multi_error: 0.131909	valid_0's multi_logloss: 0.307932
[150]	valid_0's multi_error: 0.131934	valid_0's multi_logloss: 0.307393
Early stopping, best iteration is:
[128]	valid_0's multi_error: 0.131805	valid_0's multi_logloss: 0.307478
[I 2025-06-12 00:16:18,219] Trial 9 finished with value: 0.8686720561445934 and parameters: {'boosting_type': 'gbdt', 'learning_rate': 0.12649234365302223, 'num_leaves': 118, 'max_depth': 12, 'min_data_in_leaf': 69, 'feature_fraction': 0.620588070519306, 'lambda_l1': 2.2347422594466506, 'lambda_l2': 2.0002268360386815, 'min_gain_to_split': 1.4628553210617556, 'max_bin': 243, 'bagging_fraction': 0.8985393040228882, 'bagging_freq': 2}. Best is trial 5 with value: 0.8858973092547489.
Training until validation scores don't improve for 30 rounds
[50]	valid_0's multi_error: 0.189272	valid_0's multi_logloss: 0.505096
[100]	valid_0's multi_error: 0.171626	valid_0's multi_logloss: 0.423443
[150]	valid_0's multi_error: 0.163061	valid_0's multi_logloss: 0.394246
[200]	valid_0's multi_error: 0.156619	valid_0's multi_logloss: 0.376995
[250]	valid_0's multi_error: 0.151754	valid_0's multi_logloss: 0.364774
[300]	valid_0's multi_error: 0.147588	valid_0's multi_logloss: 0.355693
[350]	valid_0's multi_error: 0.145079	valid_0's multi_logloss: 0.348152
[400]	valid_0's multi_error: 0.143474	valid_0's multi_logloss: 0.341767
[450]	valid_0's multi_error: 0.140783	valid_0's multi_logloss: 0.336684
[500]	valid_0's multi_error: 0.138688	valid_0's multi_logloss: 0.33189
[550]	valid_0's multi_error: 0.136928	valid_0's multi_logloss: 0.327453
[600]	valid_0's multi_error: 0.135945	valid_0's multi_logloss: 0.323786
[650]	valid_0's multi_error: 0.134651	valid_0's multi_logloss: 0.320201
[700]	valid_0's multi_error: 0.133409	valid_0's multi_logloss: 0.317017
[750]	valid_0's multi_error: 0.1324	valid_0's multi_logloss: 0.314335
[800]	valid_0's multi_error: 0.131339	valid_0's multi_logloss: 0.311931
[850]	valid_0's multi_error: 0.13033	valid_0's multi_logloss: 0.309674
[900]	valid_0's multi_error: 0.129606	valid_0's multi_logloss: 0.307488
[950]	valid_0's multi_error: 0.128415	valid_0's multi_logloss: 0.305711
[1000]	valid_0's multi_error: 0.127846	valid_0's multi_logloss: 0.303807
Did not meet early stopping. Best iteration is:
[994]	valid_0's multi_error: 0.127587	valid_0's multi_logloss: 0.303983
Training until validation scores don't improve for 30 rounds
[50]	valid_0's multi_error: 0.190903	valid_0's multi_logloss: 0.505408
[100]	valid_0's multi_error: 0.174239	valid_0's multi_logloss: 0.424493
[150]	valid_0's multi_error: 0.164226	valid_0's multi_logloss: 0.395836
[200]	valid_0's multi_error: 0.157731	valid_0's multi_logloss: 0.379515
[250]	valid_0's multi_error: 0.1531	valid_0's multi_logloss: 0.366737
[300]	valid_0's multi_error: 0.149529	valid_0's multi_logloss: 0.357702
[350]	valid_0's multi_error: 0.146916	valid_0's multi_logloss: 0.349977
[400]	valid_0's multi_error: 0.144691	valid_0's multi_logloss: 0.343603
[450]	valid_0's multi_error: 0.142646	valid_0's multi_logloss: 0.338468
[500]	valid_0's multi_error: 0.140499	valid_0's multi_logloss: 0.333505
[550]	valid_0's multi_error: 0.138843	valid_0's multi_logloss: 0.329119
[600]	valid_0's multi_error: 0.13654	valid_0's multi_logloss: 0.325599
[650]	valid_0's multi_error: 0.135764	valid_0's multi_logloss: 0.322028
[700]	valid_0's multi_error: 0.13447	valid_0's multi_logloss: 0.318944
[750]	valid_0's multi_error: 0.133513	valid_0's multi_logloss: 0.316561
[800]	valid_0's multi_error: 0.132478	valid_0's multi_logloss: 0.314176
[850]	valid_0's multi_error: 0.131753	valid_0's multi_logloss: 0.31197
[900]	valid_0's multi_error: 0.131443	valid_0's multi_logloss: 0.309784
Early stopping, best iteration is:
[874]	valid_0's multi_error: 0.131313	valid_0's multi_logloss: 0.31084
Training until validation scores don't improve for 30 rounds
[50]	valid_0's multi_error: 0.192507	valid_0's multi_logloss: 0.50931
[100]	valid_0's multi_error: 0.176439	valid_0's multi_logloss: 0.430207
[150]	valid_0's multi_error: 0.167486	valid_0's multi_logloss: 0.401971
[200]	valid_0's multi_error: 0.161664	valid_0's multi_logloss: 0.384815
[250]	valid_0's multi_error: 0.156489	valid_0's multi_logloss: 0.372926
[300]	valid_0's multi_error: 0.152996	valid_0's multi_logloss: 0.363199
[350]	valid_0's multi_error: 0.150305	valid_0's multi_logloss: 0.355387
[400]	valid_0's multi_error: 0.147666	valid_0's multi_logloss: 0.348879
[450]	valid_0's multi_error: 0.14601	valid_0's multi_logloss: 0.343098
[500]	valid_0's multi_error: 0.14407	valid_0's multi_logloss: 0.338276
[550]	valid_0's multi_error: 0.141586	valid_0's multi_logloss: 0.333564
[600]	valid_0's multi_error: 0.140292	valid_0's multi_logloss: 0.329919
[650]	valid_0's multi_error: 0.138946	valid_0's multi_logloss: 0.326458
[700]	valid_0's multi_error: 0.137342	valid_0's multi_logloss: 0.323392
[750]	valid_0's multi_error: 0.136074	valid_0's multi_logloss: 0.320602
[800]	valid_0's multi_error: 0.135117	valid_0's multi_logloss: 0.317799
[850]	valid_0's multi_error: 0.134315	valid_0's multi_logloss: 0.315389
Early stopping, best iteration is:
[850]	valid_0's multi_error: 0.134315	valid_0's multi_logloss: 0.315389
[I 2025-06-12 00:18:47,855] Trial 10 finished with value: 0.8661436472354489 and parameters: {'boosting_type': 'goss', 'learning_rate': 0.04336148845799745, 'num_leaves': 20, 'max_depth': 4, 'min_data_in_leaf': 100, 'feature_fraction': 0.7071899175502921, 'lambda_l1': 0.41234268544094554, 'lambda_l2': 0.24445501195649744, 'min_gain_to_split': 0.5234997641469109, 'max_bin': 171}. Best is trial 5 with value: 0.8858973092547489.
Training until validation scores don't improve for 30 rounds
[50]	valid_0's multi_error: 0.14024	valid_0's multi_logloss: 0.366848
[100]	valid_0's multi_error: 0.129088	valid_0's multi_logloss: 0.310715
[150]	valid_0's multi_error: 0.121481	valid_0's multi_logloss: 0.289468
[200]	valid_0's multi_error: 0.116617	valid_0's multi_logloss: 0.276937
[250]	valid_0's multi_error: 0.114443	valid_0's multi_logloss: 0.269151
[300]	valid_0's multi_error: 0.112477	valid_0's multi_logloss: 0.263714
[350]	valid_0's multi_error: 0.110562	valid_0's multi_logloss: 0.259438
[400]	valid_0's multi_error: 0.10976	valid_0's multi_logloss: 0.256489
[450]	valid_0's multi_error: 0.10888	valid_0's multi_logloss: 0.254091
[500]	valid_0's multi_error: 0.107819	valid_0's multi_logloss: 0.252047
Early stopping, best iteration is:
[510]	valid_0's multi_error: 0.10725	valid_0's multi_logloss: 0.251837
Training until validation scores don't improve for 30 rounds
[50]	valid_0's multi_error: 0.142051	valid_0's multi_logloss: 0.369188
[100]	valid_0's multi_error: 0.12989	valid_0's multi_logloss: 0.311752
[150]	valid_0's multi_error: 0.123292	valid_0's multi_logloss: 0.291902
[200]	valid_0's multi_error: 0.119929	valid_0's multi_logloss: 0.279535
[250]	valid_0's multi_error: 0.117238	valid_0's multi_logloss: 0.271701
[300]	valid_0's multi_error: 0.114521	valid_0's multi_logloss: 0.266388
[350]	valid_0's multi_error: 0.113149	valid_0's multi_logloss: 0.262491
[400]	valid_0's multi_error: 0.112813	valid_0's multi_logloss: 0.259891
[450]	valid_0's multi_error: 0.111131	valid_0's multi_logloss: 0.258111
[500]	valid_0's multi_error: 0.110795	valid_0's multi_logloss: 0.256409
[550]	valid_0's multi_error: 0.110381	valid_0's multi_logloss: 0.255045
[600]	valid_0's multi_error: 0.10976	valid_0's multi_logloss: 0.25441
[650]	valid_0's multi_error: 0.109191	valid_0's multi_logloss: 0.253826
Early stopping, best iteration is:
[622]	valid_0's multi_error: 0.108906	valid_0's multi_logloss: 0.254061
Training until validation scores don't improve for 30 rounds
[50]	valid_0's multi_error: 0.143992	valid_0's multi_logloss: 0.371841
[100]	valid_0's multi_error: 0.131779	valid_0's multi_logloss: 0.315209
[150]	valid_0's multi_error: 0.126061	valid_0's multi_logloss: 0.295077
[200]	valid_0's multi_error: 0.121559	valid_0's multi_logloss: 0.282603
[250]	valid_0's multi_error: 0.118247	valid_0's multi_logloss: 0.274779
[300]	valid_0's multi_error: 0.116461	valid_0's multi_logloss: 0.269493
[350]	valid_0's multi_error: 0.115426	valid_0's multi_logloss: 0.265737
[400]	valid_0's multi_error: 0.114495	valid_0's multi_logloss: 0.263032
[450]	valid_0's multi_error: 0.113227	valid_0's multi_logloss: 0.261127
[500]	valid_0's multi_error: 0.112218	valid_0's multi_logloss: 0.259624
Early stopping, best iteration is:
[477]	valid_0's multi_error: 0.111804	valid_0's multi_logloss: 0.26018
