[I 2025-06-12 02:12:38,693] Trial 43 finished with value: 0.886943378676534 and parameters: {'boosting_type': 'goss', 'learning_rate': 0.14153771930627904, 'num_leaves': 97, 'max_depth': 9, 'min_data_in_leaf': 38, 'feature_fraction': 0.6938341680737156, 'lambda_l1': 0.9090172270670867, 'lambda_l2': 4.812462794951986, 'min_gain_to_split': 0.05366905938516445, 'max_bin': 117}. Best is trial 11 with value: 0.888762461860649.
Training until validation scores don't improve for 30 rounds
[50]	valid_0's multi_error: 0.135117	valid_0's multi_logloss: 0.340721
[100]	valid_0's multi_error: 0.123862	valid_0's multi_logloss: 0.294583
[150]	valid_0's multi_error: 0.116901	valid_0's multi_logloss: 0.277771
[200]	valid_0's multi_error: 0.115245	valid_0's multi_logloss: 0.268747
[250]	valid_0's multi_error: 0.112606	valid_0's multi_logloss: 0.262675
[300]	valid_0's multi_error: 0.110821	valid_0's multi_logloss: 0.25915
[350]	valid_0's multi_error: 0.110122	valid_0's multi_logloss: 0.257048
[400]	valid_0's multi_error: 0.109139	valid_0's multi_logloss: 0.255099
Early stopping, best iteration is:
[413]	valid_0's multi_error: 0.108518	valid_0's multi_logloss: 0.254786
Training until validation scores don't improve for 30 rounds
[50]	valid_0's multi_error: 0.13535	valid_0's multi_logloss: 0.340925
[100]	valid_0's multi_error: 0.125466	valid_0's multi_logloss: 0.296701
[150]	valid_0's multi_error: 0.121067	valid_0's multi_logloss: 0.280396
[200]	valid_0's multi_error: 0.118273	valid_0's multi_logloss: 0.272071
[250]	valid_0's multi_error: 0.115608	valid_0's multi_logloss: 0.266773
[300]	valid_0's multi_error: 0.114107	valid_0's multi_logloss: 0.263176
[350]	valid_0's multi_error: 0.112528	valid_0's multi_logloss: 0.26061
[400]	valid_0's multi_error: 0.11183	valid_0's multi_logloss: 0.259281
[450]	valid_0's multi_error: 0.111261	valid_0's multi_logloss: 0.258769
[500]	valid_0's multi_error: 0.110174	valid_0's multi_logloss: 0.258242
Early stopping, best iteration is:
[500]	valid_0's multi_error: 0.110174	valid_0's multi_logloss: 0.258242
Training until validation scores don't improve for 30 rounds
[50]	valid_0's multi_error: 0.139179	valid_0's multi_logloss: 0.346059
[100]	valid_0's multi_error: 0.12782	valid_0's multi_logloss: 0.299419
[150]	valid_0's multi_error: 0.122024	valid_0's multi_logloss: 0.283196
[200]	valid_0's multi_error: 0.118609	valid_0's multi_logloss: 0.273834
[250]	valid_0's multi_error: 0.116875	valid_0's multi_logloss: 0.267919
Early stopping, best iteration is:
[221]	valid_0's multi_error: 0.116565	valid_0's multi_logloss: 0.270875
[I 2025-06-12 02:16:22,222] Trial 44 finished with value: 0.8862168114398451 and parameters: {'boosting_type': 'goss', 'learning_rate': 0.07568767216771097, 'num_leaves': 94, 'max_depth': 10, 'min_data_in_leaf': 37, 'feature_fraction': 0.6925142015992856, 'lambda_l1': 0.9460238032006651, 'lambda_l2': 4.441959454813985, 'min_gain_to_split': 0.4612433115575073, 'max_bin': 118}. Best is trial 11 with value: 0.888762461860649.
Training until validation scores don't improve for 30 rounds
[50]	valid_0's multi_error: 0.140499	valid_0's multi_logloss: 0.339871
[100]	valid_0's multi_error: 0.126682	valid_0's multi_logloss: 0.303532
[150]	valid_0's multi_error: 0.121973	valid_0's multi_logloss: 0.286496
[200]	valid_0's multi_error: 0.117962	valid_0's multi_logloss: 0.277431
[250]	valid_0's multi_error: 0.11672	valid_0's multi_logloss: 0.271893
[300]	valid_0's multi_error: 0.114262	valid_0's multi_logloss: 0.267808
[350]	valid_0's multi_error: 0.113874	valid_0's multi_logloss: 0.265444
Early stopping, best iteration is:
[339]	valid_0's multi_error: 0.11346	valid_0's multi_logloss: 0.265859
Training until validation scores don't improve for 30 rounds
[50]	valid_0's multi_error: 0.138325	valid_0's multi_logloss: 0.337361
[100]	valid_0's multi_error: 0.127484	valid_0's multi_logloss: 0.302742
[150]	valid_0's multi_error: 0.122387	valid_0's multi_logloss: 0.287187
[200]	valid_0's multi_error: 0.118997	valid_0's multi_logloss: 0.278924
[250]	valid_0's multi_error: 0.118117	valid_0's multi_logloss: 0.274447
[300]	valid_0's multi_error: 0.116746	valid_0's multi_logloss: 0.271705
[350]	valid_0's multi_error: 0.116125	valid_0's multi_logloss: 0.269708
[400]	valid_0's multi_error: 0.114987	valid_0's multi_logloss: 0.267942
Early stopping, best iteration is:
[392]	valid_0's multi_error: 0.114547	valid_0's multi_logloss: 0.268
Training until validation scores don't improve for 30 rounds
[50]	valid_0's multi_error: 0.14275	valid_0's multi_logloss: 0.343557
[100]	valid_0's multi_error: 0.130097	valid_0's multi_logloss: 0.306282
[150]	valid_0's multi_error: 0.125207	valid_0's multi_logloss: 0.290691
[200]	valid_0's multi_error: 0.121999	valid_0's multi_logloss: 0.281555
[250]	valid_0's multi_error: 0.118764	valid_0's multi_logloss: 0.275677
[300]	valid_0's multi_error: 0.116513	valid_0's multi_logloss: 0.272728
[350]	valid_0's multi_error: 0.116358	valid_0's multi_logloss: 0.270808
[400]	valid_0's multi_error: 0.115349	valid_0's multi_logloss: 0.269185
Early stopping, best iteration is:
[407]	valid_0's multi_error: 0.115323	valid_0's multi_logloss: 0.268799
[I 2025-06-12 02:18:42,622] Trial 45 finished with value: 0.8835255738305604 and parameters: {'boosting_type': 'goss', 'learning_rate': 0.11880712788868678, 'num_leaves': 128, 'max_depth': 7, 'min_data_in_leaf': 43, 'feature_fraction': 0.6431416694418527, 'lambda_l1': 1.3725960724345831, 'lambda_l2': 4.060835683407935, 'min_gain_to_split': 0.7060492059621394, 'max_bin': 127}. Best is trial 11 with value: 0.888762461860649.
Training until validation scores don't improve for 30 rounds
[50]	valid_0's multi_error: 0.136152	valid_0's multi_logloss: 0.360284
[100]	valid_0's multi_error: 0.123655	valid_0's multi_logloss: 0.299143
[150]	valid_0's multi_error: 0.118868	valid_0's multi_logloss: 0.278723
[200]	valid_0's multi_error: 0.114366	valid_0's multi_logloss: 0.268733
[250]	valid_0's multi_error: 0.112451	valid_0's multi_logloss: 0.263301
[300]	valid_0's multi_error: 0.111597	valid_0's multi_logloss: 0.26043
[350]	valid_0's multi_error: 0.11095	valid_0's multi_logloss: 0.258724
Early stopping, best iteration is:
[363]	valid_0's multi_error: 0.110743	valid_0's multi_logloss: 0.258345
Training until validation scores don't improve for 30 rounds
[50]	valid_0's multi_error: 0.135479	valid_0's multi_logloss: 0.359211
[100]	valid_0's multi_error: 0.124043	valid_0's multi_logloss: 0.299811
[150]	valid_0's multi_error: 0.117393	valid_0's multi_logloss: 0.27926
[200]	valid_0's multi_error: 0.114676	valid_0's multi_logloss: 0.270546
[250]	valid_0's multi_error: 0.113356	valid_0's multi_logloss: 0.26626
Early stopping, best iteration is:
[245]	valid_0's multi_error: 0.112684	valid_0's multi_logloss: 0.266645
Training until validation scores don't improve for 30 rounds
[50]	valid_0's multi_error: 0.140007	valid_0's multi_logloss: 0.364028
[100]	valid_0's multi_error: 0.128829	valid_0's multi_logloss: 0.303853
[150]	valid_0's multi_error: 0.120575	valid_0's multi_logloss: 0.2824
[200]	valid_0's multi_error: 0.117652	valid_0's multi_logloss: 0.273034
[250]	valid_0's multi_error: 0.114831	valid_0's multi_logloss: 0.268651
Early stopping, best iteration is:
[249]	valid_0's multi_error: 0.11465	valid_0's multi_logloss: 0.268757
[I 2025-06-12 02:22:10,101] Trial 46 finished with value: 0.885195831709534 and parameters: {'boosting_type': 'gbdt', 'learning_rate': 0.06087351353531893, 'num_leaves': 115, 'max_depth': 12, 'min_data_in_leaf': 53, 'feature_fraction': 0.6114792555219023, 'lambda_l1': 1.6446626789863559, 'lambda_l2': 4.744853148788433, 'min_gain_to_split': 0.2632303162872352, 'max_bin': 88, 'bagging_fraction': 0.7702931076843713, 'bagging_freq': 7}. Best is trial 11 with value: 0.888762461860649.
Training until validation scores don't improve for 30 rounds
[50]	valid_0's multi_error: 0.137342	valid_0's multi_logloss: 0.3692
[100]	valid_0's multi_error: 0.12544	valid_0's multi_logloss: 0.305922
[150]	valid_0's multi_error: 0.11923	valid_0's multi_logloss: 0.284141
[200]	valid_0's multi_error: 0.115815	valid_0's multi_logloss: 0.272329
[250]	valid_0's multi_error: 0.112658	valid_0's multi_logloss: 0.264439
[300]	valid_0's multi_error: 0.111054	valid_0's multi_logloss: 0.259113
[350]	valid_0's multi_error: 0.108984	valid_0's multi_logloss: 0.255329
[400]	valid_0's multi_error: 0.107768	valid_0's multi_logloss: 0.252421
[450]	valid_0's multi_error: 0.107147	valid_0's multi_logloss: 0.250453
[500]	valid_0's multi_error: 0.106888	valid_0's multi_logloss: 0.249025
Early stopping, best iteration is:
[475]	valid_0's multi_error: 0.106474	valid_0's multi_logloss: 0.249683
Training until validation scores don't improve for 30 rounds
[50]	valid_0's multi_error: 0.138481	valid_0's multi_logloss: 0.369065
[100]	valid_0's multi_error: 0.127717	valid_0's multi_logloss: 0.307199
[150]	valid_0's multi_error: 0.121455	valid_0's multi_logloss: 0.286592
[200]	valid_0's multi_error: 0.117807	valid_0's multi_logloss: 0.275805
[250]	valid_0's multi_error: 0.114676	valid_0's multi_logloss: 0.267967
[300]	valid_0's multi_error: 0.113408	valid_0's multi_logloss: 0.262546
[350]	valid_0's multi_error: 0.112089	valid_0's multi_logloss: 0.259344
[400]	valid_0's multi_error: 0.111054	valid_0's multi_logloss: 0.256813
[450]	valid_0's multi_error: 0.109941	valid_0's multi_logloss: 0.255125
[500]	valid_0's multi_error: 0.109165	valid_0's multi_logloss: 0.253777
[550]	valid_0's multi_error: 0.108647	valid_0's multi_logloss: 0.252543
[600]	valid_0's multi_error: 0.108414	valid_0's multi_logloss: 0.252073
[650]	valid_0's multi_error: 0.108285	valid_0's multi_logloss: 0.251849
Early stopping, best iteration is:
[621]	valid_0's multi_error: 0.108026	valid_0's multi_logloss: 0.252039
Training until validation scores don't improve for 30 rounds
[50]	valid_0's multi_error: 0.142569	valid_0's multi_logloss: 0.373856
[100]	valid_0's multi_error: 0.131081	valid_0's multi_logloss: 0.31159
[150]	valid_0's multi_error: 0.124845	valid_0's multi_logloss: 0.289789
[200]	valid_0's multi_error: 0.120808	valid_0's multi_logloss: 0.278451
[250]	valid_0's multi_error: 0.118014	valid_0's multi_logloss: 0.270946
[300]	valid_0's multi_error: 0.116643	valid_0's multi_logloss: 0.266243
[350]	valid_0's multi_error: 0.114754	valid_0's multi_logloss: 0.262704
[400]	valid_0's multi_error: 0.113563	valid_0's multi_logloss: 0.259907
[450]	valid_0's multi_error: 0.112321	valid_0's multi_logloss: 0.25808
[500]	valid_0's multi_error: 0.111649	valid_0's multi_logloss: 0.256779
[550]	valid_0's multi_error: 0.11139	valid_0's multi_logloss: 0.255861
Early stopping, best iteration is:
[566]	valid_0's multi_error: 0.111054	valid_0's multi_logloss: 0.255645
[I 2025-06-12 02:28:37,307] Trial 47 finished with value: 0.8895928149546414 and parameters: {'boosting_type': 'goss', 'learning_rate': 0.053333128009637965, 'num_leaves': 104, 'max_depth': 10, 'min_data_in_leaf': 28, 'feature_fraction': 0.7865979023720912, 'lambda_l1': 2.3951853911346643, 'lambda_l2': 0.3576072426652228, 'min_gain_to_split': 0.0014308012881136811, 'max_bin': 170}. Best is trial 47 with value: 0.8895928149546414.
Training until validation scores don't improve for 30 rounds
[50]	valid_0's multi_error: 0.141404	valid_0's multi_logloss: 0.408616
[100]	valid_0's multi_error: 0.130874	valid_0's multi_logloss: 0.326975
[150]	valid_0's multi_error: 0.124017	valid_0's multi_logloss: 0.300048
[200]	valid_0's multi_error: 0.120601	valid_0's multi_logloss: 0.285413
[250]	valid_0's multi_error: 0.117393	valid_0's multi_logloss: 0.276504
[300]	valid_0's multi_error: 0.114728	valid_0's multi_logloss: 0.27005
[350]	valid_0's multi_error: 0.112865	valid_0's multi_logloss: 0.265704
[400]	valid_0's multi_error: 0.112114	valid_0's multi_logloss: 0.262523
[450]	valid_0's multi_error: 0.110769	valid_0's multi_logloss: 0.26012
Early stopping, best iteration is:
[451]	valid_0's multi_error: 0.110433	valid_0's multi_logloss: 0.260062
Training until validation scores don't improve for 30 rounds
[50]	valid_0's multi_error: 0.143267	valid_0's multi_logloss: 0.408285
[100]	valid_0's multi_error: 0.131986	valid_0's multi_logloss: 0.327358
[150]	valid_0's multi_error: 0.125931	valid_0's multi_logloss: 0.300583
[200]	valid_0's multi_error: 0.120575	valid_0's multi_logloss: 0.286501
[250]	valid_0's multi_error: 0.119126	valid_0's multi_logloss: 0.278141
[300]	valid_0's multi_error: 0.116901	valid_0's multi_logloss: 0.272299
[350]	valid_0's multi_error: 0.115556	valid_0's multi_logloss: 0.268129
[400]	valid_0's multi_error: 0.113486	valid_0's multi_logloss: 0.265073
[450]	valid_0's multi_error: 0.112891	valid_0's multi_logloss: 0.263063
[500]	valid_0's multi_error: 0.11227	valid_0's multi_logloss: 0.26142
[550]	valid_0's multi_error: 0.111209	valid_0's multi_logloss: 0.260246
[600]	valid_0's multi_error: 0.111468	valid_0's multi_logloss: 0.25935
Early stopping, best iteration is:
[594]	valid_0's multi_error: 0.111028	valid_0's multi_logloss: 0.259509
Training until validation scores don't improve for 30 rounds
[50]	valid_0's multi_error: 0.144794	valid_0's multi_logloss: 0.41224
[100]	valid_0's multi_error: 0.135402	valid_0's multi_logloss: 0.330765
[150]	valid_0's multi_error: 0.128079	valid_0's multi_logloss: 0.304247
[200]	valid_0's multi_error: 0.124017	valid_0's multi_logloss: 0.28956
[250]	valid_0's multi_error: 0.120317	valid_0's multi_logloss: 0.281023
[300]	valid_0's multi_error: 0.119385	valid_0's multi_logloss: 0.275212
[350]	valid_0's multi_error: 0.117264	valid_0's multi_logloss: 0.271268
[400]	valid_0's multi_error: 0.116591	valid_0's multi_logloss: 0.268026
[450]	valid_0's multi_error: 0.115452	valid_0's multi_logloss: 0.265819
Early stopping, best iteration is:
[466]	valid_0's multi_error: 0.114987	valid_0's multi_logloss: 0.265492
[I 2025-06-12 02:33:51,235] Trial 48 finished with value: 0.8857721798698952 and parameters: {'boosting_type': 'goss', 'learning_rate': 0.04086730680254257, 'num_leaves': 103, 'max_depth': 10, 'min_data_in_leaf': 30, 'feature_fraction': 0.7844540913039251, 'lambda_l1': 2.4476824865203555, 'lambda_l2': 0.5669684734757503, 'min_gain_to_split': 0.5390819652681021, 'max_bin': 166}. Best is trial 47 with value: 0.8895928149546414.
Training until validation scores don't improve for 30 rounds
[50]	valid_0's multi_error: 0.1361	valid_0's multi_logloss: 0.358556
[100]	valid_0's multi_error: 0.124405	valid_0's multi_logloss: 0.299006
[150]	valid_0's multi_error: 0.11835	valid_0's multi_logloss: 0.279545
[200]	valid_0's multi_error: 0.115426	valid_0's multi_logloss: 0.269842
[250]	valid_0's multi_error: 0.113279	valid_0's multi_logloss: 0.263361
[300]	valid_0's multi_error: 0.11139	valid_0's multi_logloss: 0.25942
[350]	valid_0's multi_error: 0.109967	valid_0's multi_logloss: 0.256656
[400]	valid_0's multi_error: 0.109682	valid_0's multi_logloss: 0.25495
[450]	valid_0's multi_error: 0.108673	valid_0's multi_logloss: 0.254079
[500]	valid_0's multi_error: 0.108492	valid_0's multi_logloss: 0.25302
Early stopping, best iteration is:
[476]	valid_0's multi_error: 0.107923	valid_0's multi_logloss: 0.253573
Training until validation scores don't improve for 30 rounds
[50]	valid_0's multi_error: 0.136644	valid_0's multi_logloss: 0.358954
[100]	valid_0's multi_error: 0.125414	valid_0's multi_logloss: 0.300218
[150]	valid_0's multi_error: 0.12042	valid_0's multi_logloss: 0.281941
[200]	valid_0's multi_error: 0.11628	valid_0's multi_logloss: 0.272053
[250]	valid_0's multi_error: 0.113822	valid_0's multi_logloss: 0.266649
[300]	valid_0's multi_error: 0.112425	valid_0's multi_logloss: 0.262587
[350]	valid_0's multi_error: 0.111079	valid_0's multi_logloss: 0.260321
Early stopping, best iteration is:
[346]	valid_0's multi_error: 0.110872	valid_0's multi_logloss: 0.260437
Training until validation scores don't improve for 30 rounds
[50]	valid_0's multi_error: 0.139102	valid_0's multi_logloss: 0.361845
[100]	valid_0's multi_error: 0.128881	valid_0's multi_logloss: 0.304261
[150]	valid_0's multi_error: 0.122671	valid_0's multi_logloss: 0.284643
[200]	valid_0's multi_error: 0.118609	valid_0's multi_logloss: 0.27438
[250]	valid_0's multi_error: 0.116151	valid_0's multi_logloss: 0.268262
[300]	valid_0's multi_error: 0.114883	valid_0's multi_logloss: 0.264985
Early stopping, best iteration is:
[276]	valid_0's multi_error: 0.11478	valid_0's multi_logloss: 0.266436
[I 2025-06-12 02:38:52,581] Trial 49 finished with value: 0.8867912250076614 and parameters: {'boosting_type': 'goss', 'learning_rate': 0.05684350010886013, 'num_leaves': 141, 'max_depth': 10, 'min_data_in_leaf': 13, 'feature_fraction': 0.8242936649387782, 'lambda_l1': 4.390785806717728, 'lambda_l2': 1.4117926967109624, 'min_gain_to_split': 0.21785593542197937, 'max_bin': 151}. Best is trial 47 with value: 0.8895928149546414.
Training until validation scores don't improve for 30 rounds
[50]	valid_0's multi_error: 0.136928	valid_0's multi_logloss: 0.377666
[100]	valid_0's multi_error: 0.129166	valid_0's multi_logloss: 0.314877
[150]	valid_0's multi_error: 0.126423	valid_0's multi_logloss: 0.304715
Early stopping, best iteration is:
[149]	valid_0's multi_error: 0.126397	valid_0's multi_logloss: 0.30482
Training until validation scores don't improve for 30 rounds
[50]	valid_0's multi_error: 0.13861	valid_0's multi_logloss: 0.378265
[100]	valid_0's multi_error: 0.130692	valid_0's multi_logloss: 0.316272
[150]	valid_0's multi_error: 0.128959	valid_0's multi_logloss: 0.306643
Early stopping, best iteration is:
[126]	valid_0's multi_error: 0.128726	valid_0's multi_logloss: 0.308872
Training until validation scores don't improve for 30 rounds
[50]	valid_0's multi_error: 0.141456	valid_0's multi_logloss: 0.38272
[100]	valid_0's multi_error: 0.133616	valid_0's multi_logloss: 0.319573
[150]	valid_0's multi_error: 0.132297	valid_0's multi_logloss: 0.31045
[200]	valid_0's multi_error: 0.131831	valid_0's multi_logloss: 0.308574
Early stopping, best iteration is:
[208]	valid_0's multi_error: 0.131469	valid_0's multi_logloss: 0.308345
[I 2025-06-12 02:40:16,195] Trial 50 finished with value: 0.8682959862021669 and parameters: {'boosting_type': 'gbdt', 'learning_rate': 0.04751705583483362, 'num_leaves': 126, 'max_depth': 11, 'min_data_in_leaf': 21, 'feature_fraction': 0.8644829721389915, 'lambda_l1': 3.1855251055759775, 'lambda_l2': 2.0693629173159414, 'min_gain_to_split': 1.4219413248128525, 'max_bin': 176, 'bagging_fraction': 0.8916569794783786, 'bagging_freq': 5}. Best is trial 47 with value: 0.8895928149546414.
Training until validation scores don't improve for 30 rounds
[50]	valid_0's multi_error: 0.134211	valid_0's multi_logloss: 0.337346
[100]	valid_0's multi_error: 0.121973	valid_0's multi_logloss: 0.291778
[150]	valid_0's multi_error: 0.116203	valid_0's multi_logloss: 0.275516
[200]	valid_0's multi_error: 0.113331	valid_0's multi_logloss: 0.265633
[250]	valid_0's multi_error: 0.11183	valid_0's multi_logloss: 0.259638
[300]	valid_0's multi_error: 0.110407	valid_0's multi_logloss: 0.255904
Early stopping, best iteration is:
[318]	valid_0's multi_error: 0.109449	valid_0's multi_logloss: 0.25486
Training until validation scores don't improve for 30 rounds
[50]	valid_0's multi_error: 0.135195	valid_0's multi_logloss: 0.33841
[100]	valid_0's multi_error: 0.123448	valid_0's multi_logloss: 0.294752
[150]	valid_0's multi_error: 0.119515	valid_0's multi_logloss: 0.279277
[200]	valid_0's multi_error: 0.116125	valid_0's multi_logloss: 0.270364
[250]	valid_0's multi_error: 0.114003	valid_0's multi_logloss: 0.264647
[300]	valid_0's multi_error: 0.112503	valid_0's multi_logloss: 0.26154
[350]	valid_0's multi_error: 0.1117	valid_0's multi_logloss: 0.258745
[400]	valid_0's multi_error: 0.11064	valid_0's multi_logloss: 0.257351
[450]	valid_0's multi_error: 0.109501	valid_0's multi_logloss: 0.256355
[500]	valid_0's multi_error: 0.109061	valid_0's multi_logloss: 0.255874
Early stopping, best iteration is:
[500]	valid_0's multi_error: 0.109061	valid_0's multi_logloss: 0.255874
Training until validation scores don't improve for 30 rounds
[50]	valid_0's multi_error: 0.137704	valid_0's multi_logloss: 0.343044
[100]	valid_0's multi_error: 0.127665	valid_0's multi_logloss: 0.298377
[150]	valid_0's multi_error: 0.120394	valid_0's multi_logloss: 0.281487
[200]	valid_0's multi_error: 0.115892	valid_0's multi_logloss: 0.272424
[250]	valid_0's multi_error: 0.114055	valid_0's multi_logloss: 0.266295
[300]	valid_0's multi_error: 0.113563	valid_0's multi_logloss: 0.263251
Early stopping, best iteration is:
[286]	valid_0's multi_error: 0.112891	valid_0's multi_logloss: 0.264108
