[I 2025-06-12 08:59:15,071] Trial 150 finished with value: 0.8862770109486672 and parameters: {'boosting_type': 'goss', 'learning_rate': 0.04917623483400193, 'num_leaves': 150, 'max_depth': 13, 'min_data_in_leaf': 20, 'feature_fraction': 0.9349677802565618, 'lambda_l1': 0.5196532440540748, 'lambda_l2': 3.1801660091176926, 'min_gain_to_split': 0.8833946108713304, 'max_bin': 79}. Best is trial 124 with value: 0.8905374485574505.
Training until validation scores don't improve for 30 rounds
[50]	valid_0's multi_error: 0.131262	valid_0's multi_logloss: 0.344151
[100]	valid_0's multi_error: 0.120213	valid_0's multi_logloss: 0.288939
[150]	valid_0's multi_error: 0.115038	valid_0's multi_logloss: 0.270912
[200]	valid_0's multi_error: 0.111286	valid_0's multi_logloss: 0.262259
[250]	valid_0's multi_error: 0.110226	valid_0's multi_logloss: 0.256341
[300]	valid_0's multi_error: 0.108777	valid_0's multi_logloss: 0.253022
[350]	valid_0's multi_error: 0.107793	valid_0's multi_logloss: 0.251281
[400]	valid_0's multi_error: 0.10694	valid_0's multi_logloss: 0.250216
Early stopping, best iteration is:
[404]	valid_0's multi_error: 0.1065	valid_0's multi_logloss: 0.250178
Training until validation scores don't improve for 30 rounds
[50]	valid_0's multi_error: 0.133668	valid_0's multi_logloss: 0.345634
[100]	valid_0's multi_error: 0.122206	valid_0's multi_logloss: 0.290202
[150]	valid_0's multi_error: 0.116099	valid_0's multi_logloss: 0.272702
[200]	valid_0's multi_error: 0.113382	valid_0's multi_logloss: 0.264519
[250]	valid_0's multi_error: 0.111519	valid_0's multi_logloss: 0.259401
[300]	valid_0's multi_error: 0.109786	valid_0's multi_logloss: 0.256222
[350]	valid_0's multi_error: 0.109501	valid_0's multi_logloss: 0.254467
[400]	valid_0's multi_error: 0.109242	valid_0's multi_logloss: 0.253693
[450]	valid_0's multi_error: 0.108751	valid_0's multi_logloss: 0.253365
Early stopping, best iteration is:
[439]	valid_0's multi_error: 0.108466	valid_0's multi_logloss: 0.253248
Training until validation scores don't improve for 30 rounds
[50]	valid_0's multi_error: 0.135893	valid_0's multi_logloss: 0.350345
[100]	valid_0's multi_error: 0.125621	valid_0's multi_logloss: 0.29434
[150]	valid_0's multi_error: 0.119463	valid_0's multi_logloss: 0.276669
[200]	valid_0's multi_error: 0.116565	valid_0's multi_logloss: 0.268444
[250]	valid_0's multi_error: 0.11346	valid_0's multi_logloss: 0.262675
[300]	valid_0's multi_error: 0.111675	valid_0's multi_logloss: 0.259719
[350]	valid_0's multi_error: 0.111131	valid_0's multi_logloss: 0.258039
Early stopping, best iteration is:
[336]	valid_0's multi_error: 0.110847	valid_0's multi_logloss: 0.258505
[I 2025-06-12 09:04:03,585] Trial 151 finished with value: 0.889484394634877 and parameters: {'boosting_type': 'goss', 'learning_rate': 0.05453728219458741, 'num_leaves': 147, 'max_depth': 12, 'min_data_in_leaf': 27, 'feature_fraction': 0.9904822807712981, 'lambda_l1': 0.2419626970691448, 'lambda_l2': 3.8782557029092146, 'min_gain_to_split': 0.3874778519734752, 'max_bin': 78}. Best is trial 124 with value: 0.8905374485574505.
Training until validation scores don't improve for 30 rounds
[50]	valid_0's multi_error: 0.135376	valid_0's multi_logloss: 0.386693
[100]	valid_0's multi_error: 0.124664	valid_0's multi_logloss: 0.307925
[150]	valid_0's multi_error: 0.117833	valid_0's multi_logloss: 0.283595
[200]	valid_0's multi_error: 0.113874	valid_0's multi_logloss: 0.270786
[250]	valid_0's multi_error: 0.11258	valid_0's multi_logloss: 0.263123
[300]	valid_0's multi_error: 0.110252	valid_0's multi_logloss: 0.257577
[350]	valid_0's multi_error: 0.107716	valid_0's multi_logloss: 0.253446
Early stopping, best iteration is:
[348]	valid_0's multi_error: 0.107535	valid_0's multi_logloss: 0.253537
Training until validation scores don't improve for 30 rounds
[50]	valid_0's multi_error: 0.136178	valid_0's multi_logloss: 0.386557
[100]	valid_0's multi_error: 0.126138	valid_0's multi_logloss: 0.309583
[150]	valid_0's multi_error: 0.120627	valid_0's multi_logloss: 0.285387
[200]	valid_0's multi_error: 0.116487	valid_0's multi_logloss: 0.272957
[250]	valid_0's multi_error: 0.113926	valid_0's multi_logloss: 0.265534
[300]	valid_0's multi_error: 0.112373	valid_0's multi_logloss: 0.260894
[350]	valid_0's multi_error: 0.110148	valid_0's multi_logloss: 0.257177
Early stopping, best iteration is:
[349]	valid_0's multi_error: 0.109915	valid_0's multi_logloss: 0.257221
Training until validation scores don't improve for 30 rounds
[50]	valid_0's multi_error: 0.139774	valid_0's multi_logloss: 0.390005
[100]	valid_0's multi_error: 0.128752	valid_0's multi_logloss: 0.312574
[150]	valid_0's multi_error: 0.123344	valid_0's multi_logloss: 0.288446
[200]	valid_0's multi_error: 0.118609	valid_0's multi_logloss: 0.275405
[250]	valid_0's multi_error: 0.116332	valid_0's multi_logloss: 0.268762
[300]	valid_0's multi_error: 0.114314	valid_0's multi_logloss: 0.263733
[350]	valid_0's multi_error: 0.113149	valid_0's multi_logloss: 0.260268
[400]	valid_0's multi_error: 0.112218	valid_0's multi_logloss: 0.257583
[450]	valid_0's multi_error: 0.111054	valid_0's multi_logloss: 0.255957
Early stopping, best iteration is:
[466]	valid_0's multi_error: 0.110691	valid_0's multi_logloss: 0.255539
[I 2025-06-12 09:09:01,826] Trial 152 finished with value: 0.8886557769686201 and parameters: {'boosting_type': 'goss', 'learning_rate': 0.04117136647199331, 'num_leaves': 145, 'max_depth': 12, 'min_data_in_leaf': 25, 'feature_fraction': 0.9066935812201873, 'lambda_l1': 0.3029142159463287, 'lambda_l2': 3.6444955344566083, 'min_gain_to_split': 0.2041850189760901, 'max_bin': 172}. Best is trial 124 with value: 0.8905374485574505.
Training until validation scores don't improve for 30 rounds
[50]	valid_0's multi_error: 0.131986	valid_0's multi_logloss: 0.341616
[100]	valid_0's multi_error: 0.120498	valid_0's multi_logloss: 0.289586
[150]	valid_0's multi_error: 0.115918	valid_0's multi_logloss: 0.273142
[200]	valid_0's multi_error: 0.113382	valid_0's multi_logloss: 0.26612
[250]	valid_0's multi_error: 0.11183	valid_0's multi_logloss: 0.262633
[300]	valid_0's multi_error: 0.111364	valid_0's multi_logloss: 0.260392
Early stopping, best iteration is:
[278]	valid_0's multi_error: 0.111183	valid_0's multi_logloss: 0.261283
Training until validation scores don't improve for 30 rounds
[50]	valid_0's multi_error: 0.133409	valid_0's multi_logloss: 0.342415
[100]	valid_0's multi_error: 0.123292	valid_0's multi_logloss: 0.290076
[150]	valid_0's multi_error: 0.117988	valid_0's multi_logloss: 0.274923
[200]	valid_0's multi_error: 0.115685	valid_0's multi_logloss: 0.268726
[250]	valid_0's multi_error: 0.11377	valid_0's multi_logloss: 0.264979
[300]	valid_0's multi_error: 0.112632	valid_0's multi_logloss: 0.263025
Early stopping, best iteration is:
[291]	valid_0's multi_error: 0.111959	valid_0's multi_logloss: 0.263289
Training until validation scores don't improve for 30 rounds
[50]	valid_0's multi_error: 0.136954	valid_0's multi_logloss: 0.346993
[100]	valid_0's multi_error: 0.126087	valid_0's multi_logloss: 0.295237
[150]	valid_0's multi_error: 0.120161	valid_0's multi_logloss: 0.279357
[200]	valid_0's multi_error: 0.118117	valid_0's multi_logloss: 0.272251
[250]	valid_0's multi_error: 0.116513	valid_0's multi_logloss: 0.269169
Early stopping, best iteration is:
[261]	valid_0's multi_error: 0.115737	valid_0's multi_logloss: 0.268603
[I 2025-06-12 09:12:04,883] Trial 153 finished with value: 0.8849339372286681 and parameters: {'boosting_type': 'goss', 'learning_rate': 0.057223531192641904, 'num_leaves': 142, 'max_depth': 12, 'min_data_in_leaf': 27, 'feature_fraction': 0.9840493881533698, 'lambda_l1': 0.11752419256801397, 'lambda_l2': 3.83691189362309, 'min_gain_to_split': 1.2618385152883151, 'max_bin': 64}. Best is trial 124 with value: 0.8905374485574505.
Training until validation scores don't improve for 30 rounds
[50]	valid_0's multi_error: 0.135686	valid_0's multi_logloss: 0.368766
[100]	valid_0's multi_error: 0.124353	valid_0's multi_logloss: 0.302477
[150]	valid_0's multi_error: 0.117677	valid_0's multi_logloss: 0.28068
[200]	valid_0's multi_error: 0.115038	valid_0's multi_logloss: 0.269484
[250]	valid_0's multi_error: 0.112761	valid_0's multi_logloss: 0.262256
[300]	valid_0's multi_error: 0.11051	valid_0's multi_logloss: 0.257354
[350]	valid_0's multi_error: 0.109682	valid_0's multi_logloss: 0.254129
Early stopping, best iteration is:
[335]	valid_0's multi_error: 0.109113	valid_0's multi_logloss: 0.254985
Training until validation scores don't improve for 30 rounds
[50]	valid_0's multi_error: 0.138739	valid_0's multi_logloss: 0.369271
[100]	valid_0's multi_error: 0.127329	valid_0's multi_logloss: 0.304118
[150]	valid_0's multi_error: 0.120627	valid_0's multi_logloss: 0.282131
[200]	valid_0's multi_error: 0.117755	valid_0's multi_logloss: 0.271548
[250]	valid_0's multi_error: 0.114547	valid_0's multi_logloss: 0.264394
[300]	valid_0's multi_error: 0.112942	valid_0's multi_logloss: 0.259626
[350]	valid_0's multi_error: 0.112321	valid_0's multi_logloss: 0.256643
[400]	valid_0's multi_error: 0.111286	valid_0's multi_logloss: 0.254649
[450]	valid_0's multi_error: 0.1102	valid_0's multi_logloss: 0.253084
[500]	valid_0's multi_error: 0.109217	valid_0's multi_logloss: 0.252198
[550]	valid_0's multi_error: 0.10844	valid_0's multi_logloss: 0.251546
[600]	valid_0's multi_error: 0.10844	valid_0's multi_logloss: 0.251453
Early stopping, best iteration is:
[619]	valid_0's multi_error: 0.107975	valid_0's multi_logloss: 0.251294
Training until validation scores don't improve for 30 rounds
[50]	valid_0's multi_error: 0.141482	valid_0's multi_logloss: 0.374341
[100]	valid_0's multi_error: 0.130046	valid_0's multi_logloss: 0.308325
[150]	valid_0's multi_error: 0.122697	valid_0's multi_logloss: 0.286611
[200]	valid_0's multi_error: 0.118816	valid_0's multi_logloss: 0.275619
[250]	valid_0's multi_error: 0.116177	valid_0's multi_logloss: 0.268482
[300]	valid_0's multi_error: 0.114029	valid_0's multi_logloss: 0.263864
[350]	valid_0's multi_error: 0.112347	valid_0's multi_logloss: 0.260713
[400]	valid_0's multi_error: 0.112503	valid_0's multi_logloss: 0.25849
Early stopping, best iteration is:
[378]	valid_0's multi_error: 0.111907	valid_0's multi_logloss: 0.259338
[I 2025-06-12 09:16:44,596] Trial 154 finished with value: 0.8883905506353388 and parameters: {'boosting_type': 'goss', 'learning_rate': 0.04694905879816617, 'num_leaves': 118, 'max_depth': 11, 'min_data_in_leaf': 24, 'feature_fraction': 0.9916490084867747, 'lambda_l1': 0.41573544944783936, 'lambda_l2': 2.225975368963521, 'min_gain_to_split': 0.29638683007961486, 'max_bin': 70}. Best is trial 124 with value: 0.8905374485574505.
Training until validation scores don't improve for 30 rounds
[50]	valid_0's multi_error: 0.127717	valid_0's multi_logloss: 0.322633
[100]	valid_0's multi_error: 0.117289	valid_0's multi_logloss: 0.27803
[150]	valid_0's multi_error: 0.113098	valid_0's multi_logloss: 0.263978
[200]	valid_0's multi_error: 0.110588	valid_0's multi_logloss: 0.256783
[250]	valid_0's multi_error: 0.109242	valid_0's multi_logloss: 0.252989
Early stopping, best iteration is:
[258]	valid_0's multi_error: 0.108544	valid_0's multi_logloss: 0.252545
Training until validation scores don't improve for 30 rounds
[50]	valid_0's multi_error: 0.128648	valid_0's multi_logloss: 0.323173
[100]	valid_0's multi_error: 0.119696	valid_0's multi_logloss: 0.280392
[150]	valid_0's multi_error: 0.114107	valid_0's multi_logloss: 0.266414
[200]	valid_0's multi_error: 0.112166	valid_0's multi_logloss: 0.260345
[250]	valid_0's multi_error: 0.111079	valid_0's multi_logloss: 0.257109
[300]	valid_0's multi_error: 0.109734	valid_0's multi_logloss: 0.255722
Early stopping, best iteration is:
[304]	valid_0's multi_error: 0.109579	valid_0's multi_logloss: 0.25578
Training until validation scores don't improve for 30 rounds
[50]	valid_0's multi_error: 0.133306	valid_0's multi_logloss: 0.328213
[100]	valid_0's multi_error: 0.121973	valid_0's multi_logloss: 0.284152
[150]	valid_0's multi_error: 0.11685	valid_0's multi_logloss: 0.269865
[200]	valid_0's multi_error: 0.114598	valid_0's multi_logloss: 0.263328
[250]	valid_0's multi_error: 0.112891	valid_0's multi_logloss: 0.260603
[300]	valid_0's multi_error: 0.112192	valid_0's multi_logloss: 0.259665
Early stopping, best iteration is:
[288]	valid_0's multi_error: 0.112011	valid_0's multi_logloss: 0.259478
[I 2025-06-12 09:20:22,044] Trial 155 finished with value: 0.8880002443052328 and parameters: {'boosting_type': 'goss', 'learning_rate': 0.06796118791529496, 'num_leaves': 147, 'max_depth': 13, 'min_data_in_leaf': 30, 'feature_fraction': 0.9655146005915436, 'lambda_l1': 0.1736070132835572, 'lambda_l2': 3.977393611223201, 'min_gain_to_split': 0.4761598176520452, 'max_bin': 89}. Best is trial 124 with value: 0.8905374485574505.
Training until validation scores don't improve for 30 rounds
[50]	valid_0's multi_error: 0.132012	valid_0's multi_logloss: 0.346704
[100]	valid_0's multi_error: 0.120291	valid_0's multi_logloss: 0.289626
[150]	valid_0's multi_error: 0.114987	valid_0's multi_logloss: 0.270961
[200]	valid_0's multi_error: 0.111933	valid_0's multi_logloss: 0.261305
[250]	valid_0's multi_error: 0.109191	valid_0's multi_logloss: 0.255188
[300]	valid_0's multi_error: 0.107561	valid_0's multi_logloss: 0.251391
[350]	valid_0's multi_error: 0.107147	valid_0's multi_logloss: 0.24946
Early stopping, best iteration is:
[325]	valid_0's multi_error: 0.106577	valid_0's multi_logloss: 0.250015
Training until validation scores don't improve for 30 rounds
[50]	valid_0's multi_error: 0.133021	valid_0's multi_logloss: 0.346828
[100]	valid_0's multi_error: 0.123034	valid_0's multi_logloss: 0.291489
[150]	valid_0's multi_error: 0.118868	valid_0's multi_logloss: 0.273969
[200]	valid_0's multi_error: 0.115219	valid_0's multi_logloss: 0.264976
[250]	valid_0's multi_error: 0.112917	valid_0's multi_logloss: 0.259813
[300]	valid_0's multi_error: 0.111493	valid_0's multi_logloss: 0.255808
[350]	valid_0's multi_error: 0.110407	valid_0's multi_logloss: 0.25375
[400]	valid_0's multi_error: 0.109631	valid_0's multi_logloss: 0.252396
Early stopping, best iteration is:
[373]	valid_0's multi_error: 0.109294	valid_0's multi_logloss: 0.253108
Training until validation scores don't improve for 30 rounds
[50]	valid_0's multi_error: 0.13729	valid_0's multi_logloss: 0.352565
[100]	valid_0's multi_error: 0.126216	valid_0's multi_logloss: 0.295088
[150]	valid_0's multi_error: 0.120084	valid_0's multi_logloss: 0.27636
[200]	valid_0's multi_error: 0.116229	valid_0's multi_logloss: 0.266969
[250]	valid_0's multi_error: 0.113641	valid_0's multi_logloss: 0.261485
[300]	valid_0's multi_error: 0.11258	valid_0's multi_logloss: 0.25821
[350]	valid_0's multi_error: 0.110717	valid_0's multi_logloss: 0.256074
Early stopping, best iteration is:
[332]	valid_0's multi_error: 0.110433	valid_0's multi_logloss: 0.256536
[I 2025-06-12 09:24:47,087] Trial 156 finished with value: 0.889311470141864 and parameters: {'boosting_type': 'goss', 'learning_rate': 0.05431383178818092, 'num_leaves': 135, 'max_depth': 12, 'min_data_in_leaf': 22, 'feature_fraction': 0.9805001740202894, 'lambda_l1': 0.32883923282782085, 'lambda_l2': 3.7218073866319545, 'min_gain_to_split': 0.09523991767827572, 'max_bin': 76}. Best is trial 124 with value: 0.8905374485574505.
Training until validation scores don't improve for 30 rounds
[50]	valid_0's multi_error: 0.131727	valid_0's multi_logloss: 0.349264
[100]	valid_0's multi_error: 0.121015	valid_0's multi_logloss: 0.291368
[150]	valid_0's multi_error: 0.115194	valid_0's multi_logloss: 0.271659
[200]	valid_0's multi_error: 0.111752	valid_0's multi_logloss: 0.262174
[250]	valid_0's multi_error: 0.109579	valid_0's multi_logloss: 0.256168
[300]	valid_0's multi_error: 0.10857	valid_0's multi_logloss: 0.252129
[350]	valid_0's multi_error: 0.107664	valid_0's multi_logloss: 0.249398
[400]	valid_0's multi_error: 0.106914	valid_0's multi_logloss: 0.247911
Early stopping, best iteration is:
[407]	valid_0's multi_error: 0.106551	valid_0's multi_logloss: 0.247834
Training until validation scores don't improve for 30 rounds
[50]	valid_0's multi_error: 0.134548	valid_0's multi_logloss: 0.350864
[100]	valid_0's multi_error: 0.124172	valid_0's multi_logloss: 0.292901
[150]	valid_0's multi_error: 0.117367	valid_0's multi_logloss: 0.274243
[200]	valid_0's multi_error: 0.114133	valid_0's multi_logloss: 0.264737
[250]	valid_0's multi_error: 0.11183	valid_0's multi_logloss: 0.258795
[300]	valid_0's multi_error: 0.11051	valid_0's multi_logloss: 0.255005
[350]	valid_0's multi_error: 0.109346	valid_0's multi_logloss: 0.252388
Early stopping, best iteration is:
[338]	valid_0's multi_error: 0.109242	valid_0's multi_logloss: 0.253049
Training until validation scores don't improve for 30 rounds
[50]	valid_0's multi_error: 0.136954	valid_0's multi_logloss: 0.355141
[100]	valid_0's multi_error: 0.126915	valid_0's multi_logloss: 0.297386
[150]	valid_0's multi_error: 0.119411	valid_0's multi_logloss: 0.277661
[200]	valid_0's multi_error: 0.11628	valid_0's multi_logloss: 0.268057
[250]	valid_0's multi_error: 0.113589	valid_0's multi_logloss: 0.262771
[300]	valid_0's multi_error: 0.111493	valid_0's multi_logloss: 0.25905
[350]	valid_0's multi_error: 0.110769	valid_0's multi_logloss: 0.25646
[400]	valid_0's multi_error: 0.109527	valid_0's multi_logloss: 0.255095
Early stopping, best iteration is:
[393]	valid_0's multi_error: 0.109268	valid_0's multi_logloss: 0.255183
[I 2025-06-12 09:29:33,419] Trial 157 finished with value: 0.88975617217846 and parameters: {'boosting_type': 'goss', 'learning_rate': 0.05382376716225036, 'num_leaves': 138, 'max_depth': 11, 'min_data_in_leaf': 18, 'feature_fraction': 0.9766867452518384, 'lambda_l1': 0.2572446089966304, 'lambda_l2': 3.745739871417115, 'min_gain_to_split': 0.10743869761273578, 'max_bin': 71}. Best is trial 124 with value: 0.8905374485574505.
Training until validation scores don't improve for 30 rounds
[50]	valid_0's multi_error: 0.129683	valid_0's multi_logloss: 0.337138
[100]	valid_0's multi_error: 0.118324	valid_0's multi_logloss: 0.283447
[150]	valid_0's multi_error: 0.113848	valid_0's multi_logloss: 0.266704
[200]	valid_0's multi_error: 0.111105	valid_0's multi_logloss: 0.258426
[250]	valid_0's multi_error: 0.109734	valid_0's multi_logloss: 0.253554
[300]	valid_0's multi_error: 0.10844	valid_0's multi_logloss: 0.250448
[350]	valid_0's multi_error: 0.107224	valid_0's multi_logloss: 0.248739
[400]	valid_0's multi_error: 0.106137	valid_0's multi_logloss: 0.24793
Early stopping, best iteration is:
[379]	valid_0's multi_error: 0.10606	valid_0's multi_logloss: 0.248261
Training until validation scores don't improve for 30 rounds
[50]	valid_0's multi_error: 0.133513	valid_0's multi_logloss: 0.339886
[100]	valid_0's multi_error: 0.121792	valid_0's multi_logloss: 0.286835
[150]	valid_0's multi_error: 0.115168	valid_0's multi_logloss: 0.270559
[200]	valid_0's multi_error: 0.112813	valid_0's multi_logloss: 0.262642
[250]	valid_0's multi_error: 0.111028	valid_0's multi_logloss: 0.257424
[300]	valid_0's multi_error: 0.109346	valid_0's multi_logloss: 0.254591
[350]	valid_0's multi_error: 0.10813	valid_0's multi_logloss: 0.252875
Early stopping, best iteration is:
[333]	valid_0's multi_error: 0.107742	valid_0's multi_logloss: 0.253246
Training until validation scores don't improve for 30 rounds
[50]	valid_0's multi_error: 0.134315	valid_0's multi_logloss: 0.342501
[100]	valid_0's multi_error: 0.123603	valid_0's multi_logloss: 0.289249
[150]	valid_0's multi_error: 0.118117	valid_0's multi_logloss: 0.272786
[200]	valid_0's multi_error: 0.115323	valid_0's multi_logloss: 0.264664
[250]	valid_0's multi_error: 0.113201	valid_0's multi_logloss: 0.259739
[300]	valid_0's multi_error: 0.111519	valid_0's multi_logloss: 0.257095
[350]	valid_0's multi_error: 0.111183	valid_0's multi_logloss: 0.25584
Early stopping, best iteration is:
[328]	valid_0's multi_error: 0.110795	valid_0's multi_logloss: 0.256172
