[I 2025-06-12 10:16:38,166] Trial 166 finished with value: 0.8905766908257297 and parameters: {'boosting_type': 'goss', 'learning_rate': 0.06906672542355011, 'num_leaves': 131, 'max_depth': 15, 'min_data_in_leaf': 14, 'feature_fraction': 0.9737661945570872, 'lambda_l1': 0.12362772339919083, 'lambda_l2': 4.239694031564442, 'min_gain_to_split': 0.0775335195972082, 'max_bin': 64}. Best is trial 163 with value: 0.8909414087818414.
Training until validation scores don't improve for 30 rounds
[50]	valid_0's multi_error: 0.126294	valid_0's multi_logloss: 0.316796
[100]	valid_0's multi_error: 0.115219	valid_0's multi_logloss: 0.273331
[150]	valid_0's multi_error: 0.1117	valid_0's multi_logloss: 0.259957
[200]	valid_0's multi_error: 0.108906	valid_0's multi_logloss: 0.252282
[250]	valid_0's multi_error: 0.107561	valid_0's multi_logloss: 0.248691
[300]	valid_0's multi_error: 0.106888	valid_0's multi_logloss: 0.247131
Early stopping, best iteration is:
[318]	valid_0's multi_error: 0.105905	valid_0's multi_logloss: 0.246609
Training until validation scores don't improve for 30 rounds
[50]	valid_0's multi_error: 0.127639	valid_0's multi_logloss: 0.318687
[100]	valid_0's multi_error: 0.117082	valid_0's multi_logloss: 0.275739
[150]	valid_0's multi_error: 0.11258	valid_0's multi_logloss: 0.262671
[200]	valid_0's multi_error: 0.110821	valid_0's multi_logloss: 0.255805
[250]	valid_0's multi_error: 0.10932	valid_0's multi_logloss: 0.252571
[300]	valid_0's multi_error: 0.108233	valid_0's multi_logloss: 0.250722
Early stopping, best iteration is:
[309]	valid_0's multi_error: 0.107302	valid_0's multi_logloss: 0.25063
Training until validation scores don't improve for 30 rounds
[50]	valid_0's multi_error: 0.131443	valid_0's multi_logloss: 0.323298
[100]	valid_0's multi_error: 0.120239	valid_0's multi_logloss: 0.279566
[150]	valid_0's multi_error: 0.115245	valid_0's multi_logloss: 0.265514
[200]	valid_0's multi_error: 0.112761	valid_0's multi_logloss: 0.258841
[250]	valid_0's multi_error: 0.111312	valid_0's multi_logloss: 0.255429
[300]	valid_0's multi_error: 0.109967	valid_0's multi_logloss: 0.254503
[350]	valid_0's multi_error: 0.109527	valid_0's multi_logloss: 0.254168
Early stopping, best iteration is:
[349]	valid_0's multi_error: 0.109527	valid_0's multi_logloss: 0.254109
[I 2025-06-12 10:21:07,424] Trial 167 finished with value: 0.8905908720468751 and parameters: {'boosting_type': 'goss', 'learning_rate': 0.07017963261822953, 'num_leaves': 131, 'max_depth': 15, 'min_data_in_leaf': 14, 'feature_fraction': 0.9732933674728194, 'lambda_l1': 0.0929590742447386, 'lambda_l2': 4.062761945317084, 'min_gain_to_split': 0.008004627071118986, 'max_bin': 64}. Best is trial 163 with value: 0.8909414087818414.
Training until validation scores don't improve for 30 rounds
[50]	valid_0's multi_error: 0.127432	valid_0's multi_logloss: 0.31479
[100]	valid_0's multi_error: 0.115944	valid_0's multi_logloss: 0.272418
[150]	valid_0's multi_error: 0.111079	valid_0's multi_logloss: 0.258717
[200]	valid_0's multi_error: 0.10813	valid_0's multi_logloss: 0.252416
[250]	valid_0's multi_error: 0.106965	valid_0's multi_logloss: 0.249438
[300]	valid_0's multi_error: 0.106241	valid_0's multi_logloss: 0.247545
Early stopping, best iteration is:
[313]	valid_0's multi_error: 0.105672	valid_0's multi_logloss: 0.247301
Training until validation scores don't improve for 30 rounds
[50]	valid_0's multi_error: 0.128079	valid_0's multi_logloss: 0.316584
[100]	valid_0's multi_error: 0.118997	valid_0's multi_logloss: 0.276612
[150]	valid_0's multi_error: 0.114184	valid_0's multi_logloss: 0.263567
[200]	valid_0's multi_error: 0.112011	valid_0's multi_logloss: 0.257688
[250]	valid_0's multi_error: 0.109656	valid_0's multi_logloss: 0.253979
Early stopping, best iteration is:
[265]	valid_0's multi_error: 0.108906	valid_0's multi_logloss: 0.253405
Training until validation scores don't improve for 30 rounds
[50]	valid_0's multi_error: 0.1324	valid_0's multi_logloss: 0.320414
[100]	valid_0's multi_error: 0.12055	valid_0's multi_logloss: 0.27819
[150]	valid_0's multi_error: 0.11584	valid_0's multi_logloss: 0.265229
[200]	valid_0's multi_error: 0.112917	valid_0's multi_logloss: 0.259298
[250]	valid_0's multi_error: 0.111416	valid_0's multi_logloss: 0.256161
[300]	valid_0's multi_error: 0.109967	valid_0's multi_logloss: 0.255007
[350]	valid_0's multi_error: 0.109527	valid_0's multi_logloss: 0.254682
Early stopping, best iteration is:
[357]	valid_0's multi_error: 0.109398	valid_0's multi_logloss: 0.254603
[I 2025-06-12 10:25:26,976] Trial 168 finished with value: 0.8901313034892105 and parameters: {'boosting_type': 'goss', 'learning_rate': 0.0725170743149549, 'num_leaves': 130, 'max_depth': 15, 'min_data_in_leaf': 12, 'feature_fraction': 0.9706375883760463, 'lambda_l1': 0.00448327042683469, 'lambda_l2': 4.210160299911175, 'min_gain_to_split': 0.06744714229207338, 'max_bin': 65}. Best is trial 163 with value: 0.8909414087818414.
Training until validation scores don't improve for 30 rounds
[50]	valid_0's multi_error: 0.127225	valid_0's multi_logloss: 0.314819
[100]	valid_0's multi_error: 0.116099	valid_0's multi_logloss: 0.273585
[150]	valid_0's multi_error: 0.111028	valid_0's multi_logloss: 0.259823
[200]	valid_0's multi_error: 0.109294	valid_0's multi_logloss: 0.253923
[250]	valid_0's multi_error: 0.107768	valid_0's multi_logloss: 0.250202
[300]	valid_0's multi_error: 0.106267	valid_0's multi_logloss: 0.248388
[350]	valid_0's multi_error: 0.105361	valid_0's multi_logloss: 0.247782
Early stopping, best iteration is:
[335]	valid_0's multi_error: 0.105594	valid_0's multi_logloss: 0.247738
Training until validation scores don't improve for 30 rounds
[50]	valid_0's multi_error: 0.12663	valid_0's multi_logloss: 0.314858
[100]	valid_0's multi_error: 0.117108	valid_0's multi_logloss: 0.27525
[150]	valid_0's multi_error: 0.113227	valid_0's multi_logloss: 0.2622
[200]	valid_0's multi_error: 0.110976	valid_0's multi_logloss: 0.256021
[250]	valid_0's multi_error: 0.109656	valid_0's multi_logloss: 0.252676
[300]	valid_0's multi_error: 0.108414	valid_0's multi_logloss: 0.251641
[350]	valid_0's multi_error: 0.107328	valid_0's multi_logloss: 0.251412
Early stopping, best iteration is:
[323]	valid_0's multi_error: 0.107561	valid_0's multi_logloss: 0.251409
Training until validation scores don't improve for 30 rounds
[50]	valid_0's multi_error: 0.131753	valid_0's multi_logloss: 0.319763
[100]	valid_0's multi_error: 0.121067	valid_0's multi_logloss: 0.278621
[150]	valid_0's multi_error: 0.117471	valid_0's multi_logloss: 0.26644
[200]	valid_0's multi_error: 0.114805	valid_0's multi_logloss: 0.260222
[250]	valid_0's multi_error: 0.112554	valid_0's multi_logloss: 0.25701
[300]	valid_0's multi_error: 0.110821	valid_0's multi_logloss: 0.255841
Early stopping, best iteration is:
[290]	valid_0's multi_error: 0.110484	valid_0's multi_logloss: 0.255888
[I 2025-06-12 10:29:48,693] Trial 169 finished with value: 0.8902624515121281 and parameters: {'boosting_type': 'goss', 'learning_rate': 0.0731479672410357, 'num_leaves': 130, 'max_depth': 15, 'min_data_in_leaf': 14, 'feature_fraction': 0.9743168566524419, 'lambda_l1': 0.0775249274562794, 'lambda_l2': 4.085623340239015, 'min_gain_to_split': 0.010631428168413018, 'max_bin': 64}. Best is trial 163 with value: 0.8909414087818414.
Training until validation scores don't improve for 30 rounds
[50]	valid_0's multi_error: 0.125517	valid_0's multi_logloss: 0.312196
[100]	valid_0's multi_error: 0.115504	valid_0's multi_logloss: 0.271539
[150]	valid_0's multi_error: 0.110433	valid_0's multi_logloss: 0.258465
[200]	valid_0's multi_error: 0.108984	valid_0's multi_logloss: 0.252066
[250]	valid_0's multi_error: 0.107017	valid_0's multi_logloss: 0.248932
[300]	valid_0's multi_error: 0.106137	valid_0's multi_logloss: 0.247473
[350]	valid_0's multi_error: 0.106293	valid_0's multi_logloss: 0.247167
Early stopping, best iteration is:
[329]	valid_0's multi_error: 0.10518	valid_0's multi_logloss: 0.247085
Training until validation scores don't improve for 30 rounds
[50]	valid_0's multi_error: 0.128001	valid_0's multi_logloss: 0.314399
[100]	valid_0's multi_error: 0.117703	valid_0's multi_logloss: 0.275111
[150]	valid_0's multi_error: 0.113305	valid_0's multi_logloss: 0.262268
[200]	valid_0's multi_error: 0.110691	valid_0's multi_logloss: 0.256343
[250]	valid_0's multi_error: 0.109475	valid_0's multi_logloss: 0.253057
[300]	valid_0's multi_error: 0.108466	valid_0's multi_logloss: 0.252151
[350]	valid_0's multi_error: 0.107612	valid_0's multi_logloss: 0.251614
Early stopping, best iteration is:
[331]	valid_0's multi_error: 0.108233	valid_0's multi_logloss: 0.251491
Training until validation scores don't improve for 30 rounds
[50]	valid_0's multi_error: 0.130667	valid_0's multi_logloss: 0.318176
[100]	valid_0's multi_error: 0.120213	valid_0's multi_logloss: 0.277884
[150]	valid_0's multi_error: 0.11478	valid_0's multi_logloss: 0.265368
[200]	valid_0's multi_error: 0.113072	valid_0's multi_logloss: 0.260068
[250]	valid_0's multi_error: 0.111209	valid_0's multi_logloss: 0.257598
[300]	valid_0's multi_error: 0.109889	valid_0's multi_logloss: 0.256495
Early stopping, best iteration is:
[309]	valid_0's multi_error: 0.108984	valid_0's multi_logloss: 0.256169
[I 2025-06-12 10:34:15,960] Trial 170 finished with value: 0.8906728741831348 and parameters: {'boosting_type': 'goss', 'learning_rate': 0.07418510689548992, 'num_leaves': 130, 'max_depth': 15, 'min_data_in_leaf': 13, 'feature_fraction': 0.9735470207545698, 'lambda_l1': 0.08083701982384559, 'lambda_l2': 4.056025423828446, 'min_gain_to_split': 0.08455668021698487, 'max_bin': 66}. Best is trial 163 with value: 0.8909414087818414.
Training until validation scores don't improve for 30 rounds
[50]	valid_0's multi_error: 0.124845	valid_0's multi_logloss: 0.307601
[100]	valid_0's multi_error: 0.115323	valid_0's multi_logloss: 0.270062
[150]	valid_0's multi_error: 0.112011	valid_0's multi_logloss: 0.25803
[200]	valid_0's multi_error: 0.108621	valid_0's multi_logloss: 0.252485
[250]	valid_0's multi_error: 0.107561	valid_0's multi_logloss: 0.249502
[300]	valid_0's multi_error: 0.106086	valid_0's multi_logloss: 0.248484
[350]	valid_0's multi_error: 0.105491	valid_0's multi_logloss: 0.248089
Early stopping, best iteration is:
[322]	valid_0's multi_error: 0.10562	valid_0's multi_logloss: 0.247881
Training until validation scores don't improve for 30 rounds
[50]	valid_0's multi_error: 0.126345	valid_0's multi_logloss: 0.309332
[100]	valid_0's multi_error: 0.116798	valid_0's multi_logloss: 0.272941
[150]	valid_0's multi_error: 0.111882	valid_0's multi_logloss: 0.261325
[200]	valid_0's multi_error: 0.110096	valid_0's multi_logloss: 0.255814
[250]	valid_0's multi_error: 0.108311	valid_0's multi_logloss: 0.252924
[300]	valid_0's multi_error: 0.107354	valid_0's multi_logloss: 0.252095
[350]	valid_0's multi_error: 0.106991	valid_0's multi_logloss: 0.252083
Early stopping, best iteration is:
[331]	valid_0's multi_error: 0.107276	valid_0's multi_logloss: 0.251729
Training until validation scores don't improve for 30 rounds
[50]	valid_0's multi_error: 0.130227	valid_0's multi_logloss: 0.314848
[100]	valid_0's multi_error: 0.119877	valid_0's multi_logloss: 0.276875
[150]	valid_0's multi_error: 0.114547	valid_0's multi_logloss: 0.265371
[200]	valid_0's multi_error: 0.111778	valid_0's multi_logloss: 0.259584
[250]	valid_0's multi_error: 0.11095	valid_0's multi_logloss: 0.257014
Early stopping, best iteration is:
[228]	valid_0's multi_error: 0.110536	valid_0's multi_logloss: 0.257831
[I 2025-06-12 10:38:37,935] Trial 171 finished with value: 0.8903356349952811 and parameters: {'boosting_type': 'goss', 'learning_rate': 0.07819535592940187, 'num_leaves': 131, 'max_depth': 15, 'min_data_in_leaf': 13, 'feature_fraction': 0.9730972899814534, 'lambda_l1': 0.06885571920484762, 'lambda_l2': 4.082403617349431, 'min_gain_to_split': 0.08647663238136813, 'max_bin': 64}. Best is trial 163 with value: 0.8909414087818414.
Training until validation scores don't improve for 30 rounds
[50]	valid_0's multi_error: 0.126294	valid_0's multi_logloss: 0.313096
[100]	valid_0's multi_error: 0.115763	valid_0's multi_logloss: 0.272929
[150]	valid_0's multi_error: 0.111312	valid_0's multi_logloss: 0.258668
[200]	valid_0's multi_error: 0.109087	valid_0's multi_logloss: 0.252433
[250]	valid_0's multi_error: 0.108026	valid_0's multi_logloss: 0.24882
[300]	valid_0's multi_error: 0.107172	valid_0's multi_logloss: 0.247106
[350]	valid_0's multi_error: 0.105775	valid_0's multi_logloss: 0.246639
Early stopping, best iteration is:
[335]	valid_0's multi_error: 0.10637	valid_0's multi_logloss: 0.246506
Training until validation scores don't improve for 30 rounds
[50]	valid_0's multi_error: 0.127251	valid_0's multi_logloss: 0.314373
[100]	valid_0's multi_error: 0.117781	valid_0's multi_logloss: 0.274802
[150]	valid_0's multi_error: 0.113227	valid_0's multi_logloss: 0.262191
[200]	valid_0's multi_error: 0.11007	valid_0's multi_logloss: 0.255898
[250]	valid_0's multi_error: 0.108363	valid_0's multi_logloss: 0.253097
[300]	valid_0's multi_error: 0.107198	valid_0's multi_logloss: 0.25223
Early stopping, best iteration is:
[285]	valid_0's multi_error: 0.107561	valid_0's multi_logloss: 0.2521
Training until validation scores don't improve for 30 rounds
[50]	valid_0's multi_error: 0.131443	valid_0's multi_logloss: 0.319132
[100]	valid_0's multi_error: 0.12042	valid_0's multi_logloss: 0.278354
[150]	valid_0's multi_error: 0.115038	valid_0's multi_logloss: 0.26565
[200]	valid_0's multi_error: 0.112813	valid_0's multi_logloss: 0.259972
[250]	valid_0's multi_error: 0.111157	valid_0's multi_logloss: 0.257207
Early stopping, best iteration is:
[262]	valid_0's multi_error: 0.110717	valid_0's multi_logloss: 0.256787
[I 2025-06-12 10:43:19,088] Trial 172 finished with value: 0.889916009066473 and parameters: {'boosting_type': 'goss', 'learning_rate': 0.07439823337914749, 'num_leaves': 130, 'max_depth': 15, 'min_data_in_leaf': 13, 'feature_fraction': 0.9738535558360878, 'lambda_l1': 0.002454486661510158, 'lambda_l2': 4.22504747814922, 'min_gain_to_split': 0.056109129573659114, 'max_bin': 64}. Best is trial 163 with value: 0.8909414087818414.
Training until validation scores don't improve for 30 rounds
[50]	valid_0's multi_error: 0.126087	valid_0's multi_logloss: 0.315145
[100]	valid_0's multi_error: 0.116539	valid_0's multi_logloss: 0.273028
[150]	valid_0's multi_error: 0.111442	valid_0's multi_logloss: 0.258925
[200]	valid_0's multi_error: 0.108854	valid_0's multi_logloss: 0.252343
[250]	valid_0's multi_error: 0.107121	valid_0's multi_logloss: 0.249197
[300]	valid_0's multi_error: 0.106577	valid_0's multi_logloss: 0.247713
[350]	valid_0's multi_error: 0.105646	valid_0's multi_logloss: 0.246981
Early stopping, best iteration is:
[354]	valid_0's multi_error: 0.105439	valid_0's multi_logloss: 0.246964
Training until validation scores don't improve for 30 rounds
[50]	valid_0's multi_error: 0.127665	valid_0's multi_logloss: 0.316839
[100]	valid_0's multi_error: 0.119308	valid_0's multi_logloss: 0.276181
[150]	valid_0's multi_error: 0.113589	valid_0's multi_logloss: 0.263096
[200]	valid_0's multi_error: 0.11095	valid_0's multi_logloss: 0.256591
[250]	valid_0's multi_error: 0.108984	valid_0's multi_logloss: 0.253106
[300]	valid_0's multi_error: 0.106991	valid_0's multi_logloss: 0.251969
[350]	valid_0's multi_error: 0.106396	valid_0's multi_logloss: 0.251212
Early stopping, best iteration is:
[369]	valid_0's multi_error: 0.106733	valid_0's multi_logloss: 0.251092
Training until validation scores don't improve for 30 rounds
[50]	valid_0's multi_error: 0.131313	valid_0's multi_logloss: 0.32065
[100]	valid_0's multi_error: 0.12011	valid_0's multi_logloss: 0.277223
[150]	valid_0's multi_error: 0.114987	valid_0's multi_logloss: 0.264035
[200]	valid_0's multi_error: 0.11183	valid_0's multi_logloss: 0.257703
[250]	valid_0's multi_error: 0.110691	valid_0's multi_logloss: 0.254898
[300]	valid_0's multi_error: 0.109941	valid_0's multi_logloss: 0.25356
[350]	valid_0's multi_error: 0.108854	valid_0's multi_logloss: 0.253198
Early stopping, best iteration is:
[330]	valid_0's multi_error: 0.109035	valid_0's multi_logloss: 0.252969
[I 2025-06-12 10:48:51,452] Trial 173 finished with value: 0.8911108787545454 and parameters: {'boosting_type': 'goss', 'learning_rate': 0.07200900330465933, 'num_leaves': 129, 'max_depth': 15, 'min_data_in_leaf': 12, 'feature_fraction': 0.9719819783965753, 'lambda_l1': 0.07733644834387596, 'lambda_l2': 4.254210966180027, 'min_gain_to_split': 0.010685931620531067, 'max_bin': 64}. Best is trial 173 with value: 0.8911108787545454.
Training until validation scores don't improve for 30 rounds
[50]	valid_0's multi_error: 0.126552	valid_0's multi_logloss: 0.315623
[100]	valid_0's multi_error: 0.114831	valid_0's multi_logloss: 0.273202
[150]	valid_0's multi_error: 0.110924	valid_0's multi_logloss: 0.259717
[200]	valid_0's multi_error: 0.108389	valid_0's multi_logloss: 0.252981
[250]	valid_0's multi_error: 0.10694	valid_0's multi_logloss: 0.249495
Early stopping, best iteration is:
[269]	valid_0's multi_error: 0.10606	valid_0's multi_logloss: 0.248676
Training until validation scores don't improve for 30 rounds
[50]	valid_0's multi_error: 0.12839	valid_0's multi_logloss: 0.316007
[100]	valid_0's multi_error: 0.118014	valid_0's multi_logloss: 0.27554
[150]	valid_0's multi_error: 0.113149	valid_0's multi_logloss: 0.263044
[200]	valid_0's multi_error: 0.111028	valid_0's multi_logloss: 0.256725
[250]	valid_0's multi_error: 0.109812	valid_0's multi_logloss: 0.253449
[300]	valid_0's multi_error: 0.10857	valid_0's multi_logloss: 0.252152
[350]	valid_0's multi_error: 0.108466	valid_0's multi_logloss: 0.251907
Early stopping, best iteration is:
[363]	valid_0's multi_error: 0.108311	valid_0's multi_logloss: 0.251799
Training until validation scores don't improve for 30 rounds
[50]	valid_0's multi_error: 0.131572	valid_0's multi_logloss: 0.320306
[100]	valid_0's multi_error: 0.121119	valid_0's multi_logloss: 0.278496
[150]	valid_0's multi_error: 0.116151	valid_0's multi_logloss: 0.265835
[200]	valid_0's multi_error: 0.11421	valid_0's multi_logloss: 0.259163
[250]	valid_0's multi_error: 0.111933	valid_0's multi_logloss: 0.25612
[300]	valid_0's multi_error: 0.110174	valid_0's multi_logloss: 0.255071
Early stopping, best iteration is:
[316]	valid_0's multi_error: 0.109838	valid_0's multi_logloss: 0.254832
[I 2025-06-12 10:53:54,769] Trial 174 finished with value: 0.8900854995435378 and parameters: {'boosting_type': 'goss', 'learning_rate': 0.0725952155367788, 'num_leaves': 130, 'max_depth': 15, 'min_data_in_leaf': 12, 'feature_fraction': 0.9721633302663307, 'lambda_l1': 0.02267188071333852, 'lambda_l2': 4.215240323818411, 'min_gain_to_split': 0.027819311215482895, 'max_bin': 64}. Best is trial 173 with value: 0.8911108787545454.
Training until validation scores don't improve for 30 rounds
[50]	valid_0's multi_error: 0.128157	valid_0's multi_logloss: 0.317927
[100]	valid_0's multi_error: 0.116306	valid_0's multi_logloss: 0.274232
[150]	valid_0's multi_error: 0.112089	valid_0's multi_logloss: 0.260281
[200]	valid_0's multi_error: 0.109579	valid_0's multi_logloss: 0.253668
[250]	valid_0's multi_error: 0.107871	valid_0's multi_logloss: 0.24973
Early stopping, best iteration is:
[268]	valid_0's multi_error: 0.107147	valid_0's multi_logloss: 0.248757
Training until validation scores don't improve for 30 rounds
[50]	valid_0's multi_error: 0.127717	valid_0's multi_logloss: 0.318007
[100]	valid_0's multi_error: 0.117833	valid_0's multi_logloss: 0.275918
[150]	valid_0's multi_error: 0.113356	valid_0's multi_logloss: 0.263215
[200]	valid_0's multi_error: 0.110924	valid_0's multi_logloss: 0.256747
[250]	valid_0's multi_error: 0.109449	valid_0's multi_logloss: 0.253381
[300]	valid_0's multi_error: 0.108854	valid_0's multi_logloss: 0.251703
[350]	valid_0's multi_error: 0.107354	valid_0's multi_logloss: 0.250945
Early stopping, best iteration is:
[346]	valid_0's multi_error: 0.107302	valid_0's multi_logloss: 0.250921
Training until validation scores don't improve for 30 rounds
[50]	valid_0's multi_error: 0.130925	valid_0's multi_logloss: 0.323503
[100]	valid_0's multi_error: 0.11967	valid_0's multi_logloss: 0.279226
[150]	valid_0's multi_error: 0.114573	valid_0's multi_logloss: 0.265074
[200]	valid_0's multi_error: 0.111856	valid_0's multi_logloss: 0.258954
[250]	valid_0's multi_error: 0.109967	valid_0's multi_logloss: 0.255505
[300]	valid_0's multi_error: 0.10901	valid_0's multi_logloss: 0.254077
Early stopping, best iteration is:
[285]	valid_0's multi_error: 0.108725	valid_0's multi_logloss: 0.254313
