[I 2025-06-12 07:16:20,589] Trial 128 finished with value: 0.8873202516630837 and parameters: {'boosting_type': 'goss', 'learning_rate': 0.023549557742913587, 'num_leaves': 150, 'max_depth': 11, 'min_data_in_leaf': 17, 'feature_fraction': 0.9170247809699681, 'lambda_l1': 0.0054979175837046035, 'lambda_l2': 3.2360607681851095, 'min_gain_to_split': 0.4215188225287777, 'max_bin': 69}. Best is trial 124 with value: 0.8905374485574505.
Training until validation scores don't improve for 30 rounds
[50]	valid_0's multi_error: 0.140137	valid_0's multi_logloss: 0.461768
[100]	valid_0's multi_error: 0.131081	valid_0's multi_logloss: 0.34738
[150]	valid_0's multi_error: 0.123887	valid_0's multi_logloss: 0.308853
[200]	valid_0's multi_error: 0.119825	valid_0's multi_logloss: 0.289901
[250]	valid_0's multi_error: 0.116979	valid_0's multi_logloss: 0.278588
[300]	valid_0's multi_error: 0.114805	valid_0's multi_logloss: 0.271341
[350]	valid_0's multi_error: 0.113693	valid_0's multi_logloss: 0.266204
[400]	valid_0's multi_error: 0.111571	valid_0's multi_logloss: 0.262255
[450]	valid_0's multi_error: 0.110433	valid_0's multi_logloss: 0.25959
[500]	valid_0's multi_error: 0.1102	valid_0's multi_logloss: 0.257362
[550]	valid_0's multi_error: 0.109527	valid_0's multi_logloss: 0.255633
[600]	valid_0's multi_error: 0.109061	valid_0's multi_logloss: 0.254269
Early stopping, best iteration is:
[572]	valid_0's multi_error: 0.108725	valid_0's multi_logloss: 0.25501
Training until validation scores don't improve for 30 rounds
[50]	valid_0's multi_error: 0.14156	valid_0's multi_logloss: 0.463
[100]	valid_0's multi_error: 0.132038	valid_0's multi_logloss: 0.347798
[150]	valid_0's multi_error: 0.126889	valid_0's multi_logloss: 0.309864
[200]	valid_0's multi_error: 0.122361	valid_0's multi_logloss: 0.291629
[250]	valid_0's multi_error: 0.118609	valid_0's multi_logloss: 0.280678
[300]	valid_0's multi_error: 0.116099	valid_0's multi_logloss: 0.27347
[350]	valid_0's multi_error: 0.114469	valid_0's multi_logloss: 0.268453
[400]	valid_0's multi_error: 0.113279	valid_0's multi_logloss: 0.264806
[450]	valid_0's multi_error: 0.112451	valid_0's multi_logloss: 0.26206
[500]	valid_0's multi_error: 0.111623	valid_0's multi_logloss: 0.260209
[550]	valid_0's multi_error: 0.110717	valid_0's multi_logloss: 0.258886
[600]	valid_0's multi_error: 0.11007	valid_0's multi_logloss: 0.257785
Early stopping, best iteration is:
[618]	valid_0's multi_error: 0.109734	valid_0's multi_logloss: 0.257404
Training until validation scores don't improve for 30 rounds
[50]	valid_0's multi_error: 0.145933	valid_0's multi_logloss: 0.465673
[100]	valid_0's multi_error: 0.136721	valid_0's multi_logloss: 0.352874
[150]	valid_0's multi_error: 0.129864	valid_0's multi_logloss: 0.314756
[200]	valid_0's multi_error: 0.125595	valid_0's multi_logloss: 0.295808
[250]	valid_0's multi_error: 0.122697	valid_0's multi_logloss: 0.284813
[300]	valid_0's multi_error: 0.121015	valid_0's multi_logloss: 0.277739
[350]	valid_0's multi_error: 0.119023	valid_0's multi_logloss: 0.272456
[400]	valid_0's multi_error: 0.117005	valid_0's multi_logloss: 0.268565
[450]	valid_0's multi_error: 0.115064	valid_0's multi_logloss: 0.265765
[500]	valid_0's multi_error: 0.114029	valid_0's multi_logloss: 0.263938
[550]	valid_0's multi_error: 0.113382	valid_0's multi_logloss: 0.262482
Early stopping, best iteration is:
[557]	valid_0's multi_error: 0.113227	valid_0's multi_logloss: 0.262423
[I 2025-06-12 07:22:57,341] Trial 129 finished with value: 0.8873966840383796 and parameters: {'boosting_type': 'goss', 'learning_rate': 0.027247583569909337, 'num_leaves': 142, 'max_depth': 12, 'min_data_in_leaf': 27, 'feature_fraction': 0.9288211745845888, 'lambda_l1': 0.28883574421547586, 'lambda_l2': 3.731480697550403, 'min_gain_to_split': 0.7634318856692328, 'max_bin': 72}. Best is trial 124 with value: 0.8905374485574505.
Training until validation scores don't improve for 30 rounds
[50]	valid_0's multi_error: 0.135971	valid_0's multi_logloss: 0.373729
[100]	valid_0's multi_error: 0.124871	valid_0's multi_logloss: 0.306587
[150]	valid_0's multi_error: 0.118919	valid_0's multi_logloss: 0.284869
[200]	valid_0's multi_error: 0.114805	valid_0's multi_logloss: 0.273876
[250]	valid_0's multi_error: 0.113124	valid_0's multi_logloss: 0.267861
[300]	valid_0's multi_error: 0.112166	valid_0's multi_logloss: 0.26411
[350]	valid_0's multi_error: 0.111778	valid_0's multi_logloss: 0.261482
[400]	valid_0's multi_error: 0.111105	valid_0's multi_logloss: 0.259636
[450]	valid_0's multi_error: 0.110691	valid_0's multi_logloss: 0.258301
Early stopping, best iteration is:
[458]	valid_0's multi_error: 0.110148	valid_0's multi_logloss: 0.258131
Training until validation scores don't improve for 30 rounds
[50]	valid_0's multi_error: 0.138998	valid_0's multi_logloss: 0.375169
[100]	valid_0's multi_error: 0.127743	valid_0's multi_logloss: 0.307276
[150]	valid_0's multi_error: 0.120964	valid_0's multi_logloss: 0.286672
[200]	valid_0's multi_error: 0.117962	valid_0's multi_logloss: 0.276377
[250]	valid_0's multi_error: 0.115168	valid_0's multi_logloss: 0.270265
[300]	valid_0's multi_error: 0.114443	valid_0's multi_logloss: 0.266707
[350]	valid_0's multi_error: 0.112684	valid_0's multi_logloss: 0.264227
[400]	valid_0's multi_error: 0.11227	valid_0's multi_logloss: 0.262613
Early stopping, best iteration is:
[379]	valid_0's multi_error: 0.111675	valid_0's multi_logloss: 0.263236
Training until validation scores don't improve for 30 rounds
[50]	valid_0's multi_error: 0.142207	valid_0's multi_logloss: 0.378669
[100]	valid_0's multi_error: 0.130253	valid_0's multi_logloss: 0.311945
[150]	valid_0's multi_error: 0.124301	valid_0's multi_logloss: 0.290708
[200]	valid_0's multi_error: 0.120472	valid_0's multi_logloss: 0.279535
[250]	valid_0's multi_error: 0.117884	valid_0's multi_logloss: 0.273678
[300]	valid_0's multi_error: 0.116099	valid_0's multi_logloss: 0.269778
[350]	valid_0's multi_error: 0.115556	valid_0's multi_logloss: 0.26717
[400]	valid_0's multi_error: 0.114391	valid_0's multi_logloss: 0.265445
Early stopping, best iteration is:
[386]	valid_0's multi_error: 0.114184	valid_0's multi_logloss: 0.265822
[I 2025-06-12 07:27:21,471] Trial 130 finished with value: 0.8859239071280567 and parameters: {'boosting_type': 'goss', 'learning_rate': 0.04697961160946593, 'num_leaves': 136, 'max_depth': 11, 'min_data_in_leaf': 22, 'feature_fraction': 0.9664711126387888, 'lambda_l1': 3.7244736451243705, 'lambda_l2': 3.3297682237757362, 'min_gain_to_split': 0.5384133493165588, 'max_bin': 82}. Best is trial 124 with value: 0.8905374485574505.
Training until validation scores don't improve for 30 rounds
[50]	valid_0's multi_error: 0.134496	valid_0's multi_logloss: 0.373374
[100]	valid_0's multi_error: 0.123577	valid_0's multi_logloss: 0.304453
[150]	valid_0's multi_error: 0.118324	valid_0's multi_logloss: 0.281723
[200]	valid_0's multi_error: 0.114883	valid_0's multi_logloss: 0.27001
[250]	valid_0's multi_error: 0.113227	valid_0's multi_logloss: 0.262904
[300]	valid_0's multi_error: 0.111571	valid_0's multi_logloss: 0.257961
[350]	valid_0's multi_error: 0.110407	valid_0's multi_logloss: 0.254195
[400]	valid_0's multi_error: 0.109165	valid_0's multi_logloss: 0.251714
[450]	valid_0's multi_error: 0.107612	valid_0's multi_logloss: 0.249837
[500]	valid_0's multi_error: 0.107198	valid_0's multi_logloss: 0.248775
Early stopping, best iteration is:
[474]	valid_0's multi_error: 0.10694	valid_0's multi_logloss: 0.249205
Training until validation scores don't improve for 30 rounds
[50]	valid_0's multi_error: 0.137342	valid_0's multi_logloss: 0.374355
[100]	valid_0's multi_error: 0.126708	valid_0's multi_logloss: 0.305936
[150]	valid_0's multi_error: 0.119825	valid_0's multi_logloss: 0.284142
[200]	valid_0's multi_error: 0.116384	valid_0's multi_logloss: 0.272661
[250]	valid_0's multi_error: 0.113408	valid_0's multi_logloss: 0.265684
[300]	valid_0's multi_error: 0.111882	valid_0's multi_logloss: 0.260894
[350]	valid_0's multi_error: 0.110096	valid_0's multi_logloss: 0.257186
Early stopping, best iteration is:
[354]	valid_0's multi_error: 0.109656	valid_0's multi_logloss: 0.256891
Training until validation scores don't improve for 30 rounds
[50]	valid_0's multi_error: 0.140292	valid_0's multi_logloss: 0.378618
[100]	valid_0's multi_error: 0.13033	valid_0's multi_logloss: 0.309955
[150]	valid_0's multi_error: 0.123732	valid_0's multi_logloss: 0.287868
[200]	valid_0's multi_error: 0.119489	valid_0's multi_logloss: 0.276367
[250]	valid_0's multi_error: 0.115815	valid_0's multi_logloss: 0.269137
[300]	valid_0's multi_error: 0.113926	valid_0's multi_logloss: 0.264638
[350]	valid_0's multi_error: 0.112554	valid_0's multi_logloss: 0.261256
[400]	valid_0's multi_error: 0.111157	valid_0's multi_logloss: 0.259152
Early stopping, best iteration is:
[404]	valid_0's multi_error: 0.110898	valid_0's multi_logloss: 0.25902
[I 2025-06-12 07:32:14,443] Trial 131 finished with value: 0.8888560811377024 and parameters: {'boosting_type': 'goss', 'learning_rate': 0.04528578067101074, 'num_leaves': 146, 'max_depth': 11, 'min_data_in_leaf': 29, 'feature_fraction': 0.9457989026193917, 'lambda_l1': 0.5331135231881445, 'lambda_l2': 3.8213766069989465, 'min_gain_to_split': 0.279885119543874, 'max_bin': 73}. Best is trial 124 with value: 0.8905374485574505.
Training until validation scores don't improve for 30 rounds
[50]	valid_0's multi_error: 0.137083	valid_0's multi_logloss: 0.412093
[100]	valid_0's multi_error: 0.127872	valid_0's multi_logloss: 0.321787
[150]	valid_0's multi_error: 0.12174	valid_0's multi_logloss: 0.295381
[200]	valid_0's multi_error: 0.119411	valid_0's multi_logloss: 0.285428
[250]	valid_0's multi_error: 0.118066	valid_0's multi_logloss: 0.280967
[300]	valid_0's multi_error: 0.117186	valid_0's multi_logloss: 0.278116
[350]	valid_0's multi_error: 0.116798	valid_0's multi_logloss: 0.276318
Early stopping, best iteration is:
[326]	valid_0's multi_error: 0.11641	valid_0's multi_logloss: 0.277059
Training until validation scores don't improve for 30 rounds
[50]	valid_0's multi_error: 0.138144	valid_0's multi_logloss: 0.412644
[100]	valid_0's multi_error: 0.128571	valid_0's multi_logloss: 0.322741
[150]	valid_0's multi_error: 0.124534	valid_0's multi_logloss: 0.297898
[200]	valid_0's multi_error: 0.121766	valid_0's multi_logloss: 0.288488
[250]	valid_0's multi_error: 0.120368	valid_0's multi_logloss: 0.283884
[300]	valid_0's multi_error: 0.119722	valid_0's multi_logloss: 0.281438
Early stopping, best iteration is:
[287]	valid_0's multi_error: 0.119282	valid_0's multi_logloss: 0.282051
Training until validation scores don't improve for 30 rounds
[50]	valid_0's multi_error: 0.142646	valid_0's multi_logloss: 0.416329
[100]	valid_0's multi_error: 0.132788	valid_0's multi_logloss: 0.327915
[150]	valid_0's multi_error: 0.128208	valid_0's multi_logloss: 0.302249
[200]	valid_0's multi_error: 0.125647	valid_0's multi_logloss: 0.292519
[250]	valid_0's multi_error: 0.124224	valid_0's multi_logloss: 0.287736
[300]	valid_0's multi_error: 0.122568	valid_0's multi_logloss: 0.284986
[350]	valid_0's multi_error: 0.121947	valid_0's multi_logloss: 0.283297
[400]	valid_0's multi_error: 0.121481	valid_0's multi_logloss: 0.282244
Early stopping, best iteration is:
[370]	valid_0's multi_error: 0.121378	valid_0's multi_logloss: 0.282884
[I 2025-06-12 07:35:12,750] Trial 132 finished with value: 0.8785739643952256 and parameters: {'boosting_type': 'goss', 'learning_rate': 0.03474607641708804, 'num_leaves': 147, 'max_depth': 13, 'min_data_in_leaf': 26, 'feature_fraction': 0.9522898809502319, 'lambda_l1': 0.13137282144405782, 'lambda_l2': 3.8452261050684404, 'min_gain_to_split': 2.6913233273738832, 'max_bin': 67}. Best is trial 124 with value: 0.8905374485574505.
Training until validation scores don't improve for 30 rounds
[50]	valid_0's multi_error: 0.137239	valid_0's multi_logloss: 0.380003
[100]	valid_0's multi_error: 0.125026	valid_0's multi_logloss: 0.307401
[150]	valid_0's multi_error: 0.118609	valid_0's multi_logloss: 0.284497
[200]	valid_0's multi_error: 0.115012	valid_0's multi_logloss: 0.272299
[250]	valid_0's multi_error: 0.11271	valid_0's multi_logloss: 0.264583
[300]	valid_0's multi_error: 0.111131	valid_0's multi_logloss: 0.258907
[350]	valid_0's multi_error: 0.109786	valid_0's multi_logloss: 0.255336
Early stopping, best iteration is:
[353]	valid_0's multi_error: 0.109346	valid_0's multi_logloss: 0.255133
Training until validation scores don't improve for 30 rounds
[50]	valid_0's multi_error: 0.139567	valid_0's multi_logloss: 0.380809
[100]	valid_0's multi_error: 0.128001	valid_0's multi_logloss: 0.309279
[150]	valid_0's multi_error: 0.121792	valid_0's multi_logloss: 0.286765
[200]	valid_0's multi_error: 0.118402	valid_0's multi_logloss: 0.275151
[250]	valid_0's multi_error: 0.115866	valid_0's multi_logloss: 0.26791
[300]	valid_0's multi_error: 0.113434	valid_0's multi_logloss: 0.262719
[350]	valid_0's multi_error: 0.112244	valid_0's multi_logloss: 0.259209
[400]	valid_0's multi_error: 0.111364	valid_0's multi_logloss: 0.2567
Early stopping, best iteration is:
[389]	valid_0's multi_error: 0.110924	valid_0's multi_logloss: 0.257139
Training until validation scores don't improve for 30 rounds
[50]	valid_0's multi_error: 0.14112	valid_0's multi_logloss: 0.384606
[100]	valid_0's multi_error: 0.129994	valid_0's multi_logloss: 0.312557
[150]	valid_0's multi_error: 0.123085	valid_0's multi_logloss: 0.289142
[200]	valid_0's multi_error: 0.119515	valid_0's multi_logloss: 0.276948
[250]	valid_0's multi_error: 0.116332	valid_0's multi_logloss: 0.269285
[300]	valid_0's multi_error: 0.115064	valid_0's multi_logloss: 0.264654
[350]	valid_0's multi_error: 0.114159	valid_0's multi_logloss: 0.261358
[400]	valid_0's multi_error: 0.112891	valid_0's multi_logloss: 0.259021
Early stopping, best iteration is:
[419]	valid_0's multi_error: 0.111933	valid_0's multi_logloss: 0.258263
[I 2025-06-12 07:39:40,139] Trial 133 finished with value: 0.8872630583373781 and parameters: {'boosting_type': 'goss', 'learning_rate': 0.04399391509206408, 'num_leaves': 138, 'max_depth': 11, 'min_data_in_leaf': 29, 'feature_fraction': 0.9144968423561048, 'lambda_l1': 0.4517789783795644, 'lambda_l2': 3.560252350629938, 'min_gain_to_split': 0.34398435553589174, 'max_bin': 74}. Best is trial 124 with value: 0.8905374485574505.
Training until validation scores don't improve for 30 rounds
[50]	valid_0's multi_error: 0.13152	valid_0's multi_logloss: 0.353308
[100]	valid_0's multi_error: 0.120187	valid_0's multi_logloss: 0.29108
[150]	valid_0's multi_error: 0.115194	valid_0's multi_logloss: 0.27195
[200]	valid_0's multi_error: 0.112994	valid_0's multi_logloss: 0.262407
[250]	valid_0's multi_error: 0.110717	valid_0's multi_logloss: 0.256641
[300]	valid_0's multi_error: 0.109346	valid_0's multi_logloss: 0.252483
Early stopping, best iteration is:
[317]	valid_0's multi_error: 0.108285	valid_0's multi_logloss: 0.251451
Training until validation scores don't improve for 30 rounds
[50]	valid_0's multi_error: 0.133849	valid_0's multi_logloss: 0.354854
[100]	valid_0's multi_error: 0.122723	valid_0's multi_logloss: 0.292973
[150]	valid_0's multi_error: 0.117729	valid_0's multi_logloss: 0.274098
[200]	valid_0's multi_error: 0.113589	valid_0's multi_logloss: 0.264527
[250]	valid_0's multi_error: 0.111597	valid_0's multi_logloss: 0.25879
[300]	valid_0's multi_error: 0.109424	valid_0's multi_logloss: 0.255169
[350]	valid_0's multi_error: 0.108725	valid_0's multi_logloss: 0.253194
[400]	valid_0's multi_error: 0.108621	valid_0's multi_logloss: 0.252301
Early stopping, best iteration is:
[383]	valid_0's multi_error: 0.108052	valid_0's multi_logloss: 0.252487
Training until validation scores don't improve for 30 rounds
[50]	valid_0's multi_error: 0.137187	valid_0's multi_logloss: 0.358261
[100]	valid_0's multi_error: 0.125854	valid_0's multi_logloss: 0.296645
[150]	valid_0's multi_error: 0.121093	valid_0's multi_logloss: 0.277781
[200]	valid_0's multi_error: 0.116824	valid_0's multi_logloss: 0.267742
[250]	valid_0's multi_error: 0.115168	valid_0's multi_logloss: 0.26234
[300]	valid_0's multi_error: 0.113098	valid_0's multi_logloss: 0.258889
[350]	valid_0's multi_error: 0.111959	valid_0's multi_logloss: 0.256542
[400]	valid_0's multi_error: 0.111286	valid_0's multi_logloss: 0.255446
[450]	valid_0's multi_error: 0.11051	valid_0's multi_logloss: 0.254934
Early stopping, best iteration is:
[444]	valid_0's multi_error: 0.110562	valid_0's multi_logloss: 0.25489
[I 2025-06-12 07:44:39,146] Trial 134 finished with value: 0.8891439793679843 and parameters: {'boosting_type': 'goss', 'learning_rate': 0.05107657978181472, 'num_leaves': 143, 'max_depth': 13, 'min_data_in_leaf': 27, 'feature_fraction': 0.9310747785104938, 'lambda_l1': 0.25250379223569686, 'lambda_l2': 3.690938473845602, 'min_gain_to_split': 0.26313337618529153, 'max_bin': 69}. Best is trial 124 with value: 0.8905374485574505.
Training until validation scores don't improve for 30 rounds
[50]	valid_0's multi_error: 0.13447	valid_0's multi_logloss: 0.355965
[100]	valid_0's multi_error: 0.123111	valid_0's multi_logloss: 0.295875
[150]	valid_0's multi_error: 0.11672	valid_0's multi_logloss: 0.276118
[200]	valid_0's multi_error: 0.113305	valid_0's multi_logloss: 0.266031
[250]	valid_0's multi_error: 0.111675	valid_0's multi_logloss: 0.259573
[300]	valid_0's multi_error: 0.109527	valid_0's multi_logloss: 0.255242
[350]	valid_0's multi_error: 0.108182	valid_0's multi_logloss: 0.252468
[400]	valid_0's multi_error: 0.107975	valid_0's multi_logloss: 0.250878
Early stopping, best iteration is:
[392]	valid_0's multi_error: 0.107509	valid_0's multi_logloss: 0.251007
Training until validation scores don't improve for 30 rounds
[50]	valid_0's multi_error: 0.134548	valid_0's multi_logloss: 0.355463
[100]	valid_0's multi_error: 0.124043	valid_0's multi_logloss: 0.296044
[150]	valid_0's multi_error: 0.117057	valid_0's multi_logloss: 0.276994
[200]	valid_0's multi_error: 0.114003	valid_0's multi_logloss: 0.267551
[250]	valid_0's multi_error: 0.111468	valid_0's multi_logloss: 0.26173
[300]	valid_0's multi_error: 0.110355	valid_0's multi_logloss: 0.257499
[350]	valid_0's multi_error: 0.109294	valid_0's multi_logloss: 0.255174
[400]	valid_0's multi_error: 0.108596	valid_0's multi_logloss: 0.253528
[450]	valid_0's multi_error: 0.108104	valid_0's multi_logloss: 0.252891
Early stopping, best iteration is:
[426]	valid_0's multi_error: 0.107768	valid_0's multi_logloss: 0.253051
Training until validation scores don't improve for 30 rounds
[50]	valid_0's multi_error: 0.13817	valid_0's multi_logloss: 0.359866
[100]	valid_0's multi_error: 0.127898	valid_0's multi_logloss: 0.300028
[150]	valid_0's multi_error: 0.122154	valid_0's multi_logloss: 0.280703
[200]	valid_0's multi_error: 0.118298	valid_0's multi_logloss: 0.270963
[250]	valid_0's multi_error: 0.114754	valid_0's multi_logloss: 0.264003
[300]	valid_0's multi_error: 0.113227	valid_0's multi_logloss: 0.260164
[350]	valid_0's multi_error: 0.111571	valid_0's multi_logloss: 0.257839
[400]	valid_0's multi_error: 0.110148	valid_0's multi_logloss: 0.256443
Early stopping, best iteration is:
[410]	valid_0's multi_error: 0.109941	valid_0's multi_logloss: 0.256261
