[I 2025-06-12 00:24:50,896] Trial 11 finished with value: 0.888762461860649 and parameters: {'boosting_type': 'goss', 'learning_rate': 0.06327841043353384, 'num_leaves': 146, 'max_depth': 8, 'min_data_in_leaf': 10, 'feature_fraction': 0.7030308338054174, 'lambda_l1': 2.675004037577347, 'lambda_l2': 3.6723765368381396, 'min_gain_to_split': 0.016110568656384494, 'max_bin': 131}. Best is trial 11 with value: 0.888762461860649.
Training until validation scores don't improve for 30 rounds
[50]	valid_0's multi_error: 0.15429	valid_0's multi_logloss: 0.442136
[100]	valid_0's multi_error: 0.142051	valid_0's multi_logloss: 0.35816
[150]	valid_0's multi_error: 0.134367	valid_0's multi_logloss: 0.327064
[200]	valid_0's multi_error: 0.129632	valid_0's multi_logloss: 0.310129
[250]	valid_0's multi_error: 0.126035	valid_0's multi_logloss: 0.298871
[300]	valid_0's multi_error: 0.122438	valid_0's multi_logloss: 0.290488
[350]	valid_0's multi_error: 0.120265	valid_0's multi_logloss: 0.284311
[400]	valid_0's multi_error: 0.118454	valid_0's multi_logloss: 0.279066
[450]	valid_0's multi_error: 0.117367	valid_0's multi_logloss: 0.274572
[500]	valid_0's multi_error: 0.115737	valid_0's multi_logloss: 0.271086
[550]	valid_0's multi_error: 0.114107	valid_0's multi_logloss: 0.267757
Early stopping, best iteration is:
[546]	valid_0's multi_error: 0.113822	valid_0's multi_logloss: 0.268001
Training until validation scores don't improve for 30 rounds
[50]	valid_0's multi_error: 0.153954	valid_0's multi_logloss: 0.442221
[100]	valid_0's multi_error: 0.143552	valid_0's multi_logloss: 0.358594
[150]	valid_0's multi_error: 0.135479	valid_0's multi_logloss: 0.328075
[200]	valid_0's multi_error: 0.130253	valid_0's multi_logloss: 0.311314
[250]	valid_0's multi_error: 0.126475	valid_0's multi_logloss: 0.300566
[300]	valid_0's multi_error: 0.123836	valid_0's multi_logloss: 0.292524
[350]	valid_0's multi_error: 0.121843	valid_0's multi_logloss: 0.286148
[400]	valid_0's multi_error: 0.120006	valid_0's multi_logloss: 0.281021
[450]	valid_0's multi_error: 0.118635	valid_0's multi_logloss: 0.276968
[500]	valid_0's multi_error: 0.117057	valid_0's multi_logloss: 0.273554
[550]	valid_0's multi_error: 0.116617	valid_0's multi_logloss: 0.270423
[600]	valid_0's multi_error: 0.115245	valid_0's multi_logloss: 0.268123
[650]	valid_0's multi_error: 0.11434	valid_0's multi_logloss: 0.265954
[700]	valid_0's multi_error: 0.113952	valid_0's multi_logloss: 0.264274
Early stopping, best iteration is:
[711]	valid_0's multi_error: 0.113305	valid_0's multi_logloss: 0.263902
Training until validation scores don't improve for 30 rounds
[50]	valid_0's multi_error: 0.157757	valid_0's multi_logloss: 0.446102
[100]	valid_0's multi_error: 0.145389	valid_0's multi_logloss: 0.362403
[150]	valid_0's multi_error: 0.137601	valid_0's multi_logloss: 0.331867
[200]	valid_0's multi_error: 0.132788	valid_0's multi_logloss: 0.315245
[250]	valid_0's multi_error: 0.129218	valid_0's multi_logloss: 0.304527
[300]	valid_0's multi_error: 0.126682	valid_0's multi_logloss: 0.296422
[350]	valid_0's multi_error: 0.12425	valid_0's multi_logloss: 0.289597
[400]	valid_0's multi_error: 0.122749	valid_0's multi_logloss: 0.284391
[450]	valid_0's multi_error: 0.120886	valid_0's multi_logloss: 0.280004
[500]	valid_0's multi_error: 0.118919	valid_0's multi_logloss: 0.276382
[550]	valid_0's multi_error: 0.117574	valid_0's multi_logloss: 0.273317
Early stopping, best iteration is:
[545]	valid_0's multi_error: 0.117238	valid_0's multi_logloss: 0.273605
[I 2025-06-12 00:29:30,962] Trial 12 finished with value: 0.8830393642757665 and parameters: {'boosting_type': 'goss', 'learning_rate': 0.04181947020792858, 'num_leaves': 147, 'max_depth': 7, 'min_data_in_leaf': 11, 'feature_fraction': 0.6829786705032916, 'lambda_l1': 3.1258899860996, 'lambda_l2': 3.8594929043405113, 'min_gain_to_split': 0.158984337388051, 'max_bin': 136}. Best is trial 11 with value: 0.888762461860649.
Training until validation scores don't improve for 30 rounds
[50]	valid_0's multi_error: 0.187565	valid_0's multi_logloss: 0.50569
[100]	valid_0's multi_error: 0.173748	valid_0's multi_logloss: 0.425666
[150]	valid_0's multi_error: 0.162751	valid_0's multi_logloss: 0.394997
[200]	valid_0's multi_error: 0.15636	valid_0's multi_logloss: 0.377878
[250]	valid_0's multi_error: 0.152168	valid_0's multi_logloss: 0.365762
[300]	valid_0's multi_error: 0.148184	valid_0's multi_logloss: 0.356774
[350]	valid_0's multi_error: 0.145182	valid_0's multi_logloss: 0.348283
[400]	valid_0's multi_error: 0.142879	valid_0's multi_logloss: 0.341803
[450]	valid_0's multi_error: 0.141327	valid_0's multi_logloss: 0.336516
[500]	valid_0's multi_error: 0.13949	valid_0's multi_logloss: 0.332003
[550]	valid_0's multi_error: 0.137834	valid_0's multi_logloss: 0.32824
[600]	valid_0's multi_error: 0.136488	valid_0's multi_logloss: 0.324713
[650]	valid_0's multi_error: 0.135117	valid_0's multi_logloss: 0.321488
[700]	valid_0's multi_error: 0.133539	valid_0's multi_logloss: 0.318814
[750]	valid_0's multi_error: 0.1324	valid_0's multi_logloss: 0.3162
[800]	valid_0's multi_error: 0.131495	valid_0's multi_logloss: 0.313973
[850]	valid_0's multi_error: 0.131288	valid_0's multi_logloss: 0.311865
Early stopping, best iteration is:
[822]	valid_0's multi_error: 0.130899	valid_0's multi_logloss: 0.313102
Training until validation scores don't improve for 30 rounds
[50]	valid_0's multi_error: 0.191084	valid_0's multi_logloss: 0.506128
[100]	valid_0's multi_error: 0.174006	valid_0's multi_logloss: 0.425456
[150]	valid_0's multi_error: 0.16539	valid_0's multi_logloss: 0.396499
[200]	valid_0's multi_error: 0.158016	valid_0's multi_logloss: 0.379898
[250]	valid_0's multi_error: 0.15398	valid_0's multi_logloss: 0.368053
[300]	valid_0's multi_error: 0.150383	valid_0's multi_logloss: 0.358531
[350]	valid_0's multi_error: 0.147563	valid_0's multi_logloss: 0.350655
[400]	valid_0's multi_error: 0.145053	valid_0's multi_logloss: 0.344086
[450]	valid_0's multi_error: 0.14319	valid_0's multi_logloss: 0.338829
[500]	valid_0's multi_error: 0.14112	valid_0's multi_logloss: 0.334635
[550]	valid_0's multi_error: 0.13993	valid_0's multi_logloss: 0.331012
[600]	valid_0's multi_error: 0.138403	valid_0's multi_logloss: 0.327247
[650]	valid_0's multi_error: 0.137575	valid_0's multi_logloss: 0.324001
[700]	valid_0's multi_error: 0.136644	valid_0's multi_logloss: 0.32095
[750]	valid_0's multi_error: 0.13535	valid_0's multi_logloss: 0.318872
[800]	valid_0's multi_error: 0.134211	valid_0's multi_logloss: 0.316467
[850]	valid_0's multi_error: 0.133176	valid_0's multi_logloss: 0.31425
Early stopping, best iteration is:
[847]	valid_0's multi_error: 0.132943	valid_0's multi_logloss: 0.314341
Training until validation scores don't improve for 30 rounds
[50]	valid_0's multi_error: 0.192455	valid_0's multi_logloss: 0.509599
[100]	valid_0's multi_error: 0.175248	valid_0's multi_logloss: 0.429602
[150]	valid_0's multi_error: 0.168055	valid_0's multi_logloss: 0.400569
[200]	valid_0's multi_error: 0.160603	valid_0's multi_logloss: 0.383661
[250]	valid_0's multi_error: 0.155558	valid_0's multi_logloss: 0.371198
[300]	valid_0's multi_error: 0.151211	valid_0's multi_logloss: 0.362213
[350]	valid_0's multi_error: 0.148209	valid_0's multi_logloss: 0.354391
[400]	valid_0's multi_error: 0.146398	valid_0's multi_logloss: 0.347886
[450]	valid_0's multi_error: 0.143992	valid_0's multi_logloss: 0.341966
[500]	valid_0's multi_error: 0.142129	valid_0's multi_logloss: 0.3375
[550]	valid_0's multi_error: 0.141663	valid_0's multi_logloss: 0.333405
[600]	valid_0's multi_error: 0.140292	valid_0's multi_logloss: 0.329925
[650]	valid_0's multi_error: 0.139516	valid_0's multi_logloss: 0.326912
[700]	valid_0's multi_error: 0.137911	valid_0's multi_logloss: 0.324011
Early stopping, best iteration is:
[704]	valid_0's multi_error: 0.137575	valid_0's multi_logloss: 0.32381
[I 2025-06-12 00:31:45,467] Trial 13 finished with value: 0.863254810379639 and parameters: {'boosting_type': 'goss', 'learning_rate': 0.04371661461515301, 'num_leaves': 71, 'max_depth': 4, 'min_data_in_leaf': 64, 'feature_fraction': 0.6624861387916843, 'lambda_l1': 2.796567093809424, 'lambda_l2': 3.618579439922603, 'min_gain_to_split': 2.348834166512269, 'max_bin': 204}. Best is trial 11 with value: 0.888762461860649.
Training until validation scores don't improve for 30 rounds
[50]	valid_0's multi_error: 0.154057	valid_0's multi_logloss: 0.543903
[100]	valid_0's multi_error: 0.146347	valid_0's multi_logloss: 0.412271
[150]	valid_0's multi_error: 0.141404	valid_0's multi_logloss: 0.36312
[200]	valid_0's multi_error: 0.135997	valid_0's multi_logloss: 0.337388
[250]	valid_0's multi_error: 0.131469	valid_0's multi_logloss: 0.320069
[300]	valid_0's multi_error: 0.127872	valid_0's multi_logloss: 0.308163
[350]	valid_0's multi_error: 0.124793	valid_0's multi_logloss: 0.299936
[400]	valid_0's multi_error: 0.122516	valid_0's multi_logloss: 0.293226
[450]	valid_0's multi_error: 0.120679	valid_0's multi_logloss: 0.287956
[500]	valid_0's multi_error: 0.119101	valid_0's multi_logloss: 0.283562
[550]	valid_0's multi_error: 0.118169	valid_0's multi_logloss: 0.279807
[600]	valid_0's multi_error: 0.116668	valid_0's multi_logloss: 0.276203
[650]	valid_0's multi_error: 0.115349	valid_0's multi_logloss: 0.2732
[700]	valid_0's multi_error: 0.114314	valid_0's multi_logloss: 0.270327
[750]	valid_0's multi_error: 0.113175	valid_0's multi_logloss: 0.268052
Early stopping, best iteration is:
[756]	valid_0's multi_error: 0.112942	valid_0's multi_logloss: 0.267736
Training until validation scores don't improve for 30 rounds
[50]	valid_0's multi_error: 0.15398	valid_0's multi_logloss: 0.543124
[100]	valid_0's multi_error: 0.147071	valid_0's multi_logloss: 0.411202
[150]	valid_0's multi_error: 0.141016	valid_0's multi_logloss: 0.362723
[200]	valid_0's multi_error: 0.136566	valid_0's multi_logloss: 0.336574
[250]	valid_0's multi_error: 0.132038	valid_0's multi_logloss: 0.319946
[300]	valid_0's multi_error: 0.128364	valid_0's multi_logloss: 0.309063
[350]	valid_0's multi_error: 0.126164	valid_0's multi_logloss: 0.301143
[400]	valid_0's multi_error: 0.123991	valid_0's multi_logloss: 0.294648
[450]	valid_0's multi_error: 0.122257	valid_0's multi_logloss: 0.289686
[500]	valid_0's multi_error: 0.120782	valid_0's multi_logloss: 0.285212
[550]	valid_0's multi_error: 0.11967	valid_0's multi_logloss: 0.281715
[600]	valid_0's multi_error: 0.118505	valid_0's multi_logloss: 0.278323
[650]	valid_0's multi_error: 0.117445	valid_0's multi_logloss: 0.275493
[700]	valid_0's multi_error: 0.116306	valid_0's multi_logloss: 0.272936
[750]	valid_0's multi_error: 0.11597	valid_0's multi_logloss: 0.270791
Early stopping, best iteration is:
[726]	valid_0's multi_error: 0.115763	valid_0's multi_logloss: 0.271743
Training until validation scores don't improve for 30 rounds
[50]	valid_0's multi_error: 0.157628	valid_0's multi_logloss: 0.545438
[100]	valid_0's multi_error: 0.149607	valid_0's multi_logloss: 0.415617
[150]	valid_0's multi_error: 0.1435	valid_0's multi_logloss: 0.367238
[200]	valid_0's multi_error: 0.138558	valid_0's multi_logloss: 0.341153
[250]	valid_0's multi_error: 0.134806	valid_0's multi_logloss: 0.324494
[300]	valid_0's multi_error: 0.131883	valid_0's multi_logloss: 0.313398
[350]	valid_0's multi_error: 0.129062	valid_0's multi_logloss: 0.305358
[400]	valid_0's multi_error: 0.126785	valid_0's multi_logloss: 0.298641
[450]	valid_0's multi_error: 0.124922	valid_0's multi_logloss: 0.293274
[500]	valid_0's multi_error: 0.124146	valid_0's multi_logloss: 0.288793
[550]	valid_0's multi_error: 0.12262	valid_0's multi_logloss: 0.285023
[600]	valid_0's multi_error: 0.120938	valid_0's multi_logloss: 0.28186
[650]	valid_0's multi_error: 0.11998	valid_0's multi_logloss: 0.278859
[700]	valid_0's multi_error: 0.118583	valid_0's multi_logloss: 0.276099
[750]	valid_0's multi_error: 0.117884	valid_0's multi_logloss: 0.273865
[800]	valid_0's multi_error: 0.117471	valid_0's multi_logloss: 0.271658
[850]	valid_0's multi_error: 0.11641	valid_0's multi_logloss: 0.269761
[900]	valid_0's multi_error: 0.11584	valid_0's multi_logloss: 0.268271
[950]	valid_0's multi_error: 0.115297	valid_0's multi_logloss: 0.266811
[1000]	valid_0's multi_error: 0.114314	valid_0's multi_logloss: 0.265452
Did not meet early stopping. Best iteration is:
[999]	valid_0's multi_error: 0.114262	valid_0's multi_logloss: 0.265485
[I 2025-06-12 00:39:31,228] Trial 14 finished with value: 0.883527498298102 and parameters: {'boosting_type': 'goss', 'learning_rate': 0.02255981427603938, 'num_leaves': 149, 'max_depth': 8, 'min_data_in_leaf': 23, 'feature_fraction': 0.7526924006083864, 'lambda_l1': 3.8340746609038527, 'lambda_l2': 3.82035559583786, 'min_gain_to_split': 0.07615358893864163, 'max_bin': 127}. Best is trial 11 with value: 0.888762461860649.
Training until validation scores don't improve for 30 rounds
[50]	valid_0's multi_error: 0.130589	valid_0's multi_logloss: 0.314115
[100]	valid_0's multi_error: 0.120757	valid_0's multi_logloss: 0.282754
[150]	valid_0's multi_error: 0.117264	valid_0's multi_logloss: 0.272927
[200]	valid_0's multi_error: 0.114443	valid_0's multi_logloss: 0.267956
[250]	valid_0's multi_error: 0.113279	valid_0's multi_logloss: 0.265822
[300]	valid_0's multi_error: 0.112347	valid_0's multi_logloss: 0.26393
[350]	valid_0's multi_error: 0.112658	valid_0's multi_logloss: 0.263092
Early stopping, best iteration is:
[323]	valid_0's multi_error: 0.112192	valid_0's multi_logloss: 0.263551
Training until validation scores don't improve for 30 rounds
[50]	valid_0's multi_error: 0.131572	valid_0's multi_logloss: 0.316249
[100]	valid_0's multi_error: 0.122542	valid_0's multi_logloss: 0.28573
[150]	valid_0's multi_error: 0.118273	valid_0's multi_logloss: 0.27626
[200]	valid_0's multi_error: 0.117057	valid_0's multi_logloss: 0.272677
[250]	valid_0's multi_error: 0.115815	valid_0's multi_logloss: 0.270766
[300]	valid_0's multi_error: 0.114987	valid_0's multi_logloss: 0.269572
Early stopping, best iteration is:
[312]	valid_0's multi_error: 0.114521	valid_0's multi_logloss: 0.269375
Training until validation scores don't improve for 30 rounds
[50]	valid_0's multi_error: 0.133797	valid_0's multi_logloss: 0.320356
[100]	valid_0's multi_error: 0.126164	valid_0's multi_logloss: 0.288516
[150]	valid_0's multi_error: 0.120886	valid_0's multi_logloss: 0.278396
[200]	valid_0's multi_error: 0.118712	valid_0's multi_logloss: 0.274592
[250]	valid_0's multi_error: 0.117393	valid_0's multi_logloss: 0.272842
Early stopping, best iteration is:
[245]	valid_0's multi_error: 0.117108	valid_0's multi_logloss: 0.27277
[I 2025-06-12 00:42:11,904] Trial 15 finished with value: 0.883295211123658 and parameters: {'boosting_type': 'goss', 'learning_rate': 0.09919193558895162, 'num_leaves': 81, 'max_depth': 15, 'min_data_in_leaf': 48, 'feature_fraction': 0.838974107218286, 'lambda_l1': 2.1467108700559843, 'lambda_l2': 3.2244244231637884, 'min_gain_to_split': 1.1213252960487585, 'max_bin': 160}. Best is trial 11 with value: 0.888762461860649.
Training until validation scores don't improve for 30 rounds
[50]	valid_0's multi_error: 0.139516	valid_0's multi_logloss: 0.331855
[100]	valid_0's multi_error: 0.129476	valid_0's multi_logloss: 0.307622
[150]	valid_0's multi_error: 0.127587	valid_0's multi_logloss: 0.298705
[200]	valid_0's multi_error: 0.125155	valid_0's multi_logloss: 0.29363
[250]	valid_0's multi_error: 0.123215	valid_0's multi_logloss: 0.291056
Early stopping, best iteration is:
[243]	valid_0's multi_error: 0.123189	valid_0's multi_logloss: 0.291138
Training until validation scores don't improve for 30 rounds
[50]	valid_0's multi_error: 0.142724	valid_0's multi_logloss: 0.33473
[100]	valid_0's multi_error: 0.13359	valid_0's multi_logloss: 0.312185
[150]	valid_0's multi_error: 0.129735	valid_0's multi_logloss: 0.302848
[200]	valid_0's multi_error: 0.128493	valid_0's multi_logloss: 0.298995
[250]	valid_0's multi_error: 0.127717	valid_0's multi_logloss: 0.296906
Early stopping, best iteration is:
[258]	valid_0's multi_error: 0.127148	valid_0's multi_logloss: 0.296701
Training until validation scores don't improve for 30 rounds
[50]	valid_0's multi_error: 0.142129	valid_0's multi_logloss: 0.338546
[100]	valid_0's multi_error: 0.134548	valid_0's multi_logloss: 0.31511
[150]	valid_0's multi_error: 0.131443	valid_0's multi_logloss: 0.304841
[200]	valid_0's multi_error: 0.12958	valid_0's multi_logloss: 0.300344
[250]	valid_0's multi_error: 0.127794	valid_0's multi_logloss: 0.298802
Early stopping, best iteration is:
[267]	valid_0's multi_error: 0.126138	valid_0's multi_logloss: 0.297974
[I 2025-06-12 00:43:07,863] Trial 16 finished with value: 0.8722385098788429 and parameters: {'boosting_type': 'goss', 'learning_rate': 0.2936952275468354, 'num_leaves': 137, 'max_depth': 5, 'min_data_in_leaf': 74, 'feature_fraction': 0.7359247538896794, 'lambda_l1': 3.9460111273732346, 'lambda_l2': 1.3435550469707276, 'min_gain_to_split': 2.1527024625679996, 'max_bin': 195}. Best is trial 11 with value: 0.888762461860649.
Training until validation scores don't improve for 30 rounds
[50]	valid_0's multi_error: 0.141663	valid_0's multi_logloss: 0.361658
[100]	valid_0's multi_error: 0.128001	valid_0's multi_logloss: 0.309011
[150]	valid_0's multi_error: 0.122542	valid_0's multi_logloss: 0.290915
[200]	valid_0's multi_error: 0.118712	valid_0's multi_logloss: 0.279578
[250]	valid_0's multi_error: 0.115996	valid_0's multi_logloss: 0.272106
[300]	valid_0's multi_error: 0.114159	valid_0's multi_logloss: 0.267173
[350]	valid_0's multi_error: 0.113227	valid_0's multi_logloss: 0.263677
[400]	valid_0's multi_error: 0.112684	valid_0's multi_logloss: 0.261454
Early stopping, best iteration is:
[390]	valid_0's multi_error: 0.111907	valid_0's multi_logloss: 0.261878
Training until validation scores don't improve for 30 rounds
[50]	valid_0's multi_error: 0.142077	valid_0's multi_logloss: 0.361729
[100]	valid_0's multi_error: 0.129606	valid_0's multi_logloss: 0.311786
[150]	valid_0's multi_error: 0.124172	valid_0's multi_logloss: 0.293191
[200]	valid_0's multi_error: 0.120446	valid_0's multi_logloss: 0.282568
[250]	valid_0's multi_error: 0.11804	valid_0's multi_logloss: 0.275366
[300]	valid_0's multi_error: 0.115918	valid_0's multi_logloss: 0.270364
[350]	valid_0's multi_error: 0.114288	valid_0's multi_logloss: 0.267316
[400]	valid_0's multi_error: 0.113408	valid_0's multi_logloss: 0.265508
[450]	valid_0's multi_error: 0.113305	valid_0's multi_logloss: 0.263628
Early stopping, best iteration is:
[431]	valid_0's multi_error: 0.113175	valid_0's multi_logloss: 0.26405
Training until validation scores don't improve for 30 rounds
[50]	valid_0's multi_error: 0.145415	valid_0's multi_logloss: 0.365938
[100]	valid_0's multi_error: 0.132762	valid_0's multi_logloss: 0.315225
[150]	valid_0's multi_error: 0.127329	valid_0's multi_logloss: 0.296251
[200]	valid_0's multi_error: 0.12381	valid_0's multi_logloss: 0.284805
[250]	valid_0's multi_error: 0.121145	valid_0's multi_logloss: 0.277726
[300]	valid_0's multi_error: 0.118919	valid_0's multi_logloss: 0.273289
[350]	valid_0's multi_error: 0.117936	valid_0's multi_logloss: 0.269771
[400]	valid_0's multi_error: 0.117082	valid_0's multi_logloss: 0.267249
[450]	valid_0's multi_error: 0.114935	valid_0's multi_logloss: 0.265562
[500]	valid_0's multi_error: 0.114754	valid_0's multi_logloss: 0.264488
Early stopping, best iteration is:
[506]	valid_0's multi_error: 0.114366	valid_0's multi_logloss: 0.264344
