[I 2025-06-12 03:35:47,396] Trial 67 finished with value: 0.8784772788342105 and parameters: {'boosting_type': 'goss', 'learning_rate': 0.2337528978648034, 'num_leaves': 89, 'max_depth': 5, 'min_data_in_leaf': 16, 'feature_fraction': 0.7091205935329677, 'lambda_l1': 2.4025667503325363, 'lambda_l2': 4.867721594709332, 'min_gain_to_split': 0.6398646787611006, 'max_bin': 147}. Best is trial 47 with value: 0.8895928149546414.
Training until validation scores don't improve for 30 rounds
[50]	valid_0's multi_error: 0.128338	valid_0's multi_logloss: 0.306069
[100]	valid_0's multi_error: 0.120058	valid_0's multi_logloss: 0.282206
[150]	valid_0's multi_error: 0.116047	valid_0's multi_logloss: 0.271043
[200]	valid_0's multi_error: 0.114702	valid_0's multi_logloss: 0.266517
[250]	valid_0's multi_error: 0.113305	valid_0's multi_logloss: 0.263962
Early stopping, best iteration is:
[255]	valid_0's multi_error: 0.11258	valid_0's multi_logloss: 0.263976
Training until validation scores don't improve for 30 rounds
[50]	valid_0's multi_error: 0.132245	valid_0's multi_logloss: 0.310961
[100]	valid_0's multi_error: 0.122413	valid_0's multi_logloss: 0.287204
[150]	valid_0's multi_error: 0.118894	valid_0's multi_logloss: 0.277608
[200]	valid_0's multi_error: 0.117212	valid_0's multi_logloss: 0.273006
[250]	valid_0's multi_error: 0.116332	valid_0's multi_logloss: 0.270923
[300]	valid_0's multi_error: 0.114391	valid_0's multi_logloss: 0.270089
[350]	valid_0's multi_error: 0.113538	valid_0's multi_logloss: 0.27011
Early stopping, best iteration is:
[328]	valid_0's multi_error: 0.114029	valid_0's multi_logloss: 0.269518
Training until validation scores don't improve for 30 rounds
[50]	valid_0's multi_error: 0.133953	valid_0's multi_logloss: 0.312415
[100]	valid_0's multi_error: 0.124353	valid_0's multi_logloss: 0.287191
[150]	valid_0's multi_error: 0.120032	valid_0's multi_logloss: 0.277604
[200]	valid_0's multi_error: 0.117289	valid_0's multi_logloss: 0.272519
Early stopping, best iteration is:
[214]	valid_0's multi_error: 0.116539	valid_0's multi_logloss: 0.271675
[I 2025-06-12 03:37:46,871] Trial 68 finished with value: 0.8836915038338956 and parameters: {'boosting_type': 'goss', 'learning_rate': 0.19119604931852613, 'num_leaves': 84, 'max_depth': 8, 'min_data_in_leaf': 78, 'feature_fraction': 0.7358662258381397, 'lambda_l1': 1.8363746480777987, 'lambda_l2': 3.6857842597702906, 'min_gain_to_split': 0.2362991681139991, 'max_bin': 178}. Best is trial 47 with value: 0.8895928149546414.
Training until validation scores don't improve for 30 rounds
[50]	valid_0's multi_error: 0.146217	valid_0's multi_logloss: 0.412715
[100]	valid_0's multi_error: 0.135272	valid_0's multi_logloss: 0.335124
[150]	valid_0's multi_error: 0.128752	valid_0's multi_logloss: 0.308573
[200]	valid_0's multi_error: 0.124664	valid_0's multi_logloss: 0.29595
[250]	valid_0's multi_error: 0.121817	valid_0's multi_logloss: 0.288701
[300]	valid_0's multi_error: 0.119618	valid_0's multi_logloss: 0.283718
[350]	valid_0's multi_error: 0.118868	valid_0's multi_logloss: 0.280889
[400]	valid_0's multi_error: 0.118454	valid_0's multi_logloss: 0.27889
Early stopping, best iteration is:
[387]	valid_0's multi_error: 0.117988	valid_0's multi_logloss: 0.279335
Training until validation scores don't improve for 30 rounds
[50]	valid_0's multi_error: 0.146605	valid_0's multi_logloss: 0.413247
[100]	valid_0's multi_error: 0.135919	valid_0's multi_logloss: 0.335691
[150]	valid_0's multi_error: 0.12945	valid_0's multi_logloss: 0.309832
[200]	valid_0's multi_error: 0.125802	valid_0's multi_logloss: 0.298191
[250]	valid_0's multi_error: 0.123396	valid_0's multi_logloss: 0.290884
[300]	valid_0's multi_error: 0.121792	valid_0's multi_logloss: 0.286637
Early stopping, best iteration is:
[318]	valid_0's multi_error: 0.121119	valid_0's multi_logloss: 0.285485
Training until validation scores don't improve for 30 rounds
[50]	valid_0's multi_error: 0.149296	valid_0's multi_logloss: 0.416455
[100]	valid_0's multi_error: 0.139335	valid_0's multi_logloss: 0.339054
[150]	valid_0's multi_error: 0.131831	valid_0's multi_logloss: 0.312721
[200]	valid_0's multi_error: 0.128001	valid_0's multi_logloss: 0.300402
[250]	valid_0's multi_error: 0.125906	valid_0's multi_logloss: 0.293583
[300]	valid_0's multi_error: 0.124327	valid_0's multi_logloss: 0.289221
[350]	valid_0's multi_error: 0.123629	valid_0's multi_logloss: 0.285971
[400]	valid_0's multi_error: 0.122206	valid_0's multi_logloss: 0.283978
[450]	valid_0's multi_error: 0.121714	valid_0's multi_logloss: 0.282692
Early stopping, best iteration is:
[421]	valid_0's multi_error: 0.121455	valid_0's multi_logloss: 0.283385
[I 2025-06-12 03:40:35,153] Trial 69 finished with value: 0.8773800480193857 and parameters: {'boosting_type': 'goss', 'learning_rate': 0.044784252399262904, 'num_leaves': 70, 'max_depth': 9, 'min_data_in_leaf': 12, 'feature_fraction': 0.6637552844907201, 'lambda_l1': 0.7107900548969267, 'lambda_l2': 1.6196162911097867, 'min_gain_to_split': 2.53865246677772, 'max_bin': 197}. Best is trial 47 with value: 0.8895928149546414.
Training until validation scores don't improve for 30 rounds
[50]	valid_0's multi_error: 0.121895	valid_0's multi_logloss: 0.29427
[100]	valid_0's multi_error: 0.120627	valid_0's multi_logloss: 0.286173
[150]	valid_0's multi_error: 0.120394	valid_0's multi_logloss: 0.285724
Early stopping, best iteration is:
[138]	valid_0's multi_error: 0.120394	valid_0's multi_logloss: 0.285724
Training until validation scores don't improve for 30 rounds
[50]	valid_0's multi_error: 0.122956	valid_0's multi_logloss: 0.295194
[100]	valid_0's multi_error: 0.121766	valid_0's multi_logloss: 0.286744
[150]	valid_0's multi_error: 0.121533	valid_0's multi_logloss: 0.286519
Early stopping, best iteration is:
[134]	valid_0's multi_error: 0.121533	valid_0's multi_logloss: 0.286521
Training until validation scores don't improve for 30 rounds
[50]	valid_0's multi_error: 0.126837	valid_0's multi_logloss: 0.299065
[100]	valid_0's multi_error: 0.125724	valid_0's multi_logloss: 0.290773
Early stopping, best iteration is:
[92]	valid_0's multi_error: 0.125595	valid_0's multi_logloss: 0.290933
[I 2025-06-12 03:41:26,749] Trial 70 finished with value: 0.8750035614761686 and parameters: {'boosting_type': 'gbdt', 'learning_rate': 0.13119252591225197, 'num_leaves': 141, 'max_depth': 15, 'min_data_in_leaf': 28, 'feature_fraction': 0.6002725757938793, 'lambda_l1': 3.083940286441143, 'lambda_l2': 4.622200112049123, 'min_gain_to_split': 0.5706283832244582, 'max_bin': 104, 'bagging_fraction': 0.975018936403615, 'bagging_freq': 3}. Best is trial 47 with value: 0.8895928149546414.
Training until validation scores don't improve for 30 rounds
[50]	valid_0's multi_error: 0.140214	valid_0's multi_logloss: 0.354877
[100]	valid_0's multi_error: 0.128545	valid_0's multi_logloss: 0.307479
[150]	valid_0's multi_error: 0.122257	valid_0's multi_logloss: 0.289563
[200]	valid_0's multi_error: 0.118273	valid_0's multi_logloss: 0.277537
[250]	valid_0's multi_error: 0.115349	valid_0's multi_logloss: 0.269375
[300]	valid_0's multi_error: 0.112425	valid_0's multi_logloss: 0.263705
[350]	valid_0's multi_error: 0.111468	valid_0's multi_logloss: 0.259602
[400]	valid_0's multi_error: 0.110303	valid_0's multi_logloss: 0.256427
Early stopping, best iteration is:
[371]	valid_0's multi_error: 0.110122	valid_0's multi_logloss: 0.257927
Training until validation scores don't improve for 30 rounds
[50]	valid_0's multi_error: 0.141637	valid_0's multi_logloss: 0.354687
[100]	valid_0's multi_error: 0.129269	valid_0's multi_logloss: 0.308655
[150]	valid_0's multi_error: 0.123655	valid_0's multi_logloss: 0.290748
[200]	valid_0's multi_error: 0.119152	valid_0's multi_logloss: 0.279792
[250]	valid_0's multi_error: 0.116306	valid_0's multi_logloss: 0.27239
[300]	valid_0's multi_error: 0.114573	valid_0's multi_logloss: 0.267179
[350]	valid_0's multi_error: 0.11271	valid_0's multi_logloss: 0.263427
[400]	valid_0's multi_error: 0.11271	valid_0's multi_logloss: 0.260496
Early stopping, best iteration is:
[372]	valid_0's multi_error: 0.112011	valid_0's multi_logloss: 0.262048
Training until validation scores don't improve for 30 rounds
[50]	valid_0's multi_error: 0.143863	valid_0's multi_logloss: 0.36026
[100]	valid_0's multi_error: 0.131831	valid_0's multi_logloss: 0.312135
[150]	valid_0's multi_error: 0.126656	valid_0's multi_logloss: 0.294734
[200]	valid_0's multi_error: 0.123059	valid_0's multi_logloss: 0.283315
[250]	valid_0's multi_error: 0.120575	valid_0's multi_logloss: 0.276293
[300]	valid_0's multi_error: 0.118376	valid_0's multi_logloss: 0.271173
[350]	valid_0's multi_error: 0.116513	valid_0's multi_logloss: 0.26739
[400]	valid_0's multi_error: 0.115556	valid_0's multi_logloss: 0.264722
[450]	valid_0's multi_error: 0.114495	valid_0's multi_logloss: 0.262883
[500]	valid_0's multi_error: 0.113124	valid_0's multi_logloss: 0.260989
Early stopping, best iteration is:
[505]	valid_0's multi_error: 0.112503	valid_0's multi_logloss: 0.260859
[I 2025-06-12 03:44:24,974] Trial 71 finished with value: 0.8864765865793315 and parameters: {'boosting_type': 'goss', 'learning_rate': 0.07648643312360194, 'num_leaves': 97, 'max_depth': 8, 'min_data_in_leaf': 43, 'feature_fraction': 0.6907588776009402, 'lambda_l1': 0.9154338324798532, 'lambda_l2': 4.822007187357702, 'min_gain_to_split': 0.0023357779699851103, 'max_bin': 112}. Best is trial 47 with value: 0.8895928149546414.
Training until validation scores don't improve for 30 rounds
[50]	valid_0's multi_error: 0.128622	valid_0's multi_logloss: 0.308337
[100]	valid_0's multi_error: 0.118609	valid_0's multi_logloss: 0.279559
[150]	valid_0's multi_error: 0.113615	valid_0's multi_logloss: 0.26676
[200]	valid_0's multi_error: 0.111545	valid_0's multi_logloss: 0.260636
Early stopping, best iteration is:
[210]	valid_0's multi_error: 0.111028	valid_0's multi_logloss: 0.260079
Training until validation scores don't improve for 30 rounds
[50]	valid_0's multi_error: 0.129942	valid_0's multi_logloss: 0.310175
[100]	valid_0's multi_error: 0.120265	valid_0's multi_logloss: 0.283032
[150]	valid_0's multi_error: 0.117186	valid_0's multi_logloss: 0.27204
[200]	valid_0's multi_error: 0.113822	valid_0's multi_logloss: 0.26562
[250]	valid_0's multi_error: 0.112658	valid_0's multi_logloss: 0.26282
[300]	valid_0's multi_error: 0.112166	valid_0's multi_logloss: 0.261873
Early stopping, best iteration is:
[293]	valid_0's multi_error: 0.111571	valid_0's multi_logloss: 0.262019
Training until validation scores don't improve for 30 rounds
[50]	valid_0's multi_error: 0.133642	valid_0's multi_logloss: 0.31261
[100]	valid_0's multi_error: 0.123499	valid_0's multi_logloss: 0.284751
[150]	valid_0's multi_error: 0.118531	valid_0's multi_logloss: 0.273002
[200]	valid_0's multi_error: 0.11641	valid_0's multi_logloss: 0.267725
[250]	valid_0's multi_error: 0.114573	valid_0's multi_logloss: 0.263955
[300]	valid_0's multi_error: 0.112658	valid_0's multi_logloss: 0.26279
Early stopping, best iteration is:
[290]	valid_0's multi_error: 0.112296	valid_0's multi_logloss: 0.262895
[I 2025-06-12 03:46:37,146] Trial 72 finished with value: 0.8864708826993434 and parameters: {'boosting_type': 'goss', 'learning_rate': 0.13358334559457236, 'num_leaves': 99, 'max_depth': 9, 'min_data_in_leaf': 49, 'feature_fraction': 0.7838069797535523, 'lambda_l1': 1.1894012770672568, 'lambda_l2': 4.98377998878838, 'min_gain_to_split': 0.13977391224301422, 'max_bin': 117}. Best is trial 47 with value: 0.8895928149546414.
Training until validation scores don't improve for 30 rounds
[50]	valid_0's multi_error: 0.136307	valid_0's multi_logloss: 0.33538
[100]	valid_0's multi_error: 0.124638	valid_0's multi_logloss: 0.296336
[150]	valid_0's multi_error: 0.119126	valid_0's multi_logloss: 0.280982
[200]	valid_0's multi_error: 0.116125	valid_0's multi_logloss: 0.27146
[250]	valid_0's multi_error: 0.113434	valid_0's multi_logloss: 0.265411
[300]	valid_0's multi_error: 0.111959	valid_0's multi_logloss: 0.261445
Early stopping, best iteration is:
[317]	valid_0's multi_error: 0.110821	valid_0's multi_logloss: 0.260689
Training until validation scores don't improve for 30 rounds
[50]	valid_0's multi_error: 0.136876	valid_0's multi_logloss: 0.335169
[100]	valid_0's multi_error: 0.126604	valid_0's multi_logloss: 0.298077
[150]	valid_0's multi_error: 0.120938	valid_0's multi_logloss: 0.282972
[200]	valid_0's multi_error: 0.117703	valid_0's multi_logloss: 0.27429
[250]	valid_0's multi_error: 0.115426	valid_0's multi_logloss: 0.268669
[300]	valid_0's multi_error: 0.114495	valid_0's multi_logloss: 0.265418
[350]	valid_0's multi_error: 0.113667	valid_0's multi_logloss: 0.263005
Early stopping, best iteration is:
[328]	valid_0's multi_error: 0.113201	valid_0's multi_logloss: 0.264128
Training until validation scores don't improve for 30 rounds
[50]	valid_0's multi_error: 0.140576	valid_0's multi_logloss: 0.341636
[100]	valid_0's multi_error: 0.129321	valid_0's multi_logloss: 0.301315
[150]	valid_0's multi_error: 0.122878	valid_0's multi_logloss: 0.285597
[200]	valid_0's multi_error: 0.120006	valid_0's multi_logloss: 0.276091
[250]	valid_0's multi_error: 0.118428	valid_0's multi_logloss: 0.270699
Early stopping, best iteration is:
[231]	valid_0's multi_error: 0.1176	valid_0's multi_logloss: 0.272276
[I 2025-06-12 03:48:38,553] Trial 73 finished with value: 0.8840578067496302 and parameters: {'boosting_type': 'goss', 'learning_rate': 0.09300131270322758, 'num_leaves': 64, 'max_depth': 9, 'min_data_in_leaf': 31, 'feature_fraction': 0.6989408464836092, 'lambda_l1': 1.0814288191332584, 'lambda_l2': 4.663864930363638, 'min_gain_to_split': 0.3566270339297982, 'max_bin': 138}. Best is trial 47 with value: 0.8895928149546414.
Training until validation scores don't improve for 30 rounds
[50]	valid_0's multi_error: 0.123655	valid_0's multi_logloss: 0.29372
[100]	valid_0's multi_error: 0.116254	valid_0's multi_logloss: 0.271367
[150]	valid_0's multi_error: 0.112839	valid_0's multi_logloss: 0.262277
[200]	valid_0's multi_error: 0.111571	valid_0's multi_logloss: 0.260021
Early stopping, best iteration is:
[189]	valid_0's multi_error: 0.110976	valid_0's multi_logloss: 0.26021
Training until validation scores don't improve for 30 rounds
[50]	valid_0's multi_error: 0.124172	valid_0's multi_logloss: 0.295093
[100]	valid_0's multi_error: 0.117419	valid_0's multi_logloss: 0.272253
[150]	valid_0's multi_error: 0.114521	valid_0's multi_logloss: 0.265025
[200]	valid_0's multi_error: 0.112761	valid_0's multi_logloss: 0.262481
Early stopping, best iteration is:
[204]	valid_0's multi_error: 0.112839	valid_0's multi_logloss: 0.262313
Training until validation scores don't improve for 30 rounds
[50]	valid_0's multi_error: 0.125906	valid_0's multi_logloss: 0.296923
[100]	valid_0's multi_error: 0.117393	valid_0's multi_logloss: 0.275738
[150]	valid_0's multi_error: 0.114831	valid_0's multi_logloss: 0.267961
[200]	valid_0's multi_error: 0.113072	valid_0's multi_logloss: 0.265907
Early stopping, best iteration is:
[193]	valid_0's multi_error: 0.112477	valid_0's multi_logloss: 0.265809
[I 2025-06-12 03:50:38,265] Trial 74 finished with value: 0.8859758287287467 and parameters: {'boosting_type': 'goss', 'learning_rate': 0.16811259136255383, 'num_leaves': 105, 'max_depth': 10, 'min_data_in_leaf': 36, 'feature_fraction': 0.630127498909036, 'lambda_l1': 1.3813898267605593, 'lambda_l2': 3.515041895582686, 'min_gain_to_split': 0.14171135575637253, 'max_bin': 94}. Best is trial 47 with value: 0.8895928149546414.
Training until validation scores don't improve for 30 rounds
[50]	valid_0's multi_error: 0.150564	valid_0's multi_logloss: 0.402112
[100]	valid_0's multi_error: 0.139981	valid_0's multi_logloss: 0.339229
[150]	valid_0's multi_error: 0.132348	valid_0's multi_logloss: 0.316646
[200]	valid_0's multi_error: 0.127329	valid_0's multi_logloss: 0.30398
[250]	valid_0's multi_error: 0.12425	valid_0's multi_logloss: 0.295658
[300]	valid_0's multi_error: 0.121973	valid_0's multi_logloss: 0.288225
[350]	valid_0's multi_error: 0.120265	valid_0's multi_logloss: 0.282156
[400]	valid_0's multi_error: 0.118505	valid_0's multi_logloss: 0.277335
[450]	valid_0's multi_error: 0.116772	valid_0's multi_logloss: 0.273383
[500]	valid_0's multi_error: 0.115038	valid_0's multi_logloss: 0.269932
[550]	valid_0's multi_error: 0.114236	valid_0's multi_logloss: 0.267283
[600]	valid_0's multi_error: 0.113563	valid_0's multi_logloss: 0.265234
Early stopping, best iteration is:
[581]	valid_0's multi_error: 0.113227	valid_0's multi_logloss: 0.265935
Training until validation scores don't improve for 30 rounds
[50]	valid_0's multi_error: 0.152556	valid_0's multi_logloss: 0.403686
[100]	valid_0's multi_error: 0.14099	valid_0's multi_logloss: 0.341636
[150]	valid_0's multi_error: 0.132969	valid_0's multi_logloss: 0.319468
[200]	valid_0's multi_error: 0.129425	valid_0's multi_logloss: 0.306432
[250]	valid_0's multi_error: 0.126449	valid_0's multi_logloss: 0.297177
[300]	valid_0's multi_error: 0.123137	valid_0's multi_logloss: 0.289291
[350]	valid_0's multi_error: 0.120782	valid_0's multi_logloss: 0.28411
[400]	valid_0's multi_error: 0.119333	valid_0's multi_logloss: 0.27964
[450]	valid_0's multi_error: 0.118117	valid_0's multi_logloss: 0.275895
[500]	valid_0's multi_error: 0.117677	valid_0's multi_logloss: 0.272844
Early stopping, best iteration is:
[474]	valid_0's multi_error: 0.117057	valid_0's multi_logloss: 0.274417
Training until validation scores don't improve for 30 rounds
[50]	valid_0's multi_error: 0.156334	valid_0's multi_logloss: 0.408409
[100]	valid_0's multi_error: 0.143423	valid_0's multi_logloss: 0.345746
[150]	valid_0's multi_error: 0.135867	valid_0's multi_logloss: 0.323236
[200]	valid_0's multi_error: 0.13121	valid_0's multi_logloss: 0.309585
[250]	valid_0's multi_error: 0.128157	valid_0's multi_logloss: 0.29994
[300]	valid_0's multi_error: 0.125569	valid_0's multi_logloss: 0.292564
[350]	valid_0's multi_error: 0.124094	valid_0's multi_logloss: 0.286654
[400]	valid_0's multi_error: 0.12174	valid_0's multi_logloss: 0.282105
[450]	valid_0's multi_error: 0.119903	valid_0's multi_logloss: 0.278461
[500]	valid_0's multi_error: 0.119489	valid_0's multi_logloss: 0.275387
[550]	valid_0's multi_error: 0.117677	valid_0's multi_logloss: 0.272656
Early stopping, best iteration is:
[543]	valid_0's multi_error: 0.117496	valid_0's multi_logloss: 0.273047
[I 2025-06-12 03:53:13,507] Trial 75 finished with value: 0.881926945473694 and parameters: {'boosting_type': 'goss', 'learning_rate': 0.0562660267696488, 'num_leaves': 91, 'max_depth': 7, 'min_data_in_leaf': 68, 'feature_fraction': 0.7160007957195215, 'lambda_l1': 0.9071761221935258, 'lambda_l2': 3.008716093410247, 'min_gain_to_split': 0.43061115602933664, 'max_bin': 128}. Best is trial 47 with value: 0.8895928149546414.
Training until validation scores don't improve for 30 rounds
[50]	valid_0's multi_error: 0.143888	valid_0's multi_logloss: 0.373478
[100]	valid_0's multi_error: 0.1324	valid_0's multi_logloss: 0.318066
[150]	valid_0's multi_error: 0.12456	valid_0's multi_logloss: 0.297147
[200]	valid_0's multi_error: 0.120446	valid_0's multi_logloss: 0.285397
[250]	valid_0's multi_error: 0.117729	valid_0's multi_logloss: 0.277113
[300]	valid_0's multi_error: 0.114288	valid_0's multi_logloss: 0.270995
[350]	valid_0's multi_error: 0.112968	valid_0's multi_logloss: 0.265995
[400]	valid_0's multi_error: 0.112244	valid_0's multi_logloss: 0.262502
[450]	valid_0's multi_error: 0.112011	valid_0's multi_logloss: 0.259726
Early stopping, best iteration is:
[426]	valid_0's multi_error: 0.111209	valid_0's multi_logloss: 0.260888
Training until validation scores don't improve for 30 rounds
[50]	valid_0's multi_error: 0.144561	valid_0's multi_logloss: 0.374863
[100]	valid_0's multi_error: 0.132193	valid_0's multi_logloss: 0.319715
[150]	valid_0's multi_error: 0.12531	valid_0's multi_logloss: 0.298332
[200]	valid_0's multi_error: 0.121688	valid_0's multi_logloss: 0.287011
[250]	valid_0's multi_error: 0.11998	valid_0's multi_logloss: 0.279428
[300]	valid_0's multi_error: 0.117057	valid_0's multi_logloss: 0.272971
[350]	valid_0's multi_error: 0.115297	valid_0's multi_logloss: 0.268721
[400]	valid_0's multi_error: 0.113149	valid_0's multi_logloss: 0.265431
[450]	valid_0's multi_error: 0.112063	valid_0's multi_logloss: 0.262926
[500]	valid_0's multi_error: 0.110381	valid_0's multi_logloss: 0.260869
[550]	valid_0's multi_error: 0.110355	valid_0's multi_logloss: 0.259598
[600]	valid_0's multi_error: 0.110174	valid_0's multi_logloss: 0.258214
Early stopping, best iteration is:
[610]	valid_0's multi_error: 0.109579	valid_0's multi_logloss: 0.257929
Training until validation scores don't improve for 30 rounds
[50]	valid_0's multi_error: 0.147304	valid_0's multi_logloss: 0.377851
[100]	valid_0's multi_error: 0.135298	valid_0's multi_logloss: 0.322474
[150]	valid_0's multi_error: 0.129295	valid_0's multi_logloss: 0.302104
[200]	valid_0's multi_error: 0.125233	valid_0's multi_logloss: 0.290335
[250]	valid_0's multi_error: 0.121507	valid_0's multi_logloss: 0.281943
[300]	valid_0's multi_error: 0.119799	valid_0's multi_logloss: 0.276241
[350]	valid_0's multi_error: 0.117962	valid_0's multi_logloss: 0.272098
[400]	valid_0's multi_error: 0.115866	valid_0's multi_logloss: 0.2686
[450]	valid_0's multi_error: 0.114805	valid_0's multi_logloss: 0.265839
[500]	valid_0's multi_error: 0.114081	valid_0's multi_logloss: 0.26387
Early stopping, best iteration is:
[495]	valid_0's multi_error: 0.113641	valid_0's multi_logloss: 0.263992
