[I 2025-06-11 23:39:39,299] A new study created in memory with name: no-name-2b90a65a-de7f-426e-91b3-b3b75c722d4b
Training until validation scores don't improve for 30 rounds
[50]	valid_0's multi_error: 0.163501	valid_0's multi_logloss: 0.806839
[100]	valid_0's multi_error: 0.158896	valid_0's multi_logloss: 0.642359
[150]	valid_0's multi_error: 0.154626	valid_0's multi_logloss: 0.544989
[200]	valid_0's multi_error: 0.152168	valid_0's multi_logloss: 0.483165
[250]	valid_0's multi_error: 0.150176	valid_0's multi_logloss: 0.442327
[300]	valid_0's multi_error: 0.148391	valid_0's multi_logloss: 0.414647
[350]	valid_0's multi_error: 0.146761	valid_0's multi_logloss: 0.39599
[400]	valid_0's multi_error: 0.145493	valid_0's multi_logloss: 0.382523
[450]	valid_0's multi_error: 0.144613	valid_0's multi_logloss: 0.372889
[500]	valid_0's multi_error: 0.144147	valid_0's multi_logloss: 0.366142
[550]	valid_0's multi_error: 0.1435	valid_0's multi_logloss: 0.36092
[600]	valid_0's multi_error: 0.143112	valid_0's multi_logloss: 0.357129
[650]	valid_0's multi_error: 0.143009	valid_0's multi_logloss: 0.354335
Early stopping, best iteration is:
[622]	valid_0's multi_error: 0.142776	valid_0's multi_logloss: 0.35582
Training until validation scores don't improve for 30 rounds
[50]	valid_0's multi_error: 0.163061	valid_0's multi_logloss: 0.806706
[100]	valid_0's multi_error: 0.160293	valid_0's multi_logloss: 0.642133
[150]	valid_0's multi_error: 0.155972	valid_0's multi_logloss: 0.544795
[200]	valid_0's multi_error: 0.153384	valid_0's multi_logloss: 0.482666
[250]	valid_0's multi_error: 0.151004	valid_0's multi_logloss: 0.441628
[300]	valid_0's multi_error: 0.148727	valid_0's multi_logloss: 0.414377
[350]	valid_0's multi_error: 0.14689	valid_0's multi_logloss: 0.395026
[400]	valid_0's multi_error: 0.145777	valid_0's multi_logloss: 0.381787
[450]	valid_0's multi_error: 0.145208	valid_0's multi_logloss: 0.372602
[500]	valid_0's multi_error: 0.144768	valid_0's multi_logloss: 0.365491
[550]	valid_0's multi_error: 0.144199	valid_0's multi_logloss: 0.360265
[600]	valid_0's multi_error: 0.144044	valid_0's multi_logloss: 0.356484
[650]	valid_0's multi_error: 0.143604	valid_0's multi_logloss: 0.353526
[700]	valid_0's multi_error: 0.143242	valid_0's multi_logloss: 0.351381
Early stopping, best iteration is:
[681]	valid_0's multi_error: 0.14319	valid_0's multi_logloss: 0.352095
Training until validation scores don't improve for 30 rounds
[50]	valid_0's multi_error: 0.165442	valid_0's multi_logloss: 0.807003
[100]	valid_0's multi_error: 0.16244	valid_0's multi_logloss: 0.643206
[150]	valid_0's multi_error: 0.158404	valid_0's multi_logloss: 0.547049
[200]	valid_0's multi_error: 0.15548	valid_0's multi_logloss: 0.486072
[250]	valid_0's multi_error: 0.154057	valid_0's multi_logloss: 0.446129
[300]	valid_0's multi_error: 0.152401	valid_0's multi_logloss: 0.418923
[350]	valid_0's multi_error: 0.151289	valid_0's multi_logloss: 0.40032
[400]	valid_0's multi_error: 0.150021	valid_0's multi_logloss: 0.386996
[450]	valid_0's multi_error: 0.149736	valid_0's multi_logloss: 0.377827
[500]	valid_0's multi_error: 0.149089	valid_0's multi_logloss: 0.370899
[550]	valid_0's multi_error: 0.149012	valid_0's multi_logloss: 0.365858
Early stopping, best iteration is:
[521]	valid_0's multi_error: 0.148934	valid_0's multi_logloss: 0.368564
[I 2025-06-11 23:43:35,950] Trial 0 finished with value: 0.8512733293274367 and parameters: {'boosting_type': 'gbdt', 'learning_rate': 0.006915129533360806, 'num_leaves': 96, 'max_depth': 13, 'min_data_in_leaf': 87, 'feature_fraction': 0.9365519854568143, 'lambda_l1': 1.4236039776154252, 'lambda_l2': 2.298048596895415, 'min_gain_to_split': 4.841293859677749, 'max_bin': 109, 'bagging_fraction': 0.6265135946972443, 'bagging_freq': 2}. Best is trial 0 with value: 0.8512733293274367.
Training until validation scores don't improve for 30 rounds
[50]	valid_0's multi_error: 0.16376	valid_0's multi_logloss: 0.666363
[100]	valid_0's multi_error: 0.156127	valid_0's multi_logloss: 0.507611
[150]	valid_0's multi_error: 0.150486	valid_0's multi_logloss: 0.435022
[200]	valid_0's multi_error: 0.146786	valid_0's multi_logloss: 0.397499
[250]	valid_0's multi_error: 0.145648	valid_0's multi_logloss: 0.375368
[300]	valid_0's multi_error: 0.143759	valid_0's multi_logloss: 0.364384
[350]	valid_0's multi_error: 0.143086	valid_0's multi_logloss: 0.357745
Early stopping, best iteration is:
[354]	valid_0's multi_error: 0.142879	valid_0's multi_logloss: 0.357302
Training until validation scores don't improve for 30 rounds
[50]	valid_0's multi_error: 0.164485	valid_0's multi_logloss: 0.665969
[100]	valid_0's multi_error: 0.157498	valid_0's multi_logloss: 0.507446
[150]	valid_0's multi_error: 0.151961	valid_0's multi_logloss: 0.435043
[200]	valid_0's multi_error: 0.148287	valid_0's multi_logloss: 0.397301
[250]	valid_0's multi_error: 0.145622	valid_0's multi_logloss: 0.375015
[300]	valid_0's multi_error: 0.144328	valid_0's multi_logloss: 0.364027
Early stopping, best iteration is:
[301]	valid_0's multi_error: 0.144251	valid_0's multi_logloss: 0.363842
Training until validation scores don't improve for 30 rounds
[50]	valid_0's multi_error: 0.167408	valid_0's multi_logloss: 0.667754
[100]	valid_0's multi_error: 0.161406	valid_0's multi_logloss: 0.51076
[150]	valid_0's multi_error: 0.155791	valid_0's multi_logloss: 0.439466
[200]	valid_0's multi_error: 0.152039	valid_0's multi_logloss: 0.402123
[250]	valid_0's multi_error: 0.149762	valid_0's multi_logloss: 0.380249
[300]	valid_0's multi_error: 0.148546	valid_0's multi_logloss: 0.369338
[350]	valid_0's multi_error: 0.147977	valid_0's multi_logloss: 0.362723
[400]	valid_0's multi_error: 0.147821	valid_0's multi_logloss: 0.358662
Early stopping, best iteration is:
[376]	valid_0's multi_error: 0.14777	valid_0's multi_logloss: 0.360353
[I 2025-06-11 23:45:18,159] Trial 1 finished with value: 0.8512929634732052 and parameters: {'boosting_type': 'gbdt', 'learning_rate': 0.014747299441687262, 'num_leaves': 63, 'max_depth': 10, 'min_data_in_leaf': 84, 'feature_fraction': 0.613622842791896, 'lambda_l1': 1.5297343530608576, 'lambda_l2': 4.8731399542972, 'min_gain_to_split': 3.9589634043812434, 'max_bin': 71, 'bagging_fraction': 0.6438490096327253, 'bagging_freq': 1}. Best is trial 1 with value: 0.8512929634732052.
Training until validation scores don't improve for 30 rounds
[50]	valid_0's multi_error: 0.179078	valid_0's multi_logloss: 0.979989
[100]	valid_0's multi_error: 0.174446	valid_0's multi_logloss: 0.884793
[150]	valid_0's multi_error: 0.17323	valid_0's multi_logloss: 0.808095
[200]	valid_0's multi_error: 0.169608	valid_0's multi_logloss: 0.744948
[250]	valid_0's multi_error: 0.167331	valid_0's multi_logloss: 0.691684
[300]	valid_0's multi_error: 0.165778	valid_0's multi_logloss: 0.647159
[350]	valid_0's multi_error: 0.16376	valid_0's multi_logloss: 0.609252
[400]	valid_0's multi_error: 0.162751	valid_0's multi_logloss: 0.577535
[450]	valid_0's multi_error: 0.160992	valid_0's multi_logloss: 0.550233
[500]	valid_0's multi_error: 0.159724	valid_0's multi_logloss: 0.526568
[550]	valid_0's multi_error: 0.158611	valid_0's multi_logloss: 0.505878
[600]	valid_0's multi_error: 0.157524	valid_0's multi_logloss: 0.487823
[650]	valid_0's multi_error: 0.156153	valid_0's multi_logloss: 0.472056
[700]	valid_0's multi_error: 0.155454	valid_0's multi_logloss: 0.457969
[750]	valid_0's multi_error: 0.154238	valid_0's multi_logloss: 0.44559
[800]	valid_0's multi_error: 0.153203	valid_0's multi_logloss: 0.434496
[850]	valid_0's multi_error: 0.152349	valid_0's multi_logloss: 0.424559
[900]	valid_0's multi_error: 0.15103	valid_0's multi_logloss: 0.415688
[950]	valid_0's multi_error: 0.149633	valid_0's multi_logloss: 0.407591
[1000]	valid_0's multi_error: 0.148908	valid_0's multi_logloss: 0.400272
Did not meet early stopping. Best iteration is:
[1000]	valid_0's multi_error: 0.148908	valid_0's multi_logloss: 0.400272
Training until validation scores don't improve for 30 rounds
[50]	valid_0's multi_error: 0.177732	valid_0's multi_logloss: 0.980393
[100]	valid_0's multi_error: 0.174576	valid_0's multi_logloss: 0.885394
[150]	valid_0's multi_error: 0.171704	valid_0's multi_logloss: 0.808798
[200]	valid_0's multi_error: 0.169763	valid_0's multi_logloss: 0.745119
[250]	valid_0's multi_error: 0.168159	valid_0's multi_logloss: 0.69172
[300]	valid_0's multi_error: 0.166373	valid_0's multi_logloss: 0.64709
[350]	valid_0's multi_error: 0.164278	valid_0's multi_logloss: 0.609167
[400]	valid_0's multi_error: 0.163424	valid_0's multi_logloss: 0.577031
[450]	valid_0's multi_error: 0.162233	valid_0's multi_logloss: 0.549629
[500]	valid_0's multi_error: 0.160189	valid_0's multi_logloss: 0.525987
[550]	valid_0's multi_error: 0.158508	valid_0's multi_logloss: 0.505422
[600]	valid_0's multi_error: 0.156903	valid_0's multi_logloss: 0.48739
[650]	valid_0's multi_error: 0.155635	valid_0's multi_logloss: 0.471627
[700]	valid_0's multi_error: 0.154782	valid_0's multi_logloss: 0.457647
[750]	valid_0's multi_error: 0.153566	valid_0's multi_logloss: 0.445354
[800]	valid_0's multi_error: 0.152608	valid_0's multi_logloss: 0.434248
[850]	valid_0's multi_error: 0.151703	valid_0's multi_logloss: 0.424353
[900]	valid_0's multi_error: 0.150849	valid_0's multi_logloss: 0.415546
[950]	valid_0's multi_error: 0.149529	valid_0's multi_logloss: 0.407483
[1000]	valid_0's multi_error: 0.148468	valid_0's multi_logloss: 0.40025
Did not meet early stopping. Best iteration is:
[999]	valid_0's multi_error: 0.148468	valid_0's multi_logloss: 0.400392
Training until validation scores don't improve for 30 rounds
[50]	valid_0's multi_error: 0.180346	valid_0's multi_logloss: 0.980244
[100]	valid_0's multi_error: 0.177422	valid_0's multi_logloss: 0.885436
[150]	valid_0's multi_error: 0.175533	valid_0's multi_logloss: 0.809299
[200]	valid_0's multi_error: 0.172946	valid_0's multi_logloss: 0.746028
[250]	valid_0's multi_error: 0.171419	valid_0's multi_logloss: 0.693047
[300]	valid_0's multi_error: 0.168443	valid_0's multi_logloss: 0.64887
[350]	valid_0's multi_error: 0.16671	valid_0's multi_logloss: 0.611408
[400]	valid_0's multi_error: 0.165494	valid_0's multi_logloss: 0.579681
[450]	valid_0's multi_error: 0.163527	valid_0's multi_logloss: 0.552668
[500]	valid_0's multi_error: 0.162001	valid_0's multi_logloss: 0.529268
[550]	valid_0's multi_error: 0.160629	valid_0's multi_logloss: 0.508886
[600]	valid_0's multi_error: 0.159491	valid_0's multi_logloss: 0.491057
[650]	valid_0's multi_error: 0.158378	valid_0's multi_logloss: 0.475461
[700]	valid_0's multi_error: 0.15724	valid_0's multi_logloss: 0.461545
[750]	valid_0's multi_error: 0.156438	valid_0's multi_logloss: 0.449338
[800]	valid_0's multi_error: 0.155791	valid_0's multi_logloss: 0.438347
[850]	valid_0's multi_error: 0.154445	valid_0's multi_logloss: 0.428545
[900]	valid_0's multi_error: 0.153384	valid_0's multi_logloss: 0.419779
[950]	valid_0's multi_error: 0.152945	valid_0's multi_logloss: 0.411839
[1000]	valid_0's multi_error: 0.152505	valid_0's multi_logloss: 0.404665
Did not meet early stopping. Best iteration is:
[1000]	valid_0's multi_error: 0.152505	valid_0's multi_logloss: 0.404665
[I 2025-06-11 23:51:53,377] Trial 2 finished with value: 0.8459507498673958 and parameters: {'boosting_type': 'goss', 'learning_rate': 0.0023134673459363005, 'num_leaves': 50, 'max_depth': 14, 'min_data_in_leaf': 55, 'feature_fraction': 0.9615577543489983, 'lambda_l1': 0.10725958832539906, 'lambda_l2': 2.485478964055756, 'min_gain_to_split': 3.8770566413302725, 'max_bin': 224}. Best is trial 1 with value: 0.8512929634732052.
Training until validation scores don't improve for 30 rounds
[50]	valid_0's multi_error: 0.177474	valid_0's multi_logloss: 0.995856
[100]	valid_0's multi_error: 0.173567	valid_0's multi_logloss: 0.910784
Early stopping, best iteration is:
[90]	valid_0's multi_error: 0.173023	valid_0's multi_logloss: 0.926717
Training until validation scores don't improve for 30 rounds
[50]	valid_0's multi_error: 0.177474	valid_0's multi_logloss: 0.995872
[100]	valid_0's multi_error: 0.174472	valid_0's multi_logloss: 0.910598
[150]	valid_0's multi_error: 0.172454	valid_0's multi_logloss: 0.84043
[200]	valid_0's multi_error: 0.1716	valid_0's multi_logloss: 0.7807
[250]	valid_0's multi_error: 0.170901	valid_0's multi_logloss: 0.729641
[300]	valid_0's multi_error: 0.169323	valid_0's multi_logloss: 0.687745
[350]	valid_0's multi_error: 0.168159	valid_0's multi_logloss: 0.651461
[400]	valid_0's multi_error: 0.166684	valid_0's multi_logloss: 0.619534
[450]	valid_0's multi_error: 0.166089	valid_0's multi_logloss: 0.591824
[500]	valid_0's multi_error: 0.165442	valid_0's multi_logloss: 0.567513
[550]	valid_0's multi_error: 0.16464	valid_0's multi_logloss: 0.546511
[600]	valid_0's multi_error: 0.163605	valid_0's multi_logloss: 0.527925
[650]	valid_0's multi_error: 0.16288	valid_0's multi_logloss: 0.512046
[700]	valid_0's multi_error: 0.161819	valid_0's multi_logloss: 0.49762
[750]	valid_0's multi_error: 0.161199	valid_0's multi_logloss: 0.4849
[800]	valid_0's multi_error: 0.160629	valid_0's multi_logloss: 0.473526
[850]	valid_0's multi_error: 0.159982	valid_0's multi_logloss: 0.463277
[900]	valid_0's multi_error: 0.159232	valid_0's multi_logloss: 0.454178
[950]	valid_0's multi_error: 0.158508	valid_0's multi_logloss: 0.445881
[1000]	valid_0's multi_error: 0.157628	valid_0's multi_logloss: 0.438408
Did not meet early stopping. Best iteration is:
[996]	valid_0's multi_error: 0.157628	valid_0's multi_logloss: 0.438957
Training until validation scores don't improve for 30 rounds
[50]	valid_0's multi_error: 0.177655	valid_0's multi_logloss: 0.995708
[100]	valid_0's multi_error: 0.176904	valid_0's multi_logloss: 0.910752
[150]	valid_0's multi_error: 0.175171	valid_0's multi_logloss: 0.840692
[200]	valid_0's multi_error: 0.174265	valid_0's multi_logloss: 0.781105
[250]	valid_0's multi_error: 0.173644	valid_0's multi_logloss: 0.730225
[300]	valid_0's multi_error: 0.172842	valid_0's multi_logloss: 0.688567
[350]	valid_0's multi_error: 0.172247	valid_0's multi_logloss: 0.652637
[400]	valid_0's multi_error: 0.170927	valid_0's multi_logloss: 0.6209
[450]	valid_0's multi_error: 0.169401	valid_0's multi_logloss: 0.593499
[500]	valid_0's multi_error: 0.168599	valid_0's multi_logloss: 0.569573
[550]	valid_0's multi_error: 0.16746	valid_0's multi_logloss: 0.549012
Early stopping, best iteration is:
[558]	valid_0's multi_error: 0.167279	valid_0's multi_logloss: 0.545932
[I 2025-06-11 23:55:09,408] Trial 3 finished with value: 0.8289723870151828 and parameters: {'boosting_type': 'gbdt', 'learning_rate': 0.00216746901898487, 'num_leaves': 124, 'max_depth': 7, 'min_data_in_leaf': 56, 'feature_fraction': 0.8153651348992526, 'lambda_l1': 4.787128219810689, 'lambda_l2': 1.1657336376449823, 'min_gain_to_split': 3.9750820391659785, 'max_bin': 181, 'bagging_fraction': 0.6887230254609746, 'bagging_freq': 2}. Best is trial 1 with value: 0.8512929634732052.
Training until validation scores don't improve for 30 rounds
[50]	valid_0's multi_error: 0.143837	valid_0's multi_logloss: 0.34718
Early stopping, best iteration is:
[49]	valid_0's multi_error: 0.143837	valid_0's multi_logloss: 0.347273
Training until validation scores don't improve for 30 rounds
[50]	valid_0's multi_error: 0.143552	valid_0's multi_logloss: 0.346399
Early stopping, best iteration is:
[44]	valid_0's multi_error: 0.1435	valid_0's multi_logloss: 0.346556
Training until validation scores don't improve for 30 rounds
[50]	valid_0's multi_error: 0.14808	valid_0's multi_logloss: 0.352924
[I 2025-06-11 23:55:21,668] Trial 4 finished with value: 0.851222351447044 and parameters: {'boosting_type': 'gbdt', 'learning_rate': 0.2258502723347076, 'num_leaves': 102, 'max_depth': 11, 'min_data_in_leaf': 34, 'feature_fraction': 0.7691345235803505, 'lambda_l1': 3.3125715802678357, 'lambda_l2': 3.1162437541343784, 'min_gain_to_split': 4.8211478406411326, 'max_bin': 91, 'bagging_fraction': 0.7635913696620564, 'bagging_freq': 6}. Best is trial 1 with value: 0.8512929634732052.
Early stopping, best iteration is:
[46]	valid_0's multi_error: 0.14808	valid_0's multi_logloss: 0.352974
Training until validation scores don't improve for 30 rounds
[50]	valid_0's multi_error: 0.140602	valid_0's multi_logloss: 0.385041
[100]	valid_0's multi_error: 0.130589	valid_0's multi_logloss: 0.318776
[150]	valid_0's multi_error: 0.125052	valid_0's multi_logloss: 0.296559
[200]	valid_0's multi_error: 0.12011	valid_0's multi_logloss: 0.283728
[250]	valid_0's multi_error: 0.116694	valid_0's multi_logloss: 0.275158
[300]	valid_0's multi_error: 0.114676	valid_0's multi_logloss: 0.269543
[350]	valid_0's multi_error: 0.112994	valid_0's multi_logloss: 0.265089
[400]	valid_0's multi_error: 0.111726	valid_0's multi_logloss: 0.261704
[450]	valid_0's multi_error: 0.110303	valid_0's multi_logloss: 0.258982
Early stopping, best iteration is:
[448]	valid_0's multi_error: 0.110148	valid_0's multi_logloss: 0.259095
Training until validation scores don't improve for 30 rounds
[50]	valid_0's multi_error: 0.141197	valid_0's multi_logloss: 0.384847
[100]	valid_0's multi_error: 0.130925	valid_0's multi_logloss: 0.319802
[150]	valid_0's multi_error: 0.123784	valid_0's multi_logloss: 0.297071
[200]	valid_0's multi_error: 0.121196	valid_0's multi_logloss: 0.285639
[250]	valid_0's multi_error: 0.117884	valid_0's multi_logloss: 0.277763
[300]	valid_0's multi_error: 0.115297	valid_0's multi_logloss: 0.271775
[350]	valid_0's multi_error: 0.114805	valid_0's multi_logloss: 0.267691
[400]	valid_0's multi_error: 0.113408	valid_0's multi_logloss: 0.26449
[450]	valid_0's multi_error: 0.112399	valid_0's multi_logloss: 0.262495
[500]	valid_0's multi_error: 0.112063	valid_0's multi_logloss: 0.260924
Early stopping, best iteration is:
[486]	valid_0's multi_error: 0.111571	valid_0's multi_logloss: 0.261237
Training until validation scores don't improve for 30 rounds
[50]	valid_0's multi_error: 0.143914	valid_0's multi_logloss: 0.387932
[100]	valid_0's multi_error: 0.134211	valid_0's multi_logloss: 0.323015
[150]	valid_0's multi_error: 0.12839	valid_0's multi_logloss: 0.300481
[200]	valid_0's multi_error: 0.124301	valid_0's multi_logloss: 0.288026
[250]	valid_0's multi_error: 0.120912	valid_0's multi_logloss: 0.279893
[300]	valid_0's multi_error: 0.11923	valid_0's multi_logloss: 0.274418
[350]	valid_0's multi_error: 0.117833	valid_0's multi_logloss: 0.270353
[400]	valid_0's multi_error: 0.115763	valid_0's multi_logloss: 0.267139
[450]	valid_0's multi_error: 0.11465	valid_0's multi_logloss: 0.26473
Early stopping, best iteration is:
[442]	valid_0's multi_error: 0.114521	valid_0's multi_logloss: 0.265153
[I 2025-06-11 23:59:43,631] Trial 5 finished with value: 0.8858973092547489 and parameters: {'boosting_type': 'goss', 'learning_rate': 0.05166799228161234, 'num_leaves': 105, 'max_depth': 10, 'min_data_in_leaf': 63, 'feature_fraction': 0.649424396233275, 'lambda_l1': 0.4390916099079334, 'lambda_l2': 2.775915652514187, 'min_gain_to_split': 0.590393685857929, 'max_bin': 161}. Best is trial 5 with value: 0.8858973092547489.
Training until validation scores don't improve for 30 rounds
[50]	valid_0's multi_error: 0.125673	valid_0's multi_logloss: 0.299512
[100]	valid_0's multi_error: 0.12161	valid_0's multi_logloss: 0.286893
[150]	valid_0's multi_error: 0.120705	valid_0's multi_logloss: 0.28446
Early stopping, best iteration is:
[151]	valid_0's multi_error: 0.120653	valid_0's multi_logloss: 0.284457
Training until validation scores don't improve for 30 rounds
[50]	valid_0's multi_error: 0.127018	valid_0's multi_logloss: 0.29945
[100]	valid_0's multi_error: 0.12368	valid_0's multi_logloss: 0.289273
[150]	valid_0's multi_error: 0.121921	valid_0's multi_logloss: 0.286793
Early stopping, best iteration is:
[138]	valid_0's multi_error: 0.121843	valid_0's multi_logloss: 0.286783
Training until validation scores don't improve for 30 rounds
[50]	valid_0's multi_error: 0.128933	valid_0's multi_logloss: 0.302654
[100]	valid_0's multi_error: 0.125155	valid_0's multi_logloss: 0.290821
[150]	valid_0's multi_error: 0.123836	valid_0's multi_logloss: 0.288672
Early stopping, best iteration is:
[142]	valid_0's multi_error: 0.12381	valid_0's multi_logloss: 0.288715
