[I 2025-06-12 05:08:16,536] Trial 96 finished with value: 0.8884435977382522 and parameters: {'boosting_type': 'goss', 'learning_rate': 0.050387039469324116, 'num_leaves': 67, 'max_depth': 13, 'min_data_in_leaf': 29, 'feature_fraction': 0.6241716977709229, 'lambda_l1': 0.023772487982131246, 'lambda_l2': 4.378625030912964, 'min_gain_to_split': 0.14090269084232804, 'max_bin': 98}. Best is trial 94 with value: 0.8896529108188087.
Training until validation scores don't improve for 30 rounds
[50]	valid_0's multi_error: 0.155144	valid_0's multi_logloss: 0.588376
[100]	valid_0's multi_error: 0.146036	valid_0's multi_logloss: 0.440076
[150]	valid_0's multi_error: 0.139128	valid_0's multi_logloss: 0.377945
[200]	valid_0's multi_error: 0.134962	valid_0's multi_logloss: 0.345164
[250]	valid_0's multi_error: 0.13152	valid_0's multi_logloss: 0.323953
[300]	valid_0's multi_error: 0.127924	valid_0's multi_logloss: 0.311061
[350]	valid_0's multi_error: 0.125517	valid_0's multi_logloss: 0.301521
[400]	valid_0's multi_error: 0.122904	valid_0's multi_logloss: 0.294377
[450]	valid_0's multi_error: 0.121171	valid_0's multi_logloss: 0.288415
[500]	valid_0's multi_error: 0.119075	valid_0's multi_logloss: 0.283676
[550]	valid_0's multi_error: 0.117755	valid_0's multi_logloss: 0.279924
[600]	valid_0's multi_error: 0.117005	valid_0's multi_logloss: 0.27655
[650]	valid_0's multi_error: 0.115633	valid_0's multi_logloss: 0.273583
[700]	valid_0's multi_error: 0.114598	valid_0's multi_logloss: 0.270948
[750]	valid_0's multi_error: 0.11346	valid_0's multi_logloss: 0.268824
[800]	valid_0's multi_error: 0.112917	valid_0's multi_logloss: 0.26672
[850]	valid_0's multi_error: 0.112813	valid_0's multi_logloss: 0.264768
Early stopping, best iteration is:
[841]	valid_0's multi_error: 0.112399	valid_0's multi_logloss: 0.265093
Training until validation scores don't improve for 30 rounds
[50]	valid_0's multi_error: 0.154368	valid_0's multi_logloss: 0.587655
[100]	valid_0's multi_error: 0.146269	valid_0's multi_logloss: 0.439981
[150]	valid_0's multi_error: 0.140033	valid_0's multi_logloss: 0.378319
[200]	valid_0's multi_error: 0.135609	valid_0's multi_logloss: 0.345798
[250]	valid_0's multi_error: 0.131339	valid_0's multi_logloss: 0.325641
[300]	valid_0's multi_error: 0.128208	valid_0's multi_logloss: 0.312959
[350]	valid_0's multi_error: 0.12619	valid_0's multi_logloss: 0.303508
[400]	valid_0's multi_error: 0.124586	valid_0's multi_logloss: 0.296583
[450]	valid_0's multi_error: 0.121792	valid_0's multi_logloss: 0.290806
[500]	valid_0's multi_error: 0.120808	valid_0's multi_logloss: 0.286383
[550]	valid_0's multi_error: 0.119825	valid_0's multi_logloss: 0.282563
[600]	valid_0's multi_error: 0.118868	valid_0's multi_logloss: 0.279135
[650]	valid_0's multi_error: 0.117548	valid_0's multi_logloss: 0.276432
[700]	valid_0's multi_error: 0.116487	valid_0's multi_logloss: 0.273829
[750]	valid_0's multi_error: 0.115608	valid_0's multi_logloss: 0.27168
Early stopping, best iteration is:
[766]	valid_0's multi_error: 0.115064	valid_0's multi_logloss: 0.271083
Training until validation scores don't improve for 30 rounds
[50]	valid_0's multi_error: 0.157628	valid_0's multi_logloss: 0.590475
[100]	valid_0's multi_error: 0.149374	valid_0's multi_logloss: 0.443792
[150]	valid_0's multi_error: 0.143863	valid_0's multi_logloss: 0.382842
[200]	valid_0's multi_error: 0.139593	valid_0's multi_logloss: 0.350356
[250]	valid_0's multi_error: 0.135634	valid_0's multi_logloss: 0.329398
[300]	valid_0's multi_error: 0.131805	valid_0's multi_logloss: 0.316549
[350]	valid_0's multi_error: 0.12945	valid_0's multi_logloss: 0.306859
[400]	valid_0's multi_error: 0.127044	valid_0's multi_logloss: 0.299792
[450]	valid_0's multi_error: 0.125233	valid_0's multi_logloss: 0.293983
[500]	valid_0's multi_error: 0.123034	valid_0's multi_logloss: 0.289103
[550]	valid_0's multi_error: 0.121688	valid_0's multi_logloss: 0.285195
[600]	valid_0's multi_error: 0.120446	valid_0's multi_logloss: 0.281904
[650]	valid_0's multi_error: 0.11967	valid_0's multi_logloss: 0.279018
[700]	valid_0's multi_error: 0.118712	valid_0's multi_logloss: 0.276332
[750]	valid_0's multi_error: 0.117884	valid_0's multi_logloss: 0.274089
[800]	valid_0's multi_error: 0.117445	valid_0's multi_logloss: 0.272059
[850]	valid_0's multi_error: 0.116591	valid_0's multi_logloss: 0.270151
[900]	valid_0's multi_error: 0.115737	valid_0's multi_logloss: 0.26852
[950]	valid_0's multi_error: 0.115038	valid_0's multi_logloss: 0.267051
[1000]	valid_0's multi_error: 0.113977	valid_0's multi_logloss: 0.265603
Did not meet early stopping. Best iteration is:
[998]	valid_0's multi_error: 0.113926	valid_0's multi_logloss: 0.265638
[I 2025-06-12 05:14:42,918] Trial 97 finished with value: 0.8840696568507708 and parameters: {'boosting_type': 'goss', 'learning_rate': 0.019239995920842506, 'num_leaves': 69, 'max_depth': 13, 'min_data_in_leaf': 29, 'feature_fraction': 0.6219997220605464, 'lambda_l1': 0.17500782797374903, 'lambda_l2': 4.375372031234584, 'min_gain_to_split': 0.3655061876893988, 'max_bin': 71}. Best is trial 94 with value: 0.8896529108188087.
Training until validation scores don't improve for 30 rounds
[50]	valid_0's multi_error: 0.143397	valid_0's multi_logloss: 0.40325
[100]	valid_0's multi_error: 0.133409	valid_0's multi_logloss: 0.326943
[150]	valid_0's multi_error: 0.125854	valid_0's multi_logloss: 0.300619
[200]	valid_0's multi_error: 0.121196	valid_0's multi_logloss: 0.286433
[250]	valid_0's multi_error: 0.11848	valid_0's multi_logloss: 0.277032
[300]	valid_0's multi_error: 0.115944	valid_0's multi_logloss: 0.27055
[350]	valid_0's multi_error: 0.113615	valid_0's multi_logloss: 0.265431
[400]	valid_0's multi_error: 0.111882	valid_0's multi_logloss: 0.261802
[450]	valid_0's multi_error: 0.111261	valid_0's multi_logloss: 0.258968
Early stopping, best iteration is:
[435]	valid_0's multi_error: 0.110821	valid_0's multi_logloss: 0.259741
Training until validation scores don't improve for 30 rounds
[50]	valid_0's multi_error: 0.145234	valid_0's multi_logloss: 0.403421
[100]	valid_0's multi_error: 0.132478	valid_0's multi_logloss: 0.327315
[150]	valid_0's multi_error: 0.125466	valid_0's multi_logloss: 0.30212
[200]	valid_0's multi_error: 0.121378	valid_0's multi_logloss: 0.288753
[250]	valid_0's multi_error: 0.118454	valid_0's multi_logloss: 0.279976
[300]	valid_0's multi_error: 0.116591	valid_0's multi_logloss: 0.273692
[350]	valid_0's multi_error: 0.114391	valid_0's multi_logloss: 0.268653
Early stopping, best iteration is:
[361]	valid_0's multi_error: 0.113796	valid_0's multi_logloss: 0.267835
Training until validation scores don't improve for 30 rounds
[50]	valid_0's multi_error: 0.147459	valid_0's multi_logloss: 0.40729
[100]	valid_0's multi_error: 0.137135	valid_0's multi_logloss: 0.331371
[150]	valid_0's multi_error: 0.129554	valid_0's multi_logloss: 0.304363
[200]	valid_0's multi_error: 0.123862	valid_0's multi_logloss: 0.290565
[250]	valid_0's multi_error: 0.121403	valid_0's multi_logloss: 0.282044
[300]	valid_0's multi_error: 0.11967	valid_0's multi_logloss: 0.27614
[350]	valid_0's multi_error: 0.117341	valid_0's multi_logloss: 0.271494
[400]	valid_0's multi_error: 0.115737	valid_0's multi_logloss: 0.267702
[450]	valid_0's multi_error: 0.115271	valid_0's multi_logloss: 0.265244
[500]	valid_0's multi_error: 0.114391	valid_0's multi_logloss: 0.263032
[550]	valid_0's multi_error: 0.113201	valid_0's multi_logloss: 0.26141
[600]	valid_0's multi_error: 0.112347	valid_0's multi_logloss: 0.259974
Early stopping, best iteration is:
[589]	valid_0's multi_error: 0.111985	valid_0's multi_logloss: 0.260187
[I 2025-06-12 05:18:10,408] Trial 98 finished with value: 0.8857906487644316 and parameters: {'boosting_type': 'goss', 'learning_rate': 0.04890846657350468, 'num_leaves': 66, 'max_depth': 13, 'min_data_in_leaf': 34, 'feature_fraction': 0.6074478570633021, 'lambda_l1': 0.012186072031596551, 'lambda_l2': 4.233825634237428, 'min_gain_to_split': 0.156523659010966, 'max_bin': 83}. Best is trial 94 with value: 0.8896529108188087.
Training until validation scores don't improve for 30 rounds
[50]	valid_0's multi_error: 0.148727	valid_0's multi_logloss: 0.485619
[100]	valid_0's multi_error: 0.139697	valid_0's multi_logloss: 0.370963
[150]	valid_0's multi_error: 0.132141	valid_0's multi_logloss: 0.329256
[200]	valid_0's multi_error: 0.127251	valid_0's multi_logloss: 0.307739
[250]	valid_0's multi_error: 0.122982	valid_0's multi_logloss: 0.294404
[300]	valid_0's multi_error: 0.119877	valid_0's multi_logloss: 0.285837
[350]	valid_0's multi_error: 0.117703	valid_0's multi_logloss: 0.279414
[400]	valid_0's multi_error: 0.115659	valid_0's multi_logloss: 0.274583
[450]	valid_0's multi_error: 0.114081	valid_0's multi_logloss: 0.270374
[500]	valid_0's multi_error: 0.112813	valid_0's multi_logloss: 0.266959
[550]	valid_0's multi_error: 0.111856	valid_0's multi_logloss: 0.264253
Early stopping, best iteration is:
[545]	valid_0's multi_error: 0.111597	valid_0's multi_logloss: 0.264501
Training until validation scores don't improve for 30 rounds
[50]	valid_0's multi_error: 0.14927	valid_0's multi_logloss: 0.485363
[100]	valid_0's multi_error: 0.139645	valid_0's multi_logloss: 0.370315
[150]	valid_0's multi_error: 0.132788	valid_0's multi_logloss: 0.329968
[200]	valid_0's multi_error: 0.127924	valid_0's multi_logloss: 0.309405
[250]	valid_0's multi_error: 0.124508	valid_0's multi_logloss: 0.29661
[300]	valid_0's multi_error: 0.121817	valid_0's multi_logloss: 0.288303
[350]	valid_0's multi_error: 0.119903	valid_0's multi_logloss: 0.282147
[400]	valid_0's multi_error: 0.118661	valid_0's multi_logloss: 0.277146
[450]	valid_0's multi_error: 0.117031	valid_0's multi_logloss: 0.273195
[500]	valid_0's multi_error: 0.116177	valid_0's multi_logloss: 0.269981
[550]	valid_0's multi_error: 0.115375	valid_0's multi_logloss: 0.267464
[600]	valid_0's multi_error: 0.114288	valid_0's multi_logloss: 0.265021
[650]	valid_0's multi_error: 0.113667	valid_0's multi_logloss: 0.263158
[700]	valid_0's multi_error: 0.113253	valid_0's multi_logloss: 0.261287
[750]	valid_0's multi_error: 0.11214	valid_0's multi_logloss: 0.259863
[800]	valid_0's multi_error: 0.112166	valid_0's multi_logloss: 0.258567
Early stopping, best iteration is:
[776]	valid_0's multi_error: 0.111752	valid_0's multi_logloss: 0.259217
Training until validation scores don't improve for 30 rounds
[50]	valid_0's multi_error: 0.15191	valid_0's multi_logloss: 0.488355
[100]	valid_0's multi_error: 0.143578	valid_0's multi_logloss: 0.374336
[150]	valid_0's multi_error: 0.137109	valid_0's multi_logloss: 0.333409
[200]	valid_0's multi_error: 0.131236	valid_0's multi_logloss: 0.312086
[250]	valid_0's multi_error: 0.127355	valid_0's multi_logloss: 0.298699
[300]	valid_0's multi_error: 0.123422	valid_0's multi_logloss: 0.290217
[350]	valid_0's multi_error: 0.120653	valid_0's multi_logloss: 0.283879
[400]	valid_0's multi_error: 0.119152	valid_0's multi_logloss: 0.278977
[450]	valid_0's multi_error: 0.1176	valid_0's multi_logloss: 0.274917
[500]	valid_0's multi_error: 0.116229	valid_0's multi_logloss: 0.27154
[550]	valid_0's multi_error: 0.115918	valid_0's multi_logloss: 0.269223
[600]	valid_0's multi_error: 0.11509	valid_0's multi_logloss: 0.26696
[650]	valid_0's multi_error: 0.113719	valid_0's multi_logloss: 0.264787
[700]	valid_0's multi_error: 0.113356	valid_0's multi_logloss: 0.263094
Early stopping, best iteration is:
[693]	valid_0's multi_error: 0.112994	valid_0's multi_logloss: 0.263306
[I 2025-06-12 05:23:32,981] Trial 99 finished with value: 0.8858417567425647 and parameters: {'boosting_type': 'goss', 'learning_rate': 0.029128690647311706, 'num_leaves': 74, 'max_depth': 14, 'min_data_in_leaf': 36, 'feature_fraction': 0.674617095288127, 'lambda_l1': 0.24525671001810379, 'lambda_l2': 4.142527151501864, 'min_gain_to_split': 0.21287202131912888, 'max_bin': 75}. Best is trial 94 with value: 0.8896529108188087.
Training until validation scores don't improve for 30 rounds
[50]	valid_0's multi_error: 0.144561	valid_0's multi_logloss: 0.428283
[100]	valid_0's multi_error: 0.137497	valid_0's multi_logloss: 0.346568
[150]	valid_0's multi_error: 0.136048	valid_0's multi_logloss: 0.330868
[200]	valid_0's multi_error: 0.135867	valid_0's multi_logloss: 0.327153
Early stopping, best iteration is:
[170]	valid_0's multi_error: 0.13579	valid_0's multi_logloss: 0.328888
Training until validation scores don't improve for 30 rounds
[50]	valid_0's multi_error: 0.14645	valid_0's multi_logloss: 0.429458
[100]	valid_0's multi_error: 0.138351	valid_0's multi_logloss: 0.347029
[150]	valid_0's multi_error: 0.136825	valid_0's multi_logloss: 0.331582
[200]	valid_0's multi_error: 0.136462	valid_0's multi_logloss: 0.327661
[250]	valid_0's multi_error: 0.136074	valid_0's multi_logloss: 0.326336
Early stopping, best iteration is:
[260]	valid_0's multi_error: 0.135945	valid_0's multi_logloss: 0.326242
Training until validation scores don't improve for 30 rounds
[50]	valid_0's multi_error: 0.149374	valid_0's multi_logloss: 0.433581
[100]	valid_0's multi_error: 0.143009	valid_0's multi_logloss: 0.351969
[150]	valid_0's multi_error: 0.141404	valid_0's multi_logloss: 0.336572
Early stopping, best iteration is:
[158]	valid_0's multi_error: 0.141094	valid_0's multi_logloss: 0.335247
[I 2025-06-12 05:24:27,095] Trial 100 finished with value: 0.8590840733563144 and parameters: {'boosting_type': 'gbdt', 'learning_rate': 0.03857590938653433, 'num_leaves': 80, 'max_depth': 12, 'min_data_in_leaf': 27, 'feature_fraction': 0.7015601651327142, 'lambda_l1': 0.3721672482106804, 'lambda_l2': 4.0777561128391575, 'min_gain_to_split': 3.409221156726951, 'max_bin': 93, 'bagging_fraction': 0.8125636093795701, 'bagging_freq': 6}. Best is trial 94 with value: 0.8896529108188087.
Training until validation scores don't improve for 30 rounds
[50]	valid_0's multi_error: 0.141741	valid_0's multi_logloss: 0.362045
[100]	valid_0's multi_error: 0.131055	valid_0's multi_logloss: 0.311671
[150]	valid_0's multi_error: 0.123137	valid_0's multi_logloss: 0.293077
[200]	valid_0's multi_error: 0.118273	valid_0's multi_logloss: 0.281519
[250]	valid_0's multi_error: 0.116047	valid_0's multi_logloss: 0.274191
[300]	valid_0's multi_error: 0.115194	valid_0's multi_logloss: 0.268976
[350]	valid_0's multi_error: 0.11258	valid_0's multi_logloss: 0.264688
[400]	valid_0's multi_error: 0.111571	valid_0's multi_logloss: 0.261284
[450]	valid_0's multi_error: 0.110614	valid_0's multi_logloss: 0.258704
[500]	valid_0's multi_error: 0.110407	valid_0's multi_logloss: 0.256805
Early stopping, best iteration is:
[470]	valid_0's multi_error: 0.109967	valid_0's multi_logloss: 0.257889
Training until validation scores don't improve for 30 rounds
[50]	valid_0's multi_error: 0.142258	valid_0's multi_logloss: 0.363313
[100]	valid_0's multi_error: 0.131676	valid_0's multi_logloss: 0.31379
[150]	valid_0's multi_error: 0.125569	valid_0's multi_logloss: 0.295642
[200]	valid_0's multi_error: 0.121196	valid_0's multi_logloss: 0.284414
[250]	valid_0's multi_error: 0.119359	valid_0's multi_logloss: 0.277381
[300]	valid_0's multi_error: 0.117108	valid_0's multi_logloss: 0.272249
[350]	valid_0's multi_error: 0.115271	valid_0's multi_logloss: 0.268001
[400]	valid_0's multi_error: 0.113926	valid_0's multi_logloss: 0.264894
[450]	valid_0's multi_error: 0.113305	valid_0's multi_logloss: 0.262633
Early stopping, best iteration is:
[420]	valid_0's multi_error: 0.113046	valid_0's multi_logloss: 0.263884
Training until validation scores don't improve for 30 rounds
[50]	valid_0's multi_error: 0.146424	valid_0's multi_logloss: 0.368346
[100]	valid_0's multi_error: 0.134781	valid_0's multi_logloss: 0.31744
[150]	valid_0's multi_error: 0.128959	valid_0's multi_logloss: 0.29932
[200]	valid_0's multi_error: 0.124767	valid_0's multi_logloss: 0.287996
[250]	valid_0's multi_error: 0.121429	valid_0's multi_logloss: 0.28085
[300]	valid_0's multi_error: 0.119308	valid_0's multi_logloss: 0.275683
[350]	valid_0's multi_error: 0.117548	valid_0's multi_logloss: 0.271556
[400]	valid_0's multi_error: 0.116254	valid_0's multi_logloss: 0.268374
[450]	valid_0's multi_error: 0.114883	valid_0's multi_logloss: 0.265623
Early stopping, best iteration is:
[469]	valid_0's multi_error: 0.114314	valid_0's multi_logloss: 0.264922
[I 2025-06-12 05:27:03,161] Trial 101 finished with value: 0.8855507822315896 and parameters: {'boosting_type': 'goss', 'learning_rate': 0.07551213522619799, 'num_leaves': 45, 'max_depth': 14, 'min_data_in_leaf': 30, 'feature_fraction': 0.6283047622417143, 'lambda_l1': 0.4779011801977908, 'lambda_l2': 4.711814931093755, 'min_gain_to_split': 0.14198366807215876, 'max_bin': 90}. Best is trial 94 with value: 0.8896529108188087.
Training until validation scores don't improve for 30 rounds
[50]	valid_0's multi_error: 0.132866	valid_0's multi_logloss: 0.319946
[100]	valid_0's multi_error: 0.121274	valid_0's multi_logloss: 0.287095
[150]	valid_0's multi_error: 0.117574	valid_0's multi_logloss: 0.273404
[200]	valid_0's multi_error: 0.114547	valid_0's multi_logloss: 0.265129
[250]	valid_0's multi_error: 0.112089	valid_0's multi_logloss: 0.260169
[300]	valid_0's multi_error: 0.111545	valid_0's multi_logloss: 0.257917
[350]	valid_0's multi_error: 0.110303	valid_0's multi_logloss: 0.256538
[400]	valid_0's multi_error: 0.109734	valid_0's multi_logloss: 0.255204
Early stopping, best iteration is:
[404]	valid_0's multi_error: 0.109527	valid_0's multi_logloss: 0.255209
Training until validation scores don't improve for 30 rounds
[50]	valid_0's multi_error: 0.133125	valid_0's multi_logloss: 0.319716
[100]	valid_0's multi_error: 0.122982	valid_0's multi_logloss: 0.288588
[150]	valid_0's multi_error: 0.117677	valid_0's multi_logloss: 0.275485
[200]	valid_0's multi_error: 0.114107	valid_0's multi_logloss: 0.268238
[250]	valid_0's multi_error: 0.113356	valid_0's multi_logloss: 0.263898
[300]	valid_0's multi_error: 0.112451	valid_0's multi_logloss: 0.261344
Early stopping, best iteration is:
[280]	valid_0's multi_error: 0.112192	valid_0's multi_logloss: 0.261799
Training until validation scores don't improve for 30 rounds
[50]	valid_0's multi_error: 0.137368	valid_0's multi_logloss: 0.324742
[100]	valid_0's multi_error: 0.126915	valid_0's multi_logloss: 0.292211
[150]	valid_0's multi_error: 0.120782	valid_0's multi_logloss: 0.278714
[200]	valid_0's multi_error: 0.11716	valid_0's multi_logloss: 0.271214
[250]	valid_0's multi_error: 0.115064	valid_0's multi_logloss: 0.26649
[300]	valid_0's multi_error: 0.113356	valid_0's multi_logloss: 0.263724
Early stopping, best iteration is:
[300]	valid_0's multi_error: 0.113356	valid_0's multi_logloss: 0.263724
[I 2025-06-12 05:29:17,985] Trial 102 finished with value: 0.886390369211104 and parameters: {'boosting_type': 'goss', 'learning_rate': 0.1141118374185696, 'num_leaves': 57, 'max_depth': 12, 'min_data_in_leaf': 25, 'feature_fraction': 0.6581510563310055, 'lambda_l1': 0.10199839927136067, 'lambda_l2': 4.4234761403031735, 'min_gain_to_split': 0.3056955174902191, 'max_bin': 80}. Best is trial 94 with value: 0.8896529108188087.
Training until validation scores don't improve for 30 rounds
[50]	valid_0's multi_error: 0.13403	valid_0's multi_logloss: 0.329037
[100]	valid_0's multi_error: 0.122645	valid_0's multi_logloss: 0.290561
[150]	valid_0's multi_error: 0.118091	valid_0's multi_logloss: 0.275954
[200]	valid_0's multi_error: 0.11465	valid_0's multi_logloss: 0.267169
[250]	valid_0's multi_error: 0.112063	valid_0's multi_logloss: 0.261738
[300]	valid_0's multi_error: 0.109967	valid_0's multi_logloss: 0.257699
[350]	valid_0's multi_error: 0.109268	valid_0's multi_logloss: 0.255554
[400]	valid_0's multi_error: 0.108466	valid_0's multi_logloss: 0.253501
[450]	valid_0's multi_error: 0.108363	valid_0's multi_logloss: 0.252118
Early stopping, best iteration is:
[434]	valid_0's multi_error: 0.107871	valid_0's multi_logloss: 0.252389
Training until validation scores don't improve for 30 rounds
[50]	valid_0's multi_error: 0.13447	valid_0's multi_logloss: 0.329731
[100]	valid_0's multi_error: 0.124198	valid_0's multi_logloss: 0.292166
[150]	valid_0's multi_error: 0.11804	valid_0's multi_logloss: 0.278019
[200]	valid_0's multi_error: 0.115478	valid_0's multi_logloss: 0.269691
[250]	valid_0's multi_error: 0.1139	valid_0's multi_logloss: 0.264425
[300]	valid_0's multi_error: 0.113175	valid_0's multi_logloss: 0.261166
Early stopping, best iteration is:
[280]	valid_0's multi_error: 0.11258	valid_0's multi_logloss: 0.262231
Training until validation scores don't improve for 30 rounds
[50]	valid_0's multi_error: 0.139153	valid_0's multi_logloss: 0.334895
[100]	valid_0's multi_error: 0.128829	valid_0's multi_logloss: 0.295941
[150]	valid_0's multi_error: 0.12262	valid_0's multi_logloss: 0.280731
[200]	valid_0's multi_error: 0.118583	valid_0's multi_logloss: 0.2724
[250]	valid_0's multi_error: 0.115944	valid_0's multi_logloss: 0.266525
[300]	valid_0's multi_error: 0.114754	valid_0's multi_logloss: 0.26352
[350]	valid_0's multi_error: 0.11346	valid_0's multi_logloss: 0.261648
[400]	valid_0's multi_error: 0.11271	valid_0's multi_logloss: 0.260108
[450]	valid_0's multi_error: 0.111778	valid_0's multi_logloss: 0.259219
[500]	valid_0's multi_error: 0.110898	valid_0's multi_logloss: 0.259099
Early stopping, best iteration is:
[504]	valid_0's multi_error: 0.110821	valid_0's multi_logloss: 0.259005
