[I 2025-06-12 06:37:20,192] Trial 121 finished with value: 0.8891861673655996 and parameters: {'boosting_type': 'goss', 'learning_rate': 0.04392909890262063, 'num_leaves': 146, 'max_depth': 12, 'min_data_in_leaf': 27, 'feature_fraction': 0.9295200852065383, 'lambda_l1': 0.3763118892475253, 'lambda_l2': 3.8313507459554317, 'min_gain_to_split': 0.24841850252189765, 'max_bin': 75}. Best is trial 108 with value: 0.8897424994899721.
Training until validation scores don't improve for 30 rounds
[50]	valid_0's multi_error: 0.134392	valid_0's multi_logloss: 0.366933
[100]	valid_0's multi_error: 0.123344	valid_0's multi_logloss: 0.298757
[150]	valid_0's multi_error: 0.116617	valid_0's multi_logloss: 0.276841
[200]	valid_0's multi_error: 0.114081	valid_0's multi_logloss: 0.266022
[250]	valid_0's multi_error: 0.112373	valid_0's multi_logloss: 0.259575
[300]	valid_0's multi_error: 0.111054	valid_0's multi_logloss: 0.255097
[350]	valid_0's multi_error: 0.11007	valid_0's multi_logloss: 0.252321
[400]	valid_0's multi_error: 0.108932	valid_0's multi_logloss: 0.249852
[450]	valid_0's multi_error: 0.108	valid_0's multi_logloss: 0.248705
Early stopping, best iteration is:
[444]	valid_0's multi_error: 0.107923	valid_0's multi_logloss: 0.248757
Training until validation scores don't improve for 30 rounds
[50]	valid_0's multi_error: 0.135945	valid_0's multi_logloss: 0.367474
[100]	valid_0's multi_error: 0.125103	valid_0's multi_logloss: 0.300238
[150]	valid_0's multi_error: 0.118066	valid_0's multi_logloss: 0.27923
[200]	valid_0's multi_error: 0.114495	valid_0's multi_logloss: 0.268356
[250]	valid_0's multi_error: 0.111468	valid_0's multi_logloss: 0.261805
[300]	valid_0's multi_error: 0.110045	valid_0's multi_logloss: 0.257335
Early stopping, best iteration is:
[296]	valid_0's multi_error: 0.10976	valid_0's multi_logloss: 0.257591
Training until validation scores don't improve for 30 rounds
[50]	valid_0's multi_error: 0.137834	valid_0's multi_logloss: 0.370603
[100]	valid_0's multi_error: 0.127432	valid_0's multi_logloss: 0.303554
[150]	valid_0's multi_error: 0.120239	valid_0's multi_logloss: 0.281464
[200]	valid_0's multi_error: 0.117005	valid_0's multi_logloss: 0.271059
[250]	valid_0's multi_error: 0.11434	valid_0's multi_logloss: 0.264999
[300]	valid_0's multi_error: 0.113046	valid_0's multi_logloss: 0.261049
[350]	valid_0's multi_error: 0.112218	valid_0's multi_logloss: 0.25837
[400]	valid_0's multi_error: 0.111209	valid_0's multi_logloss: 0.256434
[450]	valid_0's multi_error: 0.110329	valid_0's multi_logloss: 0.255643
[500]	valid_0's multi_error: 0.10976	valid_0's multi_logloss: 0.255219
Early stopping, best iteration is:
[504]	valid_0's multi_error: 0.109527	valid_0's multi_logloss: 0.255131
[I 2025-06-12 06:42:35,512] Trial 122 finished with value: 0.8889834330483565 and parameters: {'boosting_type': 'goss', 'learning_rate': 0.04691564702983988, 'num_leaves': 146, 'max_depth': 12, 'min_data_in_leaf': 25, 'feature_fraction': 0.9277775236012947, 'lambda_l1': 0.3812706949523782, 'lambda_l2': 3.8473721305885142, 'min_gain_to_split': 0.27372447620680757, 'max_bin': 69}. Best is trial 108 with value: 0.8897424994899721.
Training until validation scores don't improve for 30 rounds
[50]	valid_0's multi_error: 0.134832	valid_0's multi_logloss: 0.368524
[100]	valid_0's multi_error: 0.12381	valid_0's multi_logloss: 0.300331
[150]	valid_0's multi_error: 0.116461	valid_0's multi_logloss: 0.278634
[200]	valid_0's multi_error: 0.113796	valid_0's multi_logloss: 0.267221
[250]	valid_0's multi_error: 0.111985	valid_0's multi_logloss: 0.260726
[300]	valid_0's multi_error: 0.109993	valid_0's multi_logloss: 0.256207
[350]	valid_0's multi_error: 0.108777	valid_0's multi_logloss: 0.252843
[400]	valid_0's multi_error: 0.107845	valid_0's multi_logloss: 0.250213
Early stopping, best iteration is:
[382]	valid_0's multi_error: 0.107379	valid_0's multi_logloss: 0.250977
Training until validation scores don't improve for 30 rounds
[50]	valid_0's multi_error: 0.135583	valid_0's multi_logloss: 0.369384
[100]	valid_0's multi_error: 0.124224	valid_0's multi_logloss: 0.302263
[150]	valid_0's multi_error: 0.119463	valid_0's multi_logloss: 0.281755
[200]	valid_0's multi_error: 0.115815	valid_0's multi_logloss: 0.270843
[250]	valid_0's multi_error: 0.112865	valid_0's multi_logloss: 0.263738
[300]	valid_0's multi_error: 0.111157	valid_0's multi_logloss: 0.259089
[350]	valid_0's multi_error: 0.110355	valid_0's multi_logloss: 0.255739
[400]	valid_0's multi_error: 0.108777	valid_0's multi_logloss: 0.253519
[450]	valid_0's multi_error: 0.10844	valid_0's multi_logloss: 0.252049
[500]	valid_0's multi_error: 0.107276	valid_0's multi_logloss: 0.251203
Early stopping, best iteration is:
[500]	valid_0's multi_error: 0.107276	valid_0's multi_logloss: 0.251203
Training until validation scores don't improve for 30 rounds
[50]	valid_0's multi_error: 0.138714	valid_0's multi_logloss: 0.372935
[100]	valid_0's multi_error: 0.127639	valid_0's multi_logloss: 0.305693
[150]	valid_0's multi_error: 0.121378	valid_0's multi_logloss: 0.28363
[200]	valid_0's multi_error: 0.117031	valid_0's multi_logloss: 0.272377
[250]	valid_0's multi_error: 0.114883	valid_0's multi_logloss: 0.265357
[300]	valid_0's multi_error: 0.112865	valid_0's multi_logloss: 0.26069
[350]	valid_0's multi_error: 0.111442	valid_0's multi_logloss: 0.257613
[400]	valid_0's multi_error: 0.110847	valid_0's multi_logloss: 0.255596
Early stopping, best iteration is:
[381]	valid_0's multi_error: 0.110329	valid_0's multi_logloss: 0.256186
[I 2025-06-12 06:47:44,580] Trial 123 finished with value: 0.8897640185340112 and parameters: {'boosting_type': 'goss', 'learning_rate': 0.04672881646442934, 'num_leaves': 147, 'max_depth': 11, 'min_data_in_leaf': 23, 'feature_fraction': 0.9222540202827623, 'lambda_l1': 0.10096735360060147, 'lambda_l2': 3.8020260534971793, 'min_gain_to_split': 0.2623488473356867, 'max_bin': 69}. Best is trial 123 with value: 0.8897640185340112.
Training until validation scores don't improve for 30 rounds
[50]	valid_0's multi_error: 0.135609	valid_0's multi_logloss: 0.375317
[100]	valid_0's multi_error: 0.124146	valid_0's multi_logloss: 0.304418
[150]	valid_0's multi_error: 0.116694	valid_0's multi_logloss: 0.281363
[200]	valid_0's multi_error: 0.114159	valid_0's multi_logloss: 0.269499
[250]	valid_0's multi_error: 0.111726	valid_0's multi_logloss: 0.262044
[300]	valid_0's multi_error: 0.109812	valid_0's multi_logloss: 0.256976
[350]	valid_0's multi_error: 0.108673	valid_0's multi_logloss: 0.253449
[400]	valid_0's multi_error: 0.10725	valid_0's multi_logloss: 0.251025
[450]	valid_0's multi_error: 0.107017	valid_0's multi_logloss: 0.249462
[500]	valid_0's multi_error: 0.106137	valid_0's multi_logloss: 0.24795
[550]	valid_0's multi_error: 0.105801	valid_0's multi_logloss: 0.247275
Early stopping, best iteration is:
[552]	valid_0's multi_error: 0.105491	valid_0's multi_logloss: 0.247246
Training until validation scores don't improve for 30 rounds
[50]	valid_0's multi_error: 0.137109	valid_0's multi_logloss: 0.376353
[100]	valid_0's multi_error: 0.125466	valid_0's multi_logloss: 0.306188
[150]	valid_0's multi_error: 0.120291	valid_0's multi_logloss: 0.28379
[200]	valid_0's multi_error: 0.117264	valid_0's multi_logloss: 0.272205
[250]	valid_0's multi_error: 0.115168	valid_0's multi_logloss: 0.26536
[300]	valid_0's multi_error: 0.112528	valid_0's multi_logloss: 0.260451
[350]	valid_0's multi_error: 0.110795	valid_0's multi_logloss: 0.256883
[400]	valid_0's multi_error: 0.109087	valid_0's multi_logloss: 0.254097
[450]	valid_0's multi_error: 0.108285	valid_0's multi_logloss: 0.252775
Early stopping, best iteration is:
[461]	valid_0's multi_error: 0.107923	valid_0's multi_logloss: 0.25251
Training until validation scores don't improve for 30 rounds
[50]	valid_0's multi_error: 0.139283	valid_0's multi_logloss: 0.379227
[100]	valid_0's multi_error: 0.128855	valid_0's multi_logloss: 0.308855
[150]	valid_0's multi_error: 0.12249	valid_0's multi_logloss: 0.28594
[200]	valid_0's multi_error: 0.118221	valid_0's multi_logloss: 0.274555
[250]	valid_0's multi_error: 0.115659	valid_0's multi_logloss: 0.267821
[300]	valid_0's multi_error: 0.114003	valid_0's multi_logloss: 0.262756
[350]	valid_0's multi_error: 0.112037	valid_0's multi_logloss: 0.259271
[400]	valid_0's multi_error: 0.111286	valid_0's multi_logloss: 0.257022
[450]	valid_0's multi_error: 0.110769	valid_0's multi_logloss: 0.255397
[500]	valid_0's multi_error: 0.109734	valid_0's multi_logloss: 0.254444
Early stopping, best iteration is:
[516]	valid_0's multi_error: 0.109294	valid_0's multi_logloss: 0.254268
[I 2025-06-12 06:53:47,536] Trial 124 finished with value: 0.8905374485574505 and parameters: {'boosting_type': 'goss', 'learning_rate': 0.04474129281683845, 'num_leaves': 147, 'max_depth': 11, 'min_data_in_leaf': 25, 'feature_fraction': 0.9224947202451048, 'lambda_l1': 0.12016752008161158, 'lambda_l2': 3.8333452302891846, 'min_gain_to_split': 0.2758829939450131, 'max_bin': 70}. Best is trial 124 with value: 0.8905374485574505.
Training until validation scores don't improve for 30 rounds
[50]	valid_0's multi_error: 0.137523	valid_0's multi_logloss: 0.381107
[100]	valid_0's multi_error: 0.12575	valid_0's multi_logloss: 0.306537
[150]	valid_0's multi_error: 0.118169	valid_0's multi_logloss: 0.283104
[200]	valid_0's multi_error: 0.114495	valid_0's multi_logloss: 0.271185
[250]	valid_0's multi_error: 0.112787	valid_0's multi_logloss: 0.263529
[300]	valid_0's multi_error: 0.111312	valid_0's multi_logloss: 0.258395
[350]	valid_0's multi_error: 0.110329	valid_0's multi_logloss: 0.25447
[400]	valid_0's multi_error: 0.10888	valid_0's multi_logloss: 0.25226
[450]	valid_0's multi_error: 0.108207	valid_0's multi_logloss: 0.250409
[500]	valid_0's multi_error: 0.10694	valid_0's multi_logloss: 0.249296
Early stopping, best iteration is:
[497]	valid_0's multi_error: 0.106784	valid_0's multi_logloss: 0.249288
Training until validation scores don't improve for 30 rounds
[50]	valid_0's multi_error: 0.137782	valid_0's multi_logloss: 0.381297
[100]	valid_0's multi_error: 0.127691	valid_0's multi_logloss: 0.308598
[150]	valid_0's multi_error: 0.120757	valid_0's multi_logloss: 0.285314
[200]	valid_0's multi_error: 0.118298	valid_0's multi_logloss: 0.274118
[250]	valid_0's multi_error: 0.114754	valid_0's multi_logloss: 0.266799
[300]	valid_0's multi_error: 0.112865	valid_0's multi_logloss: 0.261764
[350]	valid_0's multi_error: 0.111882	valid_0's multi_logloss: 0.258465
[400]	valid_0's multi_error: 0.111183	valid_0's multi_logloss: 0.256269
Early stopping, best iteration is:
[380]	valid_0's multi_error: 0.110847	valid_0's multi_logloss: 0.25679
Training until validation scores don't improve for 30 rounds
[50]	valid_0's multi_error: 0.140913	valid_0's multi_logloss: 0.384263
[100]	valid_0's multi_error: 0.12958	valid_0's multi_logloss: 0.311981
[150]	valid_0's multi_error: 0.12337	valid_0's multi_logloss: 0.288544
[200]	valid_0's multi_error: 0.119877	valid_0's multi_logloss: 0.276272
[250]	valid_0's multi_error: 0.116384	valid_0's multi_logloss: 0.268799
[300]	valid_0's multi_error: 0.115038	valid_0's multi_logloss: 0.264221
[350]	valid_0's multi_error: 0.112942	valid_0's multi_logloss: 0.260667
[400]	valid_0's multi_error: 0.111907	valid_0's multi_logloss: 0.258376
[450]	valid_0's multi_error: 0.111442	valid_0's multi_logloss: 0.256667
[500]	valid_0's multi_error: 0.111338	valid_0's multi_logloss: 0.255894
Early stopping, best iteration is:
[483]	valid_0's multi_error: 0.110536	valid_0's multi_logloss: 0.256024
[I 2025-06-12 06:58:57,305] Trial 125 finished with value: 0.8886572912633018 and parameters: {'boosting_type': 'goss', 'learning_rate': 0.04348158137090349, 'num_leaves': 140, 'max_depth': 11, 'min_data_in_leaf': 26, 'feature_fraction': 0.9220808388654105, 'lambda_l1': 0.004973877794505706, 'lambda_l2': 3.8001989476885494, 'min_gain_to_split': 0.44515863670241806, 'max_bin': 68}. Best is trial 124 with value: 0.8905374485574505.
Training until validation scores don't improve for 30 rounds
[50]	valid_0's multi_error: 0.139231	valid_0's multi_logloss: 0.429845
[100]	valid_0's multi_error: 0.129968	valid_0's multi_logloss: 0.33182
[150]	valid_0's multi_error: 0.122645	valid_0's multi_logloss: 0.298997
[200]	valid_0's multi_error: 0.117807	valid_0's multi_logloss: 0.28315
[250]	valid_0's multi_error: 0.115763	valid_0's multi_logloss: 0.273299
[300]	valid_0's multi_error: 0.113563	valid_0's multi_logloss: 0.26666
[350]	valid_0's multi_error: 0.11183	valid_0's multi_logloss: 0.261949
[400]	valid_0's multi_error: 0.110769	valid_0's multi_logloss: 0.258355
Early stopping, best iteration is:
[395]	valid_0's multi_error: 0.110562	valid_0's multi_logloss: 0.258653
Training until validation scores don't improve for 30 rounds
[50]	valid_0's multi_error: 0.14099	valid_0's multi_logloss: 0.429934
[100]	valid_0's multi_error: 0.130692	valid_0's multi_logloss: 0.332022
[150]	valid_0's multi_error: 0.124483	valid_0's multi_logloss: 0.300247
[200]	valid_0's multi_error: 0.12011	valid_0's multi_logloss: 0.284476
[250]	valid_0's multi_error: 0.116979	valid_0's multi_logloss: 0.275307
[300]	valid_0's multi_error: 0.115426	valid_0's multi_logloss: 0.269407
[350]	valid_0's multi_error: 0.113538	valid_0's multi_logloss: 0.264662
[400]	valid_0's multi_error: 0.111985	valid_0's multi_logloss: 0.261024
[450]	valid_0's multi_error: 0.111261	valid_0's multi_logloss: 0.258408
[500]	valid_0's multi_error: 0.110614	valid_0's multi_logloss: 0.256327
Early stopping, best iteration is:
[508]	valid_0's multi_error: 0.109941	valid_0's multi_logloss: 0.256066
Training until validation scores don't improve for 30 rounds
[50]	valid_0's multi_error: 0.143086	valid_0's multi_logloss: 0.432748
[100]	valid_0's multi_error: 0.134988	valid_0's multi_logloss: 0.336294
[150]	valid_0's multi_error: 0.128208	valid_0's multi_logloss: 0.304559
[200]	valid_0's multi_error: 0.123215	valid_0's multi_logloss: 0.287888
[250]	valid_0's multi_error: 0.11998	valid_0's multi_logloss: 0.278442
[300]	valid_0's multi_error: 0.117212	valid_0's multi_logloss: 0.271888
[350]	valid_0's multi_error: 0.115012	valid_0's multi_logloss: 0.267113
[400]	valid_0's multi_error: 0.114184	valid_0's multi_logloss: 0.26363
[450]	valid_0's multi_error: 0.113253	valid_0's multi_logloss: 0.261076
Early stopping, best iteration is:
[430]	valid_0's multi_error: 0.11302	valid_0's multi_logloss: 0.262124
[I 2025-06-12 07:04:05,140] Trial 126 finished with value: 0.8867773144326424 and parameters: {'boosting_type': 'goss', 'learning_rate': 0.03234648713661362, 'num_leaves': 140, 'max_depth': 11, 'min_data_in_leaf': 25, 'feature_fraction': 0.9255223494846293, 'lambda_l1': 0.09691495699013025, 'lambda_l2': 3.6193353759686735, 'min_gain_to_split': 0.4836062936743556, 'max_bin': 70}. Best is trial 124 with value: 0.8905374485574505.
Training until validation scores don't improve for 30 rounds
[50]	valid_0's multi_error: 0.135427	valid_0's multi_logloss: 0.375817
[100]	valid_0's multi_error: 0.123318	valid_0's multi_logloss: 0.303277
[150]	valid_0's multi_error: 0.1176	valid_0's multi_logloss: 0.28039
[200]	valid_0's multi_error: 0.113538	valid_0's multi_logloss: 0.268369
[250]	valid_0's multi_error: 0.110795	valid_0's multi_logloss: 0.26105
[300]	valid_0's multi_error: 0.10976	valid_0's multi_logloss: 0.255691
[350]	valid_0's multi_error: 0.10844	valid_0's multi_logloss: 0.252381
Early stopping, best iteration is:
[358]	valid_0's multi_error: 0.107975	valid_0's multi_logloss: 0.251943
Training until validation scores don't improve for 30 rounds
[50]	valid_0's multi_error: 0.136437	valid_0's multi_logloss: 0.375934
[100]	valid_0's multi_error: 0.124431	valid_0's multi_logloss: 0.304414
[150]	valid_0's multi_error: 0.119023	valid_0's multi_logloss: 0.282294
[200]	valid_0's multi_error: 0.115789	valid_0's multi_logloss: 0.271016
[250]	valid_0's multi_error: 0.114184	valid_0's multi_logloss: 0.264184
[300]	valid_0's multi_error: 0.112503	valid_0's multi_logloss: 0.259097
[350]	valid_0's multi_error: 0.110252	valid_0's multi_logloss: 0.255475
Early stopping, best iteration is:
[352]	valid_0's multi_error: 0.109993	valid_0's multi_logloss: 0.25538
Training until validation scores don't improve for 30 rounds
[50]	valid_0's multi_error: 0.139542	valid_0's multi_logloss: 0.380387
[100]	valid_0's multi_error: 0.128545	valid_0's multi_logloss: 0.309119
[150]	valid_0's multi_error: 0.122154	valid_0's multi_logloss: 0.286001
[200]	valid_0's multi_error: 0.118712	valid_0's multi_logloss: 0.274305
[250]	valid_0's multi_error: 0.115582	valid_0's multi_logloss: 0.267129
[300]	valid_0's multi_error: 0.113848	valid_0's multi_logloss: 0.262504
[350]	valid_0's multi_error: 0.112684	valid_0's multi_logloss: 0.25948
[400]	valid_0's multi_error: 0.111545	valid_0's multi_logloss: 0.25707
Early stopping, best iteration is:
[405]	valid_0's multi_error: 0.111364	valid_0's multi_logloss: 0.256848
[I 2025-06-12 07:08:45,666] Trial 127 finished with value: 0.8882600983224774 and parameters: {'boosting_type': 'goss', 'learning_rate': 0.0438132173314229, 'num_leaves': 147, 'max_depth': 11, 'min_data_in_leaf': 19, 'feature_fraction': 0.9731037173954574, 'lambda_l1': 0.14724443998884285, 'lambda_l2': 3.810125314193019, 'min_gain_to_split': 0.30868922553025746, 'max_bin': 64}. Best is trial 124 with value: 0.8905374485574505.
Training until validation scores don't improve for 30 rounds
[50]	valid_0's multi_error: 0.141508	valid_0's multi_logloss: 0.492391
[100]	valid_0's multi_error: 0.133176	valid_0's multi_logloss: 0.364477
[150]	valid_0's multi_error: 0.126009	valid_0's multi_logloss: 0.319326
[200]	valid_0's multi_error: 0.121766	valid_0's multi_logloss: 0.296917
[250]	valid_0's multi_error: 0.118428	valid_0's multi_logloss: 0.283775
[300]	valid_0's multi_error: 0.116565	valid_0's multi_logloss: 0.275616
[350]	valid_0's multi_error: 0.115012	valid_0's multi_logloss: 0.269242
[400]	valid_0's multi_error: 0.112994	valid_0's multi_logloss: 0.264549
[450]	valid_0's multi_error: 0.111985	valid_0's multi_logloss: 0.260665
[500]	valid_0's multi_error: 0.111079	valid_0's multi_logloss: 0.257682
Early stopping, best iteration is:
[489]	valid_0's multi_error: 0.110898	valid_0's multi_logloss: 0.258297
Training until validation scores don't improve for 30 rounds
[50]	valid_0's multi_error: 0.142595	valid_0's multi_logloss: 0.492863
[100]	valid_0's multi_error: 0.134082	valid_0's multi_logloss: 0.364847
[150]	valid_0's multi_error: 0.128027	valid_0's multi_logloss: 0.320105
[200]	valid_0's multi_error: 0.12412	valid_0's multi_logloss: 0.297833
[250]	valid_0's multi_error: 0.119825	valid_0's multi_logloss: 0.285199
[300]	valid_0's multi_error: 0.117677	valid_0's multi_logloss: 0.277186
[350]	valid_0's multi_error: 0.116047	valid_0's multi_logloss: 0.271214
[400]	valid_0's multi_error: 0.113253	valid_0's multi_logloss: 0.266762
[450]	valid_0's multi_error: 0.112451	valid_0's multi_logloss: 0.263295
[500]	valid_0's multi_error: 0.111493	valid_0's multi_logloss: 0.26061
[550]	valid_0's multi_error: 0.111312	valid_0's multi_logloss: 0.258236
[600]	valid_0's multi_error: 0.11007	valid_0's multi_logloss: 0.256294
[650]	valid_0's multi_error: 0.109398	valid_0's multi_logloss: 0.25466
[700]	valid_0's multi_error: 0.10888	valid_0's multi_logloss: 0.253476
Early stopping, best iteration is:
[705]	valid_0's multi_error: 0.10857	valid_0's multi_logloss: 0.253376
Training until validation scores don't improve for 30 rounds
[50]	valid_0's multi_error: 0.145803	valid_0's multi_logloss: 0.494873
[100]	valid_0's multi_error: 0.138041	valid_0's multi_logloss: 0.368797
[150]	valid_0's multi_error: 0.131986	valid_0's multi_logloss: 0.325023
[200]	valid_0's multi_error: 0.127277	valid_0's multi_logloss: 0.302552
[250]	valid_0's multi_error: 0.123629	valid_0's multi_logloss: 0.289223
[300]	valid_0's multi_error: 0.120627	valid_0's multi_logloss: 0.280603
[350]	valid_0's multi_error: 0.118738	valid_0's multi_logloss: 0.274308
[400]	valid_0's multi_error: 0.1176	valid_0's multi_logloss: 0.269601
[450]	valid_0's multi_error: 0.115685	valid_0's multi_logloss: 0.26607
[500]	valid_0's multi_error: 0.114754	valid_0's multi_logloss: 0.263147
[550]	valid_0's multi_error: 0.11377	valid_0's multi_logloss: 0.260769
[600]	valid_0's multi_error: 0.113486	valid_0's multi_logloss: 0.25879
[650]	valid_0's multi_error: 0.112477	valid_0's multi_logloss: 0.257388
Early stopping, best iteration is:
[650]	valid_0's multi_error: 0.112477	valid_0's multi_logloss: 0.257388
