[I 2025-06-12 11:45:57,929] Trial 183 finished with value: 0.8923115059376733 and parameters: {'boosting_type': 'gbdt', 'learning_rate': 0.06628645159027009, 'num_leaves': 123, 'max_depth': 15, 'min_data_in_leaf': 10, 'feature_fraction': 0.9609681129716091, 'lambda_l1': 0.09346934906713088, 'lambda_l2': 4.258983254220653, 'min_gain_to_split': 0.008921263150063762, 'max_bin': 67, 'bagging_fraction': 0.9997494880145386, 'bagging_freq': 6}. Best is trial 182 with value: 0.8935107886618453.
Training until validation scores don't improve for 30 rounds
[50]	valid_0's multi_error: 0.123473	valid_0's multi_logloss: 0.305548
[100]	valid_0's multi_error: 0.114598	valid_0's multi_logloss: 0.26918
[150]	valid_0's multi_error: 0.111131	valid_0's multi_logloss: 0.258034
[200]	valid_0's multi_error: 0.108725	valid_0's multi_logloss: 0.251316
[250]	valid_0's multi_error: 0.107043	valid_0's multi_logloss: 0.247646
[300]	valid_0's multi_error: 0.105749	valid_0's multi_logloss: 0.245021
[350]	valid_0's multi_error: 0.105594	valid_0's multi_logloss: 0.243267
Early stopping, best iteration is:
[335]	valid_0's multi_error: 0.10518	valid_0's multi_logloss: 0.243826
Training until validation scores don't improve for 30 rounds
[50]	valid_0's multi_error: 0.126035	valid_0's multi_logloss: 0.305957
[100]	valid_0's multi_error: 0.116539	valid_0's multi_logloss: 0.271514
[150]	valid_0's multi_error: 0.11227	valid_0's multi_logloss: 0.26006
[200]	valid_0's multi_error: 0.109812	valid_0's multi_logloss: 0.254011
[250]	valid_0's multi_error: 0.108466	valid_0's multi_logloss: 0.250001
[300]	valid_0's multi_error: 0.107095	valid_0's multi_logloss: 0.247914
[350]	valid_0's multi_error: 0.106344	valid_0's multi_logloss: 0.246827
[400]	valid_0's multi_error: 0.105723	valid_0's multi_logloss: 0.24618
[450]	valid_0's multi_error: 0.105568	valid_0's multi_logloss: 0.24623
Early stopping, best iteration is:
[425]	valid_0's multi_error: 0.105387	valid_0's multi_logloss: 0.246091
Training until validation scores don't improve for 30 rounds
[50]	valid_0's multi_error: 0.130278	valid_0's multi_logloss: 0.312044
[100]	valid_0's multi_error: 0.119851	valid_0's multi_logloss: 0.275015
[150]	valid_0's multi_error: 0.114495	valid_0's multi_logloss: 0.263258
[200]	valid_0's multi_error: 0.112192	valid_0's multi_logloss: 0.256879
[250]	valid_0's multi_error: 0.110277	valid_0's multi_logloss: 0.253811
[300]	valid_0's multi_error: 0.109165	valid_0's multi_logloss: 0.251681
[350]	valid_0's multi_error: 0.107742	valid_0's multi_logloss: 0.250661
[400]	valid_0's multi_error: 0.107405	valid_0's multi_logloss: 0.250009
Early stopping, best iteration is:
[413]	valid_0's multi_error: 0.107172	valid_0's multi_logloss: 0.249821
[I 2025-06-12 11:51:39,667] Trial 184 finished with value: 0.8922867289667908 and parameters: {'boosting_type': 'gbdt', 'learning_rate': 0.0805141818891495, 'num_leaves': 124, 'max_depth': 15, 'min_data_in_leaf': 10, 'feature_fraction': 0.962304554550045, 'lambda_l1': 0.07590575427463293, 'lambda_l2': 4.355809262926694, 'min_gain_to_split': 0.051700258745658, 'max_bin': 67, 'bagging_fraction': 0.9975170202555786, 'bagging_freq': 6}. Best is trial 182 with value: 0.8935107886618453.
Training until validation scores don't improve for 30 rounds
[50]	valid_0's multi_error: 0.122645	valid_0's multi_logloss: 0.301348
[100]	valid_0's multi_error: 0.113149	valid_0's multi_logloss: 0.266397
[150]	valid_0's multi_error: 0.109941	valid_0's multi_logloss: 0.255583
[200]	valid_0's multi_error: 0.107095	valid_0's multi_logloss: 0.248986
[250]	valid_0's multi_error: 0.104999	valid_0's multi_logloss: 0.245236
[300]	valid_0's multi_error: 0.104274	valid_0's multi_logloss: 0.242796
[350]	valid_0's multi_error: 0.1043	valid_0's multi_logloss: 0.241613
Early stopping, best iteration is:
[321]	valid_0's multi_error: 0.103964	valid_0's multi_logloss: 0.242322
Training until validation scores don't improve for 30 rounds
[50]	valid_0's multi_error: 0.125078	valid_0's multi_logloss: 0.303155
[100]	valid_0's multi_error: 0.114495	valid_0's multi_logloss: 0.269259
[150]	valid_0's multi_error: 0.111752	valid_0's multi_logloss: 0.258175
[200]	valid_0's multi_error: 0.109501	valid_0's multi_logloss: 0.252
[250]	valid_0's multi_error: 0.107793	valid_0's multi_logloss: 0.248284
Early stopping, best iteration is:
[243]	valid_0's multi_error: 0.107742	valid_0's multi_logloss: 0.248782
Training until validation scores don't improve for 30 rounds
[50]	valid_0's multi_error: 0.127277	valid_0's multi_logloss: 0.307962
[100]	valid_0's multi_error: 0.117755	valid_0's multi_logloss: 0.27235
[150]	valid_0's multi_error: 0.112451	valid_0's multi_logloss: 0.260845
[200]	valid_0's multi_error: 0.109734	valid_0's multi_logloss: 0.254652
[250]	valid_0's multi_error: 0.10813	valid_0's multi_logloss: 0.250979
[300]	valid_0's multi_error: 0.106577	valid_0's multi_logloss: 0.248685
[350]	valid_0's multi_error: 0.105232	valid_0's multi_logloss: 0.247896
[400]	valid_0's multi_error: 0.105025	valid_0's multi_logloss: 0.247631
Early stopping, best iteration is:
[416]	valid_0's multi_error: 0.104611	valid_0's multi_logloss: 0.247401
[I 2025-06-12 11:55:54,990] Trial 185 finished with value: 0.8927666011475061 and parameters: {'boosting_type': 'gbdt', 'learning_rate': 0.0841693625182014, 'num_leaves': 123, 'max_depth': 15, 'min_data_in_leaf': 10, 'feature_fraction': 0.9633905013777362, 'lambda_l1': 0.08541695803510077, 'lambda_l2': 4.254783496928383, 'min_gain_to_split': 0.0009257705084131582, 'max_bin': 67, 'bagging_fraction': 0.9990657024495084, 'bagging_freq': 6}. Best is trial 182 with value: 0.8935107886618453.
Training until validation scores don't improve for 30 rounds
[50]	valid_0's multi_error: 0.127976	valid_0's multi_logloss: 0.322752
[100]	valid_0's multi_error: 0.117057	valid_0's multi_logloss: 0.276224
[150]	valid_0's multi_error: 0.111468	valid_0's multi_logloss: 0.262252
[200]	valid_0's multi_error: 0.108751	valid_0's multi_logloss: 0.254318
[250]	valid_0's multi_error: 0.107069	valid_0's multi_logloss: 0.249601
[300]	valid_0's multi_error: 0.105853	valid_0's multi_logloss: 0.246395
[350]	valid_0's multi_error: 0.104947	valid_0's multi_logloss: 0.243744
Early stopping, best iteration is:
[343]	valid_0's multi_error: 0.104533	valid_0's multi_logloss: 0.244084
Training until validation scores don't improve for 30 rounds
[50]	valid_0's multi_error: 0.129994	valid_0's multi_logloss: 0.324768
[100]	valid_0's multi_error: 0.119825	valid_0's multi_logloss: 0.278827
[150]	valid_0's multi_error: 0.114857	valid_0's multi_logloss: 0.265222
[200]	valid_0's multi_error: 0.11214	valid_0's multi_logloss: 0.25745