[I 2025-06-12 08:24:44,251] Trial 142 finished with value: 0.8889388014449776 and parameters: {'boosting_type': 'goss', 'learning_rate': 0.05285416783539644, 'num_leaves': 148, 'max_depth': 12, 'min_data_in_leaf': 25, 'feature_fraction': 0.9949964095093097, 'lambda_l1': 0.2682464711494568, 'lambda_l2': 3.714696236551097, 'min_gain_to_split': 0.35419501189865776, 'max_bin': 81}. Best is trial 124 with value: 0.8905374485574505.
Training until validation scores don't improve for 30 rounds
[50]	valid_0's multi_error: 0.134884	valid_0's multi_logloss: 0.369196
[100]	valid_0's multi_error: 0.12262	valid_0's multi_logloss: 0.299958
[150]	valid_0's multi_error: 0.116772	valid_0's multi_logloss: 0.278782
[200]	valid_0's multi_error: 0.113796	valid_0's multi_logloss: 0.268279
[250]	valid_0's multi_error: 0.112218	valid_0's multi_logloss: 0.261595
[300]	valid_0's multi_error: 0.110174	valid_0's multi_logloss: 0.257473
[350]	valid_0's multi_error: 0.10901	valid_0's multi_logloss: 0.255041
[400]	valid_0's multi_error: 0.108647	valid_0's multi_logloss: 0.253399
[450]	valid_0's multi_error: 0.108466	valid_0's multi_logloss: 0.252106
Early stopping, best iteration is:
[422]	valid_0's multi_error: 0.108078	valid_0's multi_logloss: 0.252808
Training until validation scores don't improve for 30 rounds
[50]	valid_0's multi_error: 0.137549	valid_0's multi_logloss: 0.370955
[100]	valid_0's multi_error: 0.126811	valid_0's multi_logloss: 0.303148
[150]	valid_0's multi_error: 0.121248	valid_0's multi_logloss: 0.28152
[200]	valid_0's multi_error: 0.117264	valid_0's multi_logloss: 0.272028
[250]	valid_0's multi_error: 0.114909	valid_0's multi_logloss: 0.26612
[300]	valid_0's multi_error: 0.113615	valid_0's multi_logloss: 0.262126
[350]	valid_0's multi_error: 0.112011	valid_0's multi_logloss: 0.259706
Early stopping, best iteration is:
[356]	valid_0's multi_error: 0.111519	valid_0's multi_logloss: 0.259451
Training until validation scores don't improve for 30 rounds
[50]	valid_0's multi_error: 0.139748	valid_0's multi_logloss: 0.374056
[100]	valid_0's multi_error: 0.129761	valid_0's multi_logloss: 0.306531
[150]	valid_0's multi_error: 0.121947	valid_0's multi_logloss: 0.284983
[200]	valid_0's multi_error: 0.119437	valid_0's multi_logloss: 0.274214
[250]	valid_0's multi_error: 0.116358	valid_0's multi_logloss: 0.268336
[300]	valid_0's multi_error: 0.115271	valid_0's multi_logloss: 0.264767
[350]	valid_0's multi_error: 0.113874	valid_0's multi_logloss: 0.262408
[400]	valid_0's multi_error: 0.113512	valid_0's multi_logloss: 0.261076
[450]	valid_0's multi_error: 0.112761	valid_0's multi_logloss: 0.260107
Early stopping, best iteration is:
[445]	valid_0's multi_error: 0.112658	valid_0's multi_logloss: 0.260117
[I 2025-06-12 08:29:18,149] Trial 143 finished with value: 0.8872518492974826 and parameters: {'boosting_type': 'goss', 'learning_rate': 0.045448629960219714, 'num_leaves': 135, 'max_depth': 12, 'min_data_in_leaf': 25, 'feature_fraction': 0.9970068269730377, 'lambda_l1': 0.3716439656083257, 'lambda_l2': 3.707776526167031, 'min_gain_to_split': 0.674344045059047, 'max_bin': 83}. Best is trial 124 with value: 0.8905374485574505.
Training until validation scores don't improve for 30 rounds
[50]	valid_0's multi_error: 0.132038	valid_0's multi_logloss: 0.345352
[100]	valid_0's multi_error: 0.119256	valid_0's multi_logloss: 0.289141
[150]	valid_0's multi_error: 0.115633	valid_0's multi_logloss: 0.271748
[200]	valid_0's multi_error: 0.112347	valid_0's multi_logloss: 0.261841
[250]	valid_0's multi_error: 0.110743	valid_0's multi_logloss: 0.256316
[300]	valid_0's multi_error: 0.109398	valid_0's multi_logloss: 0.252705
[350]	valid_0's multi_error: 0.108104	valid_0's multi_logloss: 0.250815
[400]	valid_0's multi_error: 0.10681	valid_0's multi_logloss: 0.249382
[450]	valid_0's multi_error: 0.105646	valid_0's multi_logloss: 0.248735
[500]	valid_0's multi_error: 0.105905	valid_0's multi_logloss: 0.248695
Early stopping, best iteration is:
[475]	valid_0's multi_error: 0.105723	valid_0's multi_logloss: 0.248617
Training until validation scores don't improve for 30 rounds
[50]	valid_0's multi_error: 0.134134	valid_0's multi_logloss: 0.347764
[100]	valid_0's multi_error: 0.121999	valid_0's multi_logloss: 0.290388
[150]	valid_0's multi_error: 0.116254	valid_0's multi_logloss: 0.273785
[200]	valid_0's multi_error: 0.114262	valid_0's multi_logloss: 0.264992
[250]	valid_0's multi_error: 0.111675	valid_0's multi_logloss: 0.259528
[300]	valid_0's multi_error: 0.110536	valid_0's multi_logloss: 0.25626
Early stopping, best iteration is:
[317]	valid_0's multi_error: 0.110122	valid_0's multi_logloss: 0.255693
Training until validation scores don't improve for 30 rounds
[50]	valid_0's multi_error: 0.136385	valid_0's multi_logloss: 0.352111
[100]	valid_0's multi_error: 0.125595	valid_0's multi_logloss: 0.295162
[150]	valid_0's multi_error: 0.119799	valid_0's multi_logloss: 0.276903
[200]	valid_0's multi_error: 0.11628	valid_0's multi_logloss: 0.267695
[250]	valid_0's multi_error: 0.11421	valid_0's multi_logloss: 0.26214
[300]	valid_0's multi_error: 0.112114	valid_0's multi_logloss: 0.259023
Early stopping, best iteration is:
[291]	valid_0's multi_error: 0.111856	valid_0's multi_logloss: 0.259456
[I 2025-06-12 08:33:46,317] Trial 144 finished with value: 0.8888035383669589 and parameters: {'boosting_type': 'goss', 'learning_rate': 0.053874385328119216, 'num_leaves': 148, 'max_depth': 12, 'min_data_in_leaf': 27, 'feature_fraction': 0.9890924853965853, 'lambda_l1': 0.25037181577499407, 'lambda_l2': 3.899237329032473, 'min_gain_to_split': 0.38465132027241206, 'max_bin': 78}. Best is trial 124 with value: 0.8905374485574505.
Training until validation scores don't improve for 30 rounds
[50]	valid_0's multi_error: 0.133461	valid_0's multi_logloss: 0.359698
[100]	valid_0's multi_error: 0.122024	valid_0's multi_logloss: 0.293848
[150]	valid_0's multi_error: 0.11628	valid_0's multi_logloss: 0.273288
[200]	valid_0's multi_error: 0.113201	valid_0's multi_logloss: 0.263051
[250]	valid_0's multi_error: 0.110898	valid_0's multi_logloss: 0.256901
[300]	valid_0's multi_error: 0.109035	valid_0's multi_logloss: 0.253611
[350]	valid_0's multi_error: 0.108182	valid_0's multi_logloss: 0.251378
[400]	valid_0's multi_error: 0.107742	valid_0's multi_logloss: 0.250396
[450]	valid_0's multi_error: 0.10681	valid_0's multi_logloss: 0.249934
Early stopping, best iteration is:
[453]	valid_0's multi_error: 0.106603	valid_0's multi_logloss: 0.249935
Training until validation scores don't improve for 30 rounds
[50]	valid_0's multi_error: 0.134936	valid_0's multi_logloss: 0.360715
[100]	valid_0's multi_error: 0.123758	valid_0's multi_logloss: 0.296339
[150]	valid_0's multi_error: 0.117419	valid_0's multi_logloss: 0.277078
[200]	valid_0's multi_error: 0.114805	valid_0's multi_logloss: 0.267347
[250]	valid_0's multi_error: 0.113382	valid_0's multi_logloss: 0.262228
Early stopping, best iteration is:
[248]	valid_0's multi_error: 0.112917	valid_0's multi_logloss: 0.262396
Training until validation scores don't improve for 30 rounds
[50]	valid_0's multi_error: 0.137394	valid_0's multi_logloss: 0.36396
[100]	valid_0's multi_error: 0.127096	valid_0's multi_logloss: 0.299274
[150]	valid_0's multi_error: 0.121171	valid_0's multi_logloss: 0.279013
[200]	valid_0's multi_error: 0.117367	valid_0's multi_logloss: 0.269648
[250]	valid_0's multi_error: 0.114961	valid_0's multi_logloss: 0.264311
[300]	valid_0's multi_error: 0.113719	valid_0's multi_logloss: 0.261082
[350]	valid_0's multi_error: 0.11227	valid_0's multi_logloss: 0.259104
Early stopping, best iteration is:
[344]	valid_0's multi_error: 0.111571	valid_0's multi_logloss: 0.259204
[I 2025-06-12 08:38:05,827] Trial 145 finished with value: 0.8876447455443456 and parameters: {'boosting_type': 'goss', 'learning_rate': 0.04828423880471516, 'num_leaves': 139, 'max_depth': 13, 'min_data_in_leaf': 21, 'feature_fraction': 0.9792857398630868, 'lambda_l1': 0.24126631852282793, 'lambda_l2': 3.5262891641622613, 'min_gain_to_split': 0.5760961395111497, 'max_bin': 82}. Best is trial 124 with value: 0.8905374485574505.
Training until validation scores don't improve for 30 rounds
[50]	valid_0's multi_error: 0.138222	valid_0's multi_logloss: 0.417923
[100]	valid_0's multi_error: 0.127355	valid_0's multi_logloss: 0.325293
[150]	valid_0's multi_error: 0.120757	valid_0's multi_logloss: 0.294756
[200]	valid_0's multi_error: 0.117082	valid_0's multi_logloss: 0.28
[250]	valid_0's multi_error: 0.114883	valid_0's multi_logloss: 0.270963
[300]	valid_0's multi_error: 0.112968	valid_0's multi_logloss: 0.26464
[350]	valid_0's multi_error: 0.11183	valid_0's multi_logloss: 0.259887
[400]	valid_0's multi_error: 0.110795	valid_0's multi_logloss: 0.256092
[450]	valid_0's multi_error: 0.108906	valid_0's multi_logloss: 0.253409
[500]	valid_0's multi_error: 0.108104	valid_0's multi_logloss: 0.251478
Early stopping, best iteration is:
[480]	valid_0's multi_error: 0.107975	valid_0's multi_logloss: 0.252171
Training until validation scores don't improve for 30 rounds
[50]	valid_0's multi_error: 0.140939	valid_0's multi_logloss: 0.419727
[100]	valid_0's multi_error: 0.130408	valid_0's multi_logloss: 0.326515
[150]	valid_0's multi_error: 0.124069	valid_0's multi_logloss: 0.296289
[200]	valid_0's multi_error: 0.119903	valid_0's multi_logloss: 0.28204
[250]	valid_0's multi_error: 0.11672	valid_0's multi_logloss: 0.273566
[300]	valid_0's multi_error: 0.115012	valid_0's multi_logloss: 0.267619
[350]	valid_0's multi_error: 0.113098	valid_0's multi_logloss: 0.263182
[400]	valid_0's multi_error: 0.111907	valid_0's multi_logloss: 0.260146
[450]	valid_0's multi_error: 0.111131	valid_0's multi_logloss: 0.25786
[500]	valid_0's multi_error: 0.110536	valid_0's multi_logloss: 0.255947
Early stopping, best iteration is:
[486]	valid_0's multi_error: 0.110122	valid_0's multi_logloss: 0.256462
Training until validation scores don't improve for 30 rounds
[50]	valid_0's multi_error: 0.143914	valid_0's multi_logloss: 0.423244
[100]	valid_0's multi_error: 0.133409	valid_0's multi_logloss: 0.330303
[150]	valid_0's multi_error: 0.126734	valid_0's multi_logloss: 0.300332
[200]	valid_0's multi_error: 0.122516	valid_0's multi_logloss: 0.285109
[250]	valid_0's multi_error: 0.119282	valid_0's multi_logloss: 0.27592
[300]	valid_0's multi_error: 0.116151	valid_0's multi_logloss: 0.269619
[350]	valid_0's multi_error: 0.114573	valid_0's multi_logloss: 0.265477
[400]	valid_0's multi_error: 0.113072	valid_0's multi_logloss: 0.261829
[450]	valid_0's multi_error: 0.111597	valid_0's multi_logloss: 0.259361
[500]	valid_0's multi_error: 0.111079	valid_0's multi_logloss: 0.257588
[550]	valid_0's multi_error: 0.110536	valid_0's multi_logloss: 0.256234
Early stopping, best iteration is:
[521]	valid_0's multi_error: 0.110536	valid_0's multi_logloss: 0.256966
[I 2025-06-12 08:43:53,095] Trial 146 finished with value: 0.8884840702333584 and parameters: {'boosting_type': 'goss', 'learning_rate': 0.033330198136486515, 'num_leaves': 129, 'max_depth': 12, 'min_data_in_leaf': 24, 'feature_fraction': 0.9858095668409957, 'lambda_l1': 0.6174981965192746, 'lambda_l2': 3.0475542583105804, 'min_gain_to_split': 0.29867577453127214, 'max_bin': 219}. Best is trial 124 with value: 0.8905374485574505.
Training until validation scores don't improve for 30 rounds
[50]	valid_0's multi_error: 0.13566	valid_0's multi_logloss: 0.387975
[100]	valid_0's multi_error: 0.125466	valid_0's multi_logloss: 0.309608
[150]	valid_0's multi_error: 0.118919	valid_0's multi_logloss: 0.284869
[200]	valid_0's multi_error: 0.114831	valid_0's multi_logloss: 0.27222
[250]	valid_0's multi_error: 0.112839	valid_0's multi_logloss: 0.264698
[300]	valid_0's multi_error: 0.111131	valid_0's multi_logloss: 0.259052
[350]	valid_0's multi_error: 0.110122	valid_0's multi_logloss: 0.255089
[400]	valid_0's multi_error: 0.10901	valid_0's multi_logloss: 0.252125
[450]	valid_0's multi_error: 0.107716	valid_0's multi_logloss: 0.250094
[500]	valid_0's multi_error: 0.107509	valid_0's multi_logloss: 0.248645
Early stopping, best iteration is:
[492]	valid_0's multi_error: 0.107147	valid_0's multi_logloss: 0.2488
Training until validation scores don't improve for 30 rounds
[50]	valid_0's multi_error: 0.138118	valid_0's multi_logloss: 0.389425
[100]	valid_0's multi_error: 0.127406	valid_0's multi_logloss: 0.31178
[150]	valid_0's multi_error: 0.122128	valid_0's multi_logloss: 0.287681
[200]	valid_0's multi_error: 0.11804	valid_0's multi_logloss: 0.275413
[250]	valid_0's multi_error: 0.114805	valid_0's multi_logloss: 0.268106
[300]	valid_0's multi_error: 0.112735	valid_0's multi_logloss: 0.262982
[350]	valid_0's multi_error: 0.111675	valid_0's multi_logloss: 0.259473
[400]	valid_0's multi_error: 0.110433	valid_0's multi_logloss: 0.256316
Early stopping, best iteration is:
[419]	valid_0's multi_error: 0.109682	valid_0's multi_logloss: 0.255432
Training until validation scores don't improve for 30 rounds
[50]	valid_0's multi_error: 0.142957	valid_0's multi_logloss: 0.393577
[100]	valid_0's multi_error: 0.130977	valid_0's multi_logloss: 0.315194
[150]	valid_0's multi_error: 0.125103	valid_0's multi_logloss: 0.290168
[200]	valid_0's multi_error: 0.120472	valid_0's multi_logloss: 0.278255
[250]	valid_0's multi_error: 0.117393	valid_0's multi_logloss: 0.270379
[300]	valid_0's multi_error: 0.115452	valid_0's multi_logloss: 0.265344
[350]	valid_0's multi_error: 0.1139	valid_0's multi_logloss: 0.261633
[400]	valid_0's multi_error: 0.113175	valid_0's multi_logloss: 0.258824
Early stopping, best iteration is:
[385]	valid_0's multi_error: 0.11271	valid_0's multi_logloss: 0.259468
[I 2025-06-12 08:48:53,827] Trial 147 finished with value: 0.8881791374698332 and parameters: {'boosting_type': 'goss', 'learning_rate': 0.040672891543809486, 'num_leaves': 124, 'max_depth': 12, 'min_data_in_leaf': 27, 'feature_fraction': 0.9632800450475993, 'lambda_l1': 0.3575134281548059, 'lambda_l2': 3.3503669265456493, 'min_gain_to_split': 0.21826923095672945, 'max_bin': 73}. Best is trial 124 with value: 0.8905374485574505.
Training until validation scores don't improve for 30 rounds
[50]	valid_0's multi_error: 0.131805	valid_0's multi_logloss: 0.343841
[100]	valid_0's multi_error: 0.119696	valid_0's multi_logloss: 0.28718
[150]	valid_0's multi_error: 0.113589	valid_0's multi_logloss: 0.270353
[200]	valid_0's multi_error: 0.112528	valid_0's multi_logloss: 0.26334
[250]	valid_0's multi_error: 0.111856	valid_0's multi_logloss: 0.259921
[300]	valid_0's multi_error: 0.110355	valid_0's multi_logloss: 0.257799
[350]	valid_0's multi_error: 0.10976	valid_0's multi_logloss: 0.256778
Early stopping, best iteration is:
[349]	valid_0's multi_error: 0.10976	valid_0's multi_logloss: 0.256775
Training until validation scores don't improve for 30 rounds
[50]	valid_0's multi_error: 0.132943	valid_0's multi_logloss: 0.342879
[100]	valid_0's multi_error: 0.121041	valid_0's multi_logloss: 0.286979
[150]	valid_0's multi_error: 0.116591	valid_0's multi_logloss: 0.27145
[200]	valid_0's multi_error: 0.113512	valid_0's multi_logloss: 0.264576
[250]	valid_0's multi_error: 0.11139	valid_0's multi_logloss: 0.261636
Early stopping, best iteration is:
[249]	valid_0's multi_error: 0.111364	valid_0's multi_logloss: 0.261721
Training until validation scores don't improve for 30 rounds
[50]	valid_0's multi_error: 0.135867	valid_0's multi_logloss: 0.34808
[100]	valid_0's multi_error: 0.123034	valid_0's multi_logloss: 0.291006
[150]	valid_0's multi_error: 0.117988	valid_0's multi_logloss: 0.274306
[200]	valid_0's multi_error: 0.11641	valid_0's multi_logloss: 0.26868
[250]	valid_0's multi_error: 0.114547	valid_0's multi_logloss: 0.26563
[300]	valid_0's multi_error: 0.113745	valid_0's multi_logloss: 0.263896
[350]	valid_0's multi_error: 0.112554	valid_0's multi_logloss: 0.262604
Early stopping, best iteration is:
[353]	valid_0's multi_error: 0.112425	valid_0's multi_logloss: 0.262613
[I 2025-06-12 08:52:25,957] Trial 148 finished with value: 0.8867872660479027 and parameters: {'boosting_type': 'gbdt', 'learning_rate': 0.055303750330958655, 'num_leaves': 147, 'max_depth': 13, 'min_data_in_leaf': 22, 'feature_fraction': 0.99966317288892, 'lambda_l1': 0.44722099461799003, 'lambda_l2': 3.7682531102392156, 'min_gain_to_split': 0.4685386764442213, 'max_bin': 80, 'bagging_fraction': 0.6024614317933453, 'bagging_freq': 3}. Best is trial 124 with value: 0.8905374485574505.
Training until validation scores don't improve for 30 rounds
[50]	valid_0's multi_error: 0.126578	valid_0's multi_logloss: 0.321118
[100]	valid_0's multi_error: 0.116953	valid_0's multi_logloss: 0.278655
[150]	valid_0's multi_error: 0.113512	valid_0's multi_logloss: 0.264345
[200]	valid_0's multi_error: 0.110096	valid_0's multi_logloss: 0.257098
[250]	valid_0's multi_error: 0.108828	valid_0's multi_logloss: 0.253174
[300]	valid_0's multi_error: 0.10844	valid_0's multi_logloss: 0.251399
Early stopping, best iteration is:
[275]	valid_0's multi_error: 0.108156	valid_0's multi_logloss: 0.251873
Training until validation scores don't improve for 30 rounds
[50]	valid_0's multi_error: 0.130175	valid_0's multi_logloss: 0.322653
[100]	valid_0's multi_error: 0.119618	valid_0's multi_logloss: 0.2814
[150]	valid_0's multi_error: 0.11478	valid_0's multi_logloss: 0.266941
[200]	valid_0's multi_error: 0.112321	valid_0's multi_logloss: 0.260334
[250]	valid_0's multi_error: 0.111312	valid_0's multi_logloss: 0.256393
[300]	valid_0's multi_error: 0.109346	valid_0's multi_logloss: 0.254608
Early stopping, best iteration is:
[304]	valid_0's multi_error: 0.109165	valid_0's multi_logloss: 0.25467
Training until validation scores don't improve for 30 rounds
[50]	valid_0's multi_error: 0.132193	valid_0's multi_logloss: 0.326848
[100]	valid_0's multi_error: 0.121973	valid_0's multi_logloss: 0.282979
[150]	valid_0's multi_error: 0.116746	valid_0's multi_logloss: 0.2698
[200]	valid_0's multi_error: 0.113356	valid_0's multi_logloss: 0.262579
Early stopping, best iteration is:
[214]	valid_0's multi_error: 0.112606	valid_0's multi_logloss: 0.261317
[I 2025-06-12 08:55:46,311] Trial 149 finished with value: 0.8880751819919781 and parameters: {'boosting_type': 'goss', 'learning_rate': 0.07071778410305153, 'num_leaves': 142, 'max_depth': 12, 'min_data_in_leaf': 29, 'feature_fraction': 0.9777576387097048, 'lambda_l1': 0.197957395130965, 'lambda_l2': 4.002731081632917, 'min_gain_to_split': 0.3610268874409597, 'max_bin': 75}. Best is trial 124 with value: 0.8905374485574505.
Training until validation scores don't improve for 30 rounds
[50]	valid_0's multi_error: 0.131753	valid_0's multi_logloss: 0.356805
[100]	valid_0's multi_error: 0.120575	valid_0's multi_logloss: 0.29226
[150]	valid_0's multi_error: 0.114754	valid_0's multi_logloss: 0.27274
[200]	valid_0's multi_error: 0.112296	valid_0's multi_logloss: 0.263507
[250]	valid_0's multi_error: 0.11095	valid_0's multi_logloss: 0.259484
[300]	valid_0's multi_error: 0.109424	valid_0's multi_logloss: 0.256855
Early stopping, best iteration is:
[298]	valid_0's multi_error: 0.109191	valid_0's multi_logloss: 0.257095
Training until validation scores don't improve for 30 rounds
[50]	valid_0's multi_error: 0.132943	valid_0's multi_logloss: 0.357495
[100]	valid_0's multi_error: 0.122024	valid_0's multi_logloss: 0.293789
[150]	valid_0's multi_error: 0.116099	valid_0's multi_logloss: 0.275036
[200]	valid_0's multi_error: 0.114573	valid_0's multi_logloss: 0.266609
[250]	valid_0's multi_error: 0.112347	valid_0's multi_logloss: 0.262631
Early stopping, best iteration is:
[254]	valid_0's multi_error: 0.111907	valid_0's multi_logloss: 0.262475
Training until validation scores don't improve for 30 rounds
[50]	valid_0's multi_error: 0.137704	valid_0's multi_logloss: 0.362408
[100]	valid_0's multi_error: 0.125285	valid_0's multi_logloss: 0.298017
[150]	valid_0's multi_error: 0.118997	valid_0's multi_logloss: 0.278311
[200]	valid_0's multi_error: 0.116073	valid_0's multi_logloss: 0.269988
[250]	valid_0's multi_error: 0.114469	valid_0's multi_logloss: 0.266149
Early stopping, best iteration is:
[240]	valid_0's multi_error: 0.113822	valid_0's multi_logloss: 0.266771
