[I 2025-06-12 04:43:44,509] Trial 90 finished with value: 0.8863920794466943 and parameters: {'boosting_type': 'goss', 'learning_rate': 0.06537385254699128, 'num_leaves': 54, 'max_depth': 11, 'min_data_in_leaf': 12, 'feature_fraction': 0.662356909891721, 'lambda_l1': 0.7603069118791856, 'lambda_l2': 4.025180137979615, 'min_gain_to_split': 0.25078746540572927, 'max_bin': 98}. Best is trial 47 with value: 0.8895928149546414.
Training until validation scores don't improve for 30 rounds
[50]	valid_0's multi_error: 0.145105	valid_0's multi_logloss: 0.427552
[100]	valid_0's multi_error: 0.135453	valid_0's multi_logloss: 0.338682
[150]	valid_0's multi_error: 0.127251	valid_0's multi_logloss: 0.309015
[200]	valid_0's multi_error: 0.122154	valid_0's multi_logloss: 0.293204
[250]	valid_0's multi_error: 0.118428	valid_0's multi_logloss: 0.282919
[300]	valid_0's multi_error: 0.115789	valid_0's multi_logloss: 0.275295
[350]	valid_0's multi_error: 0.113745	valid_0's multi_logloss: 0.270044
[400]	valid_0's multi_error: 0.112658	valid_0's multi_logloss: 0.265645
[450]	valid_0's multi_error: 0.112218	valid_0's multi_logloss: 0.262002
[500]	valid_0's multi_error: 0.110924	valid_0's multi_logloss: 0.259278
[550]	valid_0's multi_error: 0.110174	valid_0's multi_logloss: 0.257133
[600]	valid_0's multi_error: 0.109605	valid_0's multi_logloss: 0.255104
[650]	valid_0's multi_error: 0.109191	valid_0's multi_logloss: 0.25335
Early stopping, best iteration is:
[649]	valid_0's multi_error: 0.108777	valid_0's multi_logloss: 0.25339
Training until validation scores don't improve for 30 rounds
[50]	valid_0's multi_error: 0.146372	valid_0's multi_logloss: 0.427736
[100]	valid_0's multi_error: 0.136359	valid_0's multi_logloss: 0.339918
[150]	valid_0's multi_error: 0.129166	valid_0's multi_logloss: 0.310163
[200]	valid_0's multi_error: 0.123991	valid_0's multi_logloss: 0.294448
[250]	valid_0's multi_error: 0.121171	valid_0's multi_logloss: 0.284949
[300]	valid_0's multi_error: 0.118764	valid_0's multi_logloss: 0.27825
[350]	valid_0's multi_error: 0.11628	valid_0's multi_logloss: 0.27288
[400]	valid_0's multi_error: 0.11509	valid_0's multi_logloss: 0.269019
[450]	valid_0's multi_error: 0.114081	valid_0's multi_logloss: 0.265433
[500]	valid_0's multi_error: 0.113227	valid_0's multi_logloss: 0.26275
[550]	valid_0's multi_error: 0.111985	valid_0's multi_logloss: 0.260534
[600]	valid_0's multi_error: 0.111079	valid_0's multi_logloss: 0.25869
[650]	valid_0's multi_error: 0.110924	valid_0's multi_logloss: 0.257241
[700]	valid_0's multi_error: 0.109682	valid_0's multi_logloss: 0.255938
[750]	valid_0's multi_error: 0.108725	valid_0's multi_logloss: 0.254814
Early stopping, best iteration is:
[768]	valid_0's multi_error: 0.108207	valid_0's multi_logloss: 0.254631
Training until validation scores don't improve for 30 rounds
[50]	valid_0's multi_error: 0.14896	valid_0's multi_logloss: 0.431983
[100]	valid_0's multi_error: 0.139645	valid_0's multi_logloss: 0.344853
[150]	valid_0's multi_error: 0.132116	valid_0's multi_logloss: 0.313825
[200]	valid_0's multi_error: 0.127225	valid_0's multi_logloss: 0.298351
[250]	valid_0's multi_error: 0.124741	valid_0's multi_logloss: 0.288288
[300]	valid_0's multi_error: 0.12086	valid_0's multi_logloss: 0.281104
[350]	valid_0's multi_error: 0.119204	valid_0's multi_logloss: 0.275867
[400]	valid_0's multi_error: 0.117988	valid_0's multi_logloss: 0.271788
[450]	valid_0's multi_error: 0.116177	valid_0's multi_logloss: 0.268422
[500]	valid_0's multi_error: 0.11478	valid_0's multi_logloss: 0.265726
Early stopping, best iteration is:
[514]	valid_0's multi_error: 0.114288	valid_0's multi_logloss: 0.265138
[I 2025-06-12 04:48:44,385] Trial 91 finished with value: 0.8875975614733842 and parameters: {'boosting_type': 'goss', 'learning_rate': 0.03975129782502556, 'num_leaves': 76, 'max_depth': 10, 'min_data_in_leaf': 21, 'feature_fraction': 0.6811301862986451, 'lambda_l1': 0.4711091084239639, 'lambda_l2': 4.300273703510945, 'min_gain_to_split': 0.12145007407525141, 'max_bin': 104}. Best is trial 47 with value: 0.8895928149546414.
Training until validation scores don't improve for 30 rounds
[50]	valid_0's multi_error: 0.146657	valid_0's multi_logloss: 0.44584
[100]	valid_0's multi_error: 0.137239	valid_0's multi_logloss: 0.349572
[150]	valid_0's multi_error: 0.129554	valid_0's multi_logloss: 0.315982
[200]	valid_0's multi_error: 0.124715	valid_0's multi_logloss: 0.298823
[250]	valid_0's multi_error: 0.120368	valid_0's multi_logloss: 0.287747
[300]	valid_0's multi_error: 0.117988	valid_0's multi_logloss: 0.280093
[350]	valid_0's multi_error: 0.116668	valid_0's multi_logloss: 0.274195
[400]	valid_0's multi_error: 0.114805	valid_0's multi_logloss: 0.269478
[450]	valid_0's multi_error: 0.113201	valid_0's multi_logloss: 0.265584
[500]	valid_0's multi_error: 0.11183	valid_0's multi_logloss: 0.262348
[550]	valid_0's multi_error: 0.111002	valid_0's multi_logloss: 0.259512
[600]	valid_0's multi_error: 0.110303	valid_0's multi_logloss: 0.257232
[650]	valid_0's multi_error: 0.10901	valid_0's multi_logloss: 0.255096
Early stopping, best iteration is:
[649]	valid_0's multi_error: 0.108803	valid_0's multi_logloss: 0.255147
Training until validation scores don't improve for 30 rounds
[50]	valid_0's multi_error: 0.147563	valid_0's multi_logloss: 0.446466
[100]	valid_0's multi_error: 0.137368	valid_0's multi_logloss: 0.350391
[150]	valid_0's multi_error: 0.129813	valid_0's multi_logloss: 0.316586
[200]	valid_0's multi_error: 0.124715	valid_0's multi_logloss: 0.299143
[250]	valid_0's multi_error: 0.121766	valid_0's multi_logloss: 0.288564
[300]	valid_0's multi_error: 0.118919	valid_0's multi_logloss: 0.2812
[350]	valid_0's multi_error: 0.117134	valid_0's multi_logloss: 0.275688
[400]	valid_0's multi_error: 0.115194	valid_0's multi_logloss: 0.271082
[450]	valid_0's multi_error: 0.114443	valid_0's multi_logloss: 0.267489
[500]	valid_0's multi_error: 0.113719	valid_0's multi_logloss: 0.264382
Early stopping, best iteration is:
[487]	valid_0's multi_error: 0.113331	valid_0's multi_logloss: 0.265203
Training until validation scores don't improve for 30 rounds
[50]	valid_0's multi_error: 0.150486	valid_0's multi_logloss: 0.450194
[100]	valid_0's multi_error: 0.140188	valid_0's multi_logloss: 0.354014
[150]	valid_0's multi_error: 0.133875	valid_0's multi_logloss: 0.320183
[200]	valid_0's multi_error: 0.128131	valid_0's multi_logloss: 0.303094
[250]	valid_0's multi_error: 0.124353	valid_0's multi_logloss: 0.291704
[300]	valid_0's multi_error: 0.122128	valid_0's multi_logloss: 0.284294
[350]	valid_0's multi_error: 0.120524	valid_0's multi_logloss: 0.278723
[400]	valid_0's multi_error: 0.118117	valid_0's multi_logloss: 0.274329
[450]	valid_0's multi_error: 0.116565	valid_0's multi_logloss: 0.270561
[500]	valid_0's multi_error: 0.115892	valid_0's multi_logloss: 0.267578
Early stopping, best iteration is:
[476]	valid_0's multi_error: 0.115478	valid_0's multi_logloss: 0.269003
[I 2025-06-12 04:52:56,445] Trial 92 finished with value: 0.8853682974841169 and parameters: {'boosting_type': 'goss', 'learning_rate': 0.03581985081634812, 'num_leaves': 75, 'max_depth': 10, 'min_data_in_leaf': 21, 'feature_fraction': 0.6813559862895046, 'lambda_l1': 0.5303220528318848, 'lambda_l2': 3.7939466683886085, 'min_gain_to_split': 0.00652164942028899, 'max_bin': 106}. Best is trial 47 with value: 0.8895928149546414.
Training until validation scores don't improve for 30 rounds
[50]	valid_0's multi_error: 0.13328	valid_0's multi_logloss: 0.334712
[100]	valid_0's multi_error: 0.120524	valid_0's multi_logloss: 0.288691
[150]	valid_0's multi_error: 0.115737	valid_0's multi_logloss: 0.273057
[200]	valid_0's multi_error: 0.113175	valid_0's multi_logloss: 0.264492
[250]	valid_0's multi_error: 0.11095	valid_0's multi_logloss: 0.258834
[300]	valid_0's multi_error: 0.109087	valid_0's multi_logloss: 0.255212
[350]	valid_0's multi_error: 0.108699	valid_0's multi_logloss: 0.252761
Early stopping, best iteration is:
[368]	valid_0's multi_error: 0.107768	valid_0's multi_logloss: 0.252033
Training until validation scores don't improve for 30 rounds
[50]	valid_0's multi_error: 0.132943	valid_0's multi_logloss: 0.335105
[100]	valid_0's multi_error: 0.123318	valid_0's multi_logloss: 0.290995
[150]	valid_0's multi_error: 0.118557	valid_0's multi_logloss: 0.276503
[200]	valid_0's multi_error: 0.114935	valid_0's multi_logloss: 0.268479
[250]	valid_0's multi_error: 0.113408	valid_0's multi_logloss: 0.263237
Early stopping, best iteration is:
[254]	valid_0's multi_error: 0.112891	valid_0's multi_logloss: 0.263034
Training until validation scores don't improve for 30 rounds
[50]	valid_0's multi_error: 0.137265	valid_0's multi_logloss: 0.339117
[100]	valid_0's multi_error: 0.126345	valid_0's multi_logloss: 0.293886
[150]	valid_0's multi_error: 0.12042	valid_0's multi_logloss: 0.27794
[200]	valid_0's multi_error: 0.116254	valid_0's multi_logloss: 0.268691
[250]	valid_0's multi_error: 0.113796	valid_0's multi_logloss: 0.263476
[300]	valid_0's multi_error: 0.112761	valid_0's multi_logloss: 0.259546
[350]	valid_0's multi_error: 0.110614	valid_0's multi_logloss: 0.257374
[400]	valid_0's multi_error: 0.110536	valid_0's multi_logloss: 0.255851
Early stopping, best iteration is:
[399]	valid_0's multi_error: 0.110381	valid_0's multi_logloss: 0.255798
[I 2025-06-12 04:56:06,642] Trial 93 finished with value: 0.8877308079293506 and parameters: {'boosting_type': 'goss', 'learning_rate': 0.07988110851990281, 'num_leaves': 87, 'max_depth': 12, 'min_data_in_leaf': 28, 'feature_fraction': 0.6217463609413671, 'lambda_l1': 0.32290661539496823, 'lambda_l2': 4.408332297601218, 'min_gain_to_split': 0.12656570654528299, 'max_bin': 87}. Best is trial 47 with value: 0.8895928149546414.
Training until validation scores don't improve for 30 rounds
[50]	valid_0's multi_error: 0.132116	valid_0's multi_logloss: 0.332202
[100]	valid_0's multi_error: 0.120317	valid_0's multi_logloss: 0.288025
[150]	valid_0's multi_error: 0.114495	valid_0's multi_logloss: 0.271807
[200]	valid_0's multi_error: 0.112761	valid_0's multi_logloss: 0.263449
[250]	valid_0's multi_error: 0.110329	valid_0's multi_logloss: 0.257953
[300]	valid_0's multi_error: 0.109061	valid_0's multi_logloss: 0.254362
[350]	valid_0's multi_error: 0.107664	valid_0's multi_logloss: 0.252021
[400]	valid_0's multi_error: 0.106551	valid_0's multi_logloss: 0.250529
[450]	valid_0's multi_error: 0.106784	valid_0's multi_logloss: 0.249992
Early stopping, best iteration is:
[435]	valid_0's multi_error: 0.10593	valid_0's multi_logloss: 0.250102
Training until validation scores don't improve for 30 rounds
[50]	valid_0's multi_error: 0.134185	valid_0's multi_logloss: 0.334295
[100]	valid_0's multi_error: 0.123318	valid_0's multi_logloss: 0.289972
[150]	valid_0's multi_error: 0.117574	valid_0's multi_logloss: 0.274466
[200]	valid_0's multi_error: 0.115297	valid_0's multi_logloss: 0.26678
[250]	valid_0's multi_error: 0.112684	valid_0's multi_logloss: 0.261842
[300]	valid_0's multi_error: 0.111105	valid_0's multi_logloss: 0.25826
[350]	valid_0's multi_error: 0.109786	valid_0's multi_logloss: 0.256289
[400]	valid_0's multi_error: 0.109191	valid_0's multi_logloss: 0.255188
Early stopping, best iteration is:
[384]	valid_0's multi_error: 0.108803	valid_0's multi_logloss: 0.255427
Training until validation scores don't improve for 30 rounds
[50]	valid_0's multi_error: 0.136695	valid_0's multi_logloss: 0.337366
[100]	valid_0's multi_error: 0.125466	valid_0's multi_logloss: 0.293686
[150]	valid_0's multi_error: 0.119644	valid_0's multi_logloss: 0.277058
[200]	valid_0's multi_error: 0.115608	valid_0's multi_logloss: 0.268924
[250]	valid_0's multi_error: 0.113745	valid_0's multi_logloss: 0.263872
[300]	valid_0's multi_error: 0.113253	valid_0's multi_logloss: 0.26085
[350]	valid_0's multi_error: 0.11227	valid_0's multi_logloss: 0.258771
[400]	valid_0's multi_error: 0.111079	valid_0's multi_logloss: 0.257844
Early stopping, best iteration is:
[416]	valid_0's multi_error: 0.110795	valid_0's multi_logloss: 0.257499
[I 2025-06-12 04:59:56,735] Trial 94 finished with value: 0.8896529108188087 and parameters: {'boosting_type': 'goss', 'learning_rate': 0.08034509285859615, 'num_leaves': 87, 'max_depth': 13, 'min_data_in_leaf': 29, 'feature_fraction': 0.6206846363353005, 'lambda_l1': 0.20995768299398723, 'lambda_l2': 4.404888256648789, 'min_gain_to_split': 0.1268961776639557, 'max_bin': 85}. Best is trial 94 with value: 0.8896529108188087.
Training until validation scores don't improve for 30 rounds
[50]	valid_0's multi_error: 0.136747	valid_0's multi_logloss: 0.363689
[100]	valid_0's multi_error: 0.125129	valid_0's multi_logloss: 0.303152
[150]	valid_0's multi_error: 0.119256	valid_0's multi_logloss: 0.282438
[200]	valid_0's multi_error: 0.115996	valid_0's multi_logloss: 0.271366
[250]	valid_0's multi_error: 0.113305	valid_0's multi_logloss: 0.264805
[300]	valid_0's multi_error: 0.111907	valid_0's multi_logloss: 0.260412
[350]	valid_0's multi_error: 0.1102	valid_0's multi_logloss: 0.257532
Early stopping, best iteration is:
[351]	valid_0's multi_error: 0.10976	valid_0's multi_logloss: 0.257495
Training until validation scores don't improve for 30 rounds
[50]	valid_0's multi_error: 0.137006	valid_0's multi_logloss: 0.365307
[100]	valid_0's multi_error: 0.126087	valid_0's multi_logloss: 0.304404
[150]	valid_0's multi_error: 0.119463	valid_0's multi_logloss: 0.284604
[200]	valid_0's multi_error: 0.116798	valid_0's multi_logloss: 0.274316
[250]	valid_0's multi_error: 0.115012	valid_0's multi_logloss: 0.268099
[300]	valid_0's multi_error: 0.113149	valid_0's multi_logloss: 0.264087
[350]	valid_0's multi_error: 0.112321	valid_0's multi_logloss: 0.261745
[400]	valid_0's multi_error: 0.111054	valid_0's multi_logloss: 0.260121
Early stopping, best iteration is:
[388]	valid_0's multi_error: 0.11095	valid_0's multi_logloss: 0.260503
Training until validation scores don't improve for 30 rounds
[50]	valid_0's multi_error: 0.141379	valid_0's multi_logloss: 0.370207
[100]	valid_0's multi_error: 0.128907	valid_0's multi_logloss: 0.308597
[150]	valid_0's multi_error: 0.121947	valid_0's multi_logloss: 0.287849
[200]	valid_0's multi_error: 0.118505	valid_0's multi_logloss: 0.277612
[250]	valid_0's multi_error: 0.116177	valid_0's multi_logloss: 0.27126
[300]	valid_0's multi_error: 0.11478	valid_0's multi_logloss: 0.267206
[350]	valid_0's multi_error: 0.114133	valid_0's multi_logloss: 0.264483
[400]	valid_0's multi_error: 0.113589	valid_0's multi_logloss: 0.262805
[450]	valid_0's multi_error: 0.112865	valid_0's multi_logloss: 0.261627
Early stopping, best iteration is:
[459]	valid_0's multi_error: 0.112503	valid_0's multi_logloss: 0.261581
[I 2025-06-12 05:03:31,799] Trial 95 finished with value: 0.8869555853999085 and parameters: {'boosting_type': 'goss', 'learning_rate': 0.059294108008288986, 'num_leaves': 88, 'max_depth': 14, 'min_data_in_leaf': 33, 'feature_fraction': 0.6152350421571156, 'lambda_l1': 0.35725018359415417, 'lambda_l2': 3.8890356881036823, 'min_gain_to_split': 0.5453749480618263, 'max_bin': 66}. Best is trial 94 with value: 0.8896529108188087.
Training until validation scores don't improve for 30 rounds
[50]	valid_0's multi_error: 0.142828	valid_0's multi_logloss: 0.394822
[100]	valid_0's multi_error: 0.131313	valid_0's multi_logloss: 0.321945
[150]	valid_0's multi_error: 0.123551	valid_0's multi_logloss: 0.297044
[200]	valid_0's multi_error: 0.119282	valid_0's multi_logloss: 0.283542
[250]	valid_0's multi_error: 0.116746	valid_0's multi_logloss: 0.274763
[300]	valid_0's multi_error: 0.114003	valid_0's multi_logloss: 0.268813
[350]	valid_0's multi_error: 0.112632	valid_0's multi_logloss: 0.264368
[400]	valid_0's multi_error: 0.11139	valid_0's multi_logloss: 0.260498
[450]	valid_0's multi_error: 0.110665	valid_0's multi_logloss: 0.257677
[500]	valid_0's multi_error: 0.109475	valid_0's multi_logloss: 0.255435
[550]	valid_0's multi_error: 0.108958	valid_0's multi_logloss: 0.25361
[600]	valid_0's multi_error: 0.108104	valid_0's multi_logloss: 0.251942
[650]	valid_0's multi_error: 0.107612	valid_0's multi_logloss: 0.250709
Early stopping, best iteration is:
[667]	valid_0's multi_error: 0.107121	valid_0's multi_logloss: 0.250398
Training until validation scores don't improve for 30 rounds
[50]	valid_0's multi_error: 0.143371	valid_0's multi_logloss: 0.39503
[100]	valid_0's multi_error: 0.131624	valid_0's multi_logloss: 0.323423
[150]	valid_0's multi_error: 0.125181	valid_0's multi_logloss: 0.299622
[200]	valid_0's multi_error: 0.120782	valid_0's multi_logloss: 0.286774
[250]	valid_0's multi_error: 0.119126	valid_0's multi_logloss: 0.278648
[300]	valid_0's multi_error: 0.116824	valid_0's multi_logloss: 0.272753
[350]	valid_0's multi_error: 0.115556	valid_0's multi_logloss: 0.268042
[400]	valid_0's multi_error: 0.114469	valid_0's multi_logloss: 0.264409
[450]	valid_0's multi_error: 0.113589	valid_0's multi_logloss: 0.261729
[500]	valid_0's multi_error: 0.112684	valid_0's multi_logloss: 0.25957
[550]	valid_0's multi_error: 0.111545	valid_0's multi_logloss: 0.257787
[600]	valid_0's multi_error: 0.110536	valid_0's multi_logloss: 0.25632
[650]	valid_0's multi_error: 0.110174	valid_0's multi_logloss: 0.255319
Early stopping, best iteration is:
[655]	valid_0's multi_error: 0.109734	valid_0's multi_logloss: 0.255222
Training until validation scores don't improve for 30 rounds
[50]	valid_0's multi_error: 0.14689	valid_0's multi_logloss: 0.39925
[100]	valid_0's multi_error: 0.13535	valid_0's multi_logloss: 0.327011
[150]	valid_0's multi_error: 0.128027	valid_0's multi_logloss: 0.30206
[200]	valid_0's multi_error: 0.124534	valid_0's multi_logloss: 0.288289
[250]	valid_0's multi_error: 0.120498	valid_0's multi_logloss: 0.279705
[300]	valid_0's multi_error: 0.11879	valid_0's multi_logloss: 0.273624
[350]	valid_0's multi_error: 0.117341	valid_0's multi_logloss: 0.26908
[400]	valid_0's multi_error: 0.115556	valid_0's multi_logloss: 0.265553
[450]	valid_0's multi_error: 0.113977	valid_0's multi_logloss: 0.26258
[500]	valid_0's multi_error: 0.113745	valid_0's multi_logloss: 0.260614
[550]	valid_0's multi_error: 0.11258	valid_0's multi_logloss: 0.259228
[600]	valid_0's multi_error: 0.112503	valid_0's multi_logloss: 0.257968
Early stopping, best iteration is:
[584]	valid_0's multi_error: 0.112114	valid_0's multi_logloss: 0.258187
