[I 2025-06-12 00:46:37,926] Trial 17 finished with value: 0.8847993309237037 and parameters: {'boosting_type': 'goss', 'learning_rate': 0.0707100178064449, 'num_leaves': 86, 'max_depth': 8, 'min_data_in_leaf': 25, 'feature_fraction': 0.6603476808196637, 'lambda_l1': 0.7562614018416086, 'lambda_l2': 4.332086246420591, 'min_gain_to_split': 0.6769382033406233, 'max_bin': 116}. Best is trial 11 with value: 0.888762461860649.
Training until validation scores don't improve for 30 rounds
[50]	valid_0's multi_error: 0.175041	valid_0's multi_logloss: 0.677908
[100]	valid_0's multi_error: 0.166813	valid_0's multi_logloss: 0.523596
[150]	valid_0's multi_error: 0.159775	valid_0's multi_logloss: 0.451332
[200]	valid_0's multi_error: 0.154497	valid_0's multi_logloss: 0.411192
[250]	valid_0's multi_error: 0.150538	valid_0's multi_logloss: 0.384211
[300]	valid_0's multi_error: 0.147174	valid_0's multi_logloss: 0.367664
[350]	valid_0's multi_error: 0.144302	valid_0's multi_logloss: 0.355212
[400]	valid_0's multi_error: 0.141508	valid_0's multi_logloss: 0.345903
[450]	valid_0's multi_error: 0.139438	valid_0's multi_logloss: 0.338593
[500]	valid_0's multi_error: 0.138093	valid_0's multi_logloss: 0.332665
[550]	valid_0's multi_error: 0.136307	valid_0's multi_logloss: 0.327991
[600]	valid_0's multi_error: 0.134729	valid_0's multi_logloss: 0.324028
[650]	valid_0's multi_error: 0.133357	valid_0's multi_logloss: 0.320444
[700]	valid_0's multi_error: 0.132271	valid_0's multi_logloss: 0.317247
[750]	valid_0's multi_error: 0.131339	valid_0's multi_logloss: 0.314651
[800]	valid_0's multi_error: 0.130718	valid_0's multi_logloss: 0.312328
[850]	valid_0's multi_error: 0.130201	valid_0's multi_logloss: 0.310363
Early stopping, best iteration is:
[824]	valid_0's multi_error: 0.130175	valid_0's multi_logloss: 0.311328
Training until validation scores don't improve for 30 rounds
[50]	valid_0's multi_error: 0.173825	valid_0's multi_logloss: 0.678326
[100]	valid_0's multi_error: 0.166296	valid_0's multi_logloss: 0.523442
[150]	valid_0's multi_error: 0.160474	valid_0's multi_logloss: 0.451219
[200]	valid_0's multi_error: 0.154575	valid_0's multi_logloss: 0.411269
[250]	valid_0's multi_error: 0.151159	valid_0's multi_logloss: 0.384486
[300]	valid_0's multi_error: 0.147381	valid_0's multi_logloss: 0.368293
[350]	valid_0's multi_error: 0.144406	valid_0's multi_logloss: 0.356305
[400]	valid_0's multi_error: 0.142	valid_0's multi_logloss: 0.347057
[450]	valid_0's multi_error: 0.139878	valid_0's multi_logloss: 0.339821
[500]	valid_0's multi_error: 0.138248	valid_0's multi_logloss: 0.333898
[550]	valid_0's multi_error: 0.136902	valid_0's multi_logloss: 0.329283
[600]	valid_0's multi_error: 0.135505	valid_0's multi_logloss: 0.325435
[650]	valid_0's multi_error: 0.133953	valid_0's multi_logloss: 0.322082
[700]	valid_0's multi_error: 0.133099	valid_0's multi_logloss: 0.319173
[750]	valid_0's multi_error: 0.132297	valid_0's multi_logloss: 0.316696
[800]	valid_0's multi_error: 0.131495	valid_0's multi_logloss: 0.31434
[850]	valid_0's multi_error: 0.130822	valid_0's multi_logloss: 0.312327
[900]	valid_0's multi_error: 0.130097	valid_0's multi_logloss: 0.310601
[950]	valid_0's multi_error: 0.129683	valid_0's multi_logloss: 0.309019
[1000]	valid_0's multi_error: 0.128804	valid_0's multi_logloss: 0.307531
Did not meet early stopping. Best iteration is:
[990]	valid_0's multi_error: 0.128752	valid_0's multi_logloss: 0.307855
Training until validation scores don't improve for 30 rounds
[50]	valid_0's multi_error: 0.178069	valid_0's multi_logloss: 0.679593
[100]	valid_0's multi_error: 0.17028	valid_0's multi_logloss: 0.526159
[150]	valid_0's multi_error: 0.164769	valid_0's multi_logloss: 0.454879
[200]	valid_0's multi_error: 0.158094	valid_0's multi_logloss: 0.414972
[250]	valid_0's multi_error: 0.153902	valid_0's multi_logloss: 0.388514
[300]	valid_0's multi_error: 0.150512	valid_0's multi_logloss: 0.372391
[350]	valid_0's multi_error: 0.147951	valid_0's multi_logloss: 0.360276
[400]	valid_0's multi_error: 0.145519	valid_0's multi_logloss: 0.350932
[450]	valid_0's multi_error: 0.143888	valid_0's multi_logloss: 0.343737
[500]	valid_0's multi_error: 0.141844	valid_0's multi_logloss: 0.337914
[550]	valid_0's multi_error: 0.140421	valid_0's multi_logloss: 0.333042
[600]	valid_0's multi_error: 0.139283	valid_0's multi_logloss: 0.32914
[650]	valid_0's multi_error: 0.137782	valid_0's multi_logloss: 0.325554
[700]	valid_0's multi_error: 0.137058	valid_0's multi_logloss: 0.322683
[750]	valid_0's multi_error: 0.136333	valid_0's multi_logloss: 0.320221
[800]	valid_0's multi_error: 0.135427	valid_0's multi_logloss: 0.317963
Early stopping, best iteration is:
[813]	valid_0's multi_error: 0.135272	valid_0's multi_logloss: 0.317308
[I 2025-06-12 00:50:45,587] Trial 18 finished with value: 0.8656696816259443 and parameters: {'boosting_type': 'goss', 'learning_rate': 0.015442117264418007, 'num_leaves': 30, 'max_depth': 9, 'min_data_in_leaf': 80, 'feature_fraction': 0.6032886658595605, 'lambda_l1': 2.23894764128947, 'lambda_l2': 2.827362237966363, 'min_gain_to_split': 3.007578858543657, 'max_bin': 152}. Best is trial 11 with value: 0.888762461860649.
Training until validation scores don't improve for 30 rounds
[50]	valid_0's multi_error: 0.170927	valid_0's multi_logloss: 0.558719
[100]	valid_0's multi_error: 0.161742	valid_0's multi_logloss: 0.437253
[150]	valid_0's multi_error: 0.153488	valid_0's multi_logloss: 0.391057
[200]	valid_0's multi_error: 0.147433	valid_0's multi_logloss: 0.366015
[250]	valid_0's multi_error: 0.14394	valid_0's multi_logloss: 0.350295
[300]	valid_0's multi_error: 0.14099	valid_0's multi_logloss: 0.339311
[350]	valid_0's multi_error: 0.137937	valid_0's multi_logloss: 0.331042
[400]	valid_0's multi_error: 0.136023	valid_0's multi_logloss: 0.324353
[450]	valid_0's multi_error: 0.133849	valid_0's multi_logloss: 0.318625
[500]	valid_0's multi_error: 0.131702	valid_0's multi_logloss: 0.313571
[550]	valid_0's multi_error: 0.129968	valid_0's multi_logloss: 0.309207
[600]	valid_0's multi_error: 0.12839	valid_0's multi_logloss: 0.305619
[650]	valid_0's multi_error: 0.127536	valid_0's multi_logloss: 0.302088
[700]	valid_0's multi_error: 0.126578	valid_0's multi_logloss: 0.299017
[750]	valid_0's multi_error: 0.125906	valid_0's multi_logloss: 0.296354
[800]	valid_0's multi_error: 0.124301	valid_0's multi_logloss: 0.293732
[850]	valid_0's multi_error: 0.123655	valid_0's multi_logloss: 0.291443
[900]	valid_0's multi_error: 0.123266	valid_0's multi_logloss: 0.289369
[950]	valid_0's multi_error: 0.12249	valid_0's multi_logloss: 0.28741
[1000]	valid_0's multi_error: 0.121869	valid_0's multi_logloss: 0.285772
Did not meet early stopping. Best iteration is:
[997]	valid_0's multi_error: 0.121792	valid_0's multi_logloss: 0.285898
Training until validation scores don't improve for 30 rounds
[50]	valid_0's multi_error: 0.170487	valid_0's multi_logloss: 0.558994
[100]	valid_0's multi_error: 0.161819	valid_0's multi_logloss: 0.436615
[150]	valid_0's multi_error: 0.154626	valid_0's multi_logloss: 0.390502
[200]	valid_0's multi_error: 0.148235	valid_0's multi_logloss: 0.366439
[250]	valid_0's multi_error: 0.144302	valid_0's multi_logloss: 0.351441
[300]	valid_0's multi_error: 0.141793	valid_0's multi_logloss: 0.34082
[350]	valid_0's multi_error: 0.137989	valid_0's multi_logloss: 0.333081
[400]	valid_0's multi_error: 0.135893	valid_0's multi_logloss: 0.326347
[450]	valid_0's multi_error: 0.133978	valid_0's multi_logloss: 0.320727
[500]	valid_0's multi_error: 0.132141	valid_0's multi_logloss: 0.315828
[550]	valid_0's multi_error: 0.13046	valid_0's multi_logloss: 0.31112
[600]	valid_0's multi_error: 0.129476	valid_0's multi_logloss: 0.307596
[650]	valid_0's multi_error: 0.128131	valid_0's multi_logloss: 0.304286
[700]	valid_0's multi_error: 0.127665	valid_0's multi_logloss: 0.301349
[750]	valid_0's multi_error: 0.126863	valid_0's multi_logloss: 0.298677
[800]	valid_0's multi_error: 0.125776	valid_0's multi_logloss: 0.296156
[850]	valid_0's multi_error: 0.124845	valid_0's multi_logloss: 0.294003
[900]	valid_0's multi_error: 0.124017	valid_0's multi_logloss: 0.291994
[950]	valid_0's multi_error: 0.123111	valid_0's multi_logloss: 0.290238
[1000]	valid_0's multi_error: 0.122723	valid_0's multi_logloss: 0.288687
Did not meet early stopping. Best iteration is:
[994]	valid_0's multi_error: 0.12262	valid_0's multi_logloss: 0.288865
Training until validation scores don't improve for 30 rounds
[50]	valid_0's multi_error: 0.173541	valid_0's multi_logloss: 0.560704
[100]	valid_0's multi_error: 0.164381	valid_0's multi_logloss: 0.440022
[150]	valid_0's multi_error: 0.157602	valid_0's multi_logloss: 0.3947
[200]	valid_0's multi_error: 0.151496	valid_0's multi_logloss: 0.370627
[250]	valid_0's multi_error: 0.148054	valid_0's multi_logloss: 0.355578
[300]	valid_0's multi_error: 0.144018	valid_0's multi_logloss: 0.344651
[350]	valid_0's multi_error: 0.141534	valid_0's multi_logloss: 0.336576
[400]	valid_0's multi_error: 0.139076	valid_0's multi_logloss: 0.329856
[450]	valid_0's multi_error: 0.137937	valid_0's multi_logloss: 0.324324
[500]	valid_0's multi_error: 0.135867	valid_0's multi_logloss: 0.319284
[550]	valid_0's multi_error: 0.13359	valid_0's multi_logloss: 0.314694
[600]	valid_0's multi_error: 0.132245	valid_0's multi_logloss: 0.310854
[650]	valid_0's multi_error: 0.130899	valid_0's multi_logloss: 0.307337
[700]	valid_0's multi_error: 0.129787	valid_0's multi_logloss: 0.304381
[750]	valid_0's multi_error: 0.129011	valid_0's multi_logloss: 0.301629
[800]	valid_0's multi_error: 0.127406	valid_0's multi_logloss: 0.298939
[850]	valid_0's multi_error: 0.12663	valid_0's multi_logloss: 0.29674
[900]	valid_0's multi_error: 0.125931	valid_0's multi_logloss: 0.29461
[950]	valid_0's multi_error: 0.125388	valid_0's multi_logloss: 0.292699
[1000]	valid_0's multi_error: 0.125129	valid_0's multi_logloss: 0.290884
Did not meet early stopping. Best iteration is:
[996]	valid_0's multi_error: 0.124793	valid_0's multi_logloss: 0.291028
[I 2025-06-12 00:55:02,588] Trial 19 finished with value: 0.8744334653089298 and parameters: {'boosting_type': 'goss', 'learning_rate': 0.024421761467577578, 'num_leaves': 111, 'max_depth': 6, 'min_data_in_leaf': 57, 'feature_fraction': 0.7279754876863723, 'lambda_l1': 0.8316581602582622, 'lambda_l2': 3.4929921745584953, 'min_gain_to_split': 1.4595871601961028, 'max_bin': 187}. Best is trial 11 with value: 0.888762461860649.
Training until validation scores don't improve for 30 rounds
[50]	valid_0's multi_error: 0.233596	valid_0's multi_logloss: 0.887266
Early stopping, best iteration is:
[26]	valid_0's multi_error: 0.229818	valid_0's multi_logloss: 0.975071
Training until validation scores don't improve for 30 rounds
[50]	valid_0's multi_error: 0.236235	valid_0's multi_logloss: 0.887713
Early stopping, best iteration is:
[22]	valid_0's multi_error: 0.232949	valid_0's multi_logloss: 0.991575
Training until validation scores don't improve for 30 rounds
[50]	valid_0's multi_error: 0.238046	valid_0's multi_logloss: 0.888141
[I 2025-06-12 00:55:09,174] Trial 20 finished with value: 0.7573822163018203 and parameters: {'boosting_type': 'goss', 'learning_rate': 0.00683749480569599, 'num_leaves': 136, 'max_depth': 3, 'min_data_in_leaf': 99, 'feature_fraction': 0.658365579349366, 'lambda_l1': 1.8087294168670631, 'lambda_l2': 4.19083964576593, 'min_gain_to_split': 3.00874315375677, 'max_bin': 208}. Best is trial 11 with value: 0.888762461860649.
Early stopping, best iteration is:
[31]	valid_0's multi_error: 0.232949	valid_0's multi_logloss: 0.953898
Training until validation scores don't improve for 30 rounds
[50]	valid_0's multi_error: 0.136152	valid_0's multi_logloss: 0.336254
[100]	valid_0's multi_error: 0.123991	valid_0's multi_logloss: 0.292416
[150]	valid_0's multi_error: 0.11848	valid_0's multi_logloss: 0.277579
[200]	valid_0's multi_error: 0.114184	valid_0's multi_logloss: 0.268281
[250]	valid_0's multi_error: 0.11271	valid_0's multi_logloss: 0.263189
[300]	valid_0's multi_error: 0.111519	valid_0's multi_logloss: 0.259892
[350]	valid_0's multi_error: 0.11051	valid_0's multi_logloss: 0.257786
[400]	valid_0's multi_error: 0.109967	valid_0's multi_logloss: 0.256497
Early stopping, best iteration is:
[415]	valid_0's multi_error: 0.109191	valid_0's multi_logloss: 0.25613
Training until validation scores don't improve for 30 rounds
[50]	valid_0's multi_error: 0.135634	valid_0's multi_logloss: 0.337211
[100]	valid_0's multi_error: 0.125388	valid_0's multi_logloss: 0.295864
[150]	valid_0's multi_error: 0.119256	valid_0's multi_logloss: 0.279757
[200]	valid_0's multi_error: 0.116539	valid_0's multi_logloss: 0.271658
[250]	valid_0's multi_error: 0.114598	valid_0's multi_logloss: 0.265855
[300]	valid_0's multi_error: 0.113512	valid_0's multi_logloss: 0.262681
[350]	valid_0's multi_error: 0.112477	valid_0's multi_logloss: 0.261004
Early stopping, best iteration is:
[330]	valid_0's multi_error: 0.111933	valid_0's multi_logloss: 0.261368
Training until validation scores don't improve for 30 rounds
[50]	valid_0's multi_error: 0.140111	valid_0's multi_logloss: 0.341377
[100]	valid_0's multi_error: 0.126475	valid_0's multi_logloss: 0.298033
[150]	valid_0's multi_error: 0.121248	valid_0's multi_logloss: 0.282878
[200]	valid_0's multi_error: 0.119075	valid_0's multi_logloss: 0.273706
[250]	valid_0's multi_error: 0.116591	valid_0's multi_logloss: 0.269181
[300]	valid_0's multi_error: 0.115038	valid_0's multi_logloss: 0.266387
Early stopping, best iteration is:
[291]	valid_0's multi_error: 0.114883	valid_0's multi_logloss: 0.266739
[I 2025-06-12 00:58:18,988] Trial 21 finished with value: 0.8860000894269556 and parameters: {'boosting_type': 'goss', 'learning_rate': 0.0855302323004095, 'num_leaves': 87, 'max_depth': 9, 'min_data_in_leaf': 23, 'feature_fraction': 0.6497217493564575, 'lambda_l1': 0.7895696032743045, 'lambda_l2': 4.458655111751643, 'min_gain_to_split': 0.5951967955142528, 'max_bin': 118}. Best is trial 11 with value: 0.888762461860649.
Training until validation scores don't improve for 30 rounds
[50]	valid_0's multi_error: 0.139179	valid_0's multi_logloss: 0.362496
[100]	valid_0's multi_error: 0.127743	valid_0's multi_logloss: 0.306911
[150]	valid_0's multi_error: 0.121041	valid_0's multi_logloss: 0.285699
[200]	valid_0's multi_error: 0.115815	valid_0's multi_logloss: 0.273785
[250]	valid_0's multi_error: 0.113926	valid_0's multi_logloss: 0.266019
[300]	valid_0's multi_error: 0.111856	valid_0's multi_logloss: 0.260695
[350]	valid_0's multi_error: 0.110226	valid_0's multi_logloss: 0.257194
[400]	valid_0's multi_error: 0.109553	valid_0's multi_logloss: 0.253942
Early stopping, best iteration is:
[410]	valid_0's multi_error: 0.109113	valid_0's multi_logloss: 0.253613
Training until validation scores don't improve for 30 rounds
[50]	valid_0's multi_error: 0.140059	valid_0's multi_logloss: 0.363209
[100]	valid_0's multi_error: 0.12839	valid_0's multi_logloss: 0.307549
[150]	valid_0's multi_error: 0.122542	valid_0's multi_logloss: 0.288408
[200]	valid_0's multi_error: 0.118816	valid_0's multi_logloss: 0.277696
[250]	valid_0's multi_error: 0.116022	valid_0's multi_logloss: 0.270195
[300]	valid_0's multi_error: 0.114184	valid_0's multi_logloss: 0.265045
[350]	valid_0's multi_error: 0.112451	valid_0's multi_logloss: 0.26122
[400]	valid_0's multi_error: 0.112244	valid_0's multi_logloss: 0.25861
Early stopping, best iteration is:
[378]	valid_0's multi_error: 0.111752	valid_0's multi_logloss: 0.259494
Training until validation scores don't improve for 30 rounds
[50]	valid_0's multi_error: 0.142439	valid_0's multi_logloss: 0.367099
[100]	valid_0's multi_error: 0.131106	valid_0's multi_logloss: 0.311474
[150]	valid_0's multi_error: 0.124819	valid_0's multi_logloss: 0.291142
[200]	valid_0's multi_error: 0.120524	valid_0's multi_logloss: 0.280094
[250]	valid_0's multi_error: 0.117781	valid_0's multi_logloss: 0.272801
[300]	valid_0's multi_error: 0.11597	valid_0's multi_logloss: 0.267636
[350]	valid_0's multi_error: 0.114495	valid_0's multi_logloss: 0.264182
[400]	valid_0's multi_error: 0.112968	valid_0's multi_logloss: 0.261233
[450]	valid_0's multi_error: 0.11227	valid_0's multi_logloss: 0.259562
Early stopping, best iteration is:
[451]	valid_0's multi_error: 0.11183	valid_0's multi_logloss: 0.259546
[I 2025-06-12 01:02:22,782] Trial 22 finished with value: 0.8871318011544641 and parameters: {'boosting_type': 'goss', 'learning_rate': 0.06588783360043207, 'num_leaves': 84, 'max_depth': 9, 'min_data_in_leaf': 21, 'feature_fraction': 0.6385789617919209, 'lambda_l1': 0.8243143023004686, 'lambda_l2': 4.929734479002341, 'min_gain_to_split': 0.01788674058949491, 'max_bin': 109}. Best is trial 11 with value: 0.888762461860649.
Training until validation scores don't improve for 30 rounds
[50]	valid_0's multi_error: 0.143009	valid_0's multi_logloss: 0.361319
[100]	valid_0's multi_error: 0.130692	valid_0's multi_logloss: 0.31286
[150]	valid_0's multi_error: 0.123836	valid_0's multi_logloss: 0.294064
[200]	valid_0's multi_error: 0.120679	valid_0's multi_logloss: 0.283392
[250]	valid_0's multi_error: 0.117781	valid_0's multi_logloss: 0.275533
[300]	valid_0's multi_error: 0.115582	valid_0's multi_logloss: 0.270161
[350]	valid_0's multi_error: 0.11478	valid_0's multi_logloss: 0.266387
[400]	valid_0's multi_error: 0.113434	valid_0's multi_logloss: 0.263381
[450]	valid_0's multi_error: 0.112554	valid_0's multi_logloss: 0.261218
[500]	valid_0's multi_error: 0.112037	valid_0's multi_logloss: 0.259477
[550]	valid_0's multi_error: 0.111131	valid_0's multi_logloss: 0.257673
Early stopping, best iteration is:
[567]	valid_0's multi_error: 0.11064	valid_0's multi_logloss: 0.257237
Training until validation scores don't improve for 30 rounds
[50]	valid_0's multi_error: 0.14407	valid_0's multi_logloss: 0.36291
[100]	valid_0's multi_error: 0.132555	valid_0's multi_logloss: 0.314724
[150]	valid_0's multi_error: 0.126759	valid_0's multi_logloss: 0.29657
[200]	valid_0's multi_error: 0.122982	valid_0's multi_logloss: 0.285214
[250]	valid_0's multi_error: 0.120058	valid_0's multi_logloss: 0.277886
[300]	valid_0's multi_error: 0.117729	valid_0's multi_logloss: 0.272747
[350]	valid_0's multi_error: 0.116125	valid_0's multi_logloss: 0.268532
[400]	valid_0's multi_error: 0.114366	valid_0's multi_logloss: 0.265379
[450]	valid_0's multi_error: 0.11346	valid_0's multi_logloss: 0.262666
[500]	valid_0's multi_error: 0.111649	valid_0's multi_logloss: 0.261075
[550]	valid_0's multi_error: 0.111312	valid_0's multi_logloss: 0.259683
[600]	valid_0's multi_error: 0.110355	valid_0's multi_logloss: 0.258755
[650]	valid_0's multi_error: 0.109708	valid_0's multi_logloss: 0.25782
[700]	valid_0's multi_error: 0.108673	valid_0's multi_logloss: 0.256975
Early stopping, best iteration is:
[700]	valid_0's multi_error: 0.108673	valid_0's multi_logloss: 0.256975
Training until validation scores don't improve for 30 rounds
[50]	valid_0's multi_error: 0.146916	valid_0's multi_logloss: 0.366861
[100]	valid_0's multi_error: 0.133823	valid_0's multi_logloss: 0.317838
[150]	valid_0's multi_error: 0.128441	valid_0's multi_logloss: 0.299545
[200]	valid_0's multi_error: 0.12368	valid_0's multi_logloss: 0.288207
[250]	valid_0's multi_error: 0.121378	valid_0's multi_logloss: 0.280843
[300]	valid_0's multi_error: 0.118454	valid_0's multi_logloss: 0.275329
[350]	valid_0's multi_error: 0.117186	valid_0's multi_logloss: 0.271188
[400]	valid_0's multi_error: 0.115866	valid_0's multi_logloss: 0.268507
[450]	valid_0's multi_error: 0.114521	valid_0's multi_logloss: 0.266097
[500]	valid_0's multi_error: 0.1139	valid_0's multi_logloss: 0.264338
[550]	valid_0's multi_error: 0.113434	valid_0's multi_logloss: 0.263099
Early stopping, best iteration is:
[556]	valid_0's multi_error: 0.112813	valid_0's multi_logloss: 0.262834
