[I 2025-06-12 01:06:26,139] Trial 23 finished with value: 0.8873862036709644 and parameters: {'boosting_type': 'goss', 'learning_rate': 0.07925259156664459, 'num_leaves': 50, 'max_depth': 8, 'min_data_in_leaf': 20, 'feature_fraction': 0.6375070686006441, 'lambda_l1': 1.0093891206267762, 'lambda_l2': 4.995014829050006, 'min_gain_to_split': 0.04199195088854069, 'max_bin': 101}. Best is trial 11 with value: 0.888762461860649.
Training until validation scores don't improve for 30 rounds
[50]	valid_0's multi_error: 0.135712	valid_0's multi_logloss: 0.322605
[100]	valid_0's multi_error: 0.125	valid_0's multi_logloss: 0.293218
[150]	valid_0's multi_error: 0.120524	valid_0's multi_logloss: 0.279384
[200]	valid_0's multi_error: 0.11685	valid_0's multi_logloss: 0.271507
[250]	valid_0's multi_error: 0.114236	valid_0's multi_logloss: 0.267178
[300]	valid_0's multi_error: 0.113175	valid_0's multi_logloss: 0.263532
[350]	valid_0's multi_error: 0.111959	valid_0's multi_logloss: 0.261326
[400]	valid_0's multi_error: 0.110924	valid_0's multi_logloss: 0.259265
[450]	valid_0's multi_error: 0.111157	valid_0's multi_logloss: 0.259042
Early stopping, best iteration is:
[423]	valid_0's multi_error: 0.110303	valid_0's multi_logloss: 0.258878
Training until validation scores don't improve for 30 rounds
[50]	valid_0's multi_error: 0.136048	valid_0's multi_logloss: 0.325176
[100]	valid_0's multi_error: 0.127096	valid_0's multi_logloss: 0.296676
[150]	valid_0's multi_error: 0.122335	valid_0's multi_logloss: 0.28271
[200]	valid_0's multi_error: 0.120161	valid_0's multi_logloss: 0.2749
[250]	valid_0's multi_error: 0.117005	valid_0's multi_logloss: 0.269645
[300]	valid_0's multi_error: 0.115194	valid_0's multi_logloss: 0.266376
[350]	valid_0's multi_error: 0.114159	valid_0's multi_logloss: 0.263908
[400]	valid_0's multi_error: 0.11302	valid_0's multi_logloss: 0.262462
[450]	valid_0's multi_error: 0.112554	valid_0's multi_logloss: 0.261568
[500]	valid_0's multi_error: 0.111959	valid_0's multi_logloss: 0.260874
[550]	valid_0's multi_error: 0.111752	valid_0's multi_logloss: 0.261035
Early stopping, best iteration is:
[523]	valid_0's multi_error: 0.111571	valid_0's multi_logloss: 0.260591
Training until validation scores don't improve for 30 rounds
[50]	valid_0's multi_error: 0.138118	valid_0's multi_logloss: 0.326034
[100]	valid_0's multi_error: 0.128959	valid_0's multi_logloss: 0.297715
[150]	valid_0's multi_error: 0.123525	valid_0's multi_logloss: 0.284706
[200]	valid_0's multi_error: 0.121196	valid_0's multi_logloss: 0.277605
[250]	valid_0's multi_error: 0.119592	valid_0's multi_logloss: 0.272786
[300]	valid_0's multi_error: 0.118195	valid_0's multi_logloss: 0.270494
[350]	valid_0's multi_error: 0.116746	valid_0's multi_logloss: 0.267812
[400]	valid_0's multi_error: 0.115401	valid_0's multi_logloss: 0.266131
Early stopping, best iteration is:
[416]	valid_0's multi_error: 0.114133	valid_0's multi_logloss: 0.265918
[I 2025-06-12 01:09:05,759] Trial 24 finished with value: 0.8861373152661497 and parameters: {'boosting_type': 'goss', 'learning_rate': 0.15005092053166744, 'num_leaves': 39, 'max_depth': 8, 'min_data_in_leaf': 18, 'feature_fraction': 0.7067800545738864, 'lambda_l1': 0.007049639576792055, 'lambda_l2': 4.97185638026524, 'min_gain_to_split': 0.027693652489740504, 'max_bin': 98}. Best is trial 11 with value: 0.888762461860649.
Training until validation scores don't improve for 30 rounds
[50]	valid_0's multi_error: 0.136514	valid_0's multi_logloss: 0.324951
[100]	valid_0's multi_error: 0.126578	valid_0's multi_logloss: 0.296351
[150]	valid_0's multi_error: 0.12262	valid_0's multi_logloss: 0.284392
[200]	valid_0's multi_error: 0.119385	valid_0's multi_logloss: 0.27866
[250]	valid_0's multi_error: 0.117703	valid_0's multi_logloss: 0.275543
[300]	valid_0's multi_error: 0.11716	valid_0's multi_logloss: 0.273836
Early stopping, best iteration is:
[271]	valid_0's multi_error: 0.116513	valid_0's multi_logloss: 0.274774
Training until validation scores don't improve for 30 rounds
[50]	valid_0's multi_error: 0.137575	valid_0's multi_logloss: 0.325948
[100]	valid_0's multi_error: 0.126708	valid_0's multi_logloss: 0.296969
[150]	valid_0's multi_error: 0.12205	valid_0's multi_logloss: 0.286826
[200]	valid_0's multi_error: 0.119308	valid_0's multi_logloss: 0.281725
[250]	valid_0's multi_error: 0.118635	valid_0's multi_logloss: 0.278501
[300]	valid_0's multi_error: 0.118117	valid_0's multi_logloss: 0.277615
Early stopping, best iteration is:
[283]	valid_0's multi_error: 0.117729	valid_0's multi_logloss: 0.27809
Training until validation scores don't improve for 30 rounds
[50]	valid_0's multi_error: 0.14112	valid_0's multi_logloss: 0.330674
[100]	valid_0's multi_error: 0.129657	valid_0's multi_logloss: 0.30174
[150]	valid_0's multi_error: 0.125259	valid_0's multi_logloss: 0.29029
[200]	valid_0's multi_error: 0.122697	valid_0's multi_logloss: 0.285129
[250]	valid_0's multi_error: 0.121041	valid_0's multi_logloss: 0.281945
Early stopping, best iteration is:
[261]	valid_0's multi_error: 0.120291	valid_0's multi_logloss: 0.281493
[I 2025-06-12 01:10:30,778] Trial 25 finished with value: 0.879693967411216 and parameters: {'boosting_type': 'goss', 'learning_rate': 0.1981970293221075, 'num_leaves': 61, 'max_depth': 6, 'min_data_in_leaf': 10, 'feature_fraction': 0.6259004431938593, 'lambda_l1': 2.5801671355834426, 'lambda_l2': 4.99709975959344, 'min_gain_to_split': 1.130401717319252, 'max_bin': 84}. Best is trial 11 with value: 0.888762461860649.
Training until validation scores don't improve for 30 rounds
[50]	valid_0's multi_error: 0.158456	valid_0's multi_logloss: 0.520177
[100]	valid_0's multi_error: 0.147174	valid_0's multi_logloss: 0.400183
[150]	valid_0's multi_error: 0.140137	valid_0's multi_logloss: 0.354947
[200]	valid_0's multi_error: 0.134781	valid_0's multi_logloss: 0.331356
[250]	valid_0's multi_error: 0.130408	valid_0's multi_logloss: 0.316209
[300]	valid_0's multi_error: 0.127432	valid_0's multi_logloss: 0.306693
[350]	valid_0's multi_error: 0.124586	valid_0's multi_logloss: 0.299334
[400]	valid_0's multi_error: 0.122671	valid_0's multi_logloss: 0.293506
[450]	valid_0's multi_error: 0.120757	valid_0's multi_logloss: 0.288811
[500]	valid_0's multi_error: 0.119101	valid_0's multi_logloss: 0.28459
[550]	valid_0's multi_error: 0.11835	valid_0's multi_logloss: 0.281316
[600]	valid_0's multi_error: 0.117005	valid_0's multi_logloss: 0.278304
[650]	valid_0's multi_error: 0.116694	valid_0's multi_logloss: 0.275663
Early stopping, best iteration is:
[637]	valid_0's multi_error: 0.116436	valid_0's multi_logloss: 0.276383
Training until validation scores don't improve for 30 rounds
[50]	valid_0's multi_error: 0.157473	valid_0's multi_logloss: 0.519717
[100]	valid_0's multi_error: 0.148054	valid_0's multi_logloss: 0.400926
[150]	valid_0's multi_error: 0.141637	valid_0's multi_logloss: 0.356368
[200]	valid_0's multi_error: 0.135634	valid_0's multi_logloss: 0.332969
[250]	valid_0's multi_error: 0.130951	valid_0's multi_logloss: 0.317857
[300]	valid_0's multi_error: 0.128415	valid_0's multi_logloss: 0.308405
[350]	valid_0's multi_error: 0.12575	valid_0's multi_logloss: 0.301392
[400]	valid_0's multi_error: 0.124715	valid_0's multi_logloss: 0.295714
[450]	valid_0's multi_error: 0.123034	valid_0's multi_logloss: 0.291122
[500]	valid_0's multi_error: 0.121636	valid_0's multi_logloss: 0.287133
[550]	valid_0's multi_error: 0.120368	valid_0's multi_logloss: 0.283867
[600]	valid_0's multi_error: 0.119204	valid_0's multi_logloss: 0.280994
[650]	valid_0's multi_error: 0.118738	valid_0's multi_logloss: 0.278613
[700]	valid_0's multi_error: 0.11804	valid_0's multi_logloss: 0.276387
Early stopping, best iteration is:
[672]	valid_0's multi_error: 0.117833	valid_0's multi_logloss: 0.277571
Training until validation scores don't improve for 30 rounds
[50]	valid_0's multi_error: 0.161043	valid_0's multi_logloss: 0.522786
[100]	valid_0's multi_error: 0.151547	valid_0's multi_logloss: 0.404895
[150]	valid_0's multi_error: 0.144044	valid_0's multi_logloss: 0.360588
[200]	valid_0's multi_error: 0.139128	valid_0's multi_logloss: 0.337245
[250]	valid_0's multi_error: 0.135376	valid_0's multi_logloss: 0.321714
[300]	valid_0's multi_error: 0.132064	valid_0's multi_logloss: 0.31181
[350]	valid_0's multi_error: 0.12914	valid_0's multi_logloss: 0.304105
[400]	valid_0's multi_error: 0.127148	valid_0's multi_logloss: 0.298377
[450]	valid_0's multi_error: 0.125336	valid_0's multi_logloss: 0.293557
[500]	valid_0's multi_error: 0.12412	valid_0's multi_logloss: 0.28993
[550]	valid_0's multi_error: 0.122749	valid_0's multi_logloss: 0.286584
[600]	valid_0's multi_error: 0.121714	valid_0's multi_logloss: 0.283526
[650]	valid_0's multi_error: 0.120782	valid_0's multi_logloss: 0.280705
[700]	valid_0's multi_error: 0.119437	valid_0's multi_logloss: 0.278287
[750]	valid_0's multi_error: 0.118454	valid_0's multi_logloss: 0.276371
[800]	valid_0's multi_error: 0.117729	valid_0's multi_logloss: 0.274505
[850]	valid_0's multi_error: 0.117134	valid_0's multi_logloss: 0.272896
Early stopping, best iteration is:
[852]	valid_0's multi_error: 0.116591	valid_0's multi_logloss: 0.272824
[I 2025-06-12 01:15:22,286] Trial 26 finished with value: 0.8808049988592984 and parameters: {'boosting_type': 'goss', 'learning_rate': 0.02832919103441793, 'num_leaves': 50, 'max_depth': 9, 'min_data_in_leaf': 30, 'feature_fraction': 0.6017999461750818, 'lambda_l1': 1.9210080423320146, 'lambda_l2': 4.097431620636788, 'min_gain_to_split': 0.3931044010653796, 'max_bin': 66}. Best is trial 11 with value: 0.888762461860649.
Training until validation scores don't improve for 30 rounds
[50]	valid_0's multi_error: 0.157162	valid_0's multi_logloss: 0.404208
[100]	valid_0's multi_error: 0.141818	valid_0's multi_logloss: 0.345116
[150]	valid_0's multi_error: 0.134418	valid_0's multi_logloss: 0.322274
[200]	valid_0's multi_error: 0.129735	valid_0's multi_logloss: 0.308864
[250]	valid_0's multi_error: 0.125517	valid_0's multi_logloss: 0.299274
[300]	valid_0's multi_error: 0.122671	valid_0's multi_logloss: 0.292171
[350]	valid_0's multi_error: 0.120575	valid_0's multi_logloss: 0.287054
[400]	valid_0's multi_error: 0.119049	valid_0's multi_logloss: 0.28338
Early stopping, best iteration is:
[394]	valid_0's multi_error: 0.118997	valid_0's multi_logloss: 0.283778
Training until validation scores don't improve for 30 rounds
[50]	valid_0's multi_error: 0.15561	valid_0's multi_logloss: 0.403912
[100]	valid_0's multi_error: 0.142491	valid_0's multi_logloss: 0.34567
[150]	valid_0's multi_error: 0.136281	valid_0's multi_logloss: 0.324077
[200]	valid_0's multi_error: 0.131288	valid_0's multi_logloss: 0.31135
[250]	valid_0's multi_error: 0.127743	valid_0's multi_logloss: 0.301888
[300]	valid_0's multi_error: 0.125647	valid_0's multi_logloss: 0.295204
[350]	valid_0's multi_error: 0.122671	valid_0's multi_logloss: 0.290653
[400]	valid_0's multi_error: 0.121326	valid_0's multi_logloss: 0.287462
[450]	valid_0's multi_error: 0.120575	valid_0's multi_logloss: 0.28493
[500]	valid_0's multi_error: 0.120058	valid_0's multi_logloss: 0.28307
Early stopping, best iteration is:
[487]	valid_0's multi_error: 0.119851	valid_0's multi_logloss: 0.283581
Training until validation scores don't improve for 30 rounds
[50]	valid_0's multi_error: 0.158689	valid_0's multi_logloss: 0.407398
[100]	valid_0's multi_error: 0.144794	valid_0's multi_logloss: 0.350296
[150]	valid_0's multi_error: 0.137549	valid_0's multi_logloss: 0.327566
[200]	valid_0's multi_error: 0.133901	valid_0's multi_logloss: 0.314664
[250]	valid_0's multi_error: 0.13121	valid_0's multi_logloss: 0.305523
[300]	valid_0's multi_error: 0.128415	valid_0's multi_logloss: 0.299039
[350]	valid_0's multi_error: 0.126966	valid_0's multi_logloss: 0.294093
[400]	valid_0's multi_error: 0.125207	valid_0's multi_logloss: 0.290349
[450]	valid_0's multi_error: 0.123318	valid_0's multi_logloss: 0.287323
[500]	valid_0's multi_error: 0.121843	valid_0's multi_logloss: 0.285126
[550]	valid_0's multi_error: 0.120472	valid_0's multi_logloss: 0.283602
[600]	valid_0's multi_error: 0.120161	valid_0's multi_logloss: 0.282101
[650]	valid_0's multi_error: 0.11967	valid_0's multi_logloss: 0.281377
Early stopping, best iteration is:
[656]	valid_0's multi_error: 0.119282	valid_0's multi_logloss: 0.281263
[I 2025-06-12 01:17:48,963] Trial 27 finished with value: 0.8782855896554382 and parameters: {'boosting_type': 'goss', 'learning_rate': 0.06449828783521327, 'num_leaves': 75, 'max_depth': 6, 'min_data_in_leaf': 18, 'feature_fraction': 0.6847536077430341, 'lambda_l1': 1.1154047212148677, 'lambda_l2': 4.545315296238775, 'min_gain_to_split': 1.881522978799871, 'max_bin': 137}. Best is trial 11 with value: 0.888762461860649.
Training until validation scores don't improve for 30 rounds
[50]	valid_0's multi_error: 0.156101	valid_0's multi_logloss: 0.47656
[100]	valid_0's multi_error: 0.144173	valid_0's multi_logloss: 0.373041
[150]	valid_0's multi_error: 0.138067	valid_0's multi_logloss: 0.335882
[200]	valid_0's multi_error: 0.132193	valid_0's multi_logloss: 0.316876
[250]	valid_0's multi_error: 0.127872	valid_0's multi_logloss: 0.30491
[300]	valid_0's multi_error: 0.125181	valid_0's multi_logloss: 0.29671
[350]	valid_0's multi_error: 0.121869	valid_0's multi_logloss: 0.290389
[400]	valid_0's multi_error: 0.12011	valid_0's multi_logloss: 0.28572
[450]	valid_0's multi_error: 0.118454	valid_0's multi_logloss: 0.281983
Early stopping, best iteration is:
[467]	valid_0's multi_error: 0.117936	valid_0's multi_logloss: 0.280971
Training until validation scores don't improve for 30 rounds
[50]	valid_0's multi_error: 0.156205	valid_0's multi_logloss: 0.477152
[100]	valid_0's multi_error: 0.144328	valid_0's multi_logloss: 0.373779
[150]	valid_0's multi_error: 0.138015	valid_0's multi_logloss: 0.337269
[200]	valid_0's multi_error: 0.131831	valid_0's multi_logloss: 0.318675
[250]	valid_0's multi_error: 0.1287	valid_0's multi_logloss: 0.306995
[300]	valid_0's multi_error: 0.126915	valid_0's multi_logloss: 0.299208
[350]	valid_0's multi_error: 0.124871	valid_0's multi_logloss: 0.293556
[400]	valid_0's multi_error: 0.123059	valid_0's multi_logloss: 0.28892
[450]	valid_0's multi_error: 0.121869	valid_0's multi_logloss: 0.285487
[500]	valid_0's multi_error: 0.120575	valid_0's multi_logloss: 0.282359
[550]	valid_0's multi_error: 0.119773	valid_0's multi_logloss: 0.280043
Early stopping, best iteration is:
[563]	valid_0's multi_error: 0.119489	valid_0's multi_logloss: 0.279601
Training until validation scores don't improve for 30 rounds
[50]	valid_0's multi_error: 0.158818	valid_0's multi_logloss: 0.479953
[100]	valid_0's multi_error: 0.148494	valid_0's multi_logloss: 0.377211
[150]	valid_0's multi_error: 0.141301	valid_0's multi_logloss: 0.34093
[200]	valid_0's multi_error: 0.135402	valid_0's multi_logloss: 0.321965
[250]	valid_0's multi_error: 0.132012	valid_0's multi_logloss: 0.310725
[300]	valid_0's multi_error: 0.129218	valid_0's multi_logloss: 0.302674
[350]	valid_0's multi_error: 0.127717	valid_0's multi_logloss: 0.296807
[400]	valid_0's multi_error: 0.125724	valid_0's multi_logloss: 0.29208
[450]	valid_0's multi_error: 0.124897	valid_0's multi_logloss: 0.288242
[500]	valid_0's multi_error: 0.123629	valid_0's multi_logloss: 0.285465
[550]	valid_0's multi_error: 0.122516	valid_0's multi_logloss: 0.283123
[600]	valid_0's multi_error: 0.121714	valid_0's multi_logloss: 0.280999
[650]	valid_0's multi_error: 0.121248	valid_0's multi_logloss: 0.279226
Early stopping, best iteration is:
[641]	valid_0's multi_error: 0.120886	valid_0's multi_logloss: 0.279447
[I 2025-06-12 01:21:37,692] Trial 28 finished with value: 0.8782184178539962 and parameters: {'boosting_type': 'goss', 'learning_rate': 0.03239437079207792, 'num_leaves': 49, 'max_depth': 11, 'min_data_in_leaf': 45, 'feature_fraction': 0.7278893098149339, 'lambda_l1': 2.925437906130211, 'lambda_l2': 4.602477044158769, 'min_gain_to_split': 0.998121049277303, 'max_bin': 109}. Best is trial 11 with value: 0.888762461860649.
Training until validation scores don't improve for 30 rounds
[50]	valid_0's multi_error: 0.158533	valid_0's multi_logloss: 0.726423
[100]	valid_0's multi_error: 0.150564	valid_0's multi_logloss: 0.551878
[150]	valid_0's multi_error: 0.145622	valid_0's multi_logloss: 0.462975
[200]	valid_0's multi_error: 0.140861	valid_0's multi_logloss: 0.410172
[250]	valid_0's multi_error: 0.137265	valid_0's multi_logloss: 0.376498
[300]	valid_0's multi_error: 0.135841	valid_0's multi_logloss: 0.353873
[350]	valid_0's multi_error: 0.13328	valid_0's multi_logloss: 0.337374
[400]	valid_0's multi_error: 0.130641	valid_0's multi_logloss: 0.325146
[450]	valid_0's multi_error: 0.128804	valid_0's multi_logloss: 0.315633
[500]	valid_0's multi_error: 0.12707	valid_0's multi_logloss: 0.308115
[550]	valid_0's multi_error: 0.124638	valid_0's multi_logloss: 0.302142
[600]	valid_0's multi_error: 0.122852	valid_0's multi_logloss: 0.296975
[650]	valid_0's multi_error: 0.121585	valid_0's multi_logloss: 0.292591
[700]	valid_0's multi_error: 0.120239	valid_0's multi_logloss: 0.288822
[750]	valid_0's multi_error: 0.119049	valid_0's multi_logloss: 0.285676
[800]	valid_0's multi_error: 0.118298	valid_0's multi_logloss: 0.282812
[850]	valid_0's multi_error: 0.117884	valid_0's multi_logloss: 0.280229
[900]	valid_0's multi_error: 0.116798	valid_0's multi_logloss: 0.277861
[950]	valid_0's multi_error: 0.115789	valid_0's multi_logloss: 0.275778
[1000]	valid_0's multi_error: 0.114883	valid_0's multi_logloss: 0.273809
Did not meet early stopping. Best iteration is:
[999]	valid_0's multi_error: 0.114883	valid_0's multi_logloss: 0.273848
Training until validation scores don't improve for 30 rounds
[50]	valid_0's multi_error: 0.158145	valid_0's multi_logloss: 0.726707
[100]	valid_0's multi_error: 0.151263	valid_0's multi_logloss: 0.55248
[150]	valid_0's multi_error: 0.146321	valid_0's multi_logloss: 0.463395
[200]	valid_0's multi_error: 0.142362	valid_0's multi_logloss: 0.410676
[250]	valid_0's multi_error: 0.139748	valid_0's multi_logloss: 0.376949
[300]	valid_0's multi_error: 0.136618	valid_0's multi_logloss: 0.354259
[350]	valid_0's multi_error: 0.133953	valid_0's multi_logloss: 0.338124
[400]	valid_0's multi_error: 0.131909	valid_0's multi_logloss: 0.32593
[450]	valid_0's multi_error: 0.129502	valid_0's multi_logloss: 0.31647
[500]	valid_0's multi_error: 0.12795	valid_0's multi_logloss: 0.309042
[550]	valid_0's multi_error: 0.12588	valid_0's multi_logloss: 0.303043
[600]	valid_0's multi_error: 0.124638	valid_0's multi_logloss: 0.297999
[650]	valid_0's multi_error: 0.123525	valid_0's multi_logloss: 0.293891
[700]	valid_0's multi_error: 0.12262	valid_0's multi_logloss: 0.290276
[750]	valid_0's multi_error: 0.121895	valid_0's multi_logloss: 0.287082
[800]	valid_0's multi_error: 0.121015	valid_0's multi_logloss: 0.284459
[850]	valid_0's multi_error: 0.120343	valid_0's multi_logloss: 0.282013
[900]	valid_0's multi_error: 0.119644	valid_0's multi_logloss: 0.279893
[950]	valid_0's multi_error: 0.118635	valid_0's multi_logloss: 0.278007
[1000]	valid_0's multi_error: 0.11835	valid_0's multi_logloss: 0.27632
Did not meet early stopping. Best iteration is:
[983]	valid_0's multi_error: 0.117962	valid_0's multi_logloss: 0.276841
Training until validation scores don't improve for 30 rounds
[50]	valid_0's multi_error: 0.159905	valid_0's multi_logloss: 0.726842
[100]	valid_0's multi_error: 0.154497	valid_0's multi_logloss: 0.554157
[150]	valid_0's multi_error: 0.149115	valid_0's multi_logloss: 0.46655
[200]	valid_0's multi_error: 0.146321	valid_0's multi_logloss: 0.414279
[250]	valid_0's multi_error: 0.143578	valid_0's multi_logloss: 0.380978
[300]	valid_0's multi_error: 0.140758	valid_0's multi_logloss: 0.358775
[350]	valid_0's multi_error: 0.137756	valid_0's multi_logloss: 0.342594
[400]	valid_0's multi_error: 0.135402	valid_0's multi_logloss: 0.330393
[450]	valid_0's multi_error: 0.134211	valid_0's multi_logloss: 0.321021
[500]	valid_0's multi_error: 0.131106	valid_0's multi_logloss: 0.313372
[550]	valid_0's multi_error: 0.129787	valid_0's multi_logloss: 0.307264
[600]	valid_0's multi_error: 0.127613	valid_0's multi_logloss: 0.302297
[650]	valid_0's multi_error: 0.126501	valid_0's multi_logloss: 0.297947
[700]	valid_0's multi_error: 0.124974	valid_0's multi_logloss: 0.294275
[750]	valid_0's multi_error: 0.124586	valid_0's multi_logloss: 0.291142
[800]	valid_0's multi_error: 0.124017	valid_0's multi_logloss: 0.288187
[850]	valid_0's multi_error: 0.123008	valid_0's multi_logloss: 0.285672
[900]	valid_0's multi_error: 0.121973	valid_0's multi_logloss: 0.2834
Early stopping, best iteration is:
[901]	valid_0's multi_error: 0.121869	valid_0's multi_logloss: 0.283346
