[I 2025-06-12 09:34:18,129] Trial 158 finished with value: 0.8899245049684924 and parameters: {'boosting_type': 'goss', 'learning_rate': 0.05771830858438656, 'num_leaves': 138, 'max_depth': 13, 'min_data_in_leaf': 19, 'feature_fraction': 0.9755757596887309, 'lambda_l1': 0.2685771893729655, 'lambda_l2': 4.051345528901022, 'min_gain_to_split': 0.08501388681537088, 'max_bin': 75}. Best is trial 124 with value: 0.8905374485574505.
Training until validation scores don't improve for 30 rounds
[50]	valid_0's multi_error: 0.147356	valid_0's multi_logloss: 0.626598
[100]	valid_0's multi_error: 0.139335	valid_0's multi_logloss: 0.458608
[150]	valid_0's multi_error: 0.134185	valid_0's multi_logloss: 0.383602
[200]	valid_0's multi_error: 0.130304	valid_0's multi_logloss: 0.343424
[250]	valid_0's multi_error: 0.126138	valid_0's multi_logloss: 0.319257
[300]	valid_0's multi_error: 0.122076	valid_0's multi_logloss: 0.303456
[350]	valid_0's multi_error: 0.119385	valid_0's multi_logloss: 0.292679
[400]	valid_0's multi_error: 0.117859	valid_0's multi_logloss: 0.28456
[450]	valid_0's multi_error: 0.116591	valid_0's multi_logloss: 0.278411
[500]	valid_0's multi_error: 0.115168	valid_0's multi_logloss: 0.27333
[550]	valid_0's multi_error: 0.114133	valid_0's multi_logloss: 0.269513
[600]	valid_0's multi_error: 0.11302	valid_0's multi_logloss: 0.265987
[650]	valid_0's multi_error: 0.111752	valid_0's multi_logloss: 0.263114
[700]	valid_0's multi_error: 0.111183	valid_0's multi_logloss: 0.260706
Early stopping, best iteration is:
[703]	valid_0's multi_error: 0.110976	valid_0's multi_logloss: 0.260613
Training until validation scores don't improve for 30 rounds
[50]	valid_0's multi_error: 0.147744	valid_0's multi_logloss: 0.627504
[100]	valid_0's multi_error: 0.141172	valid_0's multi_logloss: 0.45941
[150]	valid_0's multi_error: 0.136178	valid_0's multi_logloss: 0.384615
[200]	valid_0's multi_error: 0.131831	valid_0's multi_logloss: 0.34484
[250]	valid_0's multi_error: 0.127769	valid_0's multi_logloss: 0.321109
[300]	valid_0's multi_error: 0.125052	valid_0's multi_logloss: 0.305509
[350]	valid_0's multi_error: 0.122775	valid_0's multi_logloss: 0.294535
[400]	valid_0's multi_error: 0.120084	valid_0's multi_logloss: 0.286501
[450]	valid_0's multi_error: 0.118816	valid_0's multi_logloss: 0.280491
[500]	valid_0's multi_error: 0.117367	valid_0's multi_logloss: 0.275786
[550]	valid_0's multi_error: 0.115918	valid_0's multi_logloss: 0.271856
[600]	valid_0's multi_error: 0.114935	valid_0's multi_logloss: 0.268515
[650]	valid_0's multi_error: 0.11377	valid_0's multi_logloss: 0.265829
[700]	valid_0's multi_error: 0.11271	valid_0's multi_logloss: 0.26333
[750]	valid_0's multi_error: 0.112037	valid_0's multi_logloss: 0.261188
[800]	valid_0's multi_error: 0.111778	valid_0's multi_logloss: 0.25943
Early stopping, best iteration is:
[780]	valid_0's multi_error: 0.111545	valid_0's multi_logloss: 0.26009
Training until validation scores don't improve for 30 rounds
[50]	valid_0's multi_error: 0.150771	valid_0's multi_logloss: 0.628541
[100]	valid_0's multi_error: 0.143216	valid_0's multi_logloss: 0.462065
[150]	valid_0's multi_error: 0.138377	valid_0's multi_logloss: 0.388213
[200]	valid_0's multi_error: 0.13491	valid_0's multi_logloss: 0.348636
[250]	valid_0's multi_error: 0.130718	valid_0's multi_logloss: 0.324893
[300]	valid_0's multi_error: 0.127251	valid_0's multi_logloss: 0.30906
[350]	valid_0's multi_error: 0.124508	valid_0's multi_logloss: 0.29791
[400]	valid_0's multi_error: 0.123059	valid_0's multi_logloss: 0.289799
[450]	valid_0's multi_error: 0.121455	valid_0's multi_logloss: 0.283442
[500]	valid_0's multi_error: 0.119618	valid_0's multi_logloss: 0.278501
[550]	valid_0's multi_error: 0.118143	valid_0's multi_logloss: 0.274358
[600]	valid_0's multi_error: 0.116487	valid_0's multi_logloss: 0.271174
[650]	valid_0's multi_error: 0.115556	valid_0's multi_logloss: 0.268525
[700]	valid_0's multi_error: 0.115038	valid_0's multi_logloss: 0.266203
[750]	valid_0's multi_error: 0.114417	valid_0's multi_logloss: 0.264114
[800]	valid_0's multi_error: 0.113279	valid_0's multi_logloss: 0.262331
[850]	valid_0's multi_error: 0.112942	valid_0's multi_logloss: 0.260693
[900]	valid_0's multi_error: 0.11227	valid_0's multi_logloss: 0.259362
[950]	valid_0's multi_error: 0.111778	valid_0's multi_logloss: 0.258112
[1000]	valid_0's multi_error: 0.111519	valid_0's multi_logloss: 0.257069
Did not meet early stopping. Best iteration is:
[996]	valid_0's multi_error: 0.111261	valid_0's multi_logloss: 0.257133
[I 2025-06-12 09:44:55,839] Trial 159 finished with value: 0.8866686869639108 and parameters: {'boosting_type': 'goss', 'learning_rate': 0.013521957628547153, 'num_leaves': 135, 'max_depth': 14, 'min_data_in_leaf': 17, 'feature_fraction': 0.9596545273953423, 'lambda_l1': 0.12534738454250294, 'lambda_l2': 3.9345272594628584, 'min_gain_to_split': 0.0816839990395567, 'max_bin': 76}. Best is trial 124 with value: 0.8905374485574505.
Training until validation scores don't improve for 30 rounds
[50]	valid_0's multi_error: 0.130097	valid_0's multi_logloss: 0.333646
[100]	valid_0's multi_error: 0.118557	valid_0's multi_logloss: 0.282563
[150]	valid_0's multi_error: 0.11346	valid_0's multi_logloss: 0.266759
[200]	valid_0's multi_error: 0.110872	valid_0's multi_logloss: 0.258538
[250]	valid_0's multi_error: 0.109734	valid_0's multi_logloss: 0.253495
[300]	valid_0's multi_error: 0.107871	valid_0's multi_logloss: 0.250664
[350]	valid_0's multi_error: 0.106629	valid_0's multi_logloss: 0.249058
Early stopping, best iteration is:
[348]	valid_0's multi_error: 0.1065	valid_0's multi_logloss: 0.249132
Training until validation scores don't improve for 30 rounds
[50]	valid_0's multi_error: 0.130667	valid_0's multi_logloss: 0.333029
[100]	valid_0's multi_error: 0.120343	valid_0's multi_logloss: 0.283425
[150]	valid_0's multi_error: 0.11597	valid_0's multi_logloss: 0.267951
[200]	valid_0's multi_error: 0.112166	valid_0's multi_logloss: 0.259719
[250]	valid_0's multi_error: 0.110096	valid_0's multi_logloss: 0.255211
[300]	valid_0's multi_error: 0.109631	valid_0's multi_logloss: 0.252843
[350]	valid_0's multi_error: 0.108259	valid_0's multi_logloss: 0.251365
Early stopping, best iteration is:
[364]	valid_0's multi_error: 0.108052	valid_0's multi_logloss: 0.251055
Training until validation scores don't improve for 30 rounds
[50]	valid_0's multi_error: 0.13447	valid_0's multi_logloss: 0.33746
[100]	valid_0's multi_error: 0.122878	valid_0's multi_logloss: 0.287094
[150]	valid_0's multi_error: 0.117108	valid_0's multi_logloss: 0.270859
[200]	valid_0's multi_error: 0.114055	valid_0's multi_logloss: 0.262689
[250]	valid_0's multi_error: 0.111519	valid_0's multi_logloss: 0.258525
[300]	valid_0's multi_error: 0.109708	valid_0's multi_logloss: 0.25595
Early stopping, best iteration is:
[308]	valid_0's multi_error: 0.109579	valid_0's multi_logloss: 0.255735
[I 2025-06-12 09:49:35,436] Trial 160 finished with value: 0.8900537773633544 and parameters: {'boosting_type': 'goss', 'learning_rate': 0.06048094681767089, 'num_leaves': 138, 'max_depth': 13, 'min_data_in_leaf': 18, 'feature_fraction': 0.9802272134782163, 'lambda_l1': 0.2972002116131299, 'lambda_l2': 4.069803351466493, 'min_gain_to_split': 0.12699401623634207, 'max_bin': 70}. Best is trial 124 with value: 0.8905374485574505.
Training until validation scores don't improve for 30 rounds
[50]	valid_0's multi_error: 0.128131	valid_0's multi_logloss: 0.332388
[100]	valid_0's multi_error: 0.117652	valid_0's multi_logloss: 0.280858
[150]	valid_0's multi_error: 0.111804	valid_0's multi_logloss: 0.264472
[200]	valid_0's multi_error: 0.109993	valid_0's multi_logloss: 0.256572
[250]	valid_0's multi_error: 0.10888	valid_0's multi_logloss: 0.251685
[300]	valid_0's multi_error: 0.107043	valid_0's multi_logloss: 0.248919
Early stopping, best iteration is:
[303]	valid_0's multi_error: 0.106603	valid_0's multi_logloss: 0.24889
Training until validation scores don't improve for 30 rounds
[50]	valid_0's multi_error: 0.130511	valid_0's multi_logloss: 0.333239
[100]	valid_0's multi_error: 0.119101	valid_0's multi_logloss: 0.283747
[150]	valid_0's multi_error: 0.114159	valid_0's multi_logloss: 0.267948
[200]	valid_0's multi_error: 0.11139	valid_0's multi_logloss: 0.259708
[250]	valid_0's multi_error: 0.110019	valid_0's multi_logloss: 0.254507
[300]	valid_0's multi_error: 0.108492	valid_0's multi_logloss: 0.251833
[350]	valid_0's multi_error: 0.107457	valid_0's multi_logloss: 0.250754
[400]	valid_0's multi_error: 0.106422	valid_0's multi_logloss: 0.249976
Early stopping, best iteration is:
[405]	valid_0's multi_error: 0.106319	valid_0's multi_logloss: 0.249933
Training until validation scores don't improve for 30 rounds
[50]	valid_0's multi_error: 0.134729	valid_0's multi_logloss: 0.338363
[100]	valid_0's multi_error: 0.122775	valid_0's multi_logloss: 0.287042
[150]	valid_0's multi_error: 0.116332	valid_0's multi_logloss: 0.271232
[200]	valid_0's multi_error: 0.11377	valid_0's multi_logloss: 0.263189
[250]	valid_0's multi_error: 0.11183	valid_0's multi_logloss: 0.258256
[300]	valid_0's multi_error: 0.110407	valid_0's multi_logloss: 0.255418
[350]	valid_0's multi_error: 0.110743	valid_0's multi_logloss: 0.254388
Early stopping, best iteration is:
[325]	valid_0's multi_error: 0.109812	valid_0's multi_logloss: 0.255145
[I 2025-06-12 09:54:14,970] Trial 161 finished with value: 0.890540722300088 and parameters: {'boosting_type': 'goss', 'learning_rate': 0.06057641623888476, 'num_leaves': 138, 'max_depth': 13, 'min_data_in_leaf': 19, 'feature_fraction': 0.9732000765463574, 'lambda_l1': 0.26195327459546586, 'lambda_l2': 4.0396232087571, 'min_gain_to_split': 0.16120653719111577, 'max_bin': 69}. Best is trial 161 with value: 0.890540722300088.
Training until validation scores don't improve for 30 rounds
[50]	valid_0's multi_error: 0.129683	valid_0's multi_logloss: 0.332919
[100]	valid_0's multi_error: 0.117988	valid_0's multi_logloss: 0.281196
[150]	valid_0's multi_error: 0.113615	valid_0's multi_logloss: 0.265214
[200]	valid_0's multi_error: 0.111054	valid_0's multi_logloss: 0.257087
[250]	valid_0's multi_error: 0.108311	valid_0's multi_logloss: 0.252051
[300]	valid_0's multi_error: 0.107509	valid_0's multi_logloss: 0.249347
[350]	valid_0's multi_error: 0.106526	valid_0's multi_logloss: 0.248093
Early stopping, best iteration is:
[323]	valid_0's multi_error: 0.106241	valid_0's multi_logloss: 0.24854
Training until validation scores don't improve for 30 rounds
[50]	valid_0's multi_error: 0.131417	valid_0's multi_logloss: 0.334375
[100]	valid_0's multi_error: 0.120136	valid_0's multi_logloss: 0.283201
[150]	valid_0's multi_error: 0.115401	valid_0's multi_logloss: 0.267378
[200]	valid_0's multi_error: 0.112192	valid_0's multi_logloss: 0.259719
[250]	valid_0's multi_error: 0.111054	valid_0's multi_logloss: 0.255237
[300]	valid_0's multi_error: 0.110148	valid_0's multi_logloss: 0.252812
Early stopping, best iteration is:
[275]	valid_0's multi_error: 0.109941	valid_0's multi_logloss: 0.253851
Training until validation scores don't improve for 30 rounds
[50]	valid_0's multi_error: 0.134056	valid_0's multi_logloss: 0.337761
[100]	valid_0's multi_error: 0.122542	valid_0's multi_logloss: 0.286814
[150]	valid_0's multi_error: 0.117031	valid_0's multi_logloss: 0.269994
[200]	valid_0's multi_error: 0.113512	valid_0's multi_logloss: 0.26186
[250]	valid_0's multi_error: 0.111675	valid_0's multi_logloss: 0.257383
[300]	valid_0's multi_error: 0.110976	valid_0's multi_logloss: 0.255466
[350]	valid_0's multi_error: 0.109812	valid_0's multi_logloss: 0.254424
Early stopping, best iteration is:
[346]	valid_0's multi_error: 0.109165	valid_0's multi_logloss: 0.254406
[I 2025-06-12 09:58:38,654] Trial 162 finished with value: 0.8896447489247516 and parameters: {'boosting_type': 'goss', 'learning_rate': 0.06029940126915631, 'num_leaves': 138, 'max_depth': 13, 'min_data_in_leaf': 14, 'feature_fraction': 0.9720819608432333, 'lambda_l1': 0.24087629561993135, 'lambda_l2': 4.024015637671749, 'min_gain_to_split': 0.10445489078142747, 'max_bin': 73}. Best is trial 161 with value: 0.890540722300088.
Training until validation scores don't improve for 30 rounds
[50]	valid_0's multi_error: 0.12738	valid_0's multi_logloss: 0.323927
[100]	valid_0's multi_error: 0.117186	valid_0's multi_logloss: 0.277038
[150]	valid_0's multi_error: 0.113279	valid_0's multi_logloss: 0.262373
[200]	valid_0's multi_error: 0.109553	valid_0's multi_logloss: 0.254965
[250]	valid_0's multi_error: 0.107276	valid_0's multi_logloss: 0.250988
[300]	valid_0's multi_error: 0.105542	valid_0's multi_logloss: 0.24846
Early stopping, best iteration is:
[317]	valid_0's multi_error: 0.104714	valid_0's multi_logloss: 0.247978
Training until validation scores don't improve for 30 rounds
[50]	valid_0's multi_error: 0.129813	valid_0's multi_logloss: 0.32644
[100]	valid_0's multi_error: 0.118298	valid_0's multi_logloss: 0.280417
[150]	valid_0's multi_error: 0.114081	valid_0's multi_logloss: 0.266128
[200]	valid_0's multi_error: 0.111105	valid_0's multi_logloss: 0.258848
[250]	valid_0's multi_error: 0.109346	valid_0's multi_logloss: 0.254818
[300]	valid_0's multi_error: 0.108285	valid_0's multi_logloss: 0.252987
[350]	valid_0's multi_error: 0.107845	valid_0's multi_logloss: 0.252015
Early stopping, best iteration is:
[338]	valid_0's multi_error: 0.107535	valid_0's multi_logloss: 0.251919
Training until validation scores don't improve for 30 rounds
[50]	valid_0's multi_error: 0.13359	valid_0's multi_logloss: 0.330549
[100]	valid_0's multi_error: 0.121766	valid_0's multi_logloss: 0.283614
[150]	valid_0's multi_error: 0.116643	valid_0's multi_logloss: 0.268911
[200]	valid_0's multi_error: 0.113563	valid_0's multi_logloss: 0.261934
[250]	valid_0's multi_error: 0.111882	valid_0's multi_logloss: 0.258323
[300]	valid_0's multi_error: 0.1102	valid_0's multi_logloss: 0.256131
[350]	valid_0's multi_error: 0.109398	valid_0's multi_logloss: 0.255208
Early stopping, best iteration is:
[360]	valid_0's multi_error: 0.109346	valid_0's multi_logloss: 0.255075
[I 2025-06-12 10:03:24,728] Trial 163 finished with value: 0.8909414087818414 and parameters: {'boosting_type': 'goss', 'learning_rate': 0.06515742561093978, 'num_leaves': 137, 'max_depth': 14, 'min_data_in_leaf': 15, 'feature_fraction': 0.9761741096390275, 'lambda_l1': 0.2447784532315171, 'lambda_l2': 4.046604355527795, 'min_gain_to_split': 0.08190062939055934, 'max_bin': 73}. Best is trial 163 with value: 0.8909414087818414.
Training until validation scores don't improve for 30 rounds
[50]	valid_0's multi_error: 0.127924	valid_0's multi_logloss: 0.323852
[100]	valid_0's multi_error: 0.116099	valid_0's multi_logloss: 0.276655
[150]	valid_0's multi_error: 0.112735	valid_0's multi_logloss: 0.261971
[200]	valid_0's multi_error: 0.109941	valid_0's multi_logloss: 0.254393
[250]	valid_0's multi_error: 0.107121	valid_0's multi_logloss: 0.250582
[300]	valid_0's multi_error: 0.106241	valid_0's multi_logloss: 0.248164
Early stopping, best iteration is:
[312]	valid_0's multi_error: 0.105542	valid_0's multi_logloss: 0.247912
Training until validation scores don't improve for 30 rounds
[50]	valid_0's multi_error: 0.129683	valid_0's multi_logloss: 0.325983
[100]	valid_0's multi_error: 0.120032	valid_0's multi_logloss: 0.279687
[150]	valid_0's multi_error: 0.114598	valid_0's multi_logloss: 0.265291
[200]	valid_0's multi_error: 0.112451	valid_0's multi_logloss: 0.258792
[250]	valid_0's multi_error: 0.111131	valid_0's multi_logloss: 0.254779
[300]	valid_0's multi_error: 0.10976	valid_0's multi_logloss: 0.253062
[350]	valid_0's multi_error: 0.108673	valid_0's multi_logloss: 0.252277
Early stopping, best iteration is:
[338]	valid_0's multi_error: 0.108182	valid_0's multi_logloss: 0.252142
Training until validation scores don't improve for 30 rounds
[50]	valid_0's multi_error: 0.133254	valid_0's multi_logloss: 0.329377
[100]	valid_0's multi_error: 0.122775	valid_0's multi_logloss: 0.282767
[150]	valid_0's multi_error: 0.117341	valid_0's multi_logloss: 0.268191
[200]	valid_0's multi_error: 0.114055	valid_0's multi_logloss: 0.260618
[250]	valid_0's multi_error: 0.112089	valid_0's multi_logloss: 0.257307
[300]	valid_0's multi_error: 0.111002	valid_0's multi_logloss: 0.255523
[350]	valid_0's multi_error: 0.11051	valid_0's multi_logloss: 0.254924
Early stopping, best iteration is:
[330]	valid_0's multi_error: 0.110096	valid_0's multi_logloss: 0.25484
[I 2025-06-12 10:08:02,134] Trial 164 finished with value: 0.8901746783253882 and parameters: {'boosting_type': 'goss', 'learning_rate': 0.06522680478190811, 'num_leaves': 138, 'max_depth': 14, 'min_data_in_leaf': 14, 'feature_fraction': 0.9738345099142485, 'lambda_l1': 0.1481879531466174, 'lambda_l2': 4.060886122201407, 'min_gain_to_split': 0.07919110421276604, 'max_bin': 74}. Best is trial 163 with value: 0.8909414087818414.
Training until validation scores don't improve for 30 rounds
[50]	valid_0's multi_error: 0.126138	valid_0's multi_logloss: 0.320922
[100]	valid_0's multi_error: 0.116436	valid_0's multi_logloss: 0.276461
[150]	valid_0's multi_error: 0.111856	valid_0's multi_logloss: 0.262024
[200]	valid_0's multi_error: 0.109424	valid_0's multi_logloss: 0.255087
[250]	valid_0's multi_error: 0.107379	valid_0's multi_logloss: 0.251313
[300]	valid_0's multi_error: 0.106422	valid_0's multi_logloss: 0.249088
Early stopping, best iteration is:
[286]	valid_0's multi_error: 0.105827	valid_0's multi_logloss: 0.249817
Training until validation scores don't improve for 30 rounds
[50]	valid_0's multi_error: 0.129425	valid_0's multi_logloss: 0.322783
[100]	valid_0's multi_error: 0.118945	valid_0's multi_logloss: 0.278422
[150]	valid_0's multi_error: 0.1139	valid_0's multi_logloss: 0.2644
[200]	valid_0's multi_error: 0.111209	valid_0's multi_logloss: 0.257324
[250]	valid_0's multi_error: 0.109113	valid_0's multi_logloss: 0.253811
[300]	valid_0's multi_error: 0.108026	valid_0's multi_logloss: 0.2521
Early stopping, best iteration is:
[282]	valid_0's multi_error: 0.107716	valid_0's multi_logloss: 0.252198
Training until validation scores don't improve for 30 rounds
[50]	valid_0's multi_error: 0.133125	valid_0's multi_logloss: 0.326351
[100]	valid_0's multi_error: 0.121222	valid_0's multi_logloss: 0.28145
[150]	valid_0's multi_error: 0.115892	valid_0's multi_logloss: 0.266789
[200]	valid_0's multi_error: 0.113952	valid_0's multi_logloss: 0.260447
[250]	valid_0's multi_error: 0.111985	valid_0's multi_logloss: 0.256912
[300]	valid_0's multi_error: 0.109838	valid_0's multi_logloss: 0.255438
[350]	valid_0's multi_error: 0.109424	valid_0's multi_logloss: 0.255052
Early stopping, best iteration is:
[349]	valid_0's multi_error: 0.108984	valid_0's multi_logloss: 0.255063
[I 2025-06-12 10:12:13,261] Trial 165 finished with value: 0.8906574454860167 and parameters: {'boosting_type': 'goss', 'learning_rate': 0.06784807335487279, 'num_leaves': 132, 'max_depth': 14, 'min_data_in_leaf': 14, 'feature_fraction': 0.9759553451328945, 'lambda_l1': 0.14388423573241726, 'lambda_l2': 4.204467305900849, 'min_gain_to_split': 0.09199583779974452, 'max_bin': 64}. Best is trial 163 with value: 0.8909414087818414.
Training until validation scores don't improve for 30 rounds
[50]	valid_0's multi_error: 0.126475	valid_0's multi_logloss: 0.31889
[100]	valid_0's multi_error: 0.117134	valid_0's multi_logloss: 0.27533
[150]	valid_0's multi_error: 0.112373	valid_0's multi_logloss: 0.261315
[200]	valid_0's multi_error: 0.109165	valid_0's multi_logloss: 0.254551
[250]	valid_0's multi_error: 0.107716	valid_0's multi_logloss: 0.25037
[300]	valid_0's multi_error: 0.106707	valid_0's multi_logloss: 0.248417
Early stopping, best iteration is:
[319]	valid_0's multi_error: 0.105646	valid_0's multi_logloss: 0.247871
Training until validation scores don't improve for 30 rounds
[50]	valid_0's multi_error: 0.128907	valid_0's multi_logloss: 0.320087
[100]	valid_0's multi_error: 0.117936	valid_0's multi_logloss: 0.276268
[150]	valid_0's multi_error: 0.113667	valid_0's multi_logloss: 0.263818
[200]	valid_0's multi_error: 0.110924	valid_0's multi_logloss: 0.25716
[250]	valid_0's multi_error: 0.109579	valid_0's multi_logloss: 0.253824
[300]	valid_0's multi_error: 0.108414	valid_0's multi_logloss: 0.252181
Early stopping, best iteration is:
[307]	valid_0's multi_error: 0.107949	valid_0's multi_logloss: 0.251785
Training until validation scores don't improve for 30 rounds
[50]	valid_0's multi_error: 0.131857	valid_0's multi_logloss: 0.323912
[100]	valid_0's multi_error: 0.121171	valid_0's multi_logloss: 0.280869
[150]	valid_0's multi_error: 0.114676	valid_0's multi_logloss: 0.266836
[200]	valid_0's multi_error: 0.112554	valid_0's multi_logloss: 0.260526
[250]	valid_0's multi_error: 0.110898	valid_0's multi_logloss: 0.256975
[300]	valid_0's multi_error: 0.109812	valid_0's multi_logloss: 0.255567
[350]	valid_0's multi_error: 0.109139	valid_0's multi_logloss: 0.255554
Early stopping, best iteration is:
[331]	valid_0's multi_error: 0.109113	valid_0's multi_logloss: 0.255287
