[I 2025-06-12 03:56:29,987] Trial 76 finished with value: 0.8865428670267281 and parameters: {'boosting_type': 'goss', 'learning_rate': 0.0646127948150366, 'num_leaves': 84, 'max_depth': 8, 'min_data_in_leaf': 47, 'feature_fraction': 0.6518126364750428, 'lambda_l1': 0.46403726078346175, 'lambda_l2': 4.147333851314358, 'min_gain_to_split': 0.29358686236708453, 'max_bin': 121}. Best is trial 47 with value: 0.8895928149546414.
Training until validation scores don't improve for 30 rounds
[50]	valid_0's multi_error: 0.135402	valid_0's multi_logloss: 0.327623
[100]	valid_0's multi_error: 0.123163	valid_0's multi_logloss: 0.291251
[150]	valid_0's multi_error: 0.11685	valid_0's multi_logloss: 0.275989
[200]	valid_0's multi_error: 0.113693	valid_0's multi_logloss: 0.267
[250]	valid_0's multi_error: 0.111856	valid_0's multi_logloss: 0.261566
[300]	valid_0's multi_error: 0.11139	valid_0's multi_logloss: 0.258136
[350]	valid_0's multi_error: 0.109346	valid_0's multi_logloss: 0.255648
[400]	valid_0's multi_error: 0.108104	valid_0's multi_logloss: 0.253898
Early stopping, best iteration is:
[406]	valid_0's multi_error: 0.107897	valid_0's multi_logloss: 0.253727
Training until validation scores don't improve for 30 rounds
[50]	valid_0's multi_error: 0.135945	valid_0's multi_logloss: 0.32937
[100]	valid_0's multi_error: 0.124922	valid_0's multi_logloss: 0.293388
[150]	valid_0's multi_error: 0.119696	valid_0's multi_logloss: 0.278995
[200]	valid_0's multi_error: 0.116798	valid_0's multi_logloss: 0.270919
[250]	valid_0's multi_error: 0.115194	valid_0's multi_logloss: 0.265251
[300]	valid_0's multi_error: 0.113926	valid_0's multi_logloss: 0.261986
[350]	valid_0's multi_error: 0.112684	valid_0's multi_logloss: 0.259183
[400]	valid_0's multi_error: 0.110924	valid_0's multi_logloss: 0.257761
[450]	valid_0's multi_error: 0.110795	valid_0's multi_logloss: 0.256448
Early stopping, best iteration is:
[423]	valid_0's multi_error: 0.110277	valid_0's multi_logloss: 0.25696
Training until validation scores don't improve for 30 rounds
[50]	valid_0's multi_error: 0.138972	valid_0's multi_logloss: 0.33293
[100]	valid_0's multi_error: 0.128053	valid_0's multi_logloss: 0.297258
[150]	valid_0's multi_error: 0.120834	valid_0's multi_logloss: 0.281676
[200]	valid_0's multi_error: 0.118531	valid_0's multi_logloss: 0.272808
[250]	valid_0's multi_error: 0.116022	valid_0's multi_logloss: 0.267482
[300]	valid_0's multi_error: 0.114676	valid_0's multi_logloss: 0.264128
[350]	valid_0's multi_error: 0.113874	valid_0's multi_logloss: 0.261662
Early stopping, best iteration is:
[327]	valid_0's multi_error: 0.113279	valid_0's multi_logloss: 0.262791
[I 2025-06-12 03:59:01,362] Trial 77 finished with value: 0.8876518479548087 and parameters: {'boosting_type': 'goss', 'learning_rate': 0.10316317125576656, 'num_leaves': 54, 'max_depth': 11, 'min_data_in_leaf': 20, 'feature_fraction': 0.6823536640638542, 'lambda_l1': 0.20373808585831465, 'lambda_l2': 4.375206987601, 'min_gain_to_split': 0.004146229536416697, 'max_bin': 105}. Best is trial 47 with value: 0.8895928149546414.
Training until validation scores don't improve for 30 rounds
[50]	valid_0's multi_error: 0.135246	valid_0's multi_logloss: 0.328172
[100]	valid_0's multi_error: 0.123706	valid_0's multi_logloss: 0.292692
[150]	valid_0's multi_error: 0.118324	valid_0's multi_logloss: 0.278086
[200]	valid_0's multi_error: 0.114805	valid_0's multi_logloss: 0.269196
[250]	valid_0's multi_error: 0.112735	valid_0's multi_logloss: 0.263444
[300]	valid_0's multi_error: 0.111157	valid_0's multi_logloss: 0.259956
[350]	valid_0's multi_error: 0.111856	valid_0's multi_logloss: 0.257855
Early stopping, best iteration is:
[337]	valid_0's multi_error: 0.110536	valid_0's multi_logloss: 0.258424
Training until validation scores don't improve for 30 rounds
[50]	valid_0's multi_error: 0.136204	valid_0's multi_logloss: 0.330159
[100]	valid_0's multi_error: 0.125492	valid_0's multi_logloss: 0.294645
[150]	valid_0's multi_error: 0.120291	valid_0's multi_logloss: 0.280485
[200]	valid_0's multi_error: 0.116643	valid_0's multi_logloss: 0.271997
[250]	valid_0's multi_error: 0.115064	valid_0's multi_logloss: 0.267505
[300]	valid_0's multi_error: 0.113227	valid_0's multi_logloss: 0.263979
[350]	valid_0's multi_error: 0.112425	valid_0's multi_logloss: 0.262157
Early stopping, best iteration is:
[342]	valid_0's multi_error: 0.112218	valid_0's multi_logloss: 0.262456
Training until validation scores don't improve for 30 rounds
[50]	valid_0's multi_error: 0.140137	valid_0's multi_logloss: 0.333869
[100]	valid_0's multi_error: 0.127432	valid_0's multi_logloss: 0.297547
[150]	valid_0's multi_error: 0.121947	valid_0's multi_logloss: 0.283204
[200]	valid_0's multi_error: 0.118505	valid_0's multi_logloss: 0.27539
[250]	valid_0's multi_error: 0.116694	valid_0's multi_logloss: 0.26981
[300]	valid_0's multi_error: 0.115194	valid_0's multi_logloss: 0.266609
[350]	valid_0's multi_error: 0.11434	valid_0's multi_logloss: 0.264678
Early stopping, best iteration is:
[346]	valid_0's multi_error: 0.113822	valid_0's multi_logloss: 0.264749
[I 2025-06-12 04:01:17,649] Trial 78 finished with value: 0.8858792456465209 and parameters: {'boosting_type': 'goss', 'learning_rate': 0.10422145059457122, 'num_leaves': 53, 'max_depth': 13, 'min_data_in_leaf': 19, 'feature_fraction': 0.6829896586004368, 'lambda_l1': 2.2400151857826747, 'lambda_l2': 3.2856829331181743, 'min_gain_to_split': 0.20104055999906636, 'max_bin': 105}. Best is trial 47 with value: 0.8895928149546414.
Training until validation scores don't improve for 30 rounds
[50]	valid_0's multi_error: 0.144199	valid_0's multi_logloss: 0.372587
[100]	valid_0's multi_error: 0.132012	valid_0's multi_logloss: 0.317382
[150]	valid_0's multi_error: 0.126087	valid_0's multi_logloss: 0.297087
[200]	valid_0's multi_error: 0.120575	valid_0's multi_logloss: 0.285088
[250]	valid_0's multi_error: 0.118712	valid_0's multi_logloss: 0.277381
[300]	valid_0's multi_error: 0.116254	valid_0's multi_logloss: 0.272125
[350]	valid_0's multi_error: 0.114314	valid_0's multi_logloss: 0.267737
[400]	valid_0's multi_error: 0.113615	valid_0's multi_logloss: 0.264922
Early stopping, best iteration is:
[402]	valid_0's multi_error: 0.113305	valid_0's multi_logloss: 0.264837
Training until validation scores don't improve for 30 rounds
[50]	valid_0's multi_error: 0.144691	valid_0's multi_logloss: 0.373396
[100]	valid_0's multi_error: 0.132788	valid_0's multi_logloss: 0.319364
[150]	valid_0's multi_error: 0.126501	valid_0's multi_logloss: 0.299695
[200]	valid_0's multi_error: 0.122645	valid_0's multi_logloss: 0.288585
[250]	valid_0's multi_error: 0.120498	valid_0's multi_logloss: 0.281374
[300]	valid_0's multi_error: 0.118402	valid_0's multi_logloss: 0.275872
[350]	valid_0's multi_error: 0.11685	valid_0's multi_logloss: 0.271862
Early stopping, best iteration is:
[363]	valid_0's multi_error: 0.115892	valid_0's multi_logloss: 0.271084
Training until validation scores don't improve for 30 rounds
[50]	valid_0's multi_error: 0.149012	valid_0's multi_logloss: 0.377105
[100]	valid_0's multi_error: 0.136281	valid_0's multi_logloss: 0.322036
[150]	valid_0's multi_error: 0.130071	valid_0's multi_logloss: 0.303041
[200]	valid_0's multi_error: 0.125957	valid_0's multi_logloss: 0.291572
[250]	valid_0's multi_error: 0.122361	valid_0's multi_logloss: 0.284091
[300]	valid_0's multi_error: 0.120601	valid_0's multi_logloss: 0.279067
[350]	valid_0's multi_error: 0.11848	valid_0's multi_logloss: 0.274512
[400]	valid_0's multi_error: 0.117652	valid_0's multi_logloss: 0.27162
[450]	valid_0's multi_error: 0.116539	valid_0's multi_logloss: 0.269634
[500]	valid_0's multi_error: 0.11553	valid_0's multi_logloss: 0.268205
Early stopping, best iteration is:
[503]	valid_0's multi_error: 0.115297	valid_0's multi_logloss: 0.268017
[I 2025-06-12 04:03:40,921] Trial 79 finished with value: 0.8830277147255837 and parameters: {'boosting_type': 'goss', 'learning_rate': 0.06999570303897865, 'num_leaves': 46, 'max_depth': 11, 'min_data_in_leaf': 10, 'feature_fraction': 0.610676917682258, 'lambda_l1': 0.13064566953742163, 'lambda_l2': 4.348472556801148, 'min_gain_to_split': 0.8122521873777642, 'max_bin': 131}. Best is trial 47 with value: 0.8895928149546414.
Training until validation scores don't improve for 30 rounds
[50]	valid_0's multi_error: 0.153591	valid_0's multi_logloss: 0.42325
[100]	valid_0's multi_error: 0.141042	valid_0's multi_logloss: 0.34848
[150]	valid_0's multi_error: 0.133771	valid_0's multi_logloss: 0.321883
[200]	valid_0's multi_error: 0.129269	valid_0's multi_logloss: 0.307934
[250]	valid_0's multi_error: 0.125388	valid_0's multi_logloss: 0.298582
[300]	valid_0's multi_error: 0.123111	valid_0's multi_logloss: 0.291263
[350]	valid_0's multi_error: 0.120782	valid_0's multi_logloss: 0.285631
[400]	valid_0's multi_error: 0.11848	valid_0's multi_logloss: 0.280743
[450]	valid_0's multi_error: 0.117238	valid_0's multi_logloss: 0.276949
[500]	valid_0's multi_error: 0.116565	valid_0's multi_logloss: 0.273716
[550]	valid_0's multi_error: 0.115711	valid_0's multi_logloss: 0.270999
[600]	valid_0's multi_error: 0.115219	valid_0's multi_logloss: 0.26858
[650]	valid_0's multi_error: 0.114676	valid_0's multi_logloss: 0.266599
[700]	valid_0's multi_error: 0.113874	valid_0's multi_logloss: 0.264976
[750]	valid_0's multi_error: 0.113331	valid_0's multi_logloss: 0.263292
[800]	valid_0's multi_error: 0.112503	valid_0's multi_logloss: 0.262171
Early stopping, best iteration is:
[801]	valid_0's multi_error: 0.112244	valid_0's multi_logloss: 0.262161
Training until validation scores don't improve for 30 rounds
[50]	valid_0's multi_error: 0.154497	valid_0's multi_logloss: 0.422805
[100]	valid_0's multi_error: 0.141482	valid_0's multi_logloss: 0.349354
[150]	valid_0's multi_error: 0.134134	valid_0's multi_logloss: 0.323712
[200]	valid_0's multi_error: 0.129373	valid_0's multi_logloss: 0.30951
[250]	valid_0's multi_error: 0.126604	valid_0's multi_logloss: 0.300197
[300]	valid_0's multi_error: 0.12368	valid_0's multi_logloss: 0.29326
[350]	valid_0's multi_error: 0.12249	valid_0's multi_logloss: 0.287649
[400]	valid_0's multi_error: 0.120394	valid_0's multi_logloss: 0.282894
[450]	valid_0's multi_error: 0.118764	valid_0's multi_logloss: 0.27915
[500]	valid_0's multi_error: 0.117859	valid_0's multi_logloss: 0.276046
Early stopping, best iteration is:
[471]	valid_0's multi_error: 0.117859	valid_0's multi_logloss: 0.277648
Training until validation scores don't improve for 30 rounds
[50]	valid_0's multi_error: 0.158094	valid_0's multi_logloss: 0.427676
[100]	valid_0's multi_error: 0.14601	valid_0's multi_logloss: 0.354585
[150]	valid_0's multi_error: 0.138274	valid_0's multi_logloss: 0.327862
[200]	valid_0's multi_error: 0.134315	valid_0's multi_logloss: 0.313658
[250]	valid_0's multi_error: 0.13165	valid_0's multi_logloss: 0.303916
[300]	valid_0's multi_error: 0.128312	valid_0's multi_logloss: 0.296764
[350]	valid_0's multi_error: 0.125802	valid_0's multi_logloss: 0.290831
[400]	valid_0's multi_error: 0.124146	valid_0's multi_logloss: 0.286068
[450]	valid_0's multi_error: 0.122775	valid_0's multi_logloss: 0.282197
[500]	valid_0's multi_error: 0.121119	valid_0's multi_logloss: 0.279265
[550]	valid_0's multi_error: 0.119696	valid_0's multi_logloss: 0.276499
Early stopping, best iteration is:
[544]	valid_0's multi_error: 0.119566	valid_0's multi_logloss: 0.276747
[I 2025-06-12 04:06:30,703] Trial 80 finished with value: 0.8812575666295964 and parameters: {'boosting_type': 'goss', 'learning_rate': 0.050004266984809274, 'num_leaves': 35, 'max_depth': 12, 'min_data_in_leaf': 24, 'feature_fraction': 0.643090165239641, 'lambda_l1': 0.27544415755623886, 'lambda_l2': 4.492660714628597, 'min_gain_to_split': 0.6114305214281518, 'max_bin': 85}. Best is trial 47 with value: 0.8895928149546414.
Training until validation scores don't improve for 30 rounds
[50]	valid_0's multi_error: 0.134444	valid_0's multi_logloss: 0.332286
[100]	valid_0's multi_error: 0.123111	valid_0's multi_logloss: 0.292392
[150]	valid_0's multi_error: 0.118143	valid_0's multi_logloss: 0.276802
[200]	valid_0's multi_error: 0.114495	valid_0's multi_logloss: 0.267294
[250]	valid_0's multi_error: 0.113124	valid_0's multi_logloss: 0.261879
[300]	valid_0's multi_error: 0.11139	valid_0's multi_logloss: 0.257776
[350]	valid_0's multi_error: 0.110536	valid_0's multi_logloss: 0.255087
[400]	valid_0's multi_error: 0.109527	valid_0's multi_logloss: 0.253085
Early stopping, best iteration is:
[408]	valid_0's multi_error: 0.108492	valid_0's multi_logloss: 0.252762
Training until validation scores don't improve for 30 rounds
[50]	valid_0's multi_error: 0.134884	valid_0's multi_logloss: 0.333148
[100]	valid_0's multi_error: 0.124483	valid_0's multi_logloss: 0.292033
[150]	valid_0's multi_error: 0.119075	valid_0's multi_logloss: 0.276974
[200]	valid_0's multi_error: 0.115271	valid_0's multi_logloss: 0.268255
[250]	valid_0's multi_error: 0.113589	valid_0's multi_logloss: 0.263364
[300]	valid_0's multi_error: 0.111597	valid_0's multi_logloss: 0.260155
[350]	valid_0's multi_error: 0.110355	valid_0's multi_logloss: 0.257886
[400]	valid_0's multi_error: 0.109838	valid_0's multi_logloss: 0.25646
Early stopping, best iteration is:
[383]	valid_0's multi_error: 0.109113	valid_0's multi_logloss: 0.256797
Training until validation scores don't improve for 30 rounds
[50]	valid_0's multi_error: 0.138558	valid_0's multi_logloss: 0.33598
[100]	valid_0's multi_error: 0.127406	valid_0's multi_logloss: 0.294684
[150]	valid_0's multi_error: 0.120757	valid_0's multi_logloss: 0.27902
[200]	valid_0's multi_error: 0.116643	valid_0's multi_logloss: 0.27059
[250]	valid_0's multi_error: 0.115608	valid_0's multi_logloss: 0.26524
[300]	valid_0's multi_error: 0.113745	valid_0's multi_logloss: 0.261936
[350]	valid_0's multi_error: 0.112891	valid_0's multi_logloss: 0.260004
[400]	valid_0's multi_error: 0.111856	valid_0's multi_logloss: 0.258806
[450]	valid_0's multi_error: 0.111493	valid_0's multi_logloss: 0.258316
Early stopping, best iteration is:
[429]	valid_0's multi_error: 0.111286	valid_0's multi_logloss: 0.25828
[I 2025-06-12 04:09:46,923] Trial 81 finished with value: 0.8884945396103214 and parameters: {'boosting_type': 'goss', 'learning_rate': 0.08869684063892408, 'num_leaves': 78, 'max_depth': 10, 'min_data_in_leaf': 32, 'feature_fraction': 0.667708226236157, 'lambda_l1': 0.762314191260419, 'lambda_l2': 4.8657098144169195, 'min_gain_to_split': 0.09500179000846426, 'max_bin': 114}. Best is trial 47 with value: 0.8895928149546414.
Training until validation scores don't improve for 30 rounds
[50]	valid_0's multi_error: 0.132762	valid_0's multi_logloss: 0.330096
[100]	valid_0's multi_error: 0.121067	valid_0's multi_logloss: 0.289007
[150]	valid_0's multi_error: 0.116746	valid_0's multi_logloss: 0.27361
[200]	valid_0's multi_error: 0.113279	valid_0's multi_logloss: 0.265262
[250]	valid_0's multi_error: 0.111907	valid_0's multi_logloss: 0.260262
[300]	valid_0's multi_error: 0.109682	valid_0's multi_logloss: 0.256224
[350]	valid_0's multi_error: 0.108389	valid_0's multi_logloss: 0.253733
[400]	valid_0's multi_error: 0.107302	valid_0's multi_logloss: 0.252206
Early stopping, best iteration is:
[409]	valid_0's multi_error: 0.106733	valid_0's multi_logloss: 0.252068
Training until validation scores don't improve for 30 rounds
[50]	valid_0's multi_error: 0.134289	valid_0's multi_logloss: 0.33118
[100]	valid_0's multi_error: 0.12368	valid_0's multi_logloss: 0.290779
[150]	valid_0's multi_error: 0.117807	valid_0's multi_logloss: 0.275563
[200]	valid_0's multi_error: 0.11421	valid_0's multi_logloss: 0.267625
[250]	valid_0's multi_error: 0.112865	valid_0's multi_logloss: 0.262359
[300]	valid_0's multi_error: 0.111261	valid_0's multi_logloss: 0.258987
Early stopping, best iteration is:
[302]	valid_0's multi_error: 0.110847	valid_0's multi_logloss: 0.258911
Training until validation scores don't improve for 30 rounds
[50]	valid_0's multi_error: 0.136333	valid_0's multi_logloss: 0.334716
[100]	valid_0's multi_error: 0.126501	valid_0's multi_logloss: 0.293657
[150]	valid_0's multi_error: 0.120472	valid_0's multi_logloss: 0.278118
[200]	valid_0's multi_error: 0.117962	valid_0's multi_logloss: 0.270158
[250]	valid_0's multi_error: 0.11553	valid_0's multi_logloss: 0.264877
[300]	valid_0's multi_error: 0.113822	valid_0's multi_logloss: 0.261754
[350]	valid_0's multi_error: 0.113046	valid_0's multi_logloss: 0.259785
[400]	valid_0's multi_error: 0.111933	valid_0's multi_logloss: 0.258302
Early stopping, best iteration is:
[409]	valid_0's multi_error: 0.111597	valid_0's multi_logloss: 0.258333
[I 2025-06-12 04:12:55,855] Trial 82 finished with value: 0.8884084801353266 and parameters: {'boosting_type': 'goss', 'learning_rate': 0.08726398526131511, 'num_leaves': 78, 'max_depth': 11, 'min_data_in_leaf': 32, 'feature_fraction': 0.6669429635276616, 'lambda_l1': 0.5792523170233888, 'lambda_l2': 4.894187406923352, 'min_gain_to_split': 0.006155530533231193, 'max_bin': 111}. Best is trial 47 with value: 0.8895928149546414.
Training until validation scores don't improve for 30 rounds
[50]	valid_0's multi_error: 0.136359	valid_0's multi_logloss: 0.335568
[100]	valid_0's multi_error: 0.124172	valid_0's multi_logloss: 0.294094
[150]	valid_0's multi_error: 0.119851	valid_0's multi_logloss: 0.278524
[200]	valid_0's multi_error: 0.115944	valid_0's multi_logloss: 0.269783
[250]	valid_0's multi_error: 0.113046	valid_0's multi_logloss: 0.263787
[300]	valid_0's multi_error: 0.111985	valid_0's multi_logloss: 0.260615
[350]	valid_0's multi_error: 0.111856	valid_0's multi_logloss: 0.258248
Early stopping, best iteration is:
[329]	valid_0's multi_error: 0.111416	valid_0's multi_logloss: 0.25902
Training until validation scores don't improve for 30 rounds
[50]	valid_0's multi_error: 0.136307	valid_0's multi_logloss: 0.336175
[100]	valid_0's multi_error: 0.125285	valid_0's multi_logloss: 0.296101
[150]	valid_0's multi_error: 0.120679	valid_0's multi_logloss: 0.281417
[200]	valid_0's multi_error: 0.118066	valid_0's multi_logloss: 0.272983
[250]	valid_0's multi_error: 0.115556	valid_0's multi_logloss: 0.267825
[300]	valid_0's multi_error: 0.114003	valid_0's multi_logloss: 0.264367
[350]	valid_0's multi_error: 0.113408	valid_0's multi_logloss: 0.261699
[400]	valid_0's multi_error: 0.112503	valid_0's multi_logloss: 0.25995
[450]	valid_0's multi_error: 0.111675	valid_0's multi_logloss: 0.259364
[500]	valid_0's multi_error: 0.111338	valid_0's multi_logloss: 0.258681
Early stopping, best iteration is:
[508]	valid_0's multi_error: 0.110898	valid_0's multi_logloss: 0.25863
Training until validation scores don't improve for 30 rounds
[50]	valid_0's multi_error: 0.13949	valid_0's multi_logloss: 0.341976
[100]	valid_0's multi_error: 0.129166	valid_0's multi_logloss: 0.300996
[150]	valid_0's multi_error: 0.123396	valid_0's multi_logloss: 0.285389
[200]	valid_0's multi_error: 0.119929	valid_0's multi_logloss: 0.277165
[250]	valid_0's multi_error: 0.116358	valid_0's multi_logloss: 0.270978
[300]	valid_0's multi_error: 0.115012	valid_0's multi_logloss: 0.267103
[350]	valid_0's multi_error: 0.113434	valid_0's multi_logloss: 0.264897
[400]	valid_0's multi_error: 0.113098	valid_0's multi_logloss: 0.263637
Early stopping, best iteration is:
[383]	valid_0's multi_error: 0.112684	valid_0's multi_logloss: 0.264026
[I 2025-06-12 04:15:50,355] Trial 83 finished with value: 0.8863964153539988 and parameters: {'boosting_type': 'goss', 'learning_rate': 0.08738459935958051, 'num_leaves': 65, 'max_depth': 11, 'min_data_in_leaf': 32, 'feature_fraction': 0.6675925493206011, 'lambda_l1': 0.6779764208954749, 'lambda_l2': 4.91173224952028, 'min_gain_to_split': 0.31473685687606057, 'max_bin': 112}. Best is trial 47 with value: 0.8895928149546414.
Training until validation scores don't improve for 30 rounds
[50]	valid_0's multi_error: 0.139852	valid_0's multi_logloss: 0.35827
[100]	valid_0's multi_error: 0.131288	valid_0's multi_logloss: 0.315634
[150]	valid_0's multi_error: 0.127898	valid_0's multi_logloss: 0.306437
[200]	valid_0's multi_error: 0.126759	valid_0's multi_logloss: 0.301666
[250]	valid_0's multi_error: 0.12588	valid_0's multi_logloss: 0.299044
[300]	valid_0's multi_error: 0.124897	valid_0's multi_logloss: 0.297335
Early stopping, best iteration is:
[283]	valid_0's multi_error: 0.124612	valid_0's multi_logloss: 0.297784
Training until validation scores don't improve for 30 rounds
[50]	valid_0's multi_error: 0.14112	valid_0's multi_logloss: 0.359276
[100]	valid_0's multi_error: 0.132271	valid_0's multi_logloss: 0.316737
[150]	valid_0's multi_error: 0.130175	valid_0's multi_logloss: 0.307846
[200]	valid_0's multi_error: 0.128545	valid_0's multi_logloss: 0.303414
[250]	valid_0's multi_error: 0.126941	valid_0's multi_logloss: 0.300821
[300]	valid_0's multi_error: 0.126449	valid_0's multi_logloss: 0.299189
Early stopping, best iteration is:
[279]	valid_0's multi_error: 0.126294	valid_0's multi_logloss: 0.299923
Training until validation scores don't improve for 30 rounds
[50]	valid_0's multi_error: 0.145027	valid_0's multi_logloss: 0.363195
[100]	valid_0's multi_error: 0.13623	valid_0's multi_logloss: 0.320719
[150]	valid_0's multi_error: 0.13328	valid_0's multi_logloss: 0.311346
[200]	valid_0's multi_error: 0.131986	valid_0's multi_logloss: 0.306622
[250]	valid_0's multi_error: 0.130434	valid_0's multi_logloss: 0.304167
Early stopping, best iteration is:
[252]	valid_0's multi_error: 0.130175	valid_0's multi_logloss: 0.304126
