[I 2025-06-12 02:44:05,501] Trial 51 finished with value: 0.8875985161878789 and parameters: {'boosting_type': 'goss', 'learning_rate': 0.08221948323959018, 'num_leaves': 91, 'max_depth': 9, 'min_data_in_leaf': 28, 'feature_fraction': 0.6628771676489349, 'lambda_l1': 2.596888816089027, 'lambda_l2': 0.15351429532615538, 'min_gain_to_split': 0.02655271361460662, 'max_bin': 144}. Best is trial 47 with value: 0.8895928149546414.
Training until validation scores don't improve for 30 rounds
[50]	valid_0's multi_error: 0.135427	valid_0's multi_logloss: 0.340599
[100]	valid_0's multi_error: 0.123887	valid_0's multi_logloss: 0.294378
[150]	valid_0's multi_error: 0.117677	valid_0's multi_logloss: 0.278296
[200]	valid_0's multi_error: 0.114805	valid_0's multi_logloss: 0.269187
[250]	valid_0's multi_error: 0.112503	valid_0's multi_logloss: 0.263786
[300]	valid_0's multi_error: 0.110329	valid_0's multi_logloss: 0.259792
Early stopping, best iteration is:
[300]	valid_0's multi_error: 0.110329	valid_0's multi_logloss: 0.259792
Training until validation scores don't improve for 30 rounds
[50]	valid_0's multi_error: 0.13654	valid_0's multi_logloss: 0.341326
[100]	valid_0's multi_error: 0.125414	valid_0's multi_logloss: 0.296234
[150]	valid_0's multi_error: 0.119385	valid_0's multi_logloss: 0.279953
[200]	valid_0's multi_error: 0.11672	valid_0's multi_logloss: 0.271149
[250]	valid_0's multi_error: 0.113796	valid_0's multi_logloss: 0.26535
[300]	valid_0's multi_error: 0.1117	valid_0's multi_logloss: 0.261769
[350]	valid_0's multi_error: 0.111079	valid_0's multi_logloss: 0.259843
Early stopping, best iteration is:
[323]	valid_0's multi_error: 0.111002	valid_0's multi_logloss: 0.260788
Training until validation scores don't improve for 30 rounds
[50]	valid_0's multi_error: 0.140266	valid_0's multi_logloss: 0.345025
[100]	valid_0's multi_error: 0.128001	valid_0's multi_logloss: 0.299883
[150]	valid_0's multi_error: 0.122775	valid_0's multi_logloss: 0.2837
[200]	valid_0's multi_error: 0.118842	valid_0's multi_logloss: 0.274199
[250]	valid_0's multi_error: 0.116306	valid_0's multi_logloss: 0.26905
[300]	valid_0's multi_error: 0.115685	valid_0's multi_logloss: 0.265781
[350]	valid_0's multi_error: 0.114288	valid_0's multi_logloss: 0.263635
[400]	valid_0's multi_error: 0.113279	valid_0's multi_logloss: 0.262752
Early stopping, best iteration is:
[373]	valid_0's multi_error: 0.112968	valid_0's multi_logloss: 0.263034
[I 2025-06-12 02:47:20,937] Trial 52 finished with value: 0.8865933382929921 and parameters: {'boosting_type': 'goss', 'learning_rate': 0.08062984482915722, 'num_leaves': 86, 'max_depth': 9, 'min_data_in_leaf': 26, 'feature_fraction': 0.6714056508571141, 'lambda_l1': 2.7111239298819703, 'lambda_l2': 0.24801857403619504, 'min_gain_to_split': 0.22303230070743513, 'max_bin': 146}. Best is trial 47 with value: 0.8895928149546414.
Training until validation scores don't improve for 30 rounds
[50]	valid_0's multi_error: 0.136514	valid_0's multi_logloss: 0.332551
[100]	valid_0's multi_error: 0.124664	valid_0's multi_logloss: 0.294479
[150]	valid_0's multi_error: 0.11879	valid_0's multi_logloss: 0.279246
[200]	valid_0's multi_error: 0.115116	valid_0's multi_logloss: 0.269529
[250]	valid_0's multi_error: 0.112891	valid_0's multi_logloss: 0.263514
[300]	valid_0's multi_error: 0.111338	valid_0's multi_logloss: 0.259537
[350]	valid_0's multi_error: 0.11064	valid_0's multi_logloss: 0.257315
[400]	valid_0's multi_error: 0.109217	valid_0's multi_logloss: 0.255526
Early stopping, best iteration is:
[415]	valid_0's multi_error: 0.108285	valid_0's multi_logloss: 0.255006
Training until validation scores don't improve for 30 rounds
[50]	valid_0's multi_error: 0.136152	valid_0's multi_logloss: 0.333008
[100]	valid_0's multi_error: 0.125414	valid_0's multi_logloss: 0.297175
[150]	valid_0's multi_error: 0.120782	valid_0's multi_logloss: 0.282669
[200]	valid_0's multi_error: 0.116539	valid_0's multi_logloss: 0.273392
[250]	valid_0's multi_error: 0.114728	valid_0's multi_logloss: 0.267531
[300]	valid_0's multi_error: 0.113072	valid_0's multi_logloss: 0.263859
[350]	valid_0's multi_error: 0.112218	valid_0's multi_logloss: 0.261918
[400]	valid_0's multi_error: 0.111985	valid_0's multi_logloss: 0.260378
Early stopping, best iteration is:
[378]	valid_0's multi_error: 0.111261	valid_0's multi_logloss: 0.260747
Training until validation scores don't improve for 30 rounds
[50]	valid_0's multi_error: 0.139309	valid_0's multi_logloss: 0.33644
[100]	valid_0's multi_error: 0.129166	valid_0's multi_logloss: 0.299523
[150]	valid_0's multi_error: 0.12337	valid_0's multi_logloss: 0.283631
[200]	valid_0's multi_error: 0.119359	valid_0's multi_logloss: 0.274472
[250]	valid_0's multi_error: 0.116979	valid_0's multi_logloss: 0.268836
[300]	valid_0's multi_error: 0.114702	valid_0's multi_logloss: 0.264968
[350]	valid_0's multi_error: 0.115038	valid_0's multi_logloss: 0.2627
Early stopping, best iteration is:
[326]	valid_0's multi_error: 0.113977	valid_0's multi_logloss: 0.263519
[I 2025-06-12 02:50:21,141] Trial 53 finished with value: 0.8869327910590737 and parameters: {'boosting_type': 'goss', 'learning_rate': 0.10304713943872021, 'num_leaves': 68, 'max_depth': 8, 'min_data_in_leaf': 33, 'feature_fraction': 0.6523141220837168, 'lambda_l1': 2.127270106724074, 'lambda_l2': 0.013922088618367745, 'min_gain_to_split': 0.020728624888841668, 'max_bin': 165}. Best is trial 47 with value: 0.8895928149546414.
Training until validation scores don't improve for 30 rounds
[50]	valid_0's multi_error: 0.143759	valid_0's multi_logloss: 0.436242
[100]	valid_0's multi_error: 0.135427	valid_0's multi_logloss: 0.346175
[150]	valid_0's multi_error: 0.13046	valid_0's multi_logloss: 0.318908
[200]	valid_0's multi_error: 0.128338	valid_0's multi_logloss: 0.3073
[250]	valid_0's multi_error: 0.126009	valid_0's multi_logloss: 0.302146
[300]	valid_0's multi_error: 0.12531	valid_0's multi_logloss: 0.299115
[350]	valid_0's multi_error: 0.124353	valid_0's multi_logloss: 0.297019
Early stopping, best iteration is:
[322]	valid_0's multi_error: 0.12425	valid_0's multi_logloss: 0.29817
Training until validation scores don't improve for 30 rounds
[50]	valid_0's multi_error: 0.144251	valid_0's multi_logloss: 0.435428
[100]	valid_0's multi_error: 0.135531	valid_0's multi_logloss: 0.34631
[150]	valid_0's multi_error: 0.130149	valid_0's multi_logloss: 0.319355
[200]	valid_0's multi_error: 0.127743	valid_0's multi_logloss: 0.308891
[250]	valid_0's multi_error: 0.126604	valid_0's multi_logloss: 0.30388
[300]	valid_0's multi_error: 0.126061	valid_0's multi_logloss: 0.300891
[350]	valid_0's multi_error: 0.125724	valid_0's multi_logloss: 0.298682
Early stopping, best iteration is:
[366]	valid_0's multi_error: 0.125052	valid_0's multi_logloss: 0.297964
Training until validation scores don't improve for 30 rounds
[50]	valid_0's multi_error: 0.147485	valid_0's multi_logloss: 0.439812
[100]	valid_0's multi_error: 0.139516	valid_0's multi_logloss: 0.351243
[150]	valid_0's multi_error: 0.134444	valid_0's multi_logloss: 0.324678
[200]	valid_0's multi_error: 0.131909	valid_0's multi_logloss: 0.313962
[250]	valid_0's multi_error: 0.130925	valid_0's multi_logloss: 0.308768
Early stopping, best iteration is:
[241]	valid_0's multi_error: 0.130485	valid_0's multi_logloss: 0.309363
[I 2025-06-12 02:52:44,225] Trial 54 finished with value: 0.8706503640234026 and parameters: {'boosting_type': 'goss', 'learning_rate': 0.03744576512275887, 'num_leaves': 109, 'max_depth': 11, 'min_data_in_leaf': 28, 'feature_fraction': 0.6164972949764833, 'lambda_l1': 3.4077663931725075, 'lambda_l2': 1.0303824253267315, 'min_gain_to_split': 3.560318448060193, 'max_bin': 132}. Best is trial 47 with value: 0.8895928149546414.
Training until validation scores don't improve for 30 rounds
[50]	valid_0's multi_error: 0.146062	valid_0's multi_logloss: 0.400471
[100]	valid_0's multi_error: 0.134625	valid_0's multi_logloss: 0.330585
[150]	valid_0's multi_error: 0.127406	valid_0's multi_logloss: 0.305092
[200]	valid_0's multi_error: 0.12249	valid_0's multi_logloss: 0.291337
[250]	valid_0's multi_error: 0.119101	valid_0's multi_logloss: 0.281578
[300]	valid_0's multi_error: 0.116901	valid_0's multi_logloss: 0.275147
[350]	valid_0's multi_error: 0.115401	valid_0's multi_logloss: 0.270249
[400]	valid_0's multi_error: 0.114624	valid_0's multi_logloss: 0.266575
[450]	valid_0's multi_error: 0.113589	valid_0's multi_logloss: 0.263892
[500]	valid_0's multi_error: 0.112399	valid_0's multi_logloss: 0.261864
[550]	valid_0's multi_error: 0.111856	valid_0's multi_logloss: 0.260247
[600]	valid_0's multi_error: 0.111105	valid_0's multi_logloss: 0.25886
Early stopping, best iteration is:
[601]	valid_0's multi_error: 0.110821	valid_0's multi_logloss: 0.258835
Training until validation scores don't improve for 30 rounds
[50]	valid_0's multi_error: 0.147666	valid_0's multi_logloss: 0.4005
[100]	valid_0's multi_error: 0.134056	valid_0's multi_logloss: 0.331062
[150]	valid_0's multi_error: 0.127458	valid_0's multi_logloss: 0.30618
[200]	valid_0's multi_error: 0.123292	valid_0's multi_logloss: 0.292078
[250]	valid_0's multi_error: 0.120161	valid_0's multi_logloss: 0.283191
[300]	valid_0's multi_error: 0.118273	valid_0's multi_logloss: 0.277186
[350]	valid_0's multi_error: 0.116643	valid_0's multi_logloss: 0.272874
[400]	valid_0's multi_error: 0.114728	valid_0's multi_logloss: 0.269377
[450]	valid_0's multi_error: 0.113796	valid_0's multi_logloss: 0.267039
[500]	valid_0's multi_error: 0.113201	valid_0's multi_logloss: 0.264954
[550]	valid_0's multi_error: 0.112477	valid_0's multi_logloss: 0.263473
[600]	valid_0's multi_error: 0.111778	valid_0's multi_logloss: 0.262157
[650]	valid_0's multi_error: 0.111726	valid_0's multi_logloss: 0.261372
[700]	valid_0's multi_error: 0.110665	valid_0's multi_logloss: 0.260626
Early stopping, best iteration is:
[714]	valid_0's multi_error: 0.110303	valid_0's multi_logloss: 0.260488
Training until validation scores don't improve for 30 rounds
[50]	valid_0's multi_error: 0.149348	valid_0's multi_logloss: 0.404219
[100]	valid_0's multi_error: 0.138351	valid_0's multi_logloss: 0.334325
[150]	valid_0's multi_error: 0.131495	valid_0's multi_logloss: 0.309674
[200]	valid_0's multi_error: 0.127096	valid_0's multi_logloss: 0.295728
[250]	valid_0's multi_error: 0.123344	valid_0's multi_logloss: 0.286665
[300]	valid_0's multi_error: 0.121248	valid_0's multi_logloss: 0.280768
[350]	valid_0's multi_error: 0.119411	valid_0's multi_logloss: 0.276329
[400]	valid_0's multi_error: 0.118066	valid_0's multi_logloss: 0.272667
[450]	valid_0's multi_error: 0.116824	valid_0's multi_logloss: 0.270027
[500]	valid_0's multi_error: 0.116125	valid_0's multi_logloss: 0.268155
Early stopping, best iteration is:
[506]	valid_0's multi_error: 0.115685	valid_0's multi_logloss: 0.268009
[I 2025-06-12 02:57:31,042] Trial 55 finished with value: 0.8856787512007359 and parameters: {'boosting_type': 'goss', 'learning_rate': 0.0506556330121643, 'num_leaves': 80, 'max_depth': 8, 'min_data_in_leaf': 22, 'feature_fraction': 0.6625090612856113, 'lambda_l1': 2.94670885002855, 'lambda_l2': 0.6499912003158126, 'min_gain_to_split': 0.49329299980481733, 'max_bin': 185}. Best is trial 47 with value: 0.8895928149546414.
Training until validation scores don't improve for 30 rounds
[50]	valid_0's multi_error: 0.161354	valid_0's multi_logloss: 0.53927
[100]	valid_0's multi_error: 0.15015	valid_0's multi_logloss: 0.415726
[150]	valid_0's multi_error: 0.143526	valid_0's multi_logloss: 0.367168
[200]	valid_0's multi_error: 0.13905	valid_0's multi_logloss: 0.342007
[250]	valid_0's multi_error: 0.133771	valid_0's multi_logloss: 0.32522
[300]	valid_0's multi_error: 0.130278	valid_0's multi_logloss: 0.314643
[350]	valid_0's multi_error: 0.127846	valid_0's multi_logloss: 0.30607
[400]	valid_0's multi_error: 0.125362	valid_0's multi_logloss: 0.299389
[450]	valid_0's multi_error: 0.123344	valid_0's multi_logloss: 0.293949
[500]	valid_0's multi_error: 0.121869	valid_0's multi_logloss: 0.289565
[550]	valid_0's multi_error: 0.11998	valid_0's multi_logloss: 0.285649
[600]	valid_0's multi_error: 0.118816	valid_0's multi_logloss: 0.281849
[650]	valid_0's multi_error: 0.117419	valid_0's multi_logloss: 0.278739
[700]	valid_0's multi_error: 0.116668	valid_0's multi_logloss: 0.275778
[750]	valid_0's multi_error: 0.116151	valid_0's multi_logloss: 0.273475
[800]	valid_0's multi_error: 0.115349	valid_0's multi_logloss: 0.271192
[850]	valid_0's multi_error: 0.11509	valid_0's multi_logloss: 0.269393
Early stopping, best iteration is:
[832]	valid_0's multi_error: 0.114495	valid_0's multi_logloss: 0.26996
Training until validation scores don't improve for 30 rounds
[50]	valid_0's multi_error: 0.158559	valid_0's multi_logloss: 0.538681
[100]	valid_0's multi_error: 0.151082	valid_0's multi_logloss: 0.415163
[150]	valid_0's multi_error: 0.14363	valid_0's multi_logloss: 0.367909
[200]	valid_0's multi_error: 0.138972	valid_0's multi_logloss: 0.343081
[250]	valid_0's multi_error: 0.134444	valid_0's multi_logloss: 0.326653
[300]	valid_0's multi_error: 0.130278	valid_0's multi_logloss: 0.316059
[350]	valid_0's multi_error: 0.12826	valid_0's multi_logloss: 0.307882
[400]	valid_0's multi_error: 0.12663	valid_0's multi_logloss: 0.301295
[450]	valid_0's multi_error: 0.125026	valid_0's multi_logloss: 0.295922
[500]	valid_0's multi_error: 0.123008	valid_0's multi_logloss: 0.291457
[550]	valid_0's multi_error: 0.122154	valid_0's multi_logloss: 0.287668
[600]	valid_0's multi_error: 0.120989	valid_0's multi_logloss: 0.284202
[650]	valid_0's multi_error: 0.120394	valid_0's multi_logloss: 0.281489
[700]	valid_0's multi_error: 0.119411	valid_0's multi_logloss: 0.278961
[750]	valid_0's multi_error: 0.119204	valid_0's multi_logloss: 0.276844
[800]	valid_0's multi_error: 0.118531	valid_0's multi_logloss: 0.274942
[850]	valid_0's multi_error: 0.117367	valid_0's multi_logloss: 0.273218
[900]	valid_0's multi_error: 0.116643	valid_0's multi_logloss: 0.27168
[950]	valid_0's multi_error: 0.116203	valid_0's multi_logloss: 0.270382
[1000]	valid_0's multi_error: 0.115504	valid_0's multi_logloss: 0.269138
Did not meet early stopping. Best iteration is:
[996]	valid_0's multi_error: 0.115504	valid_0's multi_logloss: 0.269179
Training until validation scores don't improve for 30 rounds
[50]	valid_0's multi_error: 0.163398	valid_0's multi_logloss: 0.541868
[100]	valid_0's multi_error: 0.154807	valid_0's multi_logloss: 0.420174
[150]	valid_0's multi_error: 0.147252	valid_0's multi_logloss: 0.373914
[200]	valid_0's multi_error: 0.141172	valid_0's multi_logloss: 0.348326
[250]	valid_0's multi_error: 0.137886	valid_0's multi_logloss: 0.331073
[300]	valid_0's multi_error: 0.134289	valid_0's multi_logloss: 0.320281
[350]	valid_0's multi_error: 0.130718	valid_0's multi_logloss: 0.311589
[400]	valid_0's multi_error: 0.12914	valid_0's multi_logloss: 0.304975
[450]	valid_0's multi_error: 0.127096	valid_0's multi_logloss: 0.299443
[500]	valid_0's multi_error: 0.125233	valid_0's multi_logloss: 0.294943
[550]	valid_0's multi_error: 0.123862	valid_0's multi_logloss: 0.291087
[600]	valid_0's multi_error: 0.123008	valid_0's multi_logloss: 0.287605
[650]	valid_0's multi_error: 0.122128	valid_0's multi_logloss: 0.284642
[700]	valid_0's multi_error: 0.121067	valid_0's multi_logloss: 0.281833
[750]	valid_0's multi_error: 0.11998	valid_0's multi_logloss: 0.279431
[800]	valid_0's multi_error: 0.119049	valid_0's multi_logloss: 0.27726
[850]	valid_0's multi_error: 0.118661	valid_0's multi_logloss: 0.27563
Early stopping, best iteration is:
[824]	valid_0's multi_error: 0.118557	valid_0's multi_logloss: 0.276479
[I 2025-06-12 03:03:33,379] Trial 56 finished with value: 0.8815858841311385 and parameters: {'boosting_type': 'goss', 'learning_rate': 0.025399606755477994, 'num_leaves': 91, 'max_depth': 7, 'min_data_in_leaf': 14, 'feature_fraction': 0.6400478719808009, 'lambda_l1': 2.3522020621878266, 'lambda_l2': 0.6983752567806897, 'min_gain_to_split': 0.695347437894094, 'max_bin': 158}. Best is trial 47 with value: 0.8895928149546414.
Training until validation scores don't improve for 30 rounds
[50]	valid_0's multi_error: 0.129192	valid_0's multi_logloss: 0.312791
[100]	valid_0's multi_error: 0.119282	valid_0's multi_logloss: 0.281589
[150]	valid_0's multi_error: 0.114314	valid_0's multi_logloss: 0.267404
[200]	valid_0's multi_error: 0.111959	valid_0's multi_logloss: 0.260999
[250]	valid_0's multi_error: 0.110045	valid_0's multi_logloss: 0.257151
Early stopping, best iteration is:
[254]	valid_0's multi_error: 0.109734	valid_0's multi_logloss: 0.257053
Training until validation scores don't improve for 30 rounds
[50]	valid_0's multi_error: 0.130253	valid_0's multi_logloss: 0.314569
[100]	valid_0's multi_error: 0.120886	valid_0's multi_logloss: 0.283261
[150]	valid_0's multi_error: 0.115918	valid_0's multi_logloss: 0.270576
[200]	valid_0's multi_error: 0.113667	valid_0's multi_logloss: 0.263513
[250]	valid_0's multi_error: 0.112735	valid_0's multi_logloss: 0.260351
Early stopping, best iteration is:
[266]	valid_0's multi_error: 0.111261	valid_0's multi_logloss: 0.259545
Training until validation scores don't improve for 30 rounds
[50]	valid_0's multi_error: 0.134755	valid_0's multi_logloss: 0.319943
[100]	valid_0's multi_error: 0.123758	valid_0's multi_logloss: 0.286086
[150]	valid_0's multi_error: 0.118997	valid_0's multi_logloss: 0.273674
[200]	valid_0's multi_error: 0.116617	valid_0's multi_logloss: 0.267541
[250]	valid_0's multi_error: 0.115323	valid_0's multi_logloss: 0.264879
[300]	valid_0's multi_error: 0.113641	valid_0's multi_logloss: 0.26364
Early stopping, best iteration is:
[318]	valid_0's multi_error: 0.11302	valid_0's multi_logloss: 0.262863
[I 2025-06-12 03:06:33,548] Trial 57 finished with value: 0.8867541804674897 and parameters: {'boosting_type': 'goss', 'learning_rate': 0.11879342988310104, 'num_leaves': 100, 'max_depth': 9, 'min_data_in_leaf': 26, 'feature_fraction': 0.6216654289890767, 'lambda_l1': 1.9767059447012039, 'lambda_l2': 2.5547361519813516, 'min_gain_to_split': 0.16851181013953576, 'max_bin': 142}. Best is trial 47 with value: 0.8895928149546414.
Training until validation scores don't improve for 30 rounds
[50]	valid_0's multi_error: 0.170669	valid_0's multi_logloss: 1.03391
[100]	valid_0's multi_error: 0.165416	valid_0's multi_logloss: 0.976057
[150]	valid_0's multi_error: 0.162906	valid_0's multi_logloss: 0.925416
[200]	valid_0's multi_error: 0.161768	valid_0's multi_logloss: 0.879512
[250]	valid_0's multi_error: 0.161587	valid_0's multi_logloss: 0.837011
[300]	valid_0's multi_error: 0.160603	valid_0's multi_logloss: 0.800215
[350]	valid_0's multi_error: 0.159154	valid_0's multi_logloss: 0.766714
[400]	valid_0's multi_error: 0.158559	valid_0's multi_logloss: 0.735796
[450]	valid_0's multi_error: 0.157964	valid_0's multi_logloss: 0.707753
[500]	valid_0's multi_error: 0.15724	valid_0's multi_logloss: 0.682132
[550]	valid_0's multi_error: 0.156541	valid_0's multi_logloss: 0.658836
[600]	valid_0's multi_error: 0.156075	valid_0's multi_logloss: 0.637057
[650]	valid_0's multi_error: 0.155791	valid_0's multi_logloss: 0.617284
[700]	valid_0's multi_error: 0.155118	valid_0's multi_logloss: 0.598993
[750]	valid_0's multi_error: 0.154264	valid_0's multi_logloss: 0.582024
[800]	valid_0's multi_error: 0.153488	valid_0's multi_logloss: 0.566305
[850]	valid_0's multi_error: 0.152841	valid_0's multi_logloss: 0.551987
[900]	valid_0's multi_error: 0.152272	valid_0's multi_logloss: 0.53863
[950]	valid_0's multi_error: 0.151728	valid_0's multi_logloss: 0.526476
[1000]	valid_0's multi_error: 0.151418	valid_0's multi_logloss: 0.515187
Did not meet early stopping. Best iteration is:
[1000]	valid_0's multi_error: 0.151418	valid_0's multi_logloss: 0.515187
Training until validation scores don't improve for 30 rounds
[50]	valid_0's multi_error: 0.167745	valid_0's multi_logloss: 1.03394
[100]	valid_0's multi_error: 0.164278	valid_0's multi_logloss: 0.976077
[150]	valid_0's multi_error: 0.162544	valid_0's multi_logloss: 0.925359
[200]	valid_0's multi_error: 0.161483	valid_0's multi_logloss: 0.879358
Early stopping, best iteration is:
[213]	valid_0's multi_error: 0.161173	valid_0's multi_logloss: 0.867786
Training until validation scores don't improve for 30 rounds
[50]	valid_0's multi_error: 0.168883	valid_0's multi_logloss: 1.03397
[100]	valid_0's multi_error: 0.164381	valid_0's multi_logloss: 0.976181
[150]	valid_0's multi_error: 0.163398	valid_0's multi_logloss: 0.925651
Early stopping, best iteration is:
[135]	valid_0's multi_error: 0.163294	valid_0's multi_logloss: 0.940433
