[I 2025-06-12 07:49:30,585] Trial 135 finished with value: 0.8897083619959724 and parameters: {'boosting_type': 'goss', 'learning_rate': 0.0527722286700148, 'num_leaves': 143, 'max_depth': 11, 'min_data_in_leaf': 25, 'feature_fraction': 0.9291528246929207, 'lambda_l1': 0.8108352170831047, 'lambda_l2': 3.653196544159688, 'min_gain_to_split': 0.2730419208638715, 'max_bin': 64}. Best is trial 124 with value: 0.8905374485574505.
Training until validation scores don't improve for 30 rounds
[50]	valid_0's multi_error: 0.137497	valid_0's multi_logloss: 0.401169
[100]	valid_0's multi_error: 0.127044	valid_0's multi_logloss: 0.3164
[150]	valid_0's multi_error: 0.119851	valid_0's multi_logloss: 0.288897
[200]	valid_0's multi_error: 0.115142	valid_0's multi_logloss: 0.274685
[250]	valid_0's multi_error: 0.11271	valid_0's multi_logloss: 0.266984
[300]	valid_0's multi_error: 0.110821	valid_0's multi_logloss: 0.261389
[350]	valid_0's multi_error: 0.109449	valid_0's multi_logloss: 0.257288
[400]	valid_0's multi_error: 0.108751	valid_0's multi_logloss: 0.254323
[450]	valid_0's multi_error: 0.108363	valid_0's multi_logloss: 0.252059
[500]	valid_0's multi_error: 0.107975	valid_0's multi_logloss: 0.250658
Early stopping, best iteration is:
[479]	valid_0's multi_error: 0.107509	valid_0's multi_logloss: 0.251253
Training until validation scores don't improve for 30 rounds
[50]	valid_0's multi_error: 0.138791	valid_0's multi_logloss: 0.401804
[100]	valid_0's multi_error: 0.12826	valid_0's multi_logloss: 0.31835
[150]	valid_0's multi_error: 0.122283	valid_0's multi_logloss: 0.290821
[200]	valid_0's multi_error: 0.11791	valid_0's multi_logloss: 0.278232
[250]	valid_0's multi_error: 0.11553	valid_0's multi_logloss: 0.270211
[300]	valid_0's multi_error: 0.113719	valid_0's multi_logloss: 0.264544
[350]	valid_0's multi_error: 0.111649	valid_0's multi_logloss: 0.260819
[400]	valid_0's multi_error: 0.110484	valid_0's multi_logloss: 0.257782
[450]	valid_0's multi_error: 0.110148	valid_0's multi_logloss: 0.255936
[500]	valid_0's multi_error: 0.109372	valid_0's multi_logloss: 0.254721
Early stopping, best iteration is:
[504]	valid_0's multi_error: 0.109268	valid_0's multi_logloss: 0.254645
Training until validation scores don't improve for 30 rounds
[50]	valid_0's multi_error: 0.141611	valid_0's multi_logloss: 0.406299
[100]	valid_0's multi_error: 0.132116	valid_0's multi_logloss: 0.322874
[150]	valid_0's multi_error: 0.124224	valid_0's multi_logloss: 0.295108
[200]	valid_0's multi_error: 0.120498	valid_0's multi_logloss: 0.281409
[250]	valid_0's multi_error: 0.117807	valid_0's multi_logloss: 0.273453
[300]	valid_0's multi_error: 0.11641	valid_0's multi_logloss: 0.268151
[350]	valid_0's multi_error: 0.114831	valid_0's multi_logloss: 0.264001
[400]	valid_0's multi_error: 0.113952	valid_0's multi_logloss: 0.261322
[450]	valid_0's multi_error: 0.112503	valid_0's multi_logloss: 0.25954
[500]	valid_0's multi_error: 0.112218	valid_0's multi_logloss: 0.258209
[550]	valid_0's multi_error: 0.111157	valid_0's multi_logloss: 0.257517
Early stopping, best iteration is:
[548]	valid_0's multi_error: 0.111105	valid_0's multi_logloss: 0.257505
[I 2025-06-12 07:55:23,095] Trial 136 finished with value: 0.888760782963646 and parameters: {'boosting_type': 'goss', 'learning_rate': 0.03734067928216911, 'num_leaves': 143, 'max_depth': 11, 'min_data_in_leaf': 23, 'feature_fraction': 0.9450826223526976, 'lambda_l1': 0.500374211245301, 'lambda_l2': 3.4777515962370713, 'min_gain_to_split': 0.43274518889814184, 'max_bin': 68}. Best is trial 124 with value: 0.8905374485574505.
Training until validation scores don't improve for 30 rounds
[50]	valid_0's multi_error: 0.131883	valid_0's multi_logloss: 0.352873
[100]	valid_0's multi_error: 0.121093	valid_0's multi_logloss: 0.292109
[150]	valid_0's multi_error: 0.116047	valid_0's multi_logloss: 0.272285
[200]	valid_0's multi_error: 0.114003	valid_0's multi_logloss: 0.262227
[250]	valid_0's multi_error: 0.111623	valid_0's multi_logloss: 0.256231
[300]	valid_0's multi_error: 0.109294	valid_0's multi_logloss: 0.252723
[350]	valid_0's multi_error: 0.10844	valid_0's multi_logloss: 0.25043
[400]	valid_0's multi_error: 0.107897	valid_0's multi_logloss: 0.249047
Early stopping, best iteration is:
[394]	valid_0's multi_error: 0.107561	valid_0's multi_logloss: 0.249204
Training until validation scores don't improve for 30 rounds
[50]	valid_0's multi_error: 0.134367	valid_0's multi_logloss: 0.354467
[100]	valid_0's multi_error: 0.123034	valid_0's multi_logloss: 0.294037
[150]	valid_0's multi_error: 0.117005	valid_0's multi_logloss: 0.274728
[200]	valid_0's multi_error: 0.114081	valid_0's multi_logloss: 0.265948
[250]	valid_0's multi_error: 0.111933	valid_0's multi_logloss: 0.260338
[300]	valid_0's multi_error: 0.110458	valid_0's multi_logloss: 0.256787
[350]	valid_0's multi_error: 0.109708	valid_0's multi_logloss: 0.255154
Early stopping, best iteration is:
[368]	valid_0's multi_error: 0.109139	valid_0's multi_logloss: 0.254722
Training until validation scores don't improve for 30 rounds
[50]	valid_0's multi_error: 0.137679	valid_0's multi_logloss: 0.358473
[100]	valid_0's multi_error: 0.125802	valid_0's multi_logloss: 0.296964
[150]	valid_0's multi_error: 0.11967	valid_0's multi_logloss: 0.27775
[200]	valid_0's multi_error: 0.115996	valid_0's multi_logloss: 0.267843
[250]	valid_0's multi_error: 0.113356	valid_0's multi_logloss: 0.261935
[300]	valid_0's multi_error: 0.112865	valid_0's multi_logloss: 0.258645
Early stopping, best iteration is:
[271]	valid_0's multi_error: 0.112684	valid_0's multi_logloss: 0.260455
[I 2025-06-12 07:59:51,601] Trial 137 finished with value: 0.8882757903666149 and parameters: {'boosting_type': 'goss', 'learning_rate': 0.051983741001811336, 'num_leaves': 143, 'max_depth': 12, 'min_data_in_leaf': 22, 'feature_fraction': 0.9325310783005881, 'lambda_l1': 0.5318189494471988, 'lambda_l2': 3.449404732468938, 'min_gain_to_split': 0.2834566002874319, 'max_bin': 64}. Best is trial 124 with value: 0.8905374485574505.
Training until validation scores don't improve for 30 rounds
[50]	valid_0's multi_error: 0.13729	valid_0's multi_logloss: 0.399935
[100]	valid_0's multi_error: 0.126578	valid_0's multi_logloss: 0.31551
[150]	valid_0's multi_error: 0.119515	valid_0's multi_logloss: 0.28817
[200]	valid_0's multi_error: 0.115659	valid_0's multi_logloss: 0.275289
[250]	valid_0's multi_error: 0.113615	valid_0's multi_logloss: 0.266734
[300]	valid_0's multi_error: 0.111985	valid_0's multi_logloss: 0.261096
[350]	valid_0's multi_error: 0.110045	valid_0's multi_logloss: 0.257364
[400]	valid_0's multi_error: 0.109035	valid_0's multi_logloss: 0.254658
[450]	valid_0's multi_error: 0.108958	valid_0's multi_logloss: 0.25284
Early stopping, best iteration is:
[427]	valid_0's multi_error: 0.108673	valid_0's multi_logloss: 0.253636
Training until validation scores don't improve for 30 rounds
[50]	valid_0's multi_error: 0.138765	valid_0's multi_logloss: 0.400046
[100]	valid_0's multi_error: 0.128855	valid_0's multi_logloss: 0.316825
[150]	valid_0's multi_error: 0.123034	valid_0's multi_logloss: 0.290633
[200]	valid_0's multi_error: 0.118609	valid_0's multi_logloss: 0.277911
[250]	valid_0's multi_error: 0.115556	valid_0's multi_logloss: 0.270406
[300]	valid_0's multi_error: 0.113563	valid_0's multi_logloss: 0.265045
[350]	valid_0's multi_error: 0.113305	valid_0's multi_logloss: 0.261451
[400]	valid_0's multi_error: 0.112218	valid_0's multi_logloss: 0.259187
[450]	valid_0's multi_error: 0.11095	valid_0's multi_logloss: 0.257309
Early stopping, best iteration is:
[435]	valid_0's multi_error: 0.110588	valid_0's multi_logloss: 0.257715
Training until validation scores don't improve for 30 rounds
[50]	valid_0's multi_error: 0.142698	valid_0's multi_logloss: 0.403984
[100]	valid_0's multi_error: 0.13209	valid_0's multi_logloss: 0.32144
[150]	valid_0's multi_error: 0.124638	valid_0's multi_logloss: 0.294031
[200]	valid_0's multi_error: 0.121041	valid_0's multi_logloss: 0.280769
[250]	valid_0's multi_error: 0.118195	valid_0's multi_logloss: 0.272858
[300]	valid_0's multi_error: 0.11672	valid_0's multi_logloss: 0.267701
[350]	valid_0's multi_error: 0.114288	valid_0's multi_logloss: 0.264185
Early stopping, best iteration is:
[357]	valid_0's multi_error: 0.113745	valid_0's multi_logloss: 0.263806
[I 2025-06-12 08:04:42,847] Trial 138 finished with value: 0.8869539404866545 and parameters: {'boosting_type': 'goss', 'learning_rate': 0.03767402144906281, 'num_leaves': 146, 'max_depth': 11, 'min_data_in_leaf': 19, 'feature_fraction': 0.9451545306823783, 'lambda_l1': 0.6635438015391717, 'lambda_l2': 3.6432394370627104, 'min_gain_to_split': 0.5532398388298254, 'max_bin': 72}. Best is trial 124 with value: 0.8905374485574505.
Training until validation scores don't improve for 30 rounds
[50]	valid_0's multi_error: 0.144199	valid_0's multi_logloss: 0.447908
[100]	valid_0's multi_error: 0.136669	valid_0's multi_logloss: 0.349993
[150]	valid_0's multi_error: 0.12945	valid_0's multi_logloss: 0.31539
[200]	valid_0's multi_error: 0.123887	valid_0's multi_logloss: 0.297857
[250]	valid_0's multi_error: 0.119773	valid_0's multi_logloss: 0.28752
[300]	valid_0's multi_error: 0.11716	valid_0's multi_logloss: 0.279624
[350]	valid_0's multi_error: 0.115168	valid_0's multi_logloss: 0.274194
[400]	valid_0's multi_error: 0.114314	valid_0's multi_logloss: 0.269302
[450]	valid_0's multi_error: 0.113615	valid_0's multi_logloss: 0.265546
[500]	valid_0's multi_error: 0.112114	valid_0's multi_logloss: 0.262168
[550]	valid_0's multi_error: 0.110872	valid_0's multi_logloss: 0.259605
[600]	valid_0's multi_error: 0.110096	valid_0's multi_logloss: 0.25747
[650]	valid_0's multi_error: 0.109941	valid_0's multi_logloss: 0.255694
Early stopping, best iteration is:
[625]	valid_0's multi_error: 0.109682	valid_0's multi_logloss: 0.256618
Training until validation scores don't improve for 30 rounds
[50]	valid_0's multi_error: 0.144691	valid_0's multi_logloss: 0.448336
[100]	valid_0's multi_error: 0.135738	valid_0's multi_logloss: 0.350753
[150]	valid_0's multi_error: 0.130304	valid_0's multi_logloss: 0.316554
[200]	valid_0's multi_error: 0.125673	valid_0's multi_logloss: 0.299668
[250]	valid_0's multi_error: 0.122904	valid_0's multi_logloss: 0.289185
[300]	valid_0's multi_error: 0.120239	valid_0's multi_logloss: 0.282044
[350]	valid_0's multi_error: 0.118195	valid_0's multi_logloss: 0.276605
[400]	valid_0's multi_error: 0.116229	valid_0's multi_logloss: 0.271911
[450]	valid_0's multi_error: 0.114624	valid_0's multi_logloss: 0.268418
[500]	valid_0's multi_error: 0.11302	valid_0's multi_logloss: 0.265526
[550]	valid_0's multi_error: 0.112451	valid_0's multi_logloss: 0.263383
[600]	valid_0's multi_error: 0.111623	valid_0's multi_logloss: 0.261454
[650]	valid_0's multi_error: 0.110614	valid_0's multi_logloss: 0.259857
[700]	valid_0's multi_error: 0.109812	valid_0's multi_logloss: 0.258622
Early stopping, best iteration is:
[698]	valid_0's multi_error: 0.109812	valid_0's multi_logloss: 0.258667
Training until validation scores don't improve for 30 rounds
[50]	valid_0's multi_error: 0.148623	valid_0's multi_logloss: 0.451367
[100]	valid_0's multi_error: 0.139645	valid_0's multi_logloss: 0.353938
[150]	valid_0's multi_error: 0.13416	valid_0's multi_logloss: 0.320162
[200]	valid_0's multi_error: 0.127613	valid_0's multi_logloss: 0.302535
[250]	valid_0's multi_error: 0.12425	valid_0's multi_logloss: 0.291877
[300]	valid_0's multi_error: 0.122413	valid_0's multi_logloss: 0.285142
[350]	valid_0's multi_error: 0.120343	valid_0's multi_logloss: 0.279389
[400]	valid_0's multi_error: 0.118505	valid_0's multi_logloss: 0.274711
[450]	valid_0's multi_error: 0.116901	valid_0's multi_logloss: 0.270806
[500]	valid_0's multi_error: 0.11478	valid_0's multi_logloss: 0.267604
[550]	valid_0's multi_error: 0.113305	valid_0's multi_logloss: 0.265016
Early stopping, best iteration is:
[549]	valid_0's multi_error: 0.113279	valid_0's multi_logloss: 0.26505
[I 2025-06-12 08:10:41,994] Trial 139 finished with value: 0.8870982009769811 and parameters: {'boosting_type': 'goss', 'learning_rate': 0.03038191842378409, 'num_leaves': 150, 'max_depth': 12, 'min_data_in_leaf': 86, 'feature_fraction': 0.9576421472484921, 'lambda_l1': 0.7918271932290126, 'lambda_l2': 3.9458868259523276, 'min_gain_to_split': 0.2543049984504992, 'max_bin': 68}. Best is trial 124 with value: 0.8905374485574505.
Training until validation scores don't improve for 30 rounds
[50]	valid_0's multi_error: 0.129994	valid_0's multi_logloss: 0.341878
[100]	valid_0's multi_error: 0.119566	valid_0's multi_logloss: 0.286858
[150]	valid_0's multi_error: 0.113874	valid_0's multi_logloss: 0.270022
[200]	valid_0's multi_error: 0.111597	valid_0's multi_logloss: 0.260646
[250]	valid_0's multi_error: 0.10976	valid_0's multi_logloss: 0.255404
[300]	valid_0's multi_error: 0.108104	valid_0's multi_logloss: 0.251971
[350]	valid_0's multi_error: 0.106965	valid_0's multi_logloss: 0.250094
[400]	valid_0's multi_error: 0.106836	valid_0's multi_logloss: 0.249168
Early stopping, best iteration is:
[395]	valid_0's multi_error: 0.106319	valid_0's multi_logloss: 0.249275
Training until validation scores don't improve for 30 rounds
[50]	valid_0's multi_error: 0.133202	valid_0's multi_logloss: 0.345219
[100]	valid_0's multi_error: 0.123241	valid_0's multi_logloss: 0.290642
[150]	valid_0's multi_error: 0.117212	valid_0's multi_logloss: 0.273194
[200]	valid_0's multi_error: 0.114676	valid_0's multi_logloss: 0.264716
[250]	valid_0's multi_error: 0.112296	valid_0's multi_logloss: 0.259867
[300]	valid_0's multi_error: 0.111959	valid_0's multi_logloss: 0.257255
[350]	valid_0's multi_error: 0.109941	valid_0's multi_logloss: 0.255637
Early stopping, best iteration is:
[354]	valid_0's multi_error: 0.109631	valid_0's multi_logloss: 0.255528
Training until validation scores don't improve for 30 rounds
[50]	valid_0's multi_error: 0.136669	valid_0's multi_logloss: 0.347856
[100]	valid_0's multi_error: 0.126113	valid_0's multi_logloss: 0.292991
[150]	valid_0's multi_error: 0.120627	valid_0's multi_logloss: 0.276245
[200]	valid_0's multi_error: 0.117005	valid_0's multi_logloss: 0.267838
[250]	valid_0's multi_error: 0.114573	valid_0's multi_logloss: 0.262967
[300]	valid_0's multi_error: 0.112942	valid_0's multi_logloss: 0.260276
[350]	valid_0's multi_error: 0.111933	valid_0's multi_logloss: 0.258773
Early stopping, best iteration is:
[365]	valid_0's multi_error: 0.111105	valid_0's multi_logloss: 0.258595
[I 2025-06-12 08:15:14,898] Trial 140 finished with value: 0.8890551185671894 and parameters: {'boosting_type': 'goss', 'learning_rate': 0.05538379504738804, 'num_leaves': 143, 'max_depth': 12, 'min_data_in_leaf': 24, 'feature_fraction': 0.9994500669608735, 'lambda_l1': 0.3691089808002767, 'lambda_l2': 3.5136165037111566, 'min_gain_to_split': 0.39536007522571526, 'max_bin': 80}. Best is trial 124 with value: 0.8905374485574505.
Training until validation scores don't improve for 30 rounds
[50]	valid_0's multi_error: 0.135557	valid_0's multi_logloss: 0.367013
[100]	valid_0's multi_error: 0.123396	valid_0's multi_logloss: 0.299238
[150]	valid_0's multi_error: 0.116824	valid_0's multi_logloss: 0.276937
[200]	valid_0's multi_error: 0.11302	valid_0's multi_logloss: 0.265793
[250]	valid_0's multi_error: 0.110795	valid_0's multi_logloss: 0.259117
[300]	valid_0's multi_error: 0.109398	valid_0's multi_logloss: 0.25485
[350]	valid_0's multi_error: 0.108337	valid_0's multi_logloss: 0.251844
[400]	valid_0's multi_error: 0.107793	valid_0's multi_logloss: 0.250173
[450]	valid_0's multi_error: 0.107043	valid_0's multi_logloss: 0.248915
Early stopping, best iteration is:
[423]	valid_0's multi_error: 0.10694	valid_0's multi_logloss: 0.249324
Training until validation scores don't improve for 30 rounds
[50]	valid_0's multi_error: 0.137032	valid_0's multi_logloss: 0.368632
[100]	valid_0's multi_error: 0.125155	valid_0's multi_logloss: 0.301414
[150]	valid_0's multi_error: 0.119489	valid_0's multi_logloss: 0.280702
[200]	valid_0's multi_error: 0.11597	valid_0's multi_logloss: 0.27029
[250]	valid_0's multi_error: 0.113977	valid_0's multi_logloss: 0.263949
[300]	valid_0's multi_error: 0.111752	valid_0's multi_logloss: 0.259672
[350]	valid_0's multi_error: 0.111054	valid_0's multi_logloss: 0.256997
Early stopping, best iteration is:
[347]	valid_0's multi_error: 0.110614	valid_0's multi_logloss: 0.257065
Training until validation scores don't improve for 30 rounds
[50]	valid_0's multi_error: 0.140059	valid_0's multi_logloss: 0.371845
[100]	valid_0's multi_error: 0.128441	valid_0's multi_logloss: 0.304504
[150]	valid_0's multi_error: 0.122568	valid_0's multi_logloss: 0.283084
[200]	valid_0's multi_error: 0.117807	valid_0's multi_logloss: 0.272459
[250]	valid_0's multi_error: 0.116047	valid_0's multi_logloss: 0.26581
[300]	valid_0's multi_error: 0.113822	valid_0's multi_logloss: 0.261851
[350]	valid_0's multi_error: 0.112606	valid_0's multi_logloss: 0.259222
[400]	valid_0's multi_error: 0.111752	valid_0's multi_logloss: 0.257817
[450]	valid_0's multi_error: 0.111183	valid_0's multi_logloss: 0.256846
[500]	valid_0's multi_error: 0.110847	valid_0's multi_logloss: 0.256196
Early stopping, best iteration is:
[486]	valid_0's multi_error: 0.110226	valid_0's multi_logloss: 0.256337
[I 2025-06-12 08:20:05,465] Trial 141 finished with value: 0.8888077092173754 and parameters: {'boosting_type': 'goss', 'learning_rate': 0.04652357666724879, 'num_leaves': 128, 'max_depth': 12, 'min_data_in_leaf': 24, 'feature_fraction': 0.9984881044892114, 'lambda_l1': 0.3809177380083486, 'lambda_l2': 3.5404078555800167, 'min_gain_to_split': 0.36102455268002837, 'max_bin': 80}. Best is trial 124 with value: 0.8905374485574505.
Training until validation scores don't improve for 30 rounds
[50]	valid_0's multi_error: 0.132348	valid_0's multi_logloss: 0.347779
[100]	valid_0's multi_error: 0.12042	valid_0's multi_logloss: 0.289978
[150]	valid_0's multi_error: 0.114987	valid_0's multi_logloss: 0.271948
[200]	valid_0's multi_error: 0.111468	valid_0's multi_logloss: 0.262074
[250]	valid_0's multi_error: 0.109527	valid_0's multi_logloss: 0.256278
[300]	valid_0's multi_error: 0.108596	valid_0's multi_logloss: 0.25279
[350]	valid_0's multi_error: 0.107561	valid_0's multi_logloss: 0.250493
Early stopping, best iteration is:
[360]	valid_0's multi_error: 0.107095	valid_0's multi_logloss: 0.250362
Training until validation scores don't improve for 30 rounds
[50]	valid_0's multi_error: 0.133254	valid_0's multi_logloss: 0.349251
[100]	valid_0's multi_error: 0.122645	valid_0's multi_logloss: 0.29214
[150]	valid_0's multi_error: 0.117703	valid_0's multi_logloss: 0.274003
[200]	valid_0's multi_error: 0.114184	valid_0's multi_logloss: 0.265297
[250]	valid_0's multi_error: 0.112658	valid_0's multi_logloss: 0.260266
[300]	valid_0's multi_error: 0.111778	valid_0's multi_logloss: 0.257048
[350]	valid_0's multi_error: 0.11095	valid_0's multi_logloss: 0.255246
[400]	valid_0's multi_error: 0.110019	valid_0's multi_logloss: 0.254142
Early stopping, best iteration is:
[378]	valid_0's multi_error: 0.109631	valid_0's multi_logloss: 0.254608
Training until validation scores don't improve for 30 rounds
[50]	valid_0's multi_error: 0.136048	valid_0's multi_logloss: 0.352671
[100]	valid_0's multi_error: 0.124586	valid_0's multi_logloss: 0.295028
[150]	valid_0's multi_error: 0.118816	valid_0's multi_logloss: 0.277158
[200]	valid_0's multi_error: 0.11597	valid_0's multi_logloss: 0.267723
[250]	valid_0's multi_error: 0.113693	valid_0's multi_logloss: 0.262441
[300]	valid_0's multi_error: 0.112451	valid_0's multi_logloss: 0.25921
[350]	valid_0's multi_error: 0.110898	valid_0's multi_logloss: 0.257387
Early stopping, best iteration is:
[355]	valid_0's multi_error: 0.110665	valid_0's multi_logloss: 0.257231
