[I 2025-06-12 10:58:41,978] Trial 175 finished with value: 0.8904362666227987 and parameters: {'boosting_type': 'goss', 'learning_rate': 0.07035001750211117, 'num_leaves': 129, 'max_depth': 15, 'min_data_in_leaf': 11, 'feature_fraction': 0.9751606004077481, 'lambda_l1': 0.01920113607764997, 'lambda_l2': 4.220833678108176, 'min_gain_to_split': 0.02086420073843531, 'max_bin': 64}. Best is trial 173 with value: 0.8911108787545454.
Training until validation scores don't improve for 30 rounds
[50]	valid_0's multi_error: 0.127743	valid_0's multi_logloss: 0.318309
[100]	valid_0's multi_error: 0.117419	valid_0's multi_logloss: 0.274469
[150]	valid_0's multi_error: 0.112554	valid_0's multi_logloss: 0.260099
[200]	valid_0's multi_error: 0.11007	valid_0's multi_logloss: 0.253059
[250]	valid_0's multi_error: 0.107638	valid_0's multi_logloss: 0.249578
[300]	valid_0's multi_error: 0.10606	valid_0's multi_logloss: 0.247452
[350]	valid_0's multi_error: 0.105387	valid_0's multi_logloss: 0.246759
[400]	valid_0's multi_error: 0.104947	valid_0's multi_logloss: 0.246623
Early stopping, best iteration is:
[384]	valid_0's multi_error: 0.104921	valid_0's multi_logloss: 0.246355
Training until validation scores don't improve for 30 rounds
[50]	valid_0's multi_error: 0.129502	valid_0's multi_logloss: 0.320345
[100]	valid_0's multi_error: 0.118195	valid_0's multi_logloss: 0.276196
[150]	valid_0's multi_error: 0.113512	valid_0's multi_logloss: 0.262875
[200]	valid_0's multi_error: 0.110898	valid_0's multi_logloss: 0.256416
[250]	valid_0's multi_error: 0.109061	valid_0's multi_logloss: 0.252839
[300]	valid_0's multi_error: 0.108	valid_0's multi_logloss: 0.251659
[350]	valid_0's multi_error: 0.108	valid_0's multi_logloss: 0.250672
[400]	valid_0's multi_error: 0.106888	valid_0's multi_logloss: 0.25081
Early stopping, best iteration is:
[380]	valid_0's multi_error: 0.106189	valid_0's multi_logloss: 0.250442
Training until validation scores don't improve for 30 rounds
[50]	valid_0's multi_error: 0.132116	valid_0's multi_logloss: 0.323834
[100]	valid_0's multi_error: 0.119903	valid_0's multi_logloss: 0.279902
[150]	valid_0's multi_error: 0.115064	valid_0's multi_logloss: 0.266442
[200]	valid_0's multi_error: 0.11214	valid_0's multi_logloss: 0.259628
[250]	valid_0's multi_error: 0.110691	valid_0's multi_logloss: 0.256259
[300]	valid_0's multi_error: 0.109734	valid_0's multi_logloss: 0.255172
[350]	valid_0's multi_error: 0.108621	valid_0's multi_logloss: 0.254335
Early stopping, best iteration is:
[355]	valid_0's multi_error: 0.108492	valid_0's multi_logloss: 0.254293
[I 2025-06-12 11:04:34,440] Trial 176 finished with value: 0.8916511061291038 and parameters: {'boosting_type': 'goss', 'learning_rate': 0.06917004092506376, 'num_leaves': 130, 'max_depth': 15, 'min_data_in_leaf': 11, 'feature_fraction': 0.9681823770104198, 'lambda_l1': 0.0021106777455843218, 'lambda_l2': 4.228493143063362, 'min_gain_to_split': 0.016037013720650334, 'max_bin': 64}. Best is trial 176 with value: 0.8916511061291038.
Training until validation scores don't improve for 30 rounds
[50]	valid_0's multi_error: 0.12795	valid_0's multi_logloss: 0.318791
[100]	valid_0's multi_error: 0.116513	valid_0's multi_logloss: 0.274498
[150]	valid_0's multi_error: 0.111209	valid_0's multi_logloss: 0.259442
[200]	valid_0's multi_error: 0.107793	valid_0's multi_logloss: 0.252171
[250]	valid_0's multi_error: 0.107147	valid_0's multi_logloss: 0.248995
[300]	valid_0's multi_error: 0.10518	valid_0's multi_logloss: 0.246806
[350]	valid_0's multi_error: 0.104507	valid_0's multi_logloss: 0.245844
Early stopping, best iteration is:
[353]	valid_0's multi_error: 0.104119	valid_0's multi_logloss: 0.245889
Training until validation scores don't improve for 30 rounds
[50]	valid_0's multi_error: 0.128312	valid_0's multi_logloss: 0.319781
[100]	valid_0's multi_error: 0.118273	valid_0's multi_logloss: 0.276844
[150]	valid_0's multi_error: 0.113538	valid_0's multi_logloss: 0.263204
[200]	valid_0's multi_error: 0.110743	valid_0's multi_logloss: 0.25636
[250]	valid_0's multi_error: 0.10888	valid_0's multi_logloss: 0.252868
[300]	valid_0's multi_error: 0.107742	valid_0's multi_logloss: 0.251208
[350]	valid_0's multi_error: 0.106603	valid_0's multi_logloss: 0.250695
Early stopping, best iteration is:
[355]	valid_0's multi_error: 0.106267	valid_0's multi_logloss: 0.250755
Training until validation scores don't improve for 30 rounds
[50]	valid_0's multi_error: 0.132581	valid_0's multi_logloss: 0.323885
[100]	valid_0's multi_error: 0.120705	valid_0's multi_logloss: 0.279284
[150]	valid_0's multi_error: 0.114573	valid_0's multi_logloss: 0.264787
[200]	valid_0's multi_error: 0.111856	valid_0's multi_logloss: 0.25813
[250]	valid_0's multi_error: 0.111054	valid_0's multi_logloss: 0.255256
[300]	valid_0's multi_error: 0.109812	valid_0's multi_logloss: 0.253685
[350]	valid_0's multi_error: 0.109605	valid_0's multi_logloss: 0.253251
Early stopping, best iteration is:
[351]	valid_0's multi_error: 0.109605	valid_0's multi_logloss: 0.253245
[I 2025-06-12 11:10:08,468] Trial 177 finished with value: 0.8915166688989826 and parameters: {'boosting_type': 'goss', 'learning_rate': 0.06950195861316194, 'num_leaves': 129, 'max_depth': 15, 'min_data_in_leaf': 12, 'feature_fraction': 0.9688773200045657, 'lambda_l1': 0.006100695161944947, 'lambda_l2': 4.180190814495842, 'min_gain_to_split': 0.001757086552390888, 'max_bin': 64}. Best is trial 176 with value: 0.8916511061291038.
Training until validation scores don't improve for 30 rounds
[50]	valid_0's multi_error: 0.127536	valid_0's multi_logloss: 0.32186
[100]	valid_0's multi_error: 0.117082	valid_0's multi_logloss: 0.27633
[150]	valid_0's multi_error: 0.111985	valid_0's multi_logloss: 0.261283
[200]	valid_0's multi_error: 0.108906	valid_0's multi_logloss: 0.253626
[250]	valid_0's multi_error: 0.107121	valid_0's multi_logloss: 0.249776
Early stopping, best iteration is:
[258]	valid_0's multi_error: 0.106655	valid_0's multi_logloss: 0.249406
Training until validation scores don't improve for 30 rounds
[50]	valid_0's multi_error: 0.128597	valid_0's multi_logloss: 0.323587
[100]	valid_0's multi_error: 0.117548	valid_0's multi_logloss: 0.278608
[150]	valid_0's multi_error: 0.113408	valid_0's multi_logloss: 0.264694
[200]	valid_0's multi_error: 0.111597	valid_0's multi_logloss: 0.257301
[250]	valid_0's multi_error: 0.10976	valid_0's multi_logloss: 0.252989
[300]	valid_0's multi_error: 0.108414	valid_0's multi_logloss: 0.251146
[350]	valid_0's multi_error: 0.107431	valid_0's multi_logloss: 0.249747
Early stopping, best iteration is:
[364]	valid_0's multi_error: 0.106758	valid_0's multi_logloss: 0.249712
Training until validation scores don't improve for 30 rounds
[50]	valid_0's multi_error: 0.133176	valid_0's multi_logloss: 0.327753
[100]	valid_0's multi_error: 0.120938	valid_0's multi_logloss: 0.281882
[150]	valid_0's multi_error: 0.116617	valid_0's multi_logloss: 0.267707
[200]	valid_0's multi_error: 0.113538	valid_0's multi_logloss: 0.26048
[250]	valid_0's multi_error: 0.111364	valid_0's multi_logloss: 0.256401
[300]	valid_0's multi_error: 0.110381	valid_0's multi_logloss: 0.25475
Early stopping, best iteration is:
[311]	valid_0's multi_error: 0.109656	valid_0's multi_logloss: 0.254403
[I 2025-06-12 11:14:59,669] Trial 178 finished with value: 0.8904546459942618 and parameters: {'boosting_type': 'goss', 'learning_rate': 0.06759220904077852, 'num_leaves': 126, 'max_depth': 15, 'min_data_in_leaf': 11, 'feature_fraction': 0.9669402414633169, 'lambda_l1': 0.07181527210609179, 'lambda_l2': 4.239218999217794, 'min_gain_to_split': 0.023733916372893765, 'max_bin': 64}. Best is trial 176 with value: 0.8916511061291038.
Training until validation scores don't improve for 30 rounds
[50]	valid_0's multi_error: 0.126087	valid_0's multi_logloss: 0.31741
[100]	valid_0's multi_error: 0.115711	valid_0's multi_logloss: 0.273102
[150]	valid_0's multi_error: 0.1117	valid_0's multi_logloss: 0.26016
[200]	valid_0's multi_error: 0.108932	valid_0's multi_logloss: 0.252955
[250]	valid_0's multi_error: 0.106914	valid_0's multi_logloss: 0.248362
Early stopping, best iteration is:
[257]	valid_0's multi_error: 0.106474	valid_0's multi_logloss: 0.247908
Training until validation scores don't improve for 30 rounds
[50]	valid_0's multi_error: 0.127717	valid_0's multi_logloss: 0.318901
[100]	valid_0's multi_error: 0.117005	valid_0's multi_logloss: 0.275102
[150]	valid_0's multi_error: 0.112761	valid_0's multi_logloss: 0.262305
[200]	valid_0's multi_error: 0.110381	valid_0's multi_logloss: 0.255522
[250]	valid_0's multi_error: 0.108777	valid_0's multi_logloss: 0.251286
[300]	valid_0's multi_error: 0.106914	valid_0's multi_logloss: 0.248065
[350]	valid_0's multi_error: 0.1065	valid_0's multi_logloss: 0.24604
[400]	valid_0's multi_error: 0.105801	valid_0's multi_logloss: 0.245141
Early stopping, best iteration is:
[418]	valid_0's multi_error: 0.105491	valid_0's multi_logloss: 0.244904
Training until validation scores don't improve for 30 rounds
[50]	valid_0's multi_error: 0.131495	valid_0's multi_logloss: 0.322707
[100]	valid_0's multi_error: 0.120938	valid_0's multi_logloss: 0.279098
[150]	valid_0's multi_error: 0.115815	valid_0's multi_logloss: 0.265797
[200]	valid_0's multi_error: 0.112865	valid_0's multi_logloss: 0.259104
[250]	valid_0's multi_error: 0.111364	valid_0's multi_logloss: 0.254547
[300]	valid_0's multi_error: 0.109682	valid_0's multi_logloss: 0.251584
[350]	valid_0's multi_error: 0.109061	valid_0's multi_logloss: 0.250014
[400]	valid_0's multi_error: 0.108285	valid_0's multi_logloss: 0.248855
[450]	valid_0's multi_error: 0.107638	valid_0's multi_logloss: 0.248152
[500]	valid_0's multi_error: 0.106888	valid_0's multi_logloss: 0.248024
Early stopping, best iteration is:
[473]	valid_0's multi_error: 0.10725	valid_0's multi_logloss: 0.247863
[I 2025-06-12 11:20:34,828] Trial 179 finished with value: 0.891767299378741 and parameters: {'boosting_type': 'gbdt', 'learning_rate': 0.06960584375840739, 'num_leaves': 125, 'max_depth': 15, 'min_data_in_leaf': 10, 'feature_fraction': 0.9654207352941991, 'lambda_l1': 0.012247411944956692, 'lambda_l2': 4.2190675166485585, 'min_gain_to_split': 0.014715178040598315, 'max_bin': 64, 'bagging_fraction': 0.99961023604547, 'bagging_freq': 6}. Best is trial 179 with value: 0.891767299378741.
Training until validation scores don't improve for 30 rounds
[50]	valid_0's multi_error: 0.126475	valid_0's multi_logloss: 0.317479
[100]	valid_0's multi_error: 0.115116	valid_0's multi_logloss: 0.272637
[150]	valid_0's multi_error: 0.11064	valid_0's multi_logloss: 0.258519
[200]	valid_0's multi_error: 0.108026	valid_0's multi_logloss: 0.251106
[250]	valid_0's multi_error: 0.105672	valid_0's multi_logloss: 0.246451
[300]	valid_0's multi_error: 0.104042	valid_0's multi_logloss: 0.243498
[350]	valid_0's multi_error: 0.103343	valid_0's multi_logloss: 0.241695
[400]	valid_0's multi_error: 0.1028	valid_0's multi_logloss: 0.240351
Early stopping, best iteration is:
[372]	valid_0's multi_error: 0.102541	valid_0's multi_logloss: 0.240799
Training until validation scores don't improve for 30 rounds
[50]	valid_0's multi_error: 0.127743	valid_0's multi_logloss: 0.317963
[100]	valid_0's multi_error: 0.117859	valid_0's multi_logloss: 0.274593
[150]	valid_0's multi_error: 0.11377	valid_0's multi_logloss: 0.261216
[200]	valid_0's multi_error: 0.111312	valid_0's multi_logloss: 0.25409
[250]	valid_0's multi_error: 0.109398	valid_0's multi_logloss: 0.250224
[300]	valid_0's multi_error: 0.107405	valid_0's multi_logloss: 0.246839
[350]	valid_0's multi_error: 0.105594	valid_0's multi_logloss: 0.244661
[400]	valid_0's multi_error: 0.104404	valid_0's multi_logloss: 0.243418
Early stopping, best iteration is:
[403]	valid_0's multi_error: 0.104585	valid_0's multi_logloss: 0.243283
Training until validation scores don't improve for 30 rounds
[50]	valid_0's multi_error: 0.133073	valid_0's multi_logloss: 0.323834
[100]	valid_0's multi_error: 0.120731	valid_0's multi_logloss: 0.279145
[150]	valid_0's multi_error: 0.114909	valid_0's multi_logloss: 0.26492
[200]	valid_0's multi_error: 0.111907	valid_0's multi_logloss: 0.257851
[250]	valid_0's multi_error: 0.110096	valid_0's multi_logloss: 0.253019
[300]	valid_0's multi_error: 0.109449	valid_0's multi_logloss: 0.250124
[350]	valid_0's multi_error: 0.107768	valid_0's multi_logloss: 0.248177
Early stopping, best iteration is:
[365]	valid_0's multi_error: 0.107198	valid_0's multi_logloss: 0.247752
[I 2025-06-12 11:26:10,810] Trial 180 finished with value: 0.8934713688889171 and parameters: {'boosting_type': 'gbdt', 'learning_rate': 0.06970517545762185, 'num_leaves': 125, 'max_depth': 15, 'min_data_in_leaf': 11, 'feature_fraction': 0.96586320080613, 'lambda_l1': 0.07989120979222203, 'lambda_l2': 4.228973461416498, 'min_gain_to_split': 0.0040528132213006884, 'max_bin': 64, 'bagging_fraction': 0.9387360874280557, 'bagging_freq': 6}. Best is trial 180 with value: 0.8934713688889171.
Training until validation scores don't improve for 30 rounds
[50]	valid_0's multi_error: 0.126009	valid_0's multi_logloss: 0.315449
[100]	valid_0's multi_error: 0.115789	valid_0's multi_logloss: 0.272177
[150]	valid_0's multi_error: 0.111157	valid_0's multi_logloss: 0.260105
[200]	valid_0's multi_error: 0.108725	valid_0's multi_logloss: 0.253111
[250]	valid_0's multi_error: 0.107819	valid_0's multi_logloss: 0.248844
[300]	valid_0's multi_error: 0.106603	valid_0's multi_logloss: 0.245826
[350]	valid_0's multi_error: 0.105723	valid_0's multi_logloss: 0.243961
[400]	valid_0's multi_error: 0.105232	valid_0's multi_logloss: 0.242857
[450]	valid_0's multi_error: 0.104663	valid_0's multi_logloss: 0.242095
Early stopping, best iteration is:
[426]	valid_0's multi_error: 0.104481	valid_0's multi_logloss: 0.242443
Training until validation scores don't improve for 30 rounds
[50]	valid_0's multi_error: 0.126992	valid_0's multi_logloss: 0.316495
[100]	valid_0's multi_error: 0.116694	valid_0's multi_logloss: 0.274222
[150]	valid_0's multi_error: 0.112735	valid_0's multi_logloss: 0.261535
[200]	valid_0's multi_error: 0.110743	valid_0's multi_logloss: 0.255188
[250]	valid_0's multi_error: 0.108828	valid_0's multi_logloss: 0.250879
[300]	valid_0's multi_error: 0.107509	valid_0's multi_logloss: 0.247924
[350]	valid_0's multi_error: 0.106241	valid_0's multi_logloss: 0.24606
[400]	valid_0's multi_error: 0.105128	valid_0's multi_logloss: 0.244481
[450]	valid_0's multi_error: 0.10487	valid_0's multi_logloss: 0.244082
Early stopping, best iteration is:
[431]	valid_0's multi_error: 0.1043	valid_0's multi_logloss: 0.244058
Training until validation scores don't improve for 30 rounds
[50]	valid_0's multi_error: 0.131262	valid_0's multi_logloss: 0.321618
[100]	valid_0's multi_error: 0.121093	valid_0's multi_logloss: 0.279004
[150]	valid_0's multi_error: 0.115504	valid_0's multi_logloss: 0.265205
[200]	valid_0's multi_error: 0.112296	valid_0's multi_logloss: 0.258292
[250]	valid_0's multi_error: 0.110665	valid_0's multi_logloss: 0.2537
[300]	valid_0's multi_error: 0.108647	valid_0's multi_logloss: 0.250694
[350]	valid_0's multi_error: 0.108725	valid_0's multi_logloss: 0.24915
[400]	valid_0's multi_error: 0.108052	valid_0's multi_logloss: 0.248295
[450]	valid_0's multi_error: 0.107147	valid_0's multi_logloss: 0.248202
Early stopping, best iteration is:
[421]	valid_0's multi_error: 0.107664	valid_0's multi_logloss: 0.248165
[I 2025-06-12 11:32:21,160] Trial 181 finished with value: 0.8927513022778206 and parameters: {'boosting_type': 'gbdt', 'learning_rate': 0.07104675932712141, 'num_leaves': 125, 'max_depth': 15, 'min_data_in_leaf': 11, 'feature_fraction': 0.9644556601472666, 'lambda_l1': 0.014096467938443213, 'lambda_l2': 4.237048304135754, 'min_gain_to_split': 0.02214398425504926, 'max_bin': 64, 'bagging_fraction': 0.9973465507329771, 'bagging_freq': 6}. Best is trial 180 with value: 0.8934713688889171.
Training until validation scores don't improve for 30 rounds
[50]	valid_0's multi_error: 0.127303	valid_0's multi_logloss: 0.321388
[100]	valid_0's multi_error: 0.116617	valid_0's multi_logloss: 0.275447
[150]	valid_0's multi_error: 0.112373	valid_0's multi_logloss: 0.26187
[200]	valid_0's multi_error: 0.108699	valid_0's multi_logloss: 0.253698
[250]	valid_0's multi_error: 0.106655	valid_0's multi_logloss: 0.248594
[300]	valid_0's multi_error: 0.105672	valid_0's multi_logloss: 0.246272
[350]	valid_0's multi_error: 0.105309	valid_0's multi_logloss: 0.244299
[400]	valid_0's multi_error: 0.10474	valid_0's multi_logloss: 0.242995
[450]	valid_0's multi_error: 0.104999	valid_0's multi_logloss: 0.242242
[500]	valid_0's multi_error: 0.103757	valid_0's multi_logloss: 0.241793
[550]	valid_0's multi_error: 0.103472	valid_0's multi_logloss: 0.241183
[600]	valid_0's multi_error: 0.102826	valid_0's multi_logloss: 0.240864
Early stopping, best iteration is:
[582]	valid_0's multi_error: 0.102541	valid_0's multi_logloss: 0.241019
Training until validation scores don't improve for 30 rounds
[50]	valid_0's multi_error: 0.129062	valid_0's multi_logloss: 0.321933
[100]	valid_0's multi_error: 0.118454	valid_0's multi_logloss: 0.277716
[150]	valid_0's multi_error: 0.114236	valid_0's multi_logloss: 0.26408
[200]	valid_0's multi_error: 0.111364	valid_0's multi_logloss: 0.256847
[250]	valid_0's multi_error: 0.110096	valid_0's multi_logloss: 0.252353
[300]	valid_0's multi_error: 0.108363	valid_0's multi_logloss: 0.249173
[350]	valid_0's multi_error: 0.108104	valid_0's multi_logloss: 0.247122
[400]	valid_0's multi_error: 0.106733	valid_0's multi_logloss: 0.245728
[450]	valid_0's multi_error: 0.106189	valid_0's multi_logloss: 0.245167
[500]	valid_0's multi_error: 0.105465	valid_0's multi_logloss: 0.244618
Early stopping, best iteration is:
[498]	valid_0's multi_error: 0.105258	valid_0's multi_logloss: 0.244625
Training until validation scores don't improve for 30 rounds
[50]	valid_0's multi_error: 0.132555	valid_0's multi_logloss: 0.327514
[100]	valid_0's multi_error: 0.122206	valid_0's multi_logloss: 0.28225
[150]	valid_0's multi_error: 0.116384	valid_0's multi_logloss: 0.267816
[200]	valid_0's multi_error: 0.113382	valid_0's multi_logloss: 0.260493
[250]	valid_0's multi_error: 0.110769	valid_0's multi_logloss: 0.256257
[300]	valid_0's multi_error: 0.10901	valid_0's multi_logloss: 0.25325
[350]	valid_0's multi_error: 0.108	valid_0's multi_logloss: 0.251451
[400]	valid_0's multi_error: 0.107095	valid_0's multi_logloss: 0.249976
[450]	valid_0's multi_error: 0.106707	valid_0's multi_logloss: 0.249332
Early stopping, best iteration is:
[457]	valid_0's multi_error: 0.106422	valid_0's multi_logloss: 0.249271
[I 2025-06-12 11:39:44,358] Trial 182 finished with value: 0.8935107886618453 and parameters: {'boosting_type': 'gbdt', 'learning_rate': 0.06723512635762119, 'num_leaves': 122, 'max_depth': 15, 'min_data_in_leaf': 10, 'feature_fraction': 0.9673429065407727, 'lambda_l1': 0.08194095583965068, 'lambda_l2': 4.278876109231342, 'min_gain_to_split': 0.033210359311622584, 'max_bin': 66, 'bagging_fraction': 0.997265832536891, 'bagging_freq': 6}. Best is trial 182 with value: 0.8935107886618453.
Training until validation scores don't improve for 30 rounds
[50]	valid_0's multi_error: 0.127458	valid_0's multi_logloss: 0.32243
[100]	valid_0's multi_error: 0.11628	valid_0's multi_logloss: 0.275977
[150]	valid_0's multi_error: 0.112218	valid_0's multi_logloss: 0.261969
[200]	valid_0's multi_error: 0.10932	valid_0's multi_logloss: 0.254353
[250]	valid_0's multi_error: 0.107457	valid_0's multi_logloss: 0.249286
[300]	valid_0's multi_error: 0.106293	valid_0's multi_logloss: 0.246014
[350]	valid_0's multi_error: 0.104585	valid_0's multi_logloss: 0.243614
[400]	valid_0's multi_error: 0.104456	valid_0's multi_logloss: 0.241785
Early stopping, best iteration is:
[382]	valid_0's multi_error: 0.104197	valid_0's multi_logloss: 0.242323
Training until validation scores don't improve for 30 rounds
[50]	valid_0's multi_error: 0.129657	valid_0's multi_logloss: 0.323977
[100]	valid_0's multi_error: 0.118661	valid_0's multi_logloss: 0.277232
[150]	valid_0's multi_error: 0.114417	valid_0's multi_logloss: 0.264276
[200]	valid_0's multi_error: 0.111286	valid_0's multi_logloss: 0.256608
[250]	valid_0's multi_error: 0.108984	valid_0's multi_logloss: 0.251848
[300]	valid_0's multi_error: 0.107302	valid_0's multi_logloss: 0.24878
[350]	valid_0's multi_error: 0.10681	valid_0's multi_logloss: 0.247175
[400]	valid_0's multi_error: 0.106112	valid_0's multi_logloss: 0.245709
[450]	valid_0's multi_error: 0.105465	valid_0's multi_logloss: 0.245257
[500]	valid_0's multi_error: 0.105154	valid_0's multi_logloss: 0.244591
Early stopping, best iteration is:
[512]	valid_0's multi_error: 0.104999	valid_0's multi_logloss: 0.244442
Training until validation scores don't improve for 30 rounds
[50]	valid_0's multi_error: 0.132659	valid_0's multi_logloss: 0.328886
[100]	valid_0's multi_error: 0.122257	valid_0's multi_logloss: 0.281294
[150]	valid_0's multi_error: 0.117238	valid_0's multi_logloss: 0.267266
[200]	valid_0's multi_error: 0.113693	valid_0's multi_logloss: 0.259926
[250]	valid_0's multi_error: 0.11139	valid_0's multi_logloss: 0.255226
[300]	valid_0's multi_error: 0.109294	valid_0's multi_logloss: 0.252224
[350]	valid_0's multi_error: 0.108621	valid_0's multi_logloss: 0.250402
Early stopping, best iteration is:
[352]	valid_0's multi_error: 0.108414	valid_0's multi_logloss: 0.250358
