[I 2025-06-12 03:10:52,667] Trial 58 finished with value: 0.8366822236788103 and parameters: {'boosting_type': 'goss', 'learning_rate': 0.0012647081015889456, 'num_leaves': 120, 'max_depth': 8, 'min_data_in_leaf': 20, 'feature_fraction': 0.7450975119854436, 'lambda_l1': 2.6124081310776273, 'lambda_l2': 0.0014644912016484601, 'min_gain_to_split': 1.070631125773458, 'max_bin': 122}. Best is trial 47 with value: 0.8895928149546414.
Training until validation scores don't improve for 30 rounds
[50]	valid_0's multi_error: 0.133202	valid_0's multi_logloss: 0.329021
[100]	valid_0's multi_error: 0.122154	valid_0's multi_logloss: 0.289793
[150]	valid_0's multi_error: 0.117057	valid_0's multi_logloss: 0.274439
[200]	valid_0's multi_error: 0.113563	valid_0's multi_logloss: 0.266638
[250]	valid_0's multi_error: 0.111364	valid_0's multi_logloss: 0.261021
[300]	valid_0's multi_error: 0.110277	valid_0's multi_logloss: 0.258174
Early stopping, best iteration is:
[318]	valid_0's multi_error: 0.110019	valid_0's multi_logloss: 0.257609
Training until validation scores don't improve for 30 rounds
[50]	valid_0's multi_error: 0.134962	valid_0's multi_logloss: 0.330202
[100]	valid_0's multi_error: 0.123034	valid_0's multi_logloss: 0.291093
[150]	valid_0's multi_error: 0.118945	valid_0's multi_logloss: 0.276113
[200]	valid_0's multi_error: 0.11553	valid_0's multi_logloss: 0.268539
[250]	valid_0's multi_error: 0.114184	valid_0's multi_logloss: 0.264745
[300]	valid_0's multi_error: 0.112606	valid_0's multi_logloss: 0.262214
[350]	valid_0's multi_error: 0.111028	valid_0's multi_logloss: 0.26075
Early stopping, best iteration is:
[365]	valid_0's multi_error: 0.110588	valid_0's multi_logloss: 0.260506
Training until validation scores don't improve for 30 rounds
[50]	valid_0's multi_error: 0.138144	valid_0's multi_logloss: 0.335021
[100]	valid_0's multi_error: 0.126268	valid_0's multi_logloss: 0.2953
[150]	valid_0's multi_error: 0.120498	valid_0's multi_logloss: 0.280175
[200]	valid_0's multi_error: 0.117859	valid_0's multi_logloss: 0.272213
[250]	valid_0's multi_error: 0.115478	valid_0's multi_logloss: 0.267328
Early stopping, best iteration is:
[253]	valid_0's multi_error: 0.114987	valid_0's multi_logloss: 0.267235
[I 2025-06-12 03:14:06,473] Trial 59 finished with value: 0.886133549345795 and parameters: {'boosting_type': 'goss', 'learning_rate': 0.08178003336959723, 'num_leaves': 113, 'max_depth': 9, 'min_data_in_leaf': 34, 'feature_fraction': 0.9196502481608725, 'lambda_l1': 2.900004058848083, 'lambda_l2': 0.43236814763726283, 'min_gain_to_split': 0.38509384128722546, 'max_bin': 134}. Best is trial 47 with value: 0.8895928149546414.
Training until validation scores don't improve for 30 rounds
[50]	valid_0's multi_error: 0.150823	valid_0's multi_logloss: 0.475946
[100]	valid_0's multi_error: 0.141482	valid_0's multi_logloss: 0.37167
[150]	valid_0's multi_error: 0.136411	valid_0's multi_logloss: 0.33485
[200]	valid_0's multi_error: 0.130796	valid_0's multi_logloss: 0.315694
[250]	valid_0's multi_error: 0.127717	valid_0's multi_logloss: 0.304199
[300]	valid_0's multi_error: 0.12469	valid_0's multi_logloss: 0.296336
[350]	valid_0's multi_error: 0.121921	valid_0's multi_logloss: 0.290224
[400]	valid_0's multi_error: 0.120524	valid_0's multi_logloss: 0.285619
[450]	valid_0's multi_error: 0.118971	valid_0's multi_logloss: 0.282232
[500]	valid_0's multi_error: 0.118117	valid_0's multi_logloss: 0.279461
[550]	valid_0's multi_error: 0.117341	valid_0's multi_logloss: 0.27673
[600]	valid_0's multi_error: 0.116824	valid_0's multi_logloss: 0.274924
Early stopping, best iteration is:
[576]	valid_0's multi_error: 0.116565	valid_0's multi_logloss: 0.275811
Training until validation scores don't improve for 30 rounds
[50]	valid_0's multi_error: 0.152608	valid_0's multi_logloss: 0.47541
[100]	valid_0's multi_error: 0.142439	valid_0's multi_logloss: 0.371808
[150]	valid_0's multi_error: 0.135039	valid_0's multi_logloss: 0.335239
[200]	valid_0's multi_error: 0.130227	valid_0's multi_logloss: 0.316693
[250]	valid_0's multi_error: 0.12707	valid_0's multi_logloss: 0.305118
[300]	valid_0's multi_error: 0.124922	valid_0's multi_logloss: 0.297817
[350]	valid_0's multi_error: 0.123862	valid_0's multi_logloss: 0.292769
[400]	valid_0's multi_error: 0.121817	valid_0's multi_logloss: 0.288505
[450]	valid_0's multi_error: 0.120653	valid_0's multi_logloss: 0.285094
Early stopping, best iteration is:
[457]	valid_0's multi_error: 0.120058	valid_0's multi_logloss: 0.28478
Training until validation scores don't improve for 30 rounds
[50]	valid_0's multi_error: 0.153824	valid_0's multi_logloss: 0.478296
[100]	valid_0's multi_error: 0.146554	valid_0's multi_logloss: 0.375279
[150]	valid_0's multi_error: 0.139697	valid_0's multi_logloss: 0.339106
[200]	valid_0's multi_error: 0.134729	valid_0's multi_logloss: 0.320128
[250]	valid_0's multi_error: 0.131158	valid_0's multi_logloss: 0.308243
[300]	valid_0's multi_error: 0.128441	valid_0's multi_logloss: 0.300559
[350]	valid_0's multi_error: 0.126527	valid_0's multi_logloss: 0.294801
[400]	valid_0's multi_error: 0.124483	valid_0's multi_logloss: 0.290319
[450]	valid_0's multi_error: 0.123266	valid_0's multi_logloss: 0.287029
[500]	valid_0's multi_error: 0.122102	valid_0's multi_logloss: 0.284379
Early stopping, best iteration is:
[476]	valid_0's multi_error: 0.121973	valid_0's multi_logloss: 0.285555
[I 2025-06-12 03:17:55,800] Trial 60 finished with value: 0.8780992956425373 and parameters: {'boosting_type': 'goss', 'learning_rate': 0.03151727049541663, 'num_leaves': 73, 'max_depth': 10, 'min_data_in_leaf': 94, 'feature_fraction': 0.6709214271768664, 'lambda_l1': 0.6307433094356037, 'lambda_l2': 0.8362841261894002, 'min_gain_to_split': 1.7078615999696158, 'max_bin': 255}. Best is trial 47 with value: 0.8895928149546414.
Training until validation scores don't improve for 30 rounds
[50]	valid_0's multi_error: 0.123499	valid_0's multi_logloss: 0.289692
[100]	valid_0's multi_error: 0.115737	valid_0's multi_logloss: 0.27228
[150]	valid_0's multi_error: 0.113124	valid_0's multi_logloss: 0.266618
Early stopping, best iteration is:
[169]	valid_0's multi_error: 0.113098	valid_0's multi_logloss: 0.265188
Training until validation scores don't improve for 30 rounds
[50]	valid_0's multi_error: 0.125543	valid_0's multi_logloss: 0.292106
[100]	valid_0's multi_error: 0.117807	valid_0's multi_logloss: 0.275108
[150]	valid_0's multi_error: 0.116022	valid_0's multi_logloss: 0.271513
Early stopping, best iteration is:
[157]	valid_0's multi_error: 0.115633	valid_0's multi_logloss: 0.271458
Training until validation scores don't improve for 30 rounds
[50]	valid_0's multi_error: 0.126889	valid_0's multi_logloss: 0.294577
[100]	valid_0's multi_error: 0.120653	valid_0's multi_logloss: 0.277172
[150]	valid_0's multi_error: 0.118376	valid_0's multi_logloss: 0.271875
Early stopping, best iteration is:
[168]	valid_0's multi_error: 0.116953	valid_0's multi_logloss: 0.271242
[I 2025-06-12 03:19:44,588] Trial 61 finished with value: 0.882825313933405 and parameters: {'boosting_type': 'goss', 'learning_rate': 0.2378255826614967, 'num_leaves': 101, 'max_depth': 9, 'min_data_in_leaf': 40, 'feature_fraction': 0.6976947027006758, 'lambda_l1': 0.9805539095339229, 'lambda_l2': 4.435208382500912, 'min_gain_to_split': 0.1460580223580888, 'max_bin': 112}. Best is trial 47 with value: 0.8895928149546414.
Training until validation scores don't improve for 30 rounds
[50]	valid_0's multi_error: 0.123266	valid_0's multi_logloss: 0.294825
[100]	valid_0's multi_error: 0.116047	valid_0's multi_logloss: 0.271249
[150]	valid_0's multi_error: 0.112917	valid_0's multi_logloss: 0.262263
[200]	valid_0's multi_error: 0.109708	valid_0's multi_logloss: 0.258089
[250]	valid_0's multi_error: 0.10901	valid_0's multi_logloss: 0.256837
Early stopping, best iteration is:
[236]	valid_0's multi_error: 0.108389	valid_0's multi_logloss: 0.257068
Training until validation scores don't improve for 30 rounds
[50]	valid_0's multi_error: 0.126708	valid_0's multi_logloss: 0.296978
[100]	valid_0's multi_error: 0.119359	valid_0's multi_logloss: 0.274812
[150]	valid_0's multi_error: 0.115038	valid_0's multi_logloss: 0.266015
[200]	valid_0's multi_error: 0.113124	valid_0's multi_logloss: 0.262976
[250]	valid_0's multi_error: 0.111079	valid_0's multi_logloss: 0.262346
Early stopping, best iteration is:
[244]	valid_0's multi_error: 0.11139	valid_0's multi_logloss: 0.262009
Training until validation scores don't improve for 30 rounds
[50]	valid_0's multi_error: 0.127794	valid_0's multi_logloss: 0.300186
[100]	valid_0's multi_error: 0.120627	valid_0's multi_logloss: 0.277486
[150]	valid_0's multi_error: 0.115892	valid_0's multi_logloss: 0.269046
[200]	valid_0's multi_error: 0.115116	valid_0's multi_logloss: 0.266151
Early stopping, best iteration is:
[207]	valid_0's multi_error: 0.114624	valid_0's multi_logloss: 0.265745
[I 2025-06-12 03:22:08,968] Trial 62 finished with value: 0.8866313638818116 and parameters: {'boosting_type': 'goss', 'learning_rate': 0.1668533886688323, 'num_leaves': 91, 'max_depth': 9, 'min_data_in_leaf': 23, 'feature_fraction': 0.6850855144783802, 'lambda_l1': 0.30545740620635475, 'lambda_l2': 1.8191330074958658, 'min_gain_to_split': 0.1326895575278681, 'max_bin': 105}. Best is trial 47 with value: 0.8895928149546414.
Training until validation scores don't improve for 30 rounds
[50]	valid_0's multi_error: 0.131184	valid_0's multi_logloss: 0.319993
[100]	valid_0's multi_error: 0.122464	valid_0's multi_logloss: 0.289848
[150]	valid_0's multi_error: 0.117988	valid_0's multi_logloss: 0.274874
[200]	valid_0's multi_error: 0.114107	valid_0's multi_logloss: 0.266736
[250]	valid_0's multi_error: 0.112477	valid_0's multi_logloss: 0.261388
[300]	valid_0's multi_error: 0.11183	valid_0's multi_logloss: 0.258221
[350]	valid_0's multi_error: 0.110329	valid_0's multi_logloss: 0.2562
[400]	valid_0's multi_error: 0.109579	valid_0's multi_logloss: 0.254712
Early stopping, best iteration is:
[410]	valid_0's multi_error: 0.108673	valid_0's multi_logloss: 0.254577
Training until validation scores don't improve for 30 rounds
[50]	valid_0's multi_error: 0.134418	valid_0's multi_logloss: 0.322131
[100]	valid_0's multi_error: 0.125414	valid_0's multi_logloss: 0.292394
[150]	valid_0's multi_error: 0.120058	valid_0's multi_logloss: 0.278777
[200]	valid_0's multi_error: 0.116332	valid_0's multi_logloss: 0.270774
[250]	valid_0's multi_error: 0.114624	valid_0's multi_logloss: 0.266124
[300]	valid_0's multi_error: 0.11258	valid_0's multi_logloss: 0.263281
Early stopping, best iteration is:
[307]	valid_0's multi_error: 0.11183	valid_0's multi_logloss: 0.262497
Training until validation scores don't improve for 30 rounds
[50]	valid_0's multi_error: 0.137342	valid_0's multi_logloss: 0.325055
[100]	valid_0's multi_error: 0.127458	valid_0's multi_logloss: 0.29379
[150]	valid_0's multi_error: 0.121015	valid_0's multi_logloss: 0.280856
[200]	valid_0's multi_error: 0.118091	valid_0's multi_logloss: 0.27304
[250]	valid_0's multi_error: 0.115064	valid_0's multi_logloss: 0.267885
[300]	valid_0's multi_error: 0.113952	valid_0's multi_logloss: 0.264966
[350]	valid_0's multi_error: 0.112865	valid_0's multi_logloss: 0.263388
Early stopping, best iteration is:
[364]	valid_0's multi_error: 0.112917	valid_0's multi_logloss: 0.262833
[I 2025-06-12 03:25:07,254] Trial 63 finished with value: 0.8869538435193526 and parameters: {'boosting_type': 'goss', 'learning_rate': 0.12847395918685567, 'num_leaves': 83, 'max_depth': 8, 'min_data_in_leaf': 49, 'feature_fraction': 0.714774918109487, 'lambda_l1': 1.2490353156195635, 'lambda_l2': 4.6399144619167645, 'min_gain_to_split': 0.008776931481384469, 'max_bin': 121}. Best is trial 47 with value: 0.8895928149546414.
Training until validation scores don't improve for 30 rounds
[50]	valid_0's multi_error: 0.141974	valid_0's multi_logloss: 0.367852
[100]	valid_0's multi_error: 0.131158	valid_0's multi_logloss: 0.314551
[150]	valid_0's multi_error: 0.124043	valid_0's multi_logloss: 0.295866
[200]	valid_0's multi_error: 0.119851	valid_0's multi_logloss: 0.283816
[250]	valid_0's multi_error: 0.116513	valid_0's multi_logloss: 0.275896
[300]	valid_0's multi_error: 0.116151	valid_0's multi_logloss: 0.271289
[350]	valid_0's multi_error: 0.114391	valid_0's multi_logloss: 0.26771
[400]	valid_0's multi_error: 0.112968	valid_0's multi_logloss: 0.264863
[450]	valid_0's multi_error: 0.112477	valid_0's multi_logloss: 0.263125
[500]	valid_0's multi_error: 0.111286	valid_0's multi_logloss: 0.261358
Early stopping, best iteration is:
[495]	valid_0's multi_error: 0.110924	valid_0's multi_logloss: 0.261492
Training until validation scores don't improve for 30 rounds
[50]	valid_0's multi_error: 0.143914	valid_0's multi_logloss: 0.368563
[100]	valid_0's multi_error: 0.13328	valid_0's multi_logloss: 0.317089
[150]	valid_0's multi_error: 0.127613	valid_0's multi_logloss: 0.298881
[200]	valid_0's multi_error: 0.12412	valid_0's multi_logloss: 0.287749
[250]	valid_0's multi_error: 0.120265	valid_0's multi_logloss: 0.279738
[300]	valid_0's multi_error: 0.117962	valid_0's multi_logloss: 0.2746
[350]	valid_0's multi_error: 0.116487	valid_0's multi_logloss: 0.271033
[400]	valid_0's multi_error: 0.114573	valid_0's multi_logloss: 0.268498
Early stopping, best iteration is:
[400]	valid_0's multi_error: 0.114573	valid_0's multi_logloss: 0.268498
Training until validation scores don't improve for 30 rounds
[50]	valid_0's multi_error: 0.145958	valid_0's multi_logloss: 0.372415
[100]	valid_0's multi_error: 0.134522	valid_0's multi_logloss: 0.320264
[150]	valid_0's multi_error: 0.128415	valid_0's multi_logloss: 0.300328
[200]	valid_0's multi_error: 0.124871	valid_0's multi_logloss: 0.289366
[250]	valid_0's multi_error: 0.122723	valid_0's multi_logloss: 0.281621
[300]	valid_0's multi_error: 0.119489	valid_0's multi_logloss: 0.276271
[350]	valid_0's multi_error: 0.117884	valid_0's multi_logloss: 0.272659
[400]	valid_0's multi_error: 0.116979	valid_0's multi_logloss: 0.27016
[450]	valid_0's multi_error: 0.11641	valid_0's multi_logloss: 0.268789
[500]	valid_0's multi_error: 0.115478	valid_0's multi_logloss: 0.267873
[550]	valid_0's multi_error: 0.114754	valid_0's multi_logloss: 0.267239
[600]	valid_0's multi_error: 0.114366	valid_0's multi_logloss: 0.266177
Early stopping, best iteration is:
[594]	valid_0's multi_error: 0.114133	valid_0's multi_logloss: 0.266364
[I 2025-06-12 03:28:31,946] Trial 64 finished with value: 0.884757405324621 and parameters: {'boosting_type': 'goss', 'learning_rate': 0.06597925908057435, 'num_leaves': 82, 'max_depth': 8, 'min_data_in_leaf': 51, 'feature_fraction': 0.7246575366731791, 'lambda_l1': 1.2465904643014758, 'lambda_l2': 0.2458193862606628, 'min_gain_to_split': 0.8579064932889319, 'max_bin': 124}. Best is trial 47 with value: 0.8895928149546414.
Training until validation scores don't improve for 30 rounds
[50]	valid_0's multi_error: 0.142077	valid_0's multi_logloss: 0.358342
[100]	valid_0's multi_error: 0.131546	valid_0's multi_logloss: 0.316527
[150]	valid_0's multi_error: 0.125233	valid_0's multi_logloss: 0.298844
[200]	valid_0's multi_error: 0.122076	valid_0's multi_logloss: 0.287089
[250]	valid_0's multi_error: 0.118609	valid_0's multi_logloss: 0.279259
[300]	valid_0's multi_error: 0.117264	valid_0's multi_logloss: 0.27331
[350]	valid_0's multi_error: 0.114676	valid_0's multi_logloss: 0.26917
[400]	valid_0's multi_error: 0.113382	valid_0's multi_logloss: 0.265778
[450]	valid_0's multi_error: 0.113175	valid_0's multi_logloss: 0.263333
Early stopping, best iteration is:
[423]	valid_0's multi_error: 0.112503	valid_0's multi_logloss: 0.264281
Training until validation scores don't improve for 30 rounds
[50]	valid_0's multi_error: 0.144613	valid_0's multi_logloss: 0.360858
[100]	valid_0's multi_error: 0.133357	valid_0's multi_logloss: 0.318112
[150]	valid_0's multi_error: 0.12782	valid_0's multi_logloss: 0.30075
[200]	valid_0's multi_error: 0.124198	valid_0's multi_logloss: 0.289362
[250]	valid_0's multi_error: 0.121222	valid_0's multi_logloss: 0.281821
[300]	valid_0's multi_error: 0.118738	valid_0's multi_logloss: 0.276294
[350]	valid_0's multi_error: 0.116953	valid_0's multi_logloss: 0.272511
[400]	valid_0's multi_error: 0.115866	valid_0's multi_logloss: 0.269378
[450]	valid_0's multi_error: 0.115349	valid_0's multi_logloss: 0.266667
[500]	valid_0's multi_error: 0.114055	valid_0's multi_logloss: 0.264615
[550]	valid_0's multi_error: 0.113149	valid_0's multi_logloss: 0.263063
Early stopping, best iteration is:
[540]	valid_0's multi_error: 0.113072	valid_0's multi_logloss: 0.263545
Training until validation scores don't improve for 30 rounds
[50]	valid_0's multi_error: 0.147666	valid_0's multi_logloss: 0.364016
[100]	valid_0's multi_error: 0.136281	valid_0's multi_logloss: 0.320974
[150]	valid_0's multi_error: 0.130408	valid_0's multi_logloss: 0.302519
[200]	valid_0's multi_error: 0.125543	valid_0's multi_logloss: 0.291008
[250]	valid_0's multi_error: 0.122257	valid_0's multi_logloss: 0.282644
[300]	valid_0's multi_error: 0.12055	valid_0's multi_logloss: 0.277497
[350]	valid_0's multi_error: 0.117807	valid_0's multi_logloss: 0.273259
[400]	valid_0's multi_error: 0.117057	valid_0's multi_logloss: 0.269941
[450]	valid_0's multi_error: 0.116694	valid_0's multi_logloss: 0.267491
Early stopping, best iteration is:
[425]	valid_0's multi_error: 0.116487	valid_0's multi_logloss: 0.268782
[I 2025-06-12 03:31:27,709] Trial 65 finished with value: 0.8839746789002874 and parameters: {'boosting_type': 'goss', 'learning_rate': 0.08926525092250616, 'num_leaves': 76, 'max_depth': 7, 'min_data_in_leaf': 64, 'feature_fraction': 0.6517624704837957, 'lambda_l1': 2.0346504122907305, 'lambda_l2': 3.9366852654323026, 'min_gain_to_split': 0.00221129551826373, 'max_bin': 156}. Best is trial 47 with value: 0.8895928149546414.
Training until validation scores don't improve for 30 rounds
[50]	valid_0's multi_error: 0.12989	valid_0's multi_logloss: 0.313302
[100]	valid_0's multi_error: 0.120446	valid_0's multi_logloss: 0.28204
[150]	valid_0's multi_error: 0.115633	valid_0's multi_logloss: 0.269257
[200]	valid_0's multi_error: 0.113977	valid_0's multi_logloss: 0.26303
[250]	valid_0's multi_error: 0.11183	valid_0's multi_logloss: 0.259504
[300]	valid_0's multi_error: 0.111261	valid_0's multi_logloss: 0.258375
Early stopping, best iteration is:
[311]	valid_0's multi_error: 0.110665	valid_0's multi_logloss: 0.25841
Training until validation scores don't improve for 30 rounds
[50]	valid_0's multi_error: 0.130563	valid_0's multi_logloss: 0.312984
[100]	valid_0's multi_error: 0.12086	valid_0's multi_logloss: 0.282766
[150]	valid_0's multi_error: 0.116125	valid_0's multi_logloss: 0.270637
[200]	valid_0's multi_error: 0.113693	valid_0's multi_logloss: 0.26513
[250]	valid_0's multi_error: 0.112917	valid_0's multi_logloss: 0.262487
[300]	valid_0's multi_error: 0.111959	valid_0's multi_logloss: 0.261238
[350]	valid_0's multi_error: 0.111519	valid_0's multi_logloss: 0.260932
Early stopping, best iteration is:
[331]	valid_0's multi_error: 0.11183	valid_0's multi_logloss: 0.260844
Training until validation scores don't improve for 30 rounds
[50]	valid_0's multi_error: 0.133306	valid_0's multi_logloss: 0.316971
[100]	valid_0's multi_error: 0.122594	valid_0's multi_logloss: 0.286696
[150]	valid_0's multi_error: 0.11835	valid_0's multi_logloss: 0.274803
[200]	valid_0's multi_error: 0.115789	valid_0's multi_logloss: 0.268881
[250]	valid_0's multi_error: 0.11434	valid_0's multi_logloss: 0.265962
[300]	valid_0's multi_error: 0.113486	valid_0's multi_logloss: 0.265621
Early stopping, best iteration is:
[288]	valid_0's multi_error: 0.113952	valid_0's multi_logloss: 0.265242
[I 2025-06-12 03:34:31,449] Trial 66 finished with value: 0.8859216202958099 and parameters: {'boosting_type': 'goss', 'learning_rate': 0.1126971054128395, 'num_leaves': 107, 'max_depth': 10, 'min_data_in_leaf': 59, 'feature_fraction': 0.7614485982835679, 'lambda_l1': 1.6137402572520572, 'lambda_l2': 4.346779938578982, 'min_gain_to_split': 0.409171711966953, 'max_bin': 96}. Best is trial 47 with value: 0.8895928149546414.
Training until validation scores don't improve for 30 rounds
[50]	valid_0's multi_error: 0.141301	valid_0's multi_logloss: 0.337986
[100]	valid_0's multi_error: 0.129321	valid_0's multi_logloss: 0.306755
[150]	valid_0's multi_error: 0.125155	valid_0's multi_logloss: 0.293591
[200]	valid_0's multi_error: 0.122413	valid_0's multi_logloss: 0.285827
[250]	valid_0's multi_error: 0.119747	valid_0's multi_logloss: 0.280527
Early stopping, best iteration is:
[236]	valid_0's multi_error: 0.119722	valid_0's multi_logloss: 0.281758
Training until validation scores don't improve for 30 rounds
[50]	valid_0's multi_error: 0.144458	valid_0's multi_logloss: 0.339829
[100]	valid_0's multi_error: 0.132141	valid_0's multi_logloss: 0.308625
[150]	valid_0's multi_error: 0.127329	valid_0's multi_logloss: 0.296061
[200]	valid_0's multi_error: 0.125233	valid_0's multi_logloss: 0.289092
[250]	valid_0's multi_error: 0.122697	valid_0's multi_logloss: 0.284723
[300]	valid_0's multi_error: 0.121378	valid_0's multi_logloss: 0.281599
Early stopping, best iteration is:
[317]	valid_0's multi_error: 0.11967	valid_0's multi_logloss: 0.280677
Training until validation scores don't improve for 30 rounds
[50]	valid_0's multi_error: 0.146243	valid_0's multi_logloss: 0.34383
[100]	valid_0's multi_error: 0.13447	valid_0's multi_logloss: 0.313035
[150]	valid_0's multi_error: 0.129761	valid_0's multi_logloss: 0.299352
[200]	valid_0's multi_error: 0.125155	valid_0's multi_logloss: 0.290479
[250]	valid_0's multi_error: 0.123525	valid_0's multi_logloss: 0.286598
[300]	valid_0's multi_error: 0.121196	valid_0's multi_logloss: 0.283308
[350]	valid_0's multi_error: 0.119515	valid_0's multi_logloss: 0.281477
[400]	valid_0's multi_error: 0.11967	valid_0's multi_logloss: 0.280165
Early stopping, best iteration is:
[375]	valid_0's multi_error: 0.118945	valid_0's multi_logloss: 0.280295
