[I 2025-06-12 01:48:34,395] Trial 37 finished with value: 0.8717999782453214 and parameters: {'boosting_type': 'gbdt', 'learning_rate': 0.05604964480946346, 'num_leaves': 68, 'max_depth': 9, 'min_data_in_leaf': 14, 'feature_fraction': 0.7698119664425931, 'lambda_l1': 1.523246411776855, 'lambda_l2': 4.708498466396438, 'min_gain_to_split': 0.8295123030235181, 'max_bin': 90, 'bagging_fraction': 0.979556684999153, 'bagging_freq': 4}. Best is trial 11 with value: 0.888762461860649.
Training until validation scores don't improve for 30 rounds
[50]	valid_0's multi_error: 0.184744	valid_0's multi_logloss: 0.937706
[100]	valid_0's multi_error: 0.181355	valid_0's multi_logloss: 0.819807
[150]	valid_0's multi_error: 0.178172	valid_0's multi_logloss: 0.734204
[200]	valid_0's multi_error: 0.174343	valid_0's multi_logloss: 0.667416
[250]	valid_0's multi_error: 0.172428	valid_0's multi_logloss: 0.61233
[300]	valid_0's multi_error: 0.170876	valid_0's multi_logloss: 0.571622
[350]	valid_0's multi_error: 0.168806	valid_0's multi_logloss: 0.538507
[400]	valid_0's multi_error: 0.166141	valid_0's multi_logloss: 0.511539
[450]	valid_0's multi_error: 0.164562	valid_0's multi_logloss: 0.488834
[500]	valid_0's multi_error: 0.163424	valid_0's multi_logloss: 0.469771
[550]	valid_0's multi_error: 0.161794	valid_0's multi_logloss: 0.454309
[600]	valid_0's multi_error: 0.160448	valid_0's multi_logloss: 0.440663
[650]	valid_0's multi_error: 0.158637	valid_0's multi_logloss: 0.429023
[700]	valid_0's multi_error: 0.156981	valid_0's multi_logloss: 0.418821
[750]	valid_0's multi_error: 0.155687	valid_0's multi_logloss: 0.409771
[800]	valid_0's multi_error: 0.154005	valid_0's multi_logloss: 0.401606
[850]	valid_0's multi_error: 0.152634	valid_0's multi_logloss: 0.39467
[900]	valid_0's multi_error: 0.151211	valid_0's multi_logloss: 0.38835
[950]	valid_0's multi_error: 0.150486	valid_0's multi_logloss: 0.382794
[1000]	valid_0's multi_error: 0.149684	valid_0's multi_logloss: 0.377847
Did not meet early stopping. Best iteration is:
[1000]	valid_0's multi_error: 0.149684	valid_0's multi_logloss: 0.377847
Training until validation scores don't improve for 30 rounds
[50]	valid_0's multi_error: 0.18446	valid_0's multi_logloss: 0.93765
[100]	valid_0's multi_error: 0.181872	valid_0's multi_logloss: 0.819559
[150]	valid_0's multi_error: 0.177629	valid_0's multi_logloss: 0.733927
[200]	valid_0's multi_error: 0.174783	valid_0's multi_logloss: 0.667181
[250]	valid_0's multi_error: 0.172842	valid_0's multi_logloss: 0.612162
[300]	valid_0's multi_error: 0.170927	valid_0's multi_logloss: 0.57155
[350]	valid_0's multi_error: 0.168909	valid_0's multi_logloss: 0.538503
[400]	valid_0's multi_error: 0.166943	valid_0's multi_logloss: 0.511478
[450]	valid_0's multi_error: 0.164924	valid_0's multi_logloss: 0.488816
[500]	valid_0's multi_error: 0.16244	valid_0's multi_logloss: 0.469806
[550]	valid_0's multi_error: 0.161199	valid_0's multi_logloss: 0.454439
[600]	valid_0's multi_error: 0.159853	valid_0's multi_logloss: 0.440909
[650]	valid_0's multi_error: 0.158637	valid_0's multi_logloss: 0.429292
[700]	valid_0's multi_error: 0.157317	valid_0's multi_logloss: 0.419193
[750]	valid_0's multi_error: 0.155558	valid_0's multi_logloss: 0.410236
[800]	valid_0's multi_error: 0.154911	valid_0's multi_logloss: 0.402226
[850]	valid_0's multi_error: 0.153566	valid_0's multi_logloss: 0.395333
[900]	valid_0's multi_error: 0.152608	valid_0's multi_logloss: 0.389026
[950]	valid_0's multi_error: 0.151444	valid_0's multi_logloss: 0.383537
[1000]	valid_0's multi_error: 0.150202	valid_0's multi_logloss: 0.378579
Did not meet early stopping. Best iteration is:
[1000]	valid_0's multi_error: 0.150202	valid_0's multi_logloss: 0.378579
Training until validation scores don't improve for 30 rounds
[50]	valid_0's multi_error: 0.18596	valid_0's multi_logloss: 0.937875
[100]	valid_0's multi_error: 0.183218	valid_0's multi_logloss: 0.82009
[150]	valid_0's multi_error: 0.18019	valid_0's multi_logloss: 0.734812
[200]	valid_0's multi_error: 0.177318	valid_0's multi_logloss: 0.668447
[250]	valid_0's multi_error: 0.175404	valid_0's multi_logloss: 0.61386
[300]	valid_0's multi_error: 0.174058	valid_0's multi_logloss: 0.573772
[350]	valid_0's multi_error: 0.171755	valid_0's multi_logloss: 0.541
[400]	valid_0's multi_error: 0.170358	valid_0's multi_logloss: 0.514347
[450]	valid_0's multi_error: 0.168288	valid_0's multi_logloss: 0.491924
[500]	valid_0's multi_error: 0.16746	valid_0's multi_logloss: 0.473273
[550]	valid_0's multi_error: 0.166115	valid_0's multi_logloss: 0.458061
[600]	valid_0's multi_error: 0.164096	valid_0's multi_logloss: 0.444563
[650]	valid_0's multi_error: 0.162803	valid_0's multi_logloss: 0.433197
[700]	valid_0's multi_error: 0.161302	valid_0's multi_logloss: 0.423179
[750]	valid_0's multi_error: 0.159724	valid_0's multi_logloss: 0.414404
[800]	valid_0's multi_error: 0.157938	valid_0's multi_logloss: 0.406382
[850]	valid_0's multi_error: 0.156748	valid_0's multi_logloss: 0.399523
[900]	valid_0's multi_error: 0.155584	valid_0's multi_logloss: 0.393283
[950]	valid_0's multi_error: 0.154756	valid_0's multi_logloss: 0.387796
[1000]	valid_0's multi_error: 0.154109	valid_0's multi_logloss: 0.382821
Did not meet early stopping. Best iteration is:
[996]	valid_0's multi_error: 0.154109	valid_0's multi_logloss: 0.383179
[I 2025-06-12 01:53:09,058] Trial 38 finished with value: 0.844466224783646 and parameters: {'boosting_type': 'goss', 'learning_rate': 0.003866242473253794, 'num_leaves': 28, 'max_depth': 12, 'min_data_in_leaf': 26, 'feature_fraction': 0.7160780927680245, 'lambda_l1': 0.2508627080515575, 'lambda_l2': 4.2229821435440025, 'min_gain_to_split': 4.676912727543629, 'max_bin': 109}. Best is trial 11 with value: 0.888762461860649.
Training until validation scores don't improve for 30 rounds
[50]	valid_0's multi_error: 0.142569	valid_0's multi_logloss: 0.345878
[100]	valid_0's multi_error: 0.129269	valid_0's multi_logloss: 0.30609
[150]	valid_0's multi_error: 0.122645	valid_0's multi_logloss: 0.28954
[200]	valid_0's multi_error: 0.119799	valid_0's multi_logloss: 0.280698
[250]	valid_0's multi_error: 0.118505	valid_0's multi_logloss: 0.276029
[300]	valid_0's multi_error: 0.117677	valid_0's multi_logloss: 0.273413
Early stopping, best iteration is:
[302]	valid_0's multi_error: 0.117393	valid_0's multi_logloss: 0.273324
Training until validation scores don't improve for 30 rounds
[50]	valid_0's multi_error: 0.142646	valid_0's multi_logloss: 0.34734
[100]	valid_0's multi_error: 0.132529	valid_0's multi_logloss: 0.310393
[150]	valid_0's multi_error: 0.125802	valid_0's multi_logloss: 0.294224
[200]	valid_0's multi_error: 0.121766	valid_0's multi_logloss: 0.285632
[250]	valid_0's multi_error: 0.120058	valid_0's multi_logloss: 0.280796
[300]	valid_0's multi_error: 0.119101	valid_0's multi_logloss: 0.279019
Early stopping, best iteration is:
[275]	valid_0's multi_error: 0.118661	valid_0's multi_logloss: 0.279441
Training until validation scores don't improve for 30 rounds
[50]	valid_0's multi_error: 0.144354	valid_0's multi_logloss: 0.351595
[100]	valid_0's multi_error: 0.133202	valid_0's multi_logloss: 0.312762
[150]	valid_0's multi_error: 0.126397	valid_0's multi_logloss: 0.295101
[200]	valid_0's multi_error: 0.123344	valid_0's multi_logloss: 0.286564
[250]	valid_0's multi_error: 0.121947	valid_0's multi_logloss: 0.282037
[300]	valid_0's multi_error: 0.120705	valid_0's multi_logloss: 0.279277
Early stopping, best iteration is:
[285]	valid_0's multi_error: 0.120161	valid_0's multi_logloss: 0.279618
[I 2025-06-12 01:54:34,884] Trial 39 finished with value: 0.878988202852999 and parameters: {'boosting_type': 'gbdt', 'learning_rate': 0.10404696679982377, 'num_leaves': 45, 'max_depth': 7, 'min_data_in_leaf': 35, 'feature_fraction': 0.6728862573452895, 'lambda_l1': 1.0695918049942754, 'lambda_l2': 2.372025421891151, 'min_gain_to_split': 0.5095416189462956, 'max_bin': 151, 'bagging_fraction': 0.8313055291785578, 'bagging_freq': 4}. Best is trial 11 with value: 0.888762461860649.
Training until validation scores don't improve for 30 rounds
[50]	valid_0's multi_error: 0.155972	valid_0's multi_logloss: 0.575029
[100]	valid_0's multi_error: 0.147821	valid_0's multi_logloss: 0.429869
[150]	valid_0's multi_error: 0.141922	valid_0's multi_logloss: 0.373168
[200]	valid_0's multi_error: 0.136876	valid_0's multi_logloss: 0.343331
[250]	valid_0's multi_error: 0.132762	valid_0's multi_logloss: 0.324388
[300]	valid_0's multi_error: 0.128441	valid_0's multi_logloss: 0.312132
[350]	valid_0's multi_error: 0.125957	valid_0's multi_logloss: 0.303612
[400]	valid_0's multi_error: 0.123137	valid_0's multi_logloss: 0.296744
[450]	valid_0's multi_error: 0.12086	valid_0's multi_logloss: 0.291468
[500]	valid_0's multi_error: 0.120136	valid_0's multi_logloss: 0.287053
[550]	valid_0's multi_error: 0.119152	valid_0's multi_logloss: 0.283325
[600]	valid_0's multi_error: 0.118376	valid_0's multi_logloss: 0.28008
[650]	valid_0's multi_error: 0.117574	valid_0's multi_logloss: 0.27716
[700]	valid_0's multi_error: 0.116306	valid_0's multi_logloss: 0.274418
[750]	valid_0's multi_error: 0.115789	valid_0's multi_logloss: 0.272249
Early stopping, best iteration is:
[736]	valid_0's multi_error: 0.115504	valid_0's multi_logloss: 0.272832
Training until validation scores don't improve for 30 rounds
[50]	valid_0's multi_error: 0.159284	valid_0's multi_logloss: 0.575115
[100]	valid_0's multi_error: 0.149633	valid_0's multi_logloss: 0.429911
[150]	valid_0's multi_error: 0.142414	valid_0's multi_logloss: 0.373118
[200]	valid_0's multi_error: 0.137368	valid_0's multi_logloss: 0.343665
[250]	valid_0's multi_error: 0.133668	valid_0's multi_logloss: 0.325414
[300]	valid_0's multi_error: 0.129735	valid_0's multi_logloss: 0.313757
[350]	valid_0's multi_error: 0.127794	valid_0's multi_logloss: 0.305339
[400]	valid_0's multi_error: 0.125595	valid_0's multi_logloss: 0.298903
[450]	valid_0's multi_error: 0.12412	valid_0's multi_logloss: 0.293779
[500]	valid_0's multi_error: 0.122542	valid_0's multi_logloss: 0.289459
[550]	valid_0's multi_error: 0.121403	valid_0's multi_logloss: 0.285547
[600]	valid_0's multi_error: 0.120524	valid_0's multi_logloss: 0.282434
[650]	valid_0's multi_error: 0.119437	valid_0's multi_logloss: 0.279842
[700]	valid_0's multi_error: 0.118117	valid_0's multi_logloss: 0.277477
[750]	valid_0's multi_error: 0.117652	valid_0's multi_logloss: 0.275334
[800]	valid_0's multi_error: 0.116979	valid_0's multi_logloss: 0.273532
[850]	valid_0's multi_error: 0.116513	valid_0's multi_logloss: 0.271872
[900]	valid_0's multi_error: 0.115918	valid_0's multi_logloss: 0.270513
[950]	valid_0's multi_error: 0.115297	valid_0's multi_logloss: 0.269226
[1000]	valid_0's multi_error: 0.114857	valid_0's multi_logloss: 0.268196
Did not meet early stopping. Best iteration is:
[999]	valid_0's multi_error: 0.114831	valid_0's multi_logloss: 0.26821
Training until validation scores don't improve for 30 rounds
[50]	valid_0's multi_error: 0.159284	valid_0's multi_logloss: 0.577404
[100]	valid_0's multi_error: 0.152142	valid_0's multi_logloss: 0.433823
[150]	valid_0's multi_error: 0.145648	valid_0's multi_logloss: 0.377331
[200]	valid_0's multi_error: 0.140395	valid_0's multi_logloss: 0.347781
[250]	valid_0's multi_error: 0.136514	valid_0's multi_logloss: 0.329304
[300]	valid_0's multi_error: 0.134082	valid_0's multi_logloss: 0.317588
[350]	valid_0's multi_error: 0.131313	valid_0's multi_logloss: 0.308626
[400]	valid_0's multi_error: 0.129166	valid_0's multi_logloss: 0.301842
[450]	valid_0's multi_error: 0.126759	valid_0's multi_logloss: 0.296448
[500]	valid_0's multi_error: 0.125285	valid_0's multi_logloss: 0.29197
[550]	valid_0's multi_error: 0.124353	valid_0's multi_logloss: 0.288235
[600]	valid_0's multi_error: 0.123034	valid_0's multi_logloss: 0.285166
[650]	valid_0's multi_error: 0.121895	valid_0's multi_logloss: 0.282377
[700]	valid_0's multi_error: 0.120317	valid_0's multi_logloss: 0.279895
[750]	valid_0's multi_error: 0.119049	valid_0's multi_logloss: 0.277855
[800]	valid_0's multi_error: 0.118505	valid_0's multi_logloss: 0.276153
[850]	valid_0's multi_error: 0.117652	valid_0's multi_logloss: 0.274631
Early stopping, best iteration is:
[852]	valid_0's multi_error: 0.117445	valid_0's multi_logloss: 0.274577
[I 2025-06-12 02:01:05,975] Trial 40 finished with value: 0.8818544608111262 and parameters: {'boosting_type': 'goss', 'learning_rate': 0.01981358027494054, 'num_leaves': 58, 'max_depth': 11, 'min_data_in_leaf': 20, 'feature_fraction': 0.7500137512316523, 'lambda_l1': 0.5845226126645751, 'lambda_l2': 3.0971132001988653, 'min_gain_to_split': 0.903240973802142, 'max_bin': 76}. Best is trial 11 with value: 0.888762461860649.
Training until validation scores don't improve for 30 rounds
[50]	valid_0's multi_error: 0.13786	valid_0's multi_logloss: 0.343567
[100]	valid_0's multi_error: 0.124819	valid_0's multi_logloss: 0.296637
[150]	valid_0's multi_error: 0.118583	valid_0's multi_logloss: 0.27988
[200]	valid_0's multi_error: 0.114495	valid_0's multi_logloss: 0.269668
[250]	valid_0's multi_error: 0.112166	valid_0's multi_logloss: 0.262787
[300]	valid_0's multi_error: 0.110484	valid_0's multi_logloss: 0.257828
[350]	valid_0's multi_error: 0.109346	valid_0's multi_logloss: 0.254762
[400]	valid_0's multi_error: 0.108207	valid_0's multi_logloss: 0.252329
Early stopping, best iteration is:
[408]	valid_0's multi_error: 0.107431	valid_0's multi_logloss: 0.251996
Training until validation scores don't improve for 30 rounds
[50]	valid_0's multi_error: 0.137368	valid_0's multi_logloss: 0.343625
[100]	valid_0's multi_error: 0.126915	valid_0's multi_logloss: 0.29823
[150]	valid_0's multi_error: 0.122568	valid_0's multi_logloss: 0.281777
[200]	valid_0's multi_error: 0.118919	valid_0's multi_logloss: 0.272697
[250]	valid_0's multi_error: 0.116229	valid_0's multi_logloss: 0.266489
[300]	valid_0's multi_error: 0.1139	valid_0's multi_logloss: 0.262048
[350]	valid_0's multi_error: 0.112296	valid_0's multi_logloss: 0.258904
Early stopping, best iteration is:
[356]	valid_0's multi_error: 0.112114	valid_0's multi_logloss: 0.258513
Training until validation scores don't improve for 30 rounds
[50]	valid_0's multi_error: 0.140758	valid_0's multi_logloss: 0.349115
[100]	valid_0's multi_error: 0.12914	valid_0's multi_logloss: 0.302154
[150]	valid_0's multi_error: 0.123862	valid_0's multi_logloss: 0.285401
[200]	valid_0's multi_error: 0.118661	valid_0's multi_logloss: 0.275123
[250]	valid_0's multi_error: 0.11584	valid_0's multi_logloss: 0.268309
[300]	valid_0's multi_error: 0.115452	valid_0's multi_logloss: 0.263828
[350]	valid_0's multi_error: 0.114288	valid_0's multi_logloss: 0.261475
[400]	valid_0's multi_error: 0.112968	valid_0's multi_logloss: 0.259127
[450]	valid_0's multi_error: 0.113046	valid_0's multi_logloss: 0.257979
Early stopping, best iteration is:
[438]	valid_0's multi_error: 0.11258	valid_0's multi_logloss: 0.258108
[I 2025-06-12 02:04:54,478] Trial 41 finished with value: 0.8873528704405311 and parameters: {'boosting_type': 'goss', 'learning_rate': 0.08182728880815647, 'num_leaves': 79, 'max_depth': 9, 'min_data_in_leaf': 22, 'feature_fraction': 0.6441973692108509, 'lambda_l1': 0.90833998070151, 'lambda_l2': 4.498448424681174, 'min_gain_to_split': 0.005859421410910649, 'max_bin': 120}. Best is trial 11 with value: 0.888762461860649.
Training until validation scores don't improve for 30 rounds
[50]	valid_0's multi_error: 0.146735	valid_0's multi_logloss: 0.45339
[100]	valid_0's multi_error: 0.137627	valid_0's multi_logloss: 0.353524
[150]	valid_0's multi_error: 0.129968	valid_0's multi_logloss: 0.31824
[200]	valid_0's multi_error: 0.125285	valid_0's multi_logloss: 0.300415
[250]	valid_0's multi_error: 0.120808	valid_0's multi_logloss: 0.288967
[300]	valid_0's multi_error: 0.117962	valid_0's multi_logloss: 0.281015
[350]	valid_0's multi_error: 0.116229	valid_0's multi_logloss: 0.275162
[400]	valid_0's multi_error: 0.114702	valid_0's multi_logloss: 0.270164
[450]	valid_0's multi_error: 0.113408	valid_0's multi_logloss: 0.266383
Early stopping, best iteration is:
[460]	valid_0's multi_error: 0.11302	valid_0's multi_logloss: 0.26573
Training until validation scores don't improve for 30 rounds
[50]	valid_0's multi_error: 0.147174	valid_0's multi_logloss: 0.453097
[100]	valid_0's multi_error: 0.137368	valid_0's multi_logloss: 0.354648
[150]	valid_0's multi_error: 0.131055	valid_0's multi_logloss: 0.320262
[200]	valid_0's multi_error: 0.126837	valid_0's multi_logloss: 0.301934
[250]	valid_0's multi_error: 0.122413	valid_0's multi_logloss: 0.290769
[300]	valid_0's multi_error: 0.119799	valid_0's multi_logloss: 0.283539
[350]	valid_0's multi_error: 0.117988	valid_0's multi_logloss: 0.27788
[400]	valid_0's multi_error: 0.116694	valid_0's multi_logloss: 0.273413
[450]	valid_0's multi_error: 0.115918	valid_0's multi_logloss: 0.269677
[500]	valid_0's multi_error: 0.113253	valid_0's multi_logloss: 0.266889
Early stopping, best iteration is:
[496]	valid_0's multi_error: 0.113201	valid_0's multi_logloss: 0.26707
Training until validation scores don't improve for 30 rounds
[50]	valid_0's multi_error: 0.151366	valid_0's multi_logloss: 0.457086
[100]	valid_0's multi_error: 0.141741	valid_0's multi_logloss: 0.35934
[150]	valid_0's multi_error: 0.135324	valid_0's multi_logloss: 0.324258
[200]	valid_0's multi_error: 0.129683	valid_0's multi_logloss: 0.305309
[250]	valid_0's multi_error: 0.125699	valid_0's multi_logloss: 0.293341
[300]	valid_0's multi_error: 0.123603	valid_0's multi_logloss: 0.285621
[350]	valid_0's multi_error: 0.121222	valid_0's multi_logloss: 0.279909
[400]	valid_0's multi_error: 0.119489	valid_0's multi_logloss: 0.275472
[450]	valid_0's multi_error: 0.117341	valid_0's multi_logloss: 0.271758
[500]	valid_0's multi_error: 0.116565	valid_0's multi_logloss: 0.268866
[550]	valid_0's multi_error: 0.11553	valid_0's multi_logloss: 0.266529
[600]	valid_0's multi_error: 0.114262	valid_0's multi_logloss: 0.264351
Early stopping, best iteration is:
[613]	valid_0's multi_error: 0.114003	valid_0's multi_logloss: 0.263925
[I 2025-06-12 02:10:00,374] Trial 42 finished with value: 0.8844705925451309 and parameters: {'boosting_type': 'goss', 'learning_rate': 0.03528622195211952, 'num_leaves': 78, 'max_depth': 10, 'min_data_in_leaf': 15, 'feature_fraction': 0.6347594644296686, 'lambda_l1': 1.3779705306144614, 'lambda_l2': 4.571451607744887, 'min_gain_to_split': 0.3167779499782993, 'max_bin': 140}. Best is trial 11 with value: 0.888762461860649.
Training until validation scores don't improve for 30 rounds
[50]	valid_0's multi_error: 0.127148	valid_0's multi_logloss: 0.303059
[100]	valid_0's multi_error: 0.117289	valid_0's multi_logloss: 0.274748
[150]	valid_0's multi_error: 0.113279	valid_0's multi_logloss: 0.2641
[200]	valid_0's multi_error: 0.110795	valid_0's multi_logloss: 0.258867
[250]	valid_0's multi_error: 0.110614	valid_0's multi_logloss: 0.256313
Early stopping, best iteration is:
[231]	valid_0's multi_error: 0.109838	valid_0's multi_logloss: 0.256976
Training until validation scores don't improve for 30 rounds
[50]	valid_0's multi_error: 0.128804	valid_0's multi_logloss: 0.306765
[100]	valid_0's multi_error: 0.119696	valid_0's multi_logloss: 0.280357
[150]	valid_0's multi_error: 0.11509	valid_0's multi_logloss: 0.269044
[200]	valid_0's multi_error: 0.11227	valid_0's multi_logloss: 0.263052
[250]	valid_0's multi_error: 0.111131	valid_0's multi_logloss: 0.260659
Early stopping, best iteration is:
[255]	valid_0's multi_error: 0.11051	valid_0's multi_logloss: 0.260512
Training until validation scores don't improve for 30 rounds
[50]	valid_0's multi_error: 0.132245	valid_0's multi_logloss: 0.310108
[100]	valid_0's multi_error: 0.121533	valid_0's multi_logloss: 0.281418
[150]	valid_0's multi_error: 0.117238	valid_0's multi_logloss: 0.270313
[200]	valid_0's multi_error: 0.114883	valid_0's multi_logloss: 0.265332
[250]	valid_0's multi_error: 0.11346	valid_0's multi_logloss: 0.263364
Early stopping, best iteration is:
[264]	valid_0's multi_error: 0.113149	valid_0's multi_logloss: 0.263086
