[I 2025-06-12 05:59:21,067] Trial 113 finished with value: 0.888198650157364 and parameters: {'boosting_type': 'goss', 'learning_rate': 0.1216907950757389, 'num_leaves': 145, 'max_depth': 12, 'min_data_in_leaf': 24, 'feature_fraction': 0.9406076490377622, 'lambda_l1': 0.08282929169386069, 'lambda_l2': 4.14978397702269, 'min_gain_to_split': 0.22907014936813797, 'max_bin': 76}. Best is trial 108 with value: 0.8897424994899721.
Training until validation scores don't improve for 30 rounds
[50]	valid_0's multi_error: 0.119411	valid_0's multi_logloss: 0.286845
[100]	valid_0's multi_error: 0.112192	valid_0's multi_logloss: 0.262177
[150]	valid_0's multi_error: 0.110381	valid_0's multi_logloss: 0.255834
[200]	valid_0's multi_error: 0.108828	valid_0's multi_logloss: 0.254132
Early stopping, best iteration is:
[216]	valid_0's multi_error: 0.108337	valid_0's multi_logloss: 0.253744
Training until validation scores don't improve for 30 rounds
[50]	valid_0's multi_error: 0.124922	valid_0's multi_logloss: 0.290492
[100]	valid_0's multi_error: 0.115582	valid_0's multi_logloss: 0.267349
[150]	valid_0's multi_error: 0.112735	valid_0's multi_logloss: 0.26126
[200]	valid_0's multi_error: 0.111623	valid_0's multi_logloss: 0.259918
Early stopping, best iteration is:
[174]	valid_0's multi_error: 0.110847	valid_0's multi_logloss: 0.260256
Training until validation scores don't improve for 30 rounds
[50]	valid_0's multi_error: 0.125129	valid_0's multi_logloss: 0.292966
[100]	valid_0's multi_error: 0.117005	valid_0's multi_logloss: 0.269968
[150]	valid_0's multi_error: 0.113486	valid_0's multi_logloss: 0.263359
[200]	valid_0's multi_error: 0.112839	valid_0's multi_logloss: 0.262685
Early stopping, best iteration is:
[203]	valid_0's multi_error: 0.112166	valid_0's multi_logloss: 0.262354
[I 2025-06-12 06:01:49,583] Trial 114 finished with value: 0.8876172545407872 and parameters: {'boosting_type': 'goss', 'learning_rate': 0.11792683868087055, 'num_leaves': 145, 'max_depth': 12, 'min_data_in_leaf': 26, 'feature_fraction': 0.9554659393492597, 'lambda_l1': 0.056714686181043694, 'lambda_l2': 3.704225207282015, 'min_gain_to_split': 0.5344916947424274, 'max_bin': 81}. Best is trial 108 with value: 0.8897424994899721.
Training until validation scores don't improve for 30 rounds
[50]	valid_0's multi_error: 0.119308	valid_0's multi_logloss: 0.279974
[100]	valid_0's multi_error: 0.11227	valid_0's multi_logloss: 0.260383
[150]	valid_0's multi_error: 0.110717	valid_0's multi_logloss: 0.25561
Early stopping, best iteration is:
[169]	valid_0's multi_error: 0.109527	valid_0's multi_logloss: 0.254476
Training until validation scores don't improve for 30 rounds
[50]	valid_0's multi_error: 0.121067	valid_0's multi_logloss: 0.283351
[100]	valid_0's multi_error: 0.114935	valid_0's multi_logloss: 0.265023
[150]	valid_0's multi_error: 0.112528	valid_0's multi_logloss: 0.260739
Early stopping, best iteration is:
[154]	valid_0's multi_error: 0.112089	valid_0's multi_logloss: 0.260617
Training until validation scores don't improve for 30 rounds
[50]	valid_0's multi_error: 0.123706	valid_0's multi_logloss: 0.285923
[100]	valid_0's multi_error: 0.116513	valid_0's multi_logloss: 0.267215
[150]	valid_0's multi_error: 0.11434	valid_0's multi_logloss: 0.26305
Early stopping, best iteration is:
[169]	valid_0's multi_error: 0.113615	valid_0's multi_logloss: 0.262822
[I 2025-06-12 06:04:07,754] Trial 115 finished with value: 0.8863183214670941 and parameters: {'boosting_type': 'goss', 'learning_rate': 0.14121638016934862, 'num_leaves': 137, 'max_depth': 13, 'min_data_in_leaf': 23, 'feature_fraction': 0.9378755353751459, 'lambda_l1': 0.30302497926051036, 'lambda_l2': 3.902276309852804, 'min_gain_to_split': 0.23373011429998874, 'max_bin': 68}. Best is trial 108 with value: 0.8897424994899721.
Training until validation scores don't improve for 30 rounds
[50]	valid_0's multi_error: 0.131443	valid_0's multi_logloss: 0.338335
[100]	valid_0's multi_error: 0.121015	valid_0's multi_logloss: 0.288231
[150]	valid_0's multi_error: 0.116073	valid_0's multi_logloss: 0.271315
[200]	valid_0's multi_error: 0.112632	valid_0's multi_logloss: 0.262685
[250]	valid_0's multi_error: 0.11139	valid_0's multi_logloss: 0.258373
[300]	valid_0's multi_error: 0.110484	valid_0's multi_logloss: 0.255298
[350]	valid_0's multi_error: 0.109061	valid_0's multi_logloss: 0.254154
[400]	valid_0's multi_error: 0.108544	valid_0's multi_logloss: 0.253234
Early stopping, best iteration is:
[379]	valid_0's multi_error: 0.108207	valid_0's multi_logloss: 0.253578
Training until validation scores don't improve for 30 rounds
[50]	valid_0's multi_error: 0.133099	valid_0's multi_logloss: 0.338796
[100]	valid_0's multi_error: 0.122102	valid_0's multi_logloss: 0.288732
[150]	valid_0's multi_error: 0.117238	valid_0's multi_logloss: 0.273239
[200]	valid_0's multi_error: 0.112968	valid_0's multi_logloss: 0.265656
[250]	valid_0's multi_error: 0.111364	valid_0's multi_logloss: 0.261272
[300]	valid_0's multi_error: 0.110665	valid_0's multi_logloss: 0.258906
[350]	valid_0's multi_error: 0.110458	valid_0's multi_logloss: 0.257684
[400]	valid_0's multi_error: 0.109501	valid_0's multi_logloss: 0.256885
[450]	valid_0's multi_error: 0.108803	valid_0's multi_logloss: 0.256462
Early stopping, best iteration is:
[422]	valid_0's multi_error: 0.108544	valid_0's multi_logloss: 0.256565
Training until validation scores don't improve for 30 rounds
[50]	valid_0's multi_error: 0.136411	valid_0's multi_logloss: 0.343412
[100]	valid_0's multi_error: 0.125103	valid_0's multi_logloss: 0.293581
[150]	valid_0's multi_error: 0.118894	valid_0's multi_logloss: 0.276324
[200]	valid_0's multi_error: 0.115323	valid_0's multi_logloss: 0.268481
[250]	valid_0's multi_error: 0.114805	valid_0's multi_logloss: 0.264553
[300]	valid_0's multi_error: 0.113641	valid_0's multi_logloss: 0.26239
Early stopping, best iteration is:
[270]	valid_0's multi_error: 0.113512	valid_0's multi_logloss: 0.263359
[I 2025-06-12 06:08:00,570] Trial 116 finished with value: 0.8879460125940507 and parameters: {'boosting_type': 'goss', 'learning_rate': 0.06188005775741805, 'num_leaves': 132, 'max_depth': 12, 'min_data_in_leaf': 30, 'feature_fraction': 0.8951732391966583, 'lambda_l1': 0.36220520990912985, 'lambda_l2': 4.120307435518021, 'min_gain_to_split': 0.6305708700200778, 'max_bin': 75}. Best is trial 108 with value: 0.8897424994899721.
Training until validation scores don't improve for 30 rounds
[50]	valid_0's multi_error: 0.133383	valid_0's multi_logloss: 0.344213
[100]	valid_0's multi_error: 0.121559	valid_0's multi_logloss: 0.291283
[150]	valid_0's multi_error: 0.116229	valid_0's multi_logloss: 0.273899
[200]	valid_0's multi_error: 0.112244	valid_0's multi_logloss: 0.265014
[250]	valid_0's multi_error: 0.110769	valid_0's multi_logloss: 0.259843
[300]	valid_0's multi_error: 0.109812	valid_0's multi_logloss: 0.256831
[350]	valid_0's multi_error: 0.109268	valid_0's multi_logloss: 0.25475
Early stopping, best iteration is:
[348]	valid_0's multi_error: 0.10888	valid_0's multi_logloss: 0.254878
Training until validation scores don't improve for 30 rounds
[50]	valid_0's multi_error: 0.13315	valid_0's multi_logloss: 0.343995
[100]	valid_0's multi_error: 0.122645	valid_0's multi_logloss: 0.291301
[150]	valid_0's multi_error: 0.118014	valid_0's multi_logloss: 0.274679
[200]	valid_0's multi_error: 0.115375	valid_0's multi_logloss: 0.266916
[250]	valid_0's multi_error: 0.113382	valid_0's multi_logloss: 0.262363
[300]	valid_0's multi_error: 0.111752	valid_0's multi_logloss: 0.259879
[350]	valid_0's multi_error: 0.110769	valid_0's multi_logloss: 0.258738
[400]	valid_0's multi_error: 0.110743	valid_0's multi_logloss: 0.257537
Early stopping, best iteration is:
[396]	valid_0's multi_error: 0.110536	valid_0's multi_logloss: 0.25767
Training until validation scores don't improve for 30 rounds
[50]	valid_0's multi_error: 0.13566	valid_0's multi_logloss: 0.347837
[100]	valid_0's multi_error: 0.125492	valid_0's multi_logloss: 0.295028
[150]	valid_0's multi_error: 0.119256	valid_0's multi_logloss: 0.277517
[200]	valid_0's multi_error: 0.116384	valid_0's multi_logloss: 0.269242
[250]	valid_0's multi_error: 0.115038	valid_0's multi_logloss: 0.264919
[300]	valid_0's multi_error: 0.113926	valid_0's multi_logloss: 0.262341
[350]	valid_0's multi_error: 0.113046	valid_0's multi_logloss: 0.260697
[400]	valid_0's multi_error: 0.112321	valid_0's multi_logloss: 0.259887
Early stopping, best iteration is:
[373]	valid_0's multi_error: 0.112037	valid_0's multi_logloss: 0.260187
[I 2025-06-12 06:12:01,106] Trial 117 finished with value: 0.8875231857128644 and parameters: {'boosting_type': 'goss', 'learning_rate': 0.05936146181696505, 'num_leaves': 133, 'max_depth': 12, 'min_data_in_leaf': 35, 'feature_fraction': 0.899967966158532, 'lambda_l1': 0.4290145417633856, 'lambda_l2': 4.151784421580107, 'min_gain_to_split': 0.6438709123637323, 'max_bin': 77}. Best is trial 108 with value: 0.8897424994899721.
Training until validation scores don't improve for 30 rounds
[50]	valid_0's multi_error: 0.134367	valid_0's multi_logloss: 0.370394
[100]	valid_0's multi_error: 0.123344	valid_0's multi_logloss: 0.301084
[150]	valid_0's multi_error: 0.116694	valid_0's multi_logloss: 0.27904
[200]	valid_0's multi_error: 0.114081	valid_0's multi_logloss: 0.267869
[250]	valid_0's multi_error: 0.111286	valid_0's multi_logloss: 0.261219
[300]	valid_0's multi_error: 0.109656	valid_0's multi_logloss: 0.256934
[350]	valid_0's multi_error: 0.108906	valid_0's multi_logloss: 0.254248
[400]	valid_0's multi_error: 0.10857	valid_0's multi_logloss: 0.252365
[450]	valid_0's multi_error: 0.107845	valid_0's multi_logloss: 0.2512
Early stopping, best iteration is:
[448]	valid_0's multi_error: 0.107716	valid_0's multi_logloss: 0.251251
Training until validation scores don't improve for 30 rounds
[50]	valid_0's multi_error: 0.136644	valid_0's multi_logloss: 0.371322
[100]	valid_0's multi_error: 0.126061	valid_0's multi_logloss: 0.301676
[150]	valid_0's multi_error: 0.11998	valid_0's multi_logloss: 0.28014
[200]	valid_0's multi_error: 0.116047	valid_0's multi_logloss: 0.269679
[250]	valid_0's multi_error: 0.113253	valid_0's multi_logloss: 0.263333
[300]	valid_0's multi_error: 0.1117	valid_0's multi_logloss: 0.258857
[350]	valid_0's multi_error: 0.111028	valid_0's multi_logloss: 0.255964
[400]	valid_0's multi_error: 0.110614	valid_0's multi_logloss: 0.254567
[450]	valid_0's multi_error: 0.109605	valid_0's multi_logloss: 0.253678
[500]	valid_0's multi_error: 0.108777	valid_0's multi_logloss: 0.253046
[550]	valid_0's multi_error: 0.108854	valid_0's multi_logloss: 0.252639
Early stopping, best iteration is:
[528]	valid_0's multi_error: 0.108156	valid_0's multi_logloss: 0.252891
Training until validation scores don't improve for 30 rounds
[50]	valid_0's multi_error: 0.140447	valid_0's multi_logloss: 0.375019
[100]	valid_0's multi_error: 0.128519	valid_0's multi_logloss: 0.306248
[150]	valid_0's multi_error: 0.121533	valid_0's multi_logloss: 0.283694
[200]	valid_0's multi_error: 0.117677	valid_0's multi_logloss: 0.272469
[250]	valid_0's multi_error: 0.115194	valid_0's multi_logloss: 0.265934
[300]	valid_0's multi_error: 0.113072	valid_0's multi_logloss: 0.261393
[350]	valid_0's multi_error: 0.112554	valid_0's multi_logloss: 0.259271
[400]	valid_0's multi_error: 0.112114	valid_0's multi_logloss: 0.25783
[450]	valid_0's multi_error: 0.111261	valid_0's multi_logloss: 0.256755
[500]	valid_0's multi_error: 0.111286	valid_0's multi_logloss: 0.256285
Early stopping, best iteration is:
[482]	valid_0's multi_error: 0.110795	valid_0's multi_logloss: 0.256473
[I 2025-06-12 06:17:49,362] Trial 118 finished with value: 0.8891874788891739 and parameters: {'boosting_type': 'goss', 'learning_rate': 0.04475935232350828, 'num_leaves': 147, 'max_depth': 12, 'min_data_in_leaf': 25, 'feature_fraction': 0.9902915046469642, 'lambda_l1': 0.5226147379753483, 'lambda_l2': 3.848192642118049, 'min_gain_to_split': 0.40628632715452345, 'max_bin': 76}. Best is trial 108 with value: 0.8897424994899721.
Training until validation scores don't improve for 30 rounds
[50]	valid_0's multi_error: 0.130848	valid_0's multi_logloss: 0.33271
[100]	valid_0's multi_error: 0.121015	valid_0's multi_logloss: 0.290337
[150]	valid_0's multi_error: 0.117367	valid_0's multi_logloss: 0.280389
[200]	valid_0's multi_error: 0.116539	valid_0's multi_logloss: 0.277015
[250]	valid_0's multi_error: 0.116436	valid_0's multi_logloss: 0.275201
Early stopping, best iteration is:
[259]	valid_0's multi_error: 0.115892	valid_0's multi_logloss: 0.275109
Training until validation scores don't improve for 30 rounds
[50]	valid_0's multi_error: 0.132918	valid_0's multi_logloss: 0.333648
[100]	valid_0's multi_error: 0.123266	valid_0's multi_logloss: 0.291789
[150]	valid_0's multi_error: 0.121533	valid_0's multi_logloss: 0.283742
[200]	valid_0's multi_error: 0.12042	valid_0's multi_logloss: 0.280331
[250]	valid_0's multi_error: 0.119463	valid_0's multi_logloss: 0.278619
[300]	valid_0's multi_error: 0.118868	valid_0's multi_logloss: 0.27721
[350]	valid_0's multi_error: 0.118505	valid_0's multi_logloss: 0.276458
Early stopping, best iteration is:
[326]	valid_0's multi_error: 0.118143	valid_0's multi_logloss: 0.276805
Training until validation scores don't improve for 30 rounds
[50]	valid_0's multi_error: 0.135634	valid_0's multi_logloss: 0.337718
[100]	valid_0's multi_error: 0.128001	valid_0's multi_logloss: 0.296753
[150]	valid_0's multi_error: 0.124457	valid_0's multi_logloss: 0.287747
[200]	valid_0's multi_error: 0.123137	valid_0's multi_logloss: 0.28419
[250]	valid_0's multi_error: 0.121714	valid_0's multi_logloss: 0.282159
[300]	valid_0's multi_error: 0.121352	valid_0's multi_logloss: 0.28094
Early stopping, best iteration is:
[283]	valid_0's multi_error: 0.120912	valid_0's multi_logloss: 0.281367
[I 2025-06-12 06:19:56,395] Trial 119 finished with value: 0.8793744496099999 and parameters: {'boosting_type': 'goss', 'learning_rate': 0.06424198478701244, 'num_leaves': 148, 'max_depth': 12, 'min_data_in_leaf': 24, 'feature_fraction': 0.948464313686949, 'lambda_l1': 0.5520639828258911, 'lambda_l2': 4.03424735266819, 'min_gain_to_split': 2.503602996293201, 'max_bin': 72}. Best is trial 108 with value: 0.8897424994899721.
Training until validation scores don't improve for 30 rounds
[50]	valid_0's multi_error: 0.15015	valid_0's multi_logloss: 0.688244
[100]	valid_0's multi_error: 0.14231	valid_0's multi_logloss: 0.512391
[150]	valid_0's multi_error: 0.136876	valid_0's multi_logloss: 0.424708
[200]	valid_0's multi_error: 0.133901	valid_0's multi_logloss: 0.374653
[250]	valid_0's multi_error: 0.129787	valid_0's multi_logloss: 0.344132
[300]	valid_0's multi_error: 0.12707	valid_0's multi_logloss: 0.324219
[350]	valid_0's multi_error: 0.124043	valid_0's multi_logloss: 0.309504
[400]	valid_0's multi_error: 0.121507	valid_0's multi_logloss: 0.298625
[450]	valid_0's multi_error: 0.11998	valid_0's multi_logloss: 0.290121
[500]	valid_0's multi_error: 0.118247	valid_0's multi_logloss: 0.283608
[550]	valid_0's multi_error: 0.116798	valid_0's multi_logloss: 0.278573
[600]	valid_0's multi_error: 0.115659	valid_0's multi_logloss: 0.274356
[650]	valid_0's multi_error: 0.114987	valid_0's multi_logloss: 0.271017
[700]	valid_0's multi_error: 0.114288	valid_0's multi_logloss: 0.26827
[750]	valid_0's multi_error: 0.113538	valid_0's multi_logloss: 0.266083
[800]	valid_0's multi_error: 0.112917	valid_0's multi_logloss: 0.264368
[850]	valid_0's multi_error: 0.112399	valid_0's multi_logloss: 0.262939
[900]	valid_0's multi_error: 0.112037	valid_0's multi_logloss: 0.261747
[950]	valid_0's multi_error: 0.11183	valid_0's multi_logloss: 0.260903
Early stopping, best iteration is:
[965]	valid_0's multi_error: 0.111571	valid_0's multi_logloss: 0.260639
Training until validation scores don't improve for 30 rounds
[50]	valid_0's multi_error: 0.150823	valid_0's multi_logloss: 0.689111
[100]	valid_0's multi_error: 0.143267	valid_0's multi_logloss: 0.513229
[150]	valid_0's multi_error: 0.139024	valid_0's multi_logloss: 0.425399
[200]	valid_0's multi_error: 0.135427	valid_0's multi_logloss: 0.375868
[250]	valid_0's multi_error: 0.132038	valid_0's multi_logloss: 0.345597
[300]	valid_0's multi_error: 0.129502	valid_0's multi_logloss: 0.325359
[350]	valid_0's multi_error: 0.127096	valid_0's multi_logloss: 0.31085
[400]	valid_0's multi_error: 0.124405	valid_0's multi_logloss: 0.300306
[450]	valid_0's multi_error: 0.121688	valid_0's multi_logloss: 0.291997
[500]	valid_0's multi_error: 0.120291	valid_0's multi_logloss: 0.28574
[550]	valid_0's multi_error: 0.119126	valid_0's multi_logloss: 0.280808
[600]	valid_0's multi_error: 0.117677	valid_0's multi_logloss: 0.276759
[650]	valid_0's multi_error: 0.11672	valid_0's multi_logloss: 0.273687
[700]	valid_0's multi_error: 0.115633	valid_0's multi_logloss: 0.271015
[750]	valid_0's multi_error: 0.115219	valid_0's multi_logloss: 0.268617
[800]	valid_0's multi_error: 0.114702	valid_0's multi_logloss: 0.266875
[850]	valid_0's multi_error: 0.114314	valid_0's multi_logloss: 0.265328
[900]	valid_0's multi_error: 0.113796	valid_0's multi_logloss: 0.264227
Early stopping, best iteration is:
[883]	valid_0's multi_error: 0.113719	valid_0's multi_logloss: 0.26463
Training until validation scores don't improve for 30 rounds
[50]	valid_0's multi_error: 0.152142	valid_0's multi_logloss: 0.689084
[100]	valid_0's multi_error: 0.145829	valid_0's multi_logloss: 0.515558
[150]	valid_0's multi_error: 0.141327	valid_0's multi_logloss: 0.429086
[200]	valid_0's multi_error: 0.138558	valid_0's multi_logloss: 0.379976
[250]	valid_0's multi_error: 0.135117	valid_0's multi_logloss: 0.349319
[300]	valid_0's multi_error: 0.131727	valid_0's multi_logloss: 0.329377
[350]	valid_0's multi_error: 0.129399	valid_0's multi_logloss: 0.315198
[400]	valid_0's multi_error: 0.126966	valid_0's multi_logloss: 0.304499
[450]	valid_0's multi_error: 0.125078	valid_0's multi_logloss: 0.29625
[500]	valid_0's multi_error: 0.123085	valid_0's multi_logloss: 0.289848
[550]	valid_0's multi_error: 0.121378	valid_0's multi_logloss: 0.284291
[600]	valid_0's multi_error: 0.120187	valid_0's multi_logloss: 0.280161
[650]	valid_0's multi_error: 0.119075	valid_0's multi_logloss: 0.276628
[700]	valid_0's multi_error: 0.118247	valid_0's multi_logloss: 0.274075
[750]	valid_0's multi_error: 0.117393	valid_0's multi_logloss: 0.272029
[800]	valid_0's multi_error: 0.116875	valid_0's multi_logloss: 0.27033
[850]	valid_0's multi_error: 0.116436	valid_0's multi_logloss: 0.269062
Early stopping, best iteration is:
[833]	valid_0's multi_error: 0.116254	valid_0's multi_logloss: 0.26941
[I 2025-06-12 06:31:25,970] Trial 120 finished with value: 0.8839796009445416 and parameters: {'boosting_type': 'gbdt', 'learning_rate': 0.01053542449474935, 'num_leaves': 144, 'max_depth': 14, 'min_data_in_leaf': 15, 'feature_fraction': 0.9930084992127396, 'lambda_l1': 0.6768479337259579, 'lambda_l2': 3.4255487768746393, 'min_gain_to_split': 0.3735873907624898, 'max_bin': 78, 'bagging_fraction': 0.8824403568832698, 'bagging_freq': 4}. Best is trial 108 with value: 0.8897424994899721.
Training until validation scores don't improve for 30 rounds
[50]	valid_0's multi_error: 0.135738	valid_0's multi_logloss: 0.375958
[100]	valid_0's multi_error: 0.123344	valid_0's multi_logloss: 0.303282
[150]	valid_0's multi_error: 0.117289	valid_0's multi_logloss: 0.280415
[200]	valid_0's multi_error: 0.114107	valid_0's multi_logloss: 0.268792
[250]	valid_0's multi_error: 0.112503	valid_0's multi_logloss: 0.261946
[300]	valid_0's multi_error: 0.110898	valid_0's multi_logloss: 0.257088
[350]	valid_0's multi_error: 0.109812	valid_0's multi_logloss: 0.253585
[400]	valid_0's multi_error: 0.108596	valid_0's multi_logloss: 0.251423
Early stopping, best iteration is:
[406]	valid_0's multi_error: 0.108233	valid_0's multi_logloss: 0.251137
Training until validation scores don't improve for 30 rounds
[50]	valid_0's multi_error: 0.136618	valid_0's multi_logloss: 0.376857
[100]	valid_0's multi_error: 0.126345	valid_0's multi_logloss: 0.305558
[150]	valid_0's multi_error: 0.120291	valid_0's multi_logloss: 0.282669
[200]	valid_0's multi_error: 0.116539	valid_0's multi_logloss: 0.27172
[250]	valid_0's multi_error: 0.113977	valid_0's multi_logloss: 0.264886
[300]	valid_0's multi_error: 0.111571	valid_0's multi_logloss: 0.260046
[350]	valid_0's multi_error: 0.110588	valid_0's multi_logloss: 0.256984
[400]	valid_0's multi_error: 0.109682	valid_0's multi_logloss: 0.254937
[450]	valid_0's multi_error: 0.109268	valid_0's multi_logloss: 0.253373
[500]	valid_0's multi_error: 0.108647	valid_0's multi_logloss: 0.252749
[550]	valid_0's multi_error: 0.108363	valid_0's multi_logloss: 0.25226
Early stopping, best iteration is:
[523]	valid_0's multi_error: 0.108207	valid_0's multi_logloss: 0.252542
Training until validation scores don't improve for 30 rounds
[50]	valid_0's multi_error: 0.138739	valid_0's multi_logloss: 0.380574
[100]	valid_0's multi_error: 0.127846	valid_0's multi_logloss: 0.308209
[150]	valid_0's multi_error: 0.122231	valid_0's multi_logloss: 0.285263
[200]	valid_0's multi_error: 0.118661	valid_0's multi_logloss: 0.273745
[250]	valid_0's multi_error: 0.11641	valid_0's multi_logloss: 0.266911
[300]	valid_0's multi_error: 0.114754	valid_0's multi_logloss: 0.262359
[350]	valid_0's multi_error: 0.112891	valid_0's multi_logloss: 0.259008
[400]	valid_0's multi_error: 0.111597	valid_0's multi_logloss: 0.256769
[450]	valid_0's multi_error: 0.111183	valid_0's multi_logloss: 0.255384
[500]	valid_0's multi_error: 0.11064	valid_0's multi_logloss: 0.254782
Early stopping, best iteration is:
[476]	valid_0's multi_error: 0.1102	valid_0's multi_logloss: 0.254964
