[I 2025-06-12 04:17:03,976] Trial 84 finished with value: 0.870255514629016 and parameters: {'boosting_type': 'goss', 'learning_rate': 0.0744202523292015, 'num_leaves': 59, 'max_depth': 11, 'min_data_in_leaf': 28, 'feature_fraction': 0.6303582408940333, 'lambda_l1': 0.5811101809827423, 'lambda_l2': 4.757980959497616, 'min_gain_to_split': 4.324782342828131, 'max_bin': 92}. Best is trial 47 with value: 0.8895928149546414.
Training until validation scores don't improve for 30 rounds
[50]	valid_0's multi_error: 0.144354	valid_0's multi_logloss: 0.417991
[100]	valid_0's multi_error: 0.134806	valid_0's multi_logloss: 0.334167
[150]	valid_0's multi_error: 0.127355	valid_0's multi_logloss: 0.305419
[200]	valid_0's multi_error: 0.121947	valid_0's multi_logloss: 0.290059
[250]	valid_0's multi_error: 0.118376	valid_0's multi_logloss: 0.280226
[300]	valid_0's multi_error: 0.116151	valid_0's multi_logloss: 0.273304
[350]	valid_0's multi_error: 0.114417	valid_0's multi_logloss: 0.26788
[400]	valid_0's multi_error: 0.112606	valid_0's multi_logloss: 0.263886
[450]	valid_0's multi_error: 0.112011	valid_0's multi_logloss: 0.260501
Early stopping, best iteration is:
[433]	valid_0's multi_error: 0.1117	valid_0's multi_logloss: 0.261683
Training until validation scores don't improve for 30 rounds
[50]	valid_0's multi_error: 0.144095	valid_0's multi_logloss: 0.417627
[100]	valid_0's multi_error: 0.133901	valid_0's multi_logloss: 0.334454
[150]	valid_0's multi_error: 0.126915	valid_0's multi_logloss: 0.306119
[200]	valid_0's multi_error: 0.123344	valid_0's multi_logloss: 0.291396
[250]	valid_0's multi_error: 0.119722	valid_0's multi_logloss: 0.282127
[300]	valid_0's multi_error: 0.118066	valid_0's multi_logloss: 0.275754
[350]	valid_0's multi_error: 0.115711	valid_0's multi_logloss: 0.27054
[400]	valid_0's multi_error: 0.114702	valid_0's multi_logloss: 0.266859
[450]	valid_0's multi_error: 0.113745	valid_0's multi_logloss: 0.263551
[500]	valid_0's multi_error: 0.112503	valid_0's multi_logloss: 0.260891
[550]	valid_0's multi_error: 0.111726	valid_0's multi_logloss: 0.258966
[600]	valid_0's multi_error: 0.110795	valid_0's multi_logloss: 0.257307
[650]	valid_0's multi_error: 0.110614	valid_0's multi_logloss: 0.255924
[700]	valid_0's multi_error: 0.109346	valid_0's multi_logloss: 0.254696
[750]	valid_0's multi_error: 0.108828	valid_0's multi_logloss: 0.253899
[800]	valid_0's multi_error: 0.108363	valid_0's multi_logloss: 0.253164
Early stopping, best iteration is:
[773]	valid_0's multi_error: 0.108156	valid_0's multi_logloss: 0.253471
Training until validation scores don't improve for 30 rounds
[50]	valid_0's multi_error: 0.14777	valid_0's multi_logloss: 0.421927
[100]	valid_0's multi_error: 0.138481	valid_0's multi_logloss: 0.338932
[150]	valid_0's multi_error: 0.130796	valid_0's multi_logloss: 0.309714
[200]	valid_0's multi_error: 0.126216	valid_0's multi_logloss: 0.29473
[250]	valid_0's multi_error: 0.122723	valid_0's multi_logloss: 0.285337
[300]	valid_0's multi_error: 0.12055	valid_0's multi_logloss: 0.278639
[350]	valid_0's multi_error: 0.118143	valid_0's multi_logloss: 0.273591
[400]	valid_0's multi_error: 0.11685	valid_0's multi_logloss: 0.269382
[450]	valid_0's multi_error: 0.115711	valid_0's multi_logloss: 0.266119
[500]	valid_0's multi_error: 0.114495	valid_0's multi_logloss: 0.263437
[550]	valid_0's multi_error: 0.113719	valid_0's multi_logloss: 0.261578
Early stopping, best iteration is:
[556]	valid_0's multi_error: 0.113279	valid_0's multi_logloss: 0.261384
[I 2025-06-12 04:21:41,916] Trial 85 finished with value: 0.8869775325986234 and parameters: {'boosting_type': 'goss', 'learning_rate': 0.041980215818709476, 'num_leaves': 77, 'max_depth': 10, 'min_data_in_leaf': 21, 'feature_fraction': 0.6769692958864841, 'lambda_l1': 0.42116095266536313, 'lambda_l2': 4.23350641889299, 'min_gain_to_split': 0.12497526272683067, 'max_bin': 102}. Best is trial 47 with value: 0.8895928149546414.
Training until validation scores don't improve for 30 rounds
[50]	valid_0's multi_error: 0.140706	valid_0's multi_logloss: 0.376194
[100]	valid_0's multi_error: 0.129011	valid_0's multi_logloss: 0.310804
[150]	valid_0's multi_error: 0.12161	valid_0's multi_logloss: 0.288443
[200]	valid_0's multi_error: 0.117393	valid_0's multi_logloss: 0.27671
[250]	valid_0's multi_error: 0.115323	valid_0's multi_logloss: 0.269435
[300]	valid_0's multi_error: 0.113305	valid_0's multi_logloss: 0.264698
[350]	valid_0's multi_error: 0.11214	valid_0's multi_logloss: 0.261741
[400]	valid_0's multi_error: 0.111364	valid_0's multi_logloss: 0.259576
[450]	valid_0's multi_error: 0.111028	valid_0's multi_logloss: 0.258071
Early stopping, best iteration is:
[424]	valid_0's multi_error: 0.110691	valid_0's multi_logloss: 0.258763
Training until validation scores don't improve for 30 rounds
[50]	valid_0's multi_error: 0.140188	valid_0's multi_logloss: 0.376822
[100]	valid_0's multi_error: 0.129632	valid_0's multi_logloss: 0.312487
[150]	valid_0's multi_error: 0.122904	valid_0's multi_logloss: 0.29075
[200]	valid_0's multi_error: 0.11967	valid_0's multi_logloss: 0.279526
[250]	valid_0's multi_error: 0.118066	valid_0's multi_logloss: 0.272996
[300]	valid_0's multi_error: 0.116254	valid_0's multi_logloss: 0.269181
[350]	valid_0's multi_error: 0.114469	valid_0's multi_logloss: 0.266319
[400]	valid_0's multi_error: 0.11346	valid_0's multi_logloss: 0.264292
Early stopping, best iteration is:
[378]	valid_0's multi_error: 0.113356	valid_0's multi_logloss: 0.264986
Training until validation scores don't improve for 30 rounds
[50]	valid_0's multi_error: 0.143423	valid_0's multi_logloss: 0.380625
[100]	valid_0's multi_error: 0.131805	valid_0's multi_logloss: 0.31543
[150]	valid_0's multi_error: 0.124871	valid_0's multi_logloss: 0.292745
[200]	valid_0's multi_error: 0.120601	valid_0's multi_logloss: 0.281698
[250]	valid_0's multi_error: 0.118505	valid_0's multi_logloss: 0.274723
[300]	valid_0's multi_error: 0.117005	valid_0's multi_logloss: 0.270327
[350]	valid_0's multi_error: 0.115064	valid_0's multi_logloss: 0.267603
[400]	valid_0's multi_error: 0.114417	valid_0's multi_logloss: 0.265836
[450]	valid_0's multi_error: 0.1139	valid_0's multi_logloss: 0.264649
Early stopping, best iteration is:
[422]	valid_0's multi_error: 0.113589	valid_0's multi_logloss: 0.265276
[I 2025-06-12 04:24:23,299] Trial 86 finished with value: 0.8853760246456748 and parameters: {'boosting_type': 'gbdt', 'learning_rate': 0.055634195970128766, 'num_leaves': 72, 'max_depth': 12, 'min_data_in_leaf': 16, 'feature_fraction': 0.6546523376066851, 'lambda_l1': 0.1664897188585326, 'lambda_l2': 4.899782953046504, 'min_gain_to_split': 0.46580712761964493, 'max_bin': 109, 'bagging_fraction': 0.7040950932434483, 'bagging_freq': 1}. Best is trial 47 with value: 0.8895928149546414.
Training until validation scores don't improve for 30 rounds
[50]	valid_0's multi_error: 0.130356	valid_0's multi_logloss: 0.318719
[100]	valid_0's multi_error: 0.119929	valid_0's multi_logloss: 0.282853
[150]	valid_0's multi_error: 0.114987	valid_0's multi_logloss: 0.269928
[200]	valid_0's multi_error: 0.112761	valid_0's multi_logloss: 0.263169
[250]	valid_0's multi_error: 0.111804	valid_0's multi_logloss: 0.259708
[300]	valid_0's multi_error: 0.109915	valid_0's multi_logloss: 0.257438
[350]	valid_0's multi_error: 0.109915	valid_0's multi_logloss: 0.256453
Early stopping, best iteration is:
[321]	valid_0's multi_error: 0.109501	valid_0's multi_logloss: 0.25695
Training until validation scores don't improve for 30 rounds
[50]	valid_0's multi_error: 0.132271	valid_0's multi_logloss: 0.320393
[100]	valid_0's multi_error: 0.12368	valid_0's multi_logloss: 0.285817
[150]	valid_0's multi_error: 0.117652	valid_0's multi_logloss: 0.272548
[200]	valid_0's multi_error: 0.114754	valid_0's multi_logloss: 0.26662
[250]	valid_0's multi_error: 0.113382	valid_0's multi_logloss: 0.26382
[300]	valid_0's multi_error: 0.112192	valid_0's multi_logloss: 0.261998
[350]	valid_0's multi_error: 0.112011	valid_0's multi_logloss: 0.261476
Early stopping, best iteration is:
[326]	valid_0's multi_error: 0.111856	valid_0's multi_logloss: 0.261294
Training until validation scores don't improve for 30 rounds
[50]	valid_0's multi_error: 0.134962	valid_0's multi_logloss: 0.324223
[100]	valid_0's multi_error: 0.123473	valid_0's multi_logloss: 0.287838
[150]	valid_0's multi_error: 0.119437	valid_0's multi_logloss: 0.275339
[200]	valid_0's multi_error: 0.116798	valid_0's multi_logloss: 0.269008
[250]	valid_0's multi_error: 0.116177	valid_0's multi_logloss: 0.265661
[300]	valid_0's multi_error: 0.115452	valid_0's multi_logloss: 0.264351
[350]	valid_0's multi_error: 0.114598	valid_0's multi_logloss: 0.263699
Early stopping, best iteration is:
[329]	valid_0's multi_error: 0.113977	valid_0's multi_logloss: 0.26399
[I 2025-06-12 04:27:01,113] Trial 87 finished with value: 0.8862557229046771 and parameters: {'boosting_type': 'goss', 'learning_rate': 0.10545530173925956, 'num_leaves': 79, 'max_depth': 11, 'min_data_in_leaf': 24, 'feature_fraction': 0.6449902608626732, 'lambda_l1': 2.77524667905468, 'lambda_l2': 2.6192097767212887, 'min_gain_to_split': 0.26968765788061705, 'max_bin': 114}. Best is trial 47 with value: 0.8895928149546414.
Training until validation scores don't improve for 30 rounds
[50]	valid_0's multi_error: 0.129709	valid_0's multi_logloss: 0.32073
[100]	valid_0's multi_error: 0.119023	valid_0's multi_logloss: 0.282532
[150]	valid_0's multi_error: 0.114055	valid_0's multi_logloss: 0.26867
[200]	valid_0's multi_error: 0.111856	valid_0's multi_logloss: 0.261363
[250]	valid_0's multi_error: 0.110174	valid_0's multi_logloss: 0.257854
[300]	valid_0's multi_error: 0.108233	valid_0's multi_logloss: 0.255759
Early stopping, best iteration is:
[305]	valid_0's multi_error: 0.107975	valid_0's multi_logloss: 0.255467
Training until validation scores don't improve for 30 rounds
[50]	valid_0's multi_error: 0.131288	valid_0's multi_logloss: 0.320928
[100]	valid_0's multi_error: 0.121119	valid_0's multi_logloss: 0.285626
[150]	valid_0's multi_error: 0.116772	valid_0's multi_logloss: 0.272439
[200]	valid_0's multi_error: 0.113124	valid_0's multi_logloss: 0.265792
[250]	valid_0's multi_error: 0.111804	valid_0's multi_logloss: 0.262498
Early stopping, best iteration is:
[263]	valid_0's multi_error: 0.111105	valid_0's multi_logloss: 0.261735
Training until validation scores don't improve for 30 rounds
[50]	valid_0's multi_error: 0.133953	valid_0's multi_logloss: 0.324569
[100]	valid_0's multi_error: 0.123836	valid_0's multi_logloss: 0.288794
[150]	valid_0's multi_error: 0.118091	valid_0's multi_logloss: 0.274699
[200]	valid_0's multi_error: 0.116151	valid_0's multi_logloss: 0.267621
Early stopping, best iteration is:
[215]	valid_0's multi_error: 0.114417	valid_0's multi_logloss: 0.266378
[I 2025-06-12 04:30:09,316] Trial 88 finished with value: 0.8868458283116096 and parameters: {'boosting_type': 'goss', 'learning_rate': 0.09111882171817656, 'num_leaves': 150, 'max_depth': 10, 'min_data_in_leaf': 26, 'feature_fraction': 0.798516663499568, 'lambda_l1': 4.907662084777067, 'lambda_l2': 4.54122101667648, 'min_gain_to_split': 0.10387230043157684, 'max_bin': 169}. Best is trial 47 with value: 0.8895928149546414.
Training until validation scores don't improve for 30 rounds
[50]	valid_0's multi_error: 0.156748	valid_0's multi_logloss: 0.967743
[100]	valid_0's multi_error: 0.152867	valid_0's multi_logloss: 0.866182
[150]	valid_0's multi_error: 0.150616	valid_0's multi_logloss: 0.785306
[200]	valid_0's multi_error: 0.14971	valid_0's multi_logloss: 0.718588
[250]	valid_0's multi_error: 0.148649	valid_0's multi_logloss: 0.660864
[300]	valid_0's multi_error: 0.147123	valid_0's multi_logloss: 0.615873
[350]	valid_0's multi_error: 0.146062	valid_0's multi_logloss: 0.577471
[400]	valid_0's multi_error: 0.14482	valid_0's multi_logloss: 0.545416
[450]	valid_0's multi_error: 0.143811	valid_0's multi_logloss: 0.517815
[500]	valid_0's multi_error: 0.143009	valid_0's multi_logloss: 0.494158
[550]	valid_0's multi_error: 0.142336	valid_0's multi_logloss: 0.47414
[600]	valid_0's multi_error: 0.141586	valid_0's multi_logloss: 0.456166
[650]	valid_0's multi_error: 0.140499	valid_0's multi_logloss: 0.440632
[700]	valid_0's multi_error: 0.139645	valid_0's multi_logloss: 0.426869
[750]	valid_0's multi_error: 0.138895	valid_0's multi_logloss: 0.414719
[800]	valid_0's multi_error: 0.138041	valid_0's multi_logloss: 0.403664
[850]	valid_0's multi_error: 0.13729	valid_0's multi_logloss: 0.394025
[900]	valid_0's multi_error: 0.136514	valid_0's multi_logloss: 0.385319
[950]	valid_0's multi_error: 0.135712	valid_0's multi_logloss: 0.377556
[1000]	valid_0's multi_error: 0.134755	valid_0's multi_logloss: 0.370442
Did not meet early stopping. Best iteration is:
[1000]	valid_0's multi_error: 0.134755	valid_0's multi_logloss: 0.370442
Training until validation scores don't improve for 30 rounds
[50]	valid_0's multi_error: 0.155299	valid_0's multi_logloss: 0.967631
[100]	valid_0's multi_error: 0.152712	valid_0's multi_logloss: 0.86587
[150]	valid_0's multi_error: 0.150797	valid_0's multi_logloss: 0.784824
[200]	valid_0's multi_error: 0.14971	valid_0's multi_logloss: 0.717938
[250]	valid_0's multi_error: 0.148986	valid_0's multi_logloss: 0.660207
[300]	valid_0's multi_error: 0.147718	valid_0's multi_logloss: 0.615124
[350]	valid_0's multi_error: 0.146838	valid_0's multi_logloss: 0.576629
[400]	valid_0's multi_error: 0.146372	valid_0's multi_logloss: 0.544469
[450]	valid_0's multi_error: 0.145312	valid_0's multi_logloss: 0.516965
[500]	valid_0's multi_error: 0.144095	valid_0's multi_logloss: 0.493341
[550]	valid_0's multi_error: 0.143216	valid_0's multi_logloss: 0.473397
[600]	valid_0's multi_error: 0.142232	valid_0's multi_logloss: 0.45547
[650]	valid_0's multi_error: 0.141249	valid_0's multi_logloss: 0.440005
[700]	valid_0's multi_error: 0.140473	valid_0's multi_logloss: 0.426285
[750]	valid_0's multi_error: 0.139464	valid_0's multi_logloss: 0.414252
[800]	valid_0's multi_error: 0.138765	valid_0's multi_logloss: 0.403188
[850]	valid_0's multi_error: 0.13786	valid_0's multi_logloss: 0.393639
[900]	valid_0's multi_error: 0.137161	valid_0's multi_logloss: 0.384972
[950]	valid_0's multi_error: 0.136566	valid_0's multi_logloss: 0.37734
[1000]	valid_0's multi_error: 0.135919	valid_0's multi_logloss: 0.370255
Did not meet early stopping. Best iteration is:
[999]	valid_0's multi_error: 0.135867	valid_0's multi_logloss: 0.37035
Training until validation scores don't improve for 30 rounds
[50]	valid_0's multi_error: 0.158145	valid_0's multi_logloss: 0.967787
[100]	valid_0's multi_error: 0.155584	valid_0's multi_logloss: 0.866314
[150]	valid_0's multi_error: 0.15398	valid_0's multi_logloss: 0.785661
[200]	valid_0's multi_error: 0.153229	valid_0's multi_logloss: 0.719203
[250]	valid_0's multi_error: 0.15222	valid_0's multi_logloss: 0.661742
[300]	valid_0's multi_error: 0.150642	valid_0's multi_logloss: 0.617072
[350]	valid_0's multi_error: 0.149063	valid_0's multi_logloss: 0.579092
[400]	valid_0's multi_error: 0.148287	valid_0's multi_logloss: 0.547259
[450]	valid_0's multi_error: 0.146554	valid_0's multi_logloss: 0.520039
[500]	valid_0's multi_error: 0.145984	valid_0's multi_logloss: 0.49659
[550]	valid_0's multi_error: 0.145182	valid_0's multi_logloss: 0.476804
[600]	valid_0's multi_error: 0.144535	valid_0's multi_logloss: 0.459046
[650]	valid_0's multi_error: 0.143733	valid_0's multi_logloss: 0.443772
[700]	valid_0's multi_error: 0.14275	valid_0's multi_logloss: 0.430183
[750]	valid_0's multi_error: 0.142	valid_0's multi_logloss: 0.41831
[800]	valid_0's multi_error: 0.141275	valid_0's multi_logloss: 0.407444
[850]	valid_0's multi_error: 0.140602	valid_0's multi_logloss: 0.397936
[900]	valid_0's multi_error: 0.139852	valid_0's multi_logloss: 0.389321
[950]	valid_0's multi_error: 0.139102	valid_0's multi_logloss: 0.38165
[1000]	valid_0's multi_error: 0.138351	valid_0's multi_logloss: 0.374605
Did not meet early stopping. Best iteration is:
[999]	valid_0's multi_error: 0.1383	valid_0's multi_logloss: 0.374689
[I 2025-06-12 04:40:45,309] Trial 89 finished with value: 0.8603679769537705 and parameters: {'boosting_type': 'goss', 'learning_rate': 0.002745368776837934, 'num_leaves': 132, 'max_depth': 10, 'min_data_in_leaf': 18, 'feature_fraction': 0.6358034474462523, 'lambda_l1': 2.565841038723226, 'lambda_l2': 0.4100271291893467, 'min_gain_to_split': 0.42813478174000114, 'max_bin': 126}. Best is trial 47 with value: 0.8895928149546414.
Training until validation scores don't improve for 30 rounds
[50]	valid_0's multi_error: 0.141844	valid_0's multi_logloss: 0.368286
[100]	valid_0's multi_error: 0.129683	valid_0's multi_logloss: 0.312818
[150]	valid_0's multi_error: 0.123422	valid_0's multi_logloss: 0.29283
[200]	valid_0's multi_error: 0.118609	valid_0's multi_logloss: 0.281347
[250]	valid_0's multi_error: 0.116643	valid_0's multi_logloss: 0.27352
[300]	valid_0's multi_error: 0.114469	valid_0's multi_logloss: 0.267523
[350]	valid_0's multi_error: 0.112373	valid_0's multi_logloss: 0.263129
[400]	valid_0's multi_error: 0.110847	valid_0's multi_logloss: 0.259797
Early stopping, best iteration is:
[395]	valid_0's multi_error: 0.110588	valid_0's multi_logloss: 0.260039
Training until validation scores don't improve for 30 rounds
[50]	valid_0's multi_error: 0.143423	valid_0's multi_logloss: 0.369077
[100]	valid_0's multi_error: 0.131753	valid_0's multi_logloss: 0.314516
[150]	valid_0's multi_error: 0.125983	valid_0's multi_logloss: 0.295019
[200]	valid_0's multi_error: 0.122568	valid_0's multi_logloss: 0.284403
[250]	valid_0's multi_error: 0.119515	valid_0's multi_logloss: 0.27698
[300]	valid_0's multi_error: 0.117186	valid_0's multi_logloss: 0.271539
[350]	valid_0's multi_error: 0.115375	valid_0's multi_logloss: 0.267289
[400]	valid_0's multi_error: 0.113305	valid_0's multi_logloss: 0.263997
[450]	valid_0's multi_error: 0.112114	valid_0's multi_logloss: 0.261904
[500]	valid_0's multi_error: 0.111468	valid_0's multi_logloss: 0.260222
Early stopping, best iteration is:
[510]	valid_0's multi_error: 0.111442	valid_0's multi_logloss: 0.259965
Training until validation scores don't improve for 30 rounds
[50]	valid_0's multi_error: 0.145441	valid_0's multi_logloss: 0.373329
[100]	valid_0's multi_error: 0.133383	valid_0's multi_logloss: 0.318303
[150]	valid_0's multi_error: 0.126552	valid_0's multi_logloss: 0.298076
[200]	valid_0's multi_error: 0.123732	valid_0's multi_logloss: 0.286738
[250]	valid_0's multi_error: 0.120989	valid_0's multi_logloss: 0.279523
[300]	valid_0's multi_error: 0.119282	valid_0's multi_logloss: 0.274089
[350]	valid_0's multi_error: 0.116746	valid_0's multi_logloss: 0.269643
[400]	valid_0's multi_error: 0.115064	valid_0's multi_logloss: 0.266597
[450]	valid_0's multi_error: 0.114081	valid_0's multi_logloss: 0.264087
[500]	valid_0's multi_error: 0.11302	valid_0's multi_logloss: 0.262379
Early stopping, best iteration is:
[489]	valid_0's multi_error: 0.112813	valid_0's multi_logloss: 0.262638
